Pitchers,Opp: 7/9,Roster Status,GP*,Rankings_Pre-Season,Rankings_Current,Trends_% Ros,Season (total)_IP*,Season (total)_SV,Season (total)_K,Season (total)_ERA,Season (total)_WHIP,Season (total)_QS,
"Mason MontgomeryNo new player Notes PIT - P Top 9, 5-6 vs ATL",ATL,FA,37,1160,459,2%,36.0,0,53,4.25,1.31,0,
Ryan FernandezNAPlayer Note STL - P 7:45 pm vs MIL,MIL,FA,11,1263,461,0%,13.1,0,20,2.7,1.35,0,
"Seth LugoPlayer Note KC - P L, 3-7 @ NYM",@ NYM,Rafael Devers,18,256,462,25%,100.2,0,80,4.56,1.43,10,
Brock BurkeNo new player Notes CIN - P 7:10 pm vs PHI,PHI,FA,45,458,463,0%,43.1,1,38,3.12,1.38,0,
"Vince VelasquezNAPlayer Note CHC - P Top 9, 2-3 @ BAL",@ BAL,FA,2,614,466,0%,3.1,0,1,0.0,0.3,0,
Sam MollNo new player Notes CIN - P 7:10 pm vs PHI,PHI,FA,42,615,467,0%,37.2,1,40,3.82,1.3,0,
Brad KellerNew Player Note PHI - P 7:10 pm @ CIN,@ CIN,FA,32,436,469,6%,31.1,3,32,4.02,1.34,0,
JoJo RomeroPlayer Note STL - P 7:45 pm vs MIL,MIL,FA,42,496,470,13%,41.0,0,42,3.51,1.32,0,
Ryan ThompsonNo new player Notes AZ - P 9:40 pm @ SD,@ SD,FA,37,504,471,0%,33.1,0,25,2.97,1.29,0,
"Greg WeissertNo new player Notes BOS - P Top 7, 2-1 @ CWS",@ CWS,FA,37,477,472,0%,35.2,0,33,3.79,1.21,0,
"Tim HerrinIL15New Player Note CLE - P W, 5-2 @ MIN",@ MIN,FA,41,586,473,2%,32.1,0,27,3.06,1.3,0,
"Ty BlachNANo new player Notes CHC - P Top 9, 2-3 @ BAL",@ BAL,FA,1,701,474,0%,3.0,0,2,0.0,0.33,0,
Dax FultonNANo new player Notes MIA - P 6:40 pm vs SEA,SEA,FA,3,623,476,0%,7.0,0,6,2.57,0.86,0,
"Bailey OberNew Player Note MIN - P L, 2-5 vs CLE",CLE,Cash is King,12,346,477,20%,66.2,0,46,4.59,1.22,4,
"Kendry RojasNew Player Note MIN - P L, 2-5 vs CLE",CLE,FA,6,579,478,0%,16.1,0,18,1.65,1.53,0,
Garrett StallingsPlayer Note MIL - P 7:45 pm @ STL,@ STL,FA,2,733,479,0%,3.0,0,4,0.0,0.67,0,
Nick PivettaIL60Player Note SD - P 9:40 pm vs AZ,AZ,Cookie Monster ,4,222,482,72%,16.0,0,24,4.5,1.13,0,
"Jonathan PintaroNA7Player Note NYM - P W, 7-3 vs KC",KC,FA,5,692,484,0%,12.1,0,12,5.11,0.73,0,
"Garrett ActonIL60Player Note MIN - P L, 2-5 vs CLE",CLE,FA,4,581,485,0%,6.2,0,9,2.7,1.05,0,
Blake TreinenIL15Player Note LAD - P,,FA,29,515,487,1%,23.0,1,25,3.52,1.35,0,
"Caleb ThielbarNo new player Notes CHC - P Top 9, 2-3 @ BAL",@ BAL,FA,29,441,488,2%,25.2,2,32,4.56,1.29,0,
Josh EknessIL60No new player Notes MIA - P 6:40 pm vs SEA,SEA,FA,6,629,489,0%,5.1,1,5,1.69,1.31,0,
Ryne NelsonIL60No new player Notes AZ - P 9:40 pm @ SD,@ SD,FA,15,392,490,31%,83.1,0,62,4.97,1.24,6,
Ben PeoplesPlayer Note TEX - P 8:05 pm vs LAA,LAA,FA,2,628,492,0%,3.0,0,2,0.0,0.67,0,
"Yerry De los SantosNAPlayer Note NYY - P W, 12-4 @ TB",@ TB,FA,5,719,493,0%,8.2,0,7,1.04,1.38,0,
"Ryan YarbroughNo new player Notes NYY - P W, 12-4 @ TB",@ TB,FA,22,612,494,0%,35.2,2,27,4.29,1.18,0,
Enmanuel De JesúsNANo new player Notes DET - P 6:40 pm vs ATH,ATH,FA,22,564,496,0%,31.2,1,31,3.98,1.26,0,
"Franco AlemanPlayer Note CLE - P W, 5-2 @ MIN",@ MIN,FA,5,635,497,0%,6.0,0,3,1.5,1.0,0,
Andrew AlvarezPlayer Note WSH - P,,W (Jul 10),12,542,498,5%,47.0,1,51,3.64,1.4,0,
Eiberson CastellanoNANo new player Notes COL - P 9:45 pm @ SF,@ SF,FA,1,634,500,0%,3.0,1,2,0.0,1.33,0,
"Yacksel RíosNANo new player Notes CHC - P Top 9, 2-3 @ BAL",@ BAL,FA,1,636,501,0%,1.2,0,2,0.0,0.0,0,
Lazaro EstradaNANo new player Notes TOR - P,,FA,2,724,502,0%,6.1,0,3,2.84,0.79,0,
Mark Leiter Jr.Player Note ATH - P 6:40 pm @ DET,@ DET,FA,33,680,503,0%,30.2,4,33,4.7,1.34,0,
Eddy YeanNAPlayer Note WSH - P,,FA,1,637,504,0%,2.0,0,3,0.0,0.5,0,
Tommy NanceNo new player Notes TOR - P,,FA,32,525,505,0%,33.0,0,34,3.82,1.27,0,
"Logan AllenNANo new player Notes CLE - P W, 5-2 @ MIN",@ MIN,FA,1,1309,506,0%,4.0,0,7,0.0,1.5,0,
"Mitch KellerPlayer Note PIT - P Top 9, 5-6 vs ATL",ATL,Ranger danger,18,230,507,30%,100.1,0,74,5.02,1.31,9,
"Zach ThorntonNANo new player Notes NYM - P W, 7-3 vs KC",KC,FA,2,722,509,0%,10.1,0,10,4.35,1.16,1,
"Hunter GaddisNo new player Notes CLE - P W, 5-2 @ MIN",@ MIN,FA,33,492,510,11%,27.2,1,25,2.93,1.45,0,
"John SchreiberNo new player Notes KC - P L, 3-7 @ NYM",@ NYM,FA,39,587,511,0%,35.2,1,27,3.53,1.29,0,
Jhony BritoPlayer Note SD - P 9:40 pm vs AZ,AZ,FA,1,644,512,0%,1.2,0,1,0.0,0.0,0,
Max LazarPlayer Note PHI - P 7:10 pm @ CIN,@ CIN,FA,4,1165,514,0%,5.1,0,4,3.38,0.75,0,
"Cole RagansIL60Player Note KC - P  L, 3-7 @ NYM",@ NYM,FA,8,605,515,55%,35.1,0,45,4.84,1.42,3,
"Hoby MilnerIL15No new player Notes CHC - P Top 9, 2-3 @ BAL",@ BAL,FA,38,591,516,0%,35.2,1,18,3.53,1.21,0,
Tyler HoltonNo new player Notes DET - P 6:40 pm vs ATH,ATH,FA,39,473,517,8%,41.0,0,34,3.29,1.34,0,
"Joe BoyleNANo new player Notes TB - P L, 4-12 vs NYY",NYY,FA,3,1295,518,1%,15.2,0,16,5.17,1.09,1,
"Trevor RogersPlayer Note BAL - P Top 9, 3-2 vs CHC",CHC,Fightin Farmers,16,215,519,74%,84.1,0,65,4.7,1.32,6,
"Tim HillNo new player Notes NYY - P W, 12-4 @ TB",@ TB,FA,40,477,520,2%,34.0,0,16,3.97,1.06,0,
Chase SilsethNo new player Notes LAA - P 8:05 pm @ TEX,@ TEX,FA,40,540,521,0%,33.0,0,41,3.27,1.48,0,
Tanner AndrewsNANo new player Notes TOR - P,,FA,2,648,523,0%,3.0,0,1,0.0,1.0,0,
Dylan SmithPlayer Note SF - P 9:45 pm vs COL,COL,FA,13,594,524,0%,11.2,1,12,3.86,1.29,0,
"Victor MederosPlayer Note ATL - P Top 9, 6-5 @ PIT",@ PIT,FA,1,1293,525,0%,2.0,0,0,0.0,0.5,0,
"Casey LeguminaNo new player Notes TB - P L, 4-12 vs NYY",NYY,FA,29,663,526,0%,36.1,0,26,3.47,1.27,0,
Brooks KriskeIL60No new player Notes ATH - P 6:40 pm @ DET,@ DET,FA,2,1313,527,0%,2.2,0,2,0.0,1.13,0,
Joel PegueroIL60Player Note SF - P 9:45 pm vs COL,COL,FA,11,563,528,0%,11.1,0,5,2.38,1.24,0,
Elvis AlvaradoNo new player Notes ATH - P 6:40 pm @ DET,@ DET,FA,24,530,531,4%,25.1,2,32,5.33,1.22,0,
"Zack KellyNA7Player Note BOS - P Top 7, 2-1 @ CWS",@ CWS,FA,17,1138,532,0%,16.1,0,14,3.31,1.29,0,
Easton McGeeNANo new player Notes MIL - P 7:45 pm @ STL,@ STL,FA,2,1169,534,0%,2.0,0,1,0.0,1.0,0,
"Angel ChivilliPlayer Note NYY - P W, 12-4 @ TB",@ TB,FA,4,1499,535,0%,4.2,0,4,1.93,1.29,0,
"Randy DobnakNew Player Note KC - P L, 3-7 @ NYM",@ NYM,FA,2,646,536,0%,9.2,0,4,1.86,1.34,0,
Welinton HerreraIL60No new player Notes COL - P 9:45 pm @ SF,@ SF,FA,3,673,537,0%,2.1,0,2,0.0,1.29,0,
Brian FitzpatrickIL60Player Note MIL - P 7:45 pm @ STL,@ STL,FA,5,681,538,0%,6.2,0,5,1.35,1.5,0,
Zach PopNANo new player Notes MIA - P 6:40 pm vs SEA,SEA,FA,7,1330,539,0%,7.1,0,6,3.68,1.09,0,
"Danny YoungPlayer Note ATL - P Top 9, 6-5 @ PIT",@ PIT,FA,2,677,540,0%,1.2,0,2,0.0,1.2,0,
Jake EderNAPlayer Note LAD - P,,FA,4,643,541,0%,4.0,0,1,2.25,1.0,0,
Evan PhillipsPlayer Note LAD - P,,FA,1,595,542,2%,1.0,0,2,0.0,1.0,0,
"Mick AbelIL15New Player Note MIN - P L, 2-5 vs CLE",CLE,FA,4,363,543,8%,20.1,0,23,3.98,1.57,2,
Burch SmithIL60No new player Notes DET - P 6:40 pm vs ATH,ATH,FA,13,1137,544,0%,17.0,0,20,3.18,1.47,0,
Cody PonceIL60No new player Notes TOR - P,,FA,1,687,545,3%,2.1,0,3,3.86,0.86,0,
Chad DallasPlayer Note TOR - P,,FA,1,610,546,0%,3.2,0,2,2.45,1.09,0,
Julian FernándezNANo new player Notes WSH - P,,FA,3,653,547,0%,4.0,0,3,2.25,1.25,0,
Pierce JohnsonNo new player Notes CIN - P 7:10 pm vs PHI,PHI,FA,29,509,549,0%,26.0,1,25,4.15,1.31,0,
Jeff CriswellNANo new player Notes COL - P 9:45 pm @ SF,@ SF,FA,2,689,550,0%,2.0,0,2,0.0,1.5,0,
Emilio PagánPlayer Note CIN - P 7:10 pm vs PHI,PHI,Cash is King,17,287,551,67%,15.1,7,13,6.46,1.5,0,
"Tyler SamaniegoNANo new player Notes BOS - P Top 7, 2-1 @ CWS",@ CWS,FA,20,717,552,0%,20.1,0,17,2.66,1.48,0,
"Zach EflinIL60No new player Notes BAL - P Top 9, 3-2 vs CHC",CHC,FA,1,1315,553,2%,3.2,0,7,2.45,1.64,0,
"Guillo ZuñigaNAPlayer Note NYM - P W, 7-3 vs KC",KC,FA,1,702,554,0%,1.0,0,1,0.0,1.0,0,
"Cameron WestonNAPlayer Note BAL - P Top 9, 3-2 vs CHC",CHC,FA,1,696,555,0%,1.0,0,1,0.0,1.0,0,
Adam MackoNo new player Notes TOR - P,,FA,17,576,556,0%,17.1,0,17,3.63,1.33,0,
"Matt FestaNo new player Notes CLE - P W, 5-2 @ MIN",@ MIN,FA,40,489,557,0%,38.1,1,38,3.99,1.36,0,
Sam HentgesNo new player Notes SF - P 9:45 pm vs COL,COL,FA,22,612,558,0%,16.1,0,18,2.2,1.65,0,
Erik MillerNo new player Notes SF - P 9:45 pm vs COL,COL,FA,29,547,559,1%,24.0,2,33,3.75,1.63,0,
Tyler ZuberNo new player Notes MIA - P 6:40 pm vs SEA,SEA,FA,12,1392,560,0%,10.1,1,11,4.35,1.35,0,
"Jesse ScholtensIL15Player Note TB - P L, 4-12 vs NYY",NYY,FA,9,510,561,1%,37.2,0,30,3.82,1.27,0,
Mitch FarrisNo new player Notes LAA - P 8:05 pm @ TEX,@ TEX,FA,18,1355,562,0%,38.1,0,38,3.52,1.41,0,
Kyle HurtNo new player Notes LAD - P,,FA,31,549,563,1%,29.2,1,37,4.55,1.35,0,
"Mason EnglertNAPlayer Note TB - P L, 4-12 vs NYY",NYY,FA,13,1167,564,0%,30.2,1,28,3.82,1.37,0,
"Jack AndersonNAPlayer Note BOS - P Top 7, 2-1 @ CWS",@ CWS,FA,3,708,565,0%,8.0,0,6,3.38,1.25,0,
"Duncan DavittNANo new player Notes CWS - P Top 7, 1-2 vs BOS",BOS,FA,1,704,567,0%,1.0,0,0,0.0,1.0,0,
Paul GervaseNAPlayer Note LAD - P,,FA,4,1189,568,0%,7.2,0,8,2.35,1.57,0,
Kai-Wei TengIL15Player Note HOU - P,,No Longer Rowdy,23,1168,569,2%,64.0,0,63,4.36,1.36,2,
"Connor BrogdonNANo new player Notes CLE - P W, 5-2 @ MIN",@ MIN,FA,15,648,570,0%,15.1,1,14,5.28,1.11,0,
"Josh WalkerNAPlayer Note BAL - P Top 9, 3-2 vs CHC",CHC,FA,5,1217,571,0%,6.0,0,7,4.5,1.17,0,
Luis SeverinoIL60No new player Notes ATH - P 6:40 pm @ DET,@ DET,FA,12,1357,572,7%,62.2,0,65,4.16,1.47,3,
Hunter DobbinsNAPlayer Note STL - P 7:45 pm vs MIL,MIL,FA,5,620,573,1%,22.1,1,23,4.03,1.39,0,
Spencer BivensPlayer Note SF - P 9:45 pm vs COL,COL,FA,2,633,574,0%,2.0,0,3,0.0,2.0,0,
Mitch BrattNANo new player Notes AZ - P 9:40 pm @ SD,@ SD,Stealth Bomber,1,711,575,1%,3.0,0,3,3.0,1.33,0,
Nate PearsonNo new player Notes HOU - P,,FA,16,1364,577,0%,20.0,1,16,3.6,1.4,0,
"Kervin CastroNANo new player Notes NYY - P W, 12-4 @ TB",@ TB,FA,1,719,578,0%,2.0,0,2,4.5,1.0,0,
"Marco RayaIL15New Player Note MIN - P L, 2-5 vs CLE",CLE,FA,3,726,579,0%,6.0,0,4,3.0,1.33,0,
"Joey GerberNAPlayer Note NYM - P W, 7-3 vs KC",KC,FA,7,686,580,0%,8.1,0,8,4.32,1.2,0,
Drew RomPlayer Note MIL - P 7:45 pm @ STL,@ STL,FA,5,627,582,0%,5.2,0,11,3.18,1.76,0,
"Jose CuasPlayer Note KC - P L, 3-7 @ NYM",@ NYM,FA,4,697,583,0%,5.1,0,7,3.38,1.5,0,
"Jake BirdNo new player Notes NYY - P W, 12-4 @ TB",@ TB,FA,33,1281,584,0%,28.2,0,30,4.08,1.33,0,
Chase PettyNAPlayer Note CIN - P 7:10 pm vs PHI,PHI,FA,10,1354,585,0%,22.2,1,9,4.37,1.1,0,
Luis GastelumNo new player Notes STL - P 7:45 pm vs MIL,MIL,FA,1,810,586,0%,0.2,0,0,0.0,1.5,0,
Brett KerryNANo new player Notes LAA - P 8:05 pm @ TEX,@ TEX,FA,1,734,587,0%,4.0,0,2,4.5,1.0,0,
"Tyler FergusonNo new player Notes CHC - P Top 9, 2-3 @ BAL",@ BAL,FA,9,699,588,0%,9.1,0,12,5.79,1.07,0,
"Anthony BandaIL15New Player Note MIN - P L, 2-5 vs CLE",CLE,FA,39,516,589,1%,34.1,2,33,4.46,1.34,0,
TJ ShookPlayer Note COL - P 9:45 pm @ SF,@ SF,FA,3,1147,590,0%,3.2,0,3,4.91,1.09,0,
Sam BachmanNo new player Notes LAA - P 8:05 pm @ TEX,@ TEX,FA,33,1220,591,1%,39.1,1,39,4.35,1.32,0,
"Jose EspadaNANo new player Notes BAL - P Top 9, 3-2 vs CHC",CHC,FA,1,678,592,0%,1.0,0,0,0.0,2.0,0,
"Tyler DavisNew Player Note CWS - P Top 7, 1-2 vs BOS",BOS,FA,22,594,593,0%,23.1,1,20,4.63,1.24,0,
"Alec GamboaNAPlayer Note BOS - P Top 7, 2-1 @ CWS",@ CWS,FA,4,1162,594,0%,5.0,0,4,3.6,1.4,0,
Kyle LeahyPlayer Note STL - P 7:45 pm vs MIL,MIL,Cookie Monster ,17,478,595,14%,86.1,0,73,3.86,1.45,3,
"Tyler UberstineNANo new player Notes BOS - P Top 7, 2-1 @ CWS",@ CWS,FA,1,1159,596,0%,2.2,0,2,3.38,1.5,0,
"Beck WayNo new player Notes KC - P L, 3-7 @ NYM",@ NYM,FA,14,652,597,0%,17.2,0,17,3.06,1.53,0,
"Cole SandsIL15Player Note MIN - P L, 2-5 vs CLE",CLE,FA,12,555,598,1%,11.2,1,11,4.63,1.37,0,
Drey JamesonNo new player Notes AZ - P 9:40 pm @ SD,@ SD,FA,9,1205,599,0%,14.1,0,11,3.77,1.33,0,
Zach BrzykcyNANew Player Note MIA - P 6:40 pm vs SEA,SEA,FA,1,1433,600,0%,2.0,0,2,4.5,1.5,0,
Tayler SaucedoPlayer Note LAA - P 8:05 pm @ TEX,@ TEX,FA,6,1313,601,0%,3.1,0,6,5.4,1.5,0,
"Owen MurphyNAPlayer Note ATL - P Top 9, 6-5 @ PIT",@ PIT,FA,1,1169,602,1%,1.0,0,1,9.0,1.0,0,
"Doug NikhazyNANo new player Notes CHC - P Top 9, 2-3 @ BAL",@ BAL,FA,1,1291,604,0%,2.0,0,1,4.5,1.5,0,
Kyle HartNo new player Notes SD - P 9:40 pm vs AZ,AZ,FA,22,1241,605,0%,32.2,0,28,5.23,1.07,0,
Alan RangelNew Player Note PHI - P 7:10 pm @ CIN,@ CIN,FA,5,670,606,1%,19.1,0,22,4.19,1.4,0,
"Anthony NunezPlayer Note BAL - P Top 9, 3-2 vs CHC",CHC,FA,33,622,608,0%,36.1,3,40,5.2,1.32,0,
Robert GarciaIL60No new player Notes TEX - P 8:05 pm vs LAA,LAA,FA,9,540,609,4%,8.0,0,6,3.38,1.5,0,
Tony SantillanIL15No new player Notes CIN - P 7:10 pm vs PHI,PHI,FA,34,503,610,5%,31.0,5,28,5.23,1.39,0,
Jordan RomanoPlayer Note COL - P 9:45 pm @ SF,@ SF,Joe Byron,14,1391,611,5%,11.0,6,17,7.36,1.91,0,
"Daniel EspinoNAPlayer Note CLE - P W, 5-2 @ MIN",@ MIN,FA,5,1191,613,0%,5.0,0,9,5.4,1.6,0,
Alek JacobNAPlayer Note SD - P 9:40 pm vs AZ,AZ,FA,3,1236,615,0%,5.0,0,6,5.4,1.4,0,
Juan BurgosNAPlayer Note AZ - P 9:40 pm @ SD,@ SD,FA,1,1282,616,0%,1.1,0,0,6.75,1.5,0,
"Cody LawerysonNAPlayer Note MIN - P L, 2-5 vs CLE",CLE,FA,15,607,617,0%,16.2,1,18,4.86,1.38,0,
Carter BaumlerIL60No new player Notes TEX - P 8:05 pm vs LAA,LAA,FA,4,1192,618,0%,5.2,0,6,3.18,1.76,0,
Blas CastañoIL15Player Note COL - P 9:45 pm @ SF,@ SF,FA,10,1165,619,0%,20.2,0,17,3.92,1.35,0,
"David SandlinNANo new player Notes CWS - P Top 7, 1-2 vs BOS",BOS,FA,4,720,620,1%,19.1,0,20,6.05,1.29,2,
"Lucas ErcegNo new player Notes KC - P L, 3-7 @ NYM",@ NYM,FA,36,364,621,18%,34.2,12,25,5.19,1.67,0,
"Xzavion CurryPlayer Note NYM - P W, 7-3 vs KC",KC,W (Jul 11),1,-,622,0%,1.0,0,1,9.0,2.0,0,
"Luke LittleNANo new player Notes CHC - P Top 9, 2-3 @ BAL",@ BAL,FA,1,1213,623,0%,1.0,0,1,9.0,2.0,0,
Brenan HanifeeNANo new player Notes DET - P 6:40 pm vs ATH,ATH,FA,14,668,624,0%,13.2,0,6,3.29,1.39,0,
Gavin CollyerPlayer Note TEX - P 8:05 pm vs LAA,LAA,FA,21,597,625,0%,20.2,0,19,3.92,1.4,0,
Carlos RodriguezIL15Player Note MIL - P 7:45 pm @ STL,@ STL,FA,4,1311,626,0%,9.1,0,8,3.86,1.5,0,
"Joe La SorsaNANo new player Notes BOS - P Top 7, 2-1 @ CWS",@ CWS,FA,1,1339,627,0%,0.1,0,1,27.0,3.0,0,
"Tyler SchweitzerNAPlayer Note CWS - P Top 7, 1-2 vs BOS",BOS,FA,5,1201,628,0%,8.0,1,4,4.5,1.5,0,
"Jonah TongNANo new player Notes NYM - P W, 7-3 vs KC",KC,FA,3,1259,629,3%,10.0,0,7,3.6,1.5,0,
Carson WhisenhuntNANew Player Note SF - P 9:45 pm vs COL,COL,FA,1,1161,630,1%,5.0,0,2,3.6,1.6,0,
Jalen BeeksIL15Player Note TEX - P 8:05 pm vs LAA,LAA,FA,29,528,632,0%,26.0,0,21,3.81,1.38,0,
"Craig KimbrelNo new player Notes TB - P L, 4-12 vs NYY",NYY,FA,25,1168,633,0%,25.1,0,23,4.62,1.26,0,
Chayce McDermottNANo new player Notes LAD - P,,FA,2,1425,634,0%,2.1,0,1,7.71,1.29,0,
"Antwone KellyNANo new player Notes PIT - P Top 9, 5-6 vs ATL",ATL,FA,1,1198,635,0%,2.1,0,1,7.71,1.29,0,
Max RajcicIL60Player Note STL - P 7:45 pm vs MIL,MIL,FA,6,1213,636,0%,9.0,0,8,5.0,1.33,0,
"John KleinNANo new player Notes MIN - P L, 2-5 vs CLE",CLE,FA,3,1204,637,0%,4.1,0,2,4.15,1.62,0,
"Spencer StriderIL60No new player Notes ATL - P Top 9, 6-5 @ PIT",@ PIT,Tm Mndlsn nd Mtchn,8,344,638,57%,39.0,0,46,5.31,1.36,2,
Gregory SantosNAPlayer Note SF - P 9:45 pm vs COL,COL,FA,3,1269,639,0%,5.0,0,1,3.6,1.6,0,
Luis CastilloPlayer Note SEA - P 6:40 pm @ MIA,@ MIA,The Eds,17,387,641,68%,82.2,0,77,4.79,1.33,3,
"Connor PrielippIL15New Player Note MIN - P L, 2-5 vs CLE",CLE,W (Jul 11),13,1370,643,8%,66.2,0,71,5.0,1.37,3,
Matt PushardNANo new player Notes MIA - P 6:40 pm vs SEA,SEA,FA,6,1218,644,0%,7.0,0,6,5.14,1.43,0,
Winston SantosNAPlayer Note TEX - P 8:05 pm vs LAA,LAA,FA,1,1214,645,0%,2.0,0,1,9.0,1.5,0,
"Andrew KittredgeNo new player Notes BAL - P Top 9, 3-2 vs CHC",CHC,FA,26,532,646,1%,22.0,1,22,4.91,1.36,0,
"Gavin HollowellPlayer Note CHC - P Top 9, 2-3 @ BAL",@ BAL,FA,6,1264,647,0%,6.2,0,5,4.05,1.65,0,
"Anthony MolinaNAPlayer Note ATL - P Top 9, 6-5 @ PIT",@ PIT,FA,3,1478,648,0%,5.0,0,2,5.4,1.4,0,
Bruce ZimmermannNAPlayer Note STL - P 7:45 pm vs MIL,MIL,W (Jul 10),1,1273,649,0%,5.0,0,2,5.4,1.4,0,
"Hunter HarveyIL60No new player Notes CHC - P Top 9, 2-3 @ BAL",@ BAL,FA,4,631,651,0%,4.0,0,4,6.75,1.5,0,
Reiver SanmartinNANo new player Notes SF - P 9:45 pm vs COL,COL,FA,2,699,652,0%,3.1,0,4,8.1,1.5,0,
"Camilo DovalNo new player Notes NYY - P W, 12-4 @ TB",@ TB,FA,39,488,653,3%,34.2,1,35,4.67,1.36,0,
"Jameson TaillonIL15Player Note CHC - P Top 9, 2-3 @ BAL",@ BAL,FA,13,548,655,7%,67.2,0,59,5.19,1.3,4,
JP SearsPlayer Note SD - P 9:40 pm vs AZ,AZ,FA,3,1217,656,3%,15.1,0,14,4.7,1.37,0,
"Taylor RashiNANo new player Notes MIN - P L, 2-5 vs CLE",CLE,FA,3,1143,657,0%,3.2,0,4,9.82,1.09,0,
Luis MedinaNo new player Notes ATH - P 6:40 pm @ DET,@ DET,FA,29,1235,658,0%,39.2,0,48,3.86,1.54,0,
"Chris DevenskiIL60No new player Notes PIT - P Top 9, 5-6 vs ATL",ATL,FA,3,1147,660,0%,2.1,0,3,7.71,2.14,0,
"Nick RaquetPlayer Note BAL - P Top 9, 3-2 vs CHC",CHC,FA,4,1209,662,0%,3.2,0,1,7.36,1.36,0,
"Dietrich EnnsNANo new player Notes BAL - P Top 9, 3-2 vs CHC",CHC,FA,13,574,663,0%,16.0,0,13,3.94,1.50,0,
Brycen MautzNANo new player Notes STL - P 7:45 pm vs MIL,MIL,FA,1,1230,664,0%,3.0,0,2,6.00,2.00,0,
Nolan HoffmanNANo new player Notes PHI - P 7:10 pm @ CIN,@ CIN,FA,3,1289,666,0%,4.2,0,2,3.86,1.93,0,
Kade StrowdNANo new player Notes AZ - P 9:40 pm @ SD,@ SD,FA,1,674,667,0%,1.0,0,1,9.00,4.00,0,
"Hunter StrattonPlayer Note PIT - P Top 9, 5-6 vs ATL",ATL,FA,2,1283,668,0%,2.0,0,1,9.00,2.00,0,
"Lucas SimsNANo new player Notes CWS - P Top 7, 1-2 vs BOS",BOS,FA,9,1455,669,0%,10.0,0,10,4.50,1.60,0,
Jared KoenigNo new player Notes MIL - P 7:45 pm @ STL,@ STL,FA,8,529,670,2%,7.0,0,7,2.57,2.14,0,
Chase ShugartNANew Player Note PHI - P 7:10 pm @ CIN,@ CIN,FA,26,566,671,0%,29.0,0,34,4.97,1.34,0,
"Anthony KayPlayer Note CWS - P Top 7, 1-2 vs BOS",BOS,Cash is King,18,659,673,13%,84.0,0,67,4.29,1.39,3,
"Chase SoleskyNANo new player Notes TB - P L, 4-12 vs NYY",NYY,FA,1,1234,674,0%,3.0,0,4,6.00,2.33,0,
"JR RitchiePlayer Note ATL - P Top 9, 6-5 @ PIT",@ PIT,FA,9,1292,675,3%,43.2,1,41,4.53,1.42,1,
Joey EstesNANo new player Notes ATH - P 6:40 pm @ DET,@ DET,FA,1,1404,677,0%,4.1,0,4,8.31,1.38,0,
Justin BruihlPlayer Note STL - P 7:45 pm vs MIL,MIL,FA,40,1387,679,0%,43.1,0,30,3.74,1.38,0,
Sammy PeraltaNAPlayer Note LAA - P 8:05 pm @ TEX,@ TEX,FA,2,1367,680,0%,2.2,0,4,10.13,1.88,0,
"Trevor MartinNAPlayer Note TB - P L, 4-12 vs NYY",NYY,FA,6,1253,683,0%,11.1,0,7,3.97,1.59,0,
"Cade PovichNANo new player Notes BAL - P Top 9, 3-2 vs CHC",CHC,FA,4,1510,684,0%,19.1,0,12,5.12,1.34,1,
Joel KuhnelIL15Player Note MIL - P 7:45 pm @ STL,@ STL,FA,35,1224,685,2%,35.1,6,22,4.84,1.47,0,
Michael RuckerNo new player Notes SEA - P 6:40 pm @ MIA,@ MIA,FA,9,1256,686,0%,8.2,0,11,6.23,1.50,0,
"Chris MurphyPlayer Note CWS - P Top 7, 1-2 vs BOS",BOS,FA,20,583,687,0%,20.2,1,21,4.79,1.50,0,
"Jonathan CannonNANo new player Notes CWS - P Top 7, 1-2 vs BOS",BOS,FA,1,1498,688,0%,0.0,0,0,-,-,0,
Drew SommersNo new player Notes DET - P 6:40 pm vs ATH,ATH,FA,15,1369,689,0%,9.0,0,14,6.00,1.67,0,
Robby SnellingIL60No new player Notes MIA - P 6:40 pm vs SEA,SEA,FA,1,1252,690,2%,5.0,0,2,5.40,1.80,0,
"Freddy PeraltaPlayer Note NYM - P W, 7-3 vs KC",KC,Rafael Devers,19,135,691,89%,100.0,0,98,4.68,1.42,4,
Eric LauerPlayer Note LAD - P,,Cash is King,15,533,693,18%,76.2,0,47,4.81,1.28,4,
"Grant WolframNo new player Notes BAL - P Top 9, 3-2 vs CHC",CHC,FA,33,1327,694,0%,26.2,0,29,5.06,1.35,0,
Josh SimpsonNAPlayer Note SEA - P 6:40 pm @ MIA,@ MIA,FA,4,1409,695,0%,3.0,0,3,9.0,2.0,0,
Chase LeeNANo new player Notes TOR - P,,FA,3,686,698,0%,3.1,0,1,8.1,1.8,0,
Carson PalmquistNew Player Note WSH - P,,FA,4,1534,699,0%,6.1,0,7,7.11,1.58,0,
Andrew NardiIL60No new player Notes MIA - P 6:40 pm vs SEA,SEA,FA,25,617,700,0%,22.2,0,27,5.16,1.41,0,
"Cam SandersPlayer Note PIT - P Top 9, 5-6 vs ATL",ATL,FA,8,1363,701,0%,8.2,0,11,6.23,1.62,0,
Edwin DíazIL60New Player Note LAD - P,,Joey Spierer's Team,7,360,702,81%,6.0,4,10,10.5,2.33,0,
Jack FlahertyPlayer Note DET - P 6:40 pm vs ATH,ATH,No Longer Rowdy,17,1246,703,54%,76.1,0,92,4.6,1.45,1,
Mason FluhartyNo new player Notes TOR - P,,FA,48,559,704,1%,35.1,1,43,4.58,1.53,0,
Brandon SproatPlayer Note MIL - P 7:45 pm @ STL,@ STL,NY Bombsquad,17,1413,705,24%,79.0,0,84,5.13,1.37,3,
"Kody FunderburkNo new player Notes MIN - P L, 2-5 vs CLE",CLE,FA,25,1211,706,0%,23.1,1,16,4.24,1.5,0,
"Ethan RobertsIL15Player Note CHC - P Top 9, 2-3 @ BAL",@ BAL,FA,23,1321,708,0%,25.2,0,17,4.21,1.4,0,
Domingo GonzálezNANo new player Notes SEA - P 6:40 pm @ MIA,@ MIA,FA,5,1279,710,0%,7.2,0,5,4.7,1.83,0,
"Mason BlackNANo new player Notes KC - P L, 3-7 @ NYM",@ NYM,FA,12,1338,711,0%,17.2,0,15,3.57,1.7,0,
Hayden JuengerNANo new player Notes ATH - P 6:40 pm @ DET,@ DET,FA,2,1272,712,0%,2.0,0,0,13.5,2.0,0,
"Brandon EisertNo new player Notes CWS - P Top 7, 1-2 vs BOS",BOS,FA,25,1237,714,0%,27.1,0,32,5.93,1.24,0,
"Connor ThomasNAPlayer Note ATL - P Top 9, 6-5 @ PIT",@ PIT,W (Jul 10),1,1431,715,0%,3.2,0,2,9.82,1.64,0,
"Steven CruzPlayer Note KC - P L, 3-7 @ NYM",@ NYM,FA,27,626,716,0%,29.1,0,39,5.22,1.43,0,
Bennett SousaIL60Player Note HOU - P,,FA,5,545,717,0%,3.1,0,4,8.1,2.4,0,
"Sean ManaeaNew Player Note NYM - P W, 7-3 vs KC",KC,NY Bombsquad,19,373,718,16%,68.0,0,68,4.76,1.35,1,
"Ryan WatsonNo new player Notes BOS - P Top 7, 2-1 @ CWS",@ CWS,FA,30,1361,719,0%,48.2,1,38,4.62,1.32,0,
"Shawn ArmstrongNo new player Notes CLE - P W, 5-2 @ MIN",@ MIN,FA,32,448,720,2%,28.1,0,28,4.76,1.41,0,
Wyatt MillsNAPlayer Note LAD - P,,FA,5,1286,721,0%,4.1,0,4,6.23,2.31,0,
Janson JunkNew Player Note MIA - P 6:40 pm vs SEA,SEA,Detroit Fastballs,11,1184,722,5%,60.0,0,43,4.8,1.3,2,
"Garrett CrochetIL60No new player Notes BOS - P  Top 7, 2-1 @ CWS",@ CWS,Stealth Bomber,6,138,723,95%,30.0,0,37,6.3,1.47,3,
"Ian HamiltonNAPlayer Note ATL - P Top 9, 6-5 @ PIT",@ PIT,FA,4,1266,724,0%,4.2,0,4,7.71,1.93,0,
Geoff HartliebNAPlayer Note ATH - P 6:40 pm @ DET,@ DET,FA,4,1388,725,0%,8.2,0,3,5.19,1.62,0,
"Slade CecconiNew Player Note CLE - P W, 5-2 @ MIN",@ MIN,W (Jul 11),19,1335,726,12%,99.0,0,77,4.55,1.41,5,
"Joe RockNANo new player Notes CWS - P Top 7, 1-2 vs BOS",BOS,FA,4,1268,727,0%,10.1,0,12,3.48,2.13,0,
"Johan OviedoIL60Player Note BOS - P Top 7, 2-1 @ CWS",@ CWS,FA,1,1219,728,0%,3.2,0,3,9.82,1.91,0,
Brent SuterNo new player Notes LAA - P 8:05 pm @ TEX,@ TEX,FA,34,1369,729,0%,51.1,0,44,4.56,1.32,0,
"Jordan LeasureIL60No new player Notes CWS - P Top 7, 1-2 vs BOS",BOS,FA,18,553,730,0%,18.2,0,18,6.27,1.23,0,
"Rolddy MuñozNANo new player Notes ATL - P Top 9, 6-5 @ PIT",@ PIT,FA,1,1374,732,0%,2.0,0,3,13.5,3.0,0,
Tristan BeckNANo new player Notes SF - P 9:45 pm vs COL,COL,FA,8,1297,734,0%,10.2,1,5,6.75,1.41,0,
"Alex LangePlayer Note KC - P L, 3-7 @ NYM",@ NYM,FA,37,249,735,22%,38.0,8,37,5.92,1.53,0,
"Wilber DotelIL15Player Note PIT - P Top 9, 5-6 vs ATL",ATL,FA,9,1240,736,0%,18.1,0,19,5.89,1.36,0,
"Noah CameronPlayer Note KC - P L, 3-7 @ NYM",@ NYM,FA,17,193,737,21%,88.2,0,82,4.77,1.45,5,
Ken WaldichukIL60No new player Notes WSH - P,,FA,5,1309,739,0%,9.1,0,8,6.75,1.5,0,
"Isaac MattsonNo new player Notes PIT - P Top 9, 5-6 vs ATL",ATL,FA,30,631,740,0%,29.0,0,25,4.66,1.41,0,
"Mike ParedesPlayer Note MIN - P L, 2-5 vs CLE",CLE,FA,7,1336,741,0%,29.1,0,15,4.6,1.3,0,
Zach McCambleyNAPlayer Note CIN - P 7:10 pm vs PHI,PHI,FA,4,1305,742,0%,4.1,0,4,6.23,2.54,0,
Richard LoveladyIL15No new player Notes WSH - P,,FA,33,1287,743,1%,30.1,4,27,3.86,1.81,0,
"Bryse WilsonNAPlayer Note CHC - P Top 9, 2-3 @ BAL",@ BAL,FA,3,1539,744,0%,9.2,0,8,6.52,1.55,0,
John BrebbiaNAPlayer Note COL - P 9:45 pm @ SF,@ SF,FA,3,1468,745,0%,4.1,0,2,10.38,1.62,0,
"Codi HeuerNew Player Note CLE - P W, 5-2 @ MIN",@ MIN,FA,7,1332,746,0%,8.0,0,6,5.63,1.88,0,
Bryan AbreuNo new player Notes HOU - P,,FA,33,374,747,18%,30.0,5,38,5.7,1.67,0,
Roki SasakiNew Player Note LAD - P,,W (Jul 10),16,330,748,35%,81.0,0,80,5.33,1.36,4,
"Aaron BrooksNA7No new player Notes TB - P L, 4-12 vs NYY",NYY,FA,1,1331,750,0%,0.1,0,0,81.0,9.0,0,
Brandon PfaadtPlayer Note AZ - P 9:40 pm @ SD,@ SD,W (Jul 11),15,1455,752,6%,48.1,0,39,4.84,1.34,1,
Blake SnellIL60Player Note LAD - P,,The Eds,1,208,753,77%,3.0,0,5,12.0,2.67,0,
"Edward CabreraIL15Player Note CHC - P Top 9, 2-3 @ BAL",@ BAL,FA,14,176,756,43%,72.1,0,65,5.1,1.4,4,
"Austin WarrenIL15New Player Note NYM - P W, 7-3 vs KC",KC,FA,26,1219,757,0%,35.0,0,37,4.63,1.49,0,
Christian RoaNAPlayer Note HOU - P,,FA,7,1317,758,0%,8.2,0,6,5.19,1.96,0,
"Dennis SantanaNo new player Notes PIT - P Top 9, 5-6 vs ATL",ATL,FA,40,282,759,41%,38.1,2,35,5.17,1.41,0,
J.P. FranceNANo new player Notes HOU - P,,FA,3,1318,760,0%,6.2,0,4,8.1,1.65,0,
"Joel PayampsNANo new player Notes ATL - P Top 9, 6-5 @ PIT",@ PIT,FA,12,1433,761,0%,7.2,0,9,8.22,1.7,0,
Nick LodoloPlayer Note CIN - P  7:10 pm vs PHI,PHI,Stealth Bomber,11,158,762,69%,57.2,0,46,4.68,1.46,3,
"Corbin MartinNANo new player Notes CHC - P Top 9, 2-3 @ BAL",@ BAL,FA,7,1390,763,0%,5.0,1,4,10.8,2.0,0,
"Will DionNANo new player Notes CLE - P W, 5-2 @ MIN",@ MIN,FA,6,1340,764,0%,11.1,0,13,5.56,1.85,0,
"Nick MearsIL15No new player Notes KC - P L, 3-7 @ NYM",@ NYM,FA,21,561,765,0%,19.1,0,15,5.12,1.5,0,
"Jordan HicksNo new player Notes CWS - P Top 7, 1-2 vs BOS",BOS,FA,26,1562,766,0%,23.0,1,25,4.3,1.78,0,
Lyon RichardsonNANo new player Notes MIL - P 7:45 pm @ STL,@ STL,FA,2,1445,767,0%,1.2,0,3,27.0,2.4,0,
"Luis GilNA7No new player Notes NYY - P W, 12-4 @ TB",@ TB,FA,4,1220,768,3%,19.1,0,9,6.05,1.34,1,
Ryne StanekDTDNew Player Note STL - P 7:45 pm vs MIL,MIL,FA,39,1354,770,2%,34.2,1,39,4.93,1.53,0,
Luis MeyNANo new player Notes CIN - P 7:10 pm vs PHI,PHI,FA,7,1348,771,0%,8.2,0,14,7.27,1.96,0,
"Jonathan HeasleyIL60No new player Notes TB - P L, 4-12 vs NYY",NYY,FA,1,1355,772,0%,4.0,0,2,11.25,2.0,0,
Kyle BackhusNAPlayer Note PHI - P 7:10 pm @ CIN,@ CIN,FA,17,1337,773,0%,15.1,0,15,5.87,1.57,0,
Ben CaspariusIL60No new player Notes LAD - P,,FA,5,1258,774,0%,4.2,0,4,9.64,2.14,0,
Angel ZerpaIL60No new player Notes MIL - P 7:45 pm @ STL,@ STL,FA,12,1350,775,0%,12.2,2,8,6.39,1.74,0,
Will VestIL15Player Note DET - P 6:40 pm vs ATH,ATH,FA,27,458,776,3%,26.2,2,27,6.08,1.43,0,
"Osvaldo BidoNANo new player Notes CWS - P Top 7, 1-2 vs BOS",BOS,FA,11,1500,777,0%,18.2,1,11,6.27,1.34,0,
Jake IrvinIL15Player Note WSH - P,,FA,11,1580,778,1%,51.2,0,58,5.23,1.35,0,
