Douglas GlodNANo new player Notes ATL - OF 7:15 pm vs SD,SD,FA,-,2285,1681,0%,-/-,-,-,-,-,-,
"David McCabeNANo new player Notes ATL - 1B,3B 7:15 pm vs SD",SD,FA,-,2059,1682,0%,-/-,-,-,-,-,-,
"Jud FabianNANo new player Notes BAL - OF L, 3-6 @ BOS; 7:10 pm @ BOS","@ BOS,@ BOS",FA,-,2446,1683,0%,-/-,-,-,-,-,-,
"Miguel BleisNANo new player Notes BOS - OF W, 6-3 vs BAL; 7:10 pm vs BAL","BAL,BAL",FA,-,1948,1684,0%,-/-,-,-,-,-,-,
"Mikey RomeroNANo new player Notes BOS - 2B,3B W, 6-3 vs BAL; 7:10 pm vs BAL","BAL,BAL",FA,-,2342,1685,0%,-/-,-,-,-,-,-,
"Eddinson PaulinoNANo new player Notes NYM - 2B,SS L, 3-4 @ MIL",@ MIL,FA,-,2128,1686,0%,-/-,-,-,-,-,-,
"Cutter CoffeyNANo new player Notes TOR - 2B,3B 7:07 pm vs TB",TB,FA,-,2051,1687,0%,-/-,-,-,-,-,-,
"Niko KavadasNANo new player Notes LAA - 1B,OF Top 6, 0-1 vs STL",STL,FA,-,2482,1688,0%,-/-,-,-,-,-,-,
"Brooks BrannonNANo new player Notes BOS - C,1B W, 6-3 vs BAL; 7:10 pm vs BAL","BAL,BAL",FA,-,2111,1689,0%,-/-,-,-,-,-,-,
"Cam CollierNANo new player Notes CIN - 1B,3B Bot 7, 5-3 @ SEA",@ SEA,FA,-,2450,1690,0%,-/-,-,-,-,-,-,
"Ricky CabreraNANo new player Notes CIN - 3B Bot 7, 5-3 @ SEA",@ SEA,FA,-,2395,1691,0%,-/-,-,-,-,-,-,
Jake FoxNANo new player Notes CLE - OF 6:40 pm vs MIN,MIN,FA,-,2179,1692,0%,-/-,-,-,-,-,-,
"Angel GenaoNANo new player Notes CLE - 2B,3B,SS 6:40 pm vs MIN",MIN,FA,-,1936,1693,1%,-/-,-,-,-,-,-,
"Yanquiel FernándezNANo new player Notes NYY - OF L, 3-5 vs PIT; 7:05 pm vs PIT","PIT,PIT",FA,-,1843,1694,0%,-/-,-,-,-,-,-,
"Dyan JorgeNANo new player Notes COL - 2B,SS Top 8, 0-8 vs WSH",WSH,FA,-,2331,1695,0%,-/-,-,-,-,-,-,
"Ryan BurrowesNANo new player Notes CWS - 2B,3B,SS 8:05 pm @ TEX",@ TEX,FA,-,2199,1696,0%,-/-,-,-,-,-,-,
Justyn-Henry MalloyNA7No new player Notes TB - OF 7:07 pm @ TOR,@ TOR,FA,-,1816,1697,0%,-/-,-,-,-,-,-,
Keaton AnthonyNANo new player Notes PHI - 1B 6:40 pm vs LAD,LAD,FA,-,2050,1698,0%,-/-,-,-,-,-,-,
Jacob MeltonNANo new player Notes TB - OF 7:07 pm @ TOR,@ TOR,FA,-,1879,1699,0%,-/-,-,-,-,-,-,
"Ryan CliffordNANo new player Notes NYM - 1B,OF L, 3-4 @ MIL",@ MIL,FA,-,1971,1700,0%,-/-,-,-,-,-,-,
Alexander AlbertusNANo new player Notes CWS - 3B 8:05 pm @ TEX,@ TEX,FA,-,2428,1701,0%,-/-,-,-,-,-,-,
Kenni GomezNANo new player Notes HOU - OF 8:10 pm vs MIA,MIA,FA,-,2321,1702,0%,-/-,-,-,-,-,-,
"Gavin CrossNANo new player Notes KC - OF W, 5-4 vs SF",SF,FA,-,2133,1703,0%,-/-,-,-,-,-,-,
"Cayden WallaceNANo new player Notes WSH - 2B,3B Top 8, 8-0 @ COL",@ COL,FA,-,1933,1704,0%,-/-,-,-,-,-,-,
Tyler GentryNANo new player Notes DET - OF 8:10 pm @ CHC,@ CHC,FA,-,2464,1705,0%,-/-,-,-,-,-,-,
"Austin CharlesNANo new player Notes KC - 3B,SS W, 5-4 vs SF",SF,FA,-,2182,1706,0%,-/-,-,-,-,-,-,
"Payton EelesNANo new player Notes BAL - 2B,SS,OF L, 3-6 @ BOS; 7:10 pm @ BOS","@ BOS,@ BOS",FA,-,2444,1707,0%,-/-,-,-,-,-,-,
"Charlie CondonNANo new player Notes COL - 1B,OF Top 8, 0-8 vs WSH",WSH,Joe Byron,-,1955,1708,9%,-/-,-,-,-,-,-,
"Randy De JesusNANo new player Notes LAA - OF Top 6, 0-1 vs STL",STL,FA,-,2204,1709,0%,-/-,-,-,-,-,-,
Bryce RainerNANo new player Notes DET - SS 8:10 pm @ CHC,@ CHC,FA,-,2088,1710,1%,-/-,-,-,-,-,-,
"Seaver KingNANo new player Notes WSH - SS Top 8, 8-0 @ COL",@ COL,FA,-,2026,1711,0%,-/-,-,-,-,-,-,
"Caleb LomavitaNANo new player Notes WSH - C Top 8, 8-0 @ COL",@ COL,FA,-,2089,1712,0%,-/-,-,-,-,-,-,
"Billy AmickNANo new player Notes MIN - 1B,3B 6:40 pm @ CLE",@ CLE,FA,-,1962,1713,0%,-/-,-,-,-,-,-,
"Slade CaldwellNANo new player Notes AZ - OF Bot 6, 9-2 vs ATH",ATH,FA,-,2178,1714,0%,-/-,-,-,-,-,-,
"Vance HoneycuttNANo new player Notes BAL - OF L, 3-6 @ BOS; 7:10 pm @ BOS","@ BOS,@ BOS",FA,-,2017,1715,0%,-/-,-,-,-,-,-,
"Dakota JordanNANo new player Notes SF - OF L, 4-5 @ KC",@ KC,FA,-,2459,1716,0%,-/-,-,-,-,-,-,
"Cavan BiggioNANo new player Notes HOU - 1B,OF 8:10 pm vs MIA",MIA,FA,-,1891,1717,0%,-/-,-,-,-,-,-,
Walker JanekNANo new player Notes HOU - C 8:10 pm vs MIA,MIA,FA,-,2314,1718,0%,-/-,-,-,-,-,-,
Theo GillenNANo new player Notes TB - OF 7:07 pm @ TOR,@ TOR,Cash is King,-,2238,1719,1%,-/-,-,-,-,-,-,
Rayne DonconNANo new player Notes MIN - 3B 6:40 pm @ CLE,@ CLE,FA,-,2278,1720,0%,-/-,-,-,-,-,-,
"Logan WagnerNANo new player Notes LAD - 2B,3B 6:40 pm @ PHI",@ PHI,FA,-,1969,1721,0%,-/-,-,-,-,-,-,
Kellon LindseyNANo new player Notes LAD - SS 6:40 pm @ PHI,@ PHI,FA,-,2313,1722,0%,-/-,-,-,-,-,-,
Kaelen CulpepperNANo new player Notes MIN - SS 6:40 pm @ CLE,@ CLE,FA,-,2134,1723,4%,-/-,-,-,-,-,-,
Malcolm MooreNANo new player Notes TEX - C 8:05 pm vs CWS,CWS,FA,-,2153,1724,0%,-/-,-,-,-,-,-,
"Wyatt SanfordNANo new player Notes PIT - 2B,SS W, 5-3 @ NYY; 7:05 pm @ NYY","@ NYY,@ NYY",FA,-,1940,1725,0%,-/-,-,-,-,-,-,
"Ronald HernandezNANo new player Notes NYM - C,1B L, 3-4 @ MIL",@ MIL,FA,-,2195,1726,0%,-/-,-,-,-,-,-,
"Griff O'FerrallNANo new player Notes BAL - 2B,SS L, 3-6 @ BOS; 7:10 pm @ BOS","@ BOS,@ BOS",FA,-,2240,1727,0%,-/-,-,-,-,-,-,
Jacob CozartNANo new player Notes CLE - C 6:40 pm vs MIN,MIN,FA,-,2137,1728,0%,-/-,-,-,-,-,-,
"Carter JohnsonNANo new player Notes MIA - 2B,SS 8:10 pm @ HOU",@ HOU,FA,-,2011,1729,0%,-/-,-,-,-,-,-,
"Tyson LewisNANo new player Notes CIN - SS Bot 7, 5-3 @ SEA",@ SEA,FA,-,2394,1730,0%,-/-,-,-,-,-,-,
Hendry MendezNANo new player Notes MIN - OF 6:40 pm @ CLE,@ CLE,Tm Mndlsn nd Mtchn,-,2280,1731,0%,-/-,-,-,-,-,-,
"Kevin BazzellNANo new player Notes WSH - C Top 8, 8-0 @ COL",@ COL,FA,-,2190,1732,0%,-/-,-,-,-,-,-,
Dante NoriNANo new player Notes PHI - OF 6:40 pm vs LAD,LAD,FA,-,2081,1733,0%,-/-,-,-,-,-,-,
PJ MorlandoNANo new player Notes MIA - OF 8:10 pm @ HOU,@ HOU,FA,-,2227,1734,0%,-/-,-,-,-,-,-,
"Jared ThomasNANo new player Notes COL - OF Top 8, 0-8 vs WSH",WSH,FA,-,1987,1735,0%,-/-,-,-,-,-,-,
"Braylon PayneNANo new player Notes MIL - OF W, 4-3 vs NYM",NYM,FA,-,2317,1736,0%,-/-,-,-,-,-,-,
"Tanner SchobelNANo new player Notes MIN - 3B,SS 6:40 pm @ CLE",@ CLE,FA,-,2366,1737,0%,-/-,-,-,-,-,-,
Yasser MercedesNANo new player Notes MIN - OF 6:40 pm @ CLE,@ CLE,FA,-,1957,1738,0%,-/-,-,-,-,-,-,
Mike SirotaNANo new player Notes LAD - OF 6:40 pm @ PHI,@ PHI,Joe Byron,-,2283,1739,1%,-/-,-,-,-,-,-,
"Danny De AndradeNANo new player Notes MIN - 2B,3B,SS 6:40 pm @ CLE",@ CLE,FA,-,2117,1740,0%,-/-,-,-,-,-,-,
"Caleb BonemerNANo new player Notes CWS - 3B,SS 8:05 pm @ TEX",@ TEX,FA,-,2370,1741,1%,-/-,-,-,-,-,-,
Kavares TearsNANo new player Notes SD - OF 7:15 pm @ ATL,@ ATL,FA,-,2097,1742,0%,-/-,-,-,-,-,-,
"Kevin ParadaNANo new player Notes NYM - C L, 3-4 @ MIL",@ MIL,FA,-,2247,1743,0%,-/-,-,-,-,-,-,
"Jett WilliamsNANo new player Notes MIL - 2B,SS,OF W, 4-3 vs NYM",NYM,Detroit Fastballs,-,2353,1744,2%,-/-,-,-,-,-,-,
"Blake BurkeNANo new player Notes MIL - 1B W, 4-3 vs NYM",NYM,FA,-,1929,1745,0%,-/-,-,-,-,-,-,
"Peyton StovallNANo new player Notes CIN - 1B,2B Bot 7, 5-3 @ SEA",@ SEA,FA,-,2029,1746,0%,-/-,-,-,-,-,-,
"Ethan AndersonNANo new player Notes BAL - C,1B L, 3-6 @ BOS; 7:10 pm @ BOS","@ BOS,@ BOS",FA,-,2171,1747,0%,-/-,-,-,-,-,-,
"Jacob ReimerNANo new player Notes NYM - 1B,3B L, 3-4 @ MIL",@ MIL,FA,-,2315,1748,0%,-/-,-,-,-,-,-,
"Gage MillerNANo new player Notes MIA - 2B,3B 8:10 pm @ HOU",@ HOU,FA,-,2073,1749,0%,-/-,-,-,-,-,-,
"Kyle DeBargeNANo new player Notes MIN - 2B,SS,OF 6:40 pm @ CLE",@ CLE,FA,-,2322,1750,0%,-/-,-,-,-,-,-,
"Roderick AriasNANo new player Notes NYY - 3B,SS L, 3-5 vs PIT; 7:05 pm vs PIT","PIT,PIT",FA,-,1949,1751,0%,-/-,-,-,-,-,-,
Dylan DreilingNANo new player Notes TEX - OF 8:05 pm vs CWS,CWS,FA,-,2410,1752,0%,-/-,-,-,-,-,-,
"Carson DeMartiniNANo new player Notes PHI - 3B,SS 6:40 pm vs LAD",LAD,FA,-,2074,1753,0%,-/-,-,-,-,-,-,
Griffin BurkholderNANo new player Notes PHI - OF 6:40 pm vs LAD,LAD,FA,-,2125,1754,0%,-/-,-,-,-,-,-,
Ty SouthiseneNANo new player Notes CHC - 2B 8:10 pm vs DET,DET,FA,-,2412,1755,0%,-/-,-,-,-,-,-,
"Cooper BowmanNANo new player Notes TB - 1B,2B,OF 7:07 pm @ TOR",@ TOR,FA,-,2393,1756,0%,-/-,-,-,-,-,-,
Austin OvernNANo new player Notes TB - OF 7:07 pm @ TOR,@ TOR,FA,-,1982,1757,0%,-/-,-,-,-,-,-,
"Jon BertiNANo new player Notes CHC - 2B,3B 8:10 pm vs DET",DET,FA,-,1820,1758,0%,-/-,-,-,-,-,-,
"William BergollaNANo new player Notes CWS - 2B,SS 8:05 pm @ TEX",@ TEX,FA,-,2425,1759,0%,-/-,-,-,-,-,-,
"JD DixNANo new player Notes AZ - 2B Bot 6, 9-2 vs ATH",ATH,FA,-,2068,1760,0%,-/-,-,-,-,-,-,
"Cole MathisNANo new player Notes NYM - 3B L, 3-4 @ MIL",@ MIL,FA,-,2180,1761,0%,-/-,-,-,-,-,-,
"Jared JonesNANo new player Notes PIT - 1B W, 5-3 @ NYY; 7:05 pm @ NYY","@ NYY,@ NYY",FA,-,1950,1762,0%,-/-,-,-,-,-,-,
Caleb RickettsNANo new player Notes PHI - C 6:40 pm vs LAD,LAD,FA,-,2129,1763,0%,-/-,-,-,-,-,-,
"Termarr JohnsonNANo new player Notes PIT - 2B W, 5-3 @ NYY; 7:05 pm @ NYY","@ NYY,@ NYY",FA,-,2352,1764,0%,-/-,-,-,-,-,-,
"Kale FountainNANo new player Notes SD - 1B,3B 7:15 pm @ ATL",@ ATL,FA,-,1973,1765,0%,-/-,-,-,-,-,-,
Chase HarlanNANo new player Notes LAD - 3B 6:40 pm @ PHI,@ PHI,FA,-,2053,1766,0%,-/-,-,-,-,-,-,
"Shalin PolancoNANo new player Notes PIT - OF W, 5-3 @ NYY; 7:05 pm @ NYY","@ NYY,@ NYY",FA,-,2297,1767,0%,-/-,-,-,-,-,-,
John SpikermanNANo new player Notes PHI - OF 6:40 pm vs LAD,LAD,FA,-,2071,1768,0%,-/-,-,-,-,-,-,
Casey SauckeNANo new player Notes CWS - Util 8:05 pm @ TEX,@ TEX,FA,-,2110,1769,0%,-/-,-,-,-,-,-,
"Robert HipwellNANo new player Notes SF - 1B,3B L, 4-5 @ KC",@ KC,FA,-,1992,1770,0%,-/-,-,-,-,-,-,
"Cole MessinaNANo new player Notes COL - C Top 8, 0-8 vs WSH",WSH,FA,-,1941,1771,0%,-/-,-,-,-,-,-,
"Lamar King Jr.NANo new player Notes SD - C,1B 7:15 pm @ ATL",@ ATL,FA,-,2045,1772,0%,-/-,-,-,-,-,-,
"Lazaro MontesNANo new player Notes SEA - OF Bot 7, 3-5 vs CIN",CIN,Trust The Process,-,2225,1773,1%,-/-,-,-,-,-,-,
"Victor LabradaNANo new player Notes SEA - OF Bot 7, 3-5 vs CIN",CIN,FA,-,1981,1774,0%,-/-,-,-,-,-,-,
"Luke DickersonNANo new player Notes WSH - 2B,SS Top 8, 8-0 @ COL",@ COL,FA,-,2194,1775,0%,-/-,-,-,-,-,-,
Nick McLainNANo new player Notes CWS - OF 8:05 pm @ TEX,@ TEX,FA,-,2358,1776,0%,-/-,-,-,-,-,-,
"Jonathan MejiaNANo new player Notes STL - 2B,SS Top 6, 1-0 @ LAA",@ LAA,FA,-,2165,1777,0%,-/-,-,-,-,-,-,
"Khadim DiawNANo new player Notes MIN - C,OF 6:40 pm @ CLE",@ CLE,FA,-,2086,1778,0%,-/-,-,-,-,-,-,
"Leonardo BernalNANo new player Notes STL - C Top 6, 1-0 @ LAA",@ LAA,FA,-,2072,1779,0%,-/-,-,-,-,-,-,
"Won-Bin ChoNANo new player Notes STL - OF Top 6, 1-0 @ LAA",@ LAA,FA,-,2205,1780,0%,-/-,-,-,-,-,-,
"Casey CookNANo new player Notes TEX - 2B,SS 8:05 pm vs CWS",CWS,FA,-,2104,1781,0%,-/-,-,-,-,-,-,
"Josh CaronNANo new player Notes SEA - C Bot 7, 3-5 vs CIN",CIN,FA,-,2445,1782,0%,-/-,-,-,-,-,-,
"Ryan CamposNANo new player Notes STL - C Top 6, 1-0 @ LAA",@ LAA,FA,-,2149,1783,0%,-/-,-,-,-,-,-,
Xavier IsaacNANo new player Notes TB - Util 7:07 pm @ TOR,@ TOR,FA,-,2001,1784,0%,-/-,-,-,-,-,-,
"Émilien PitreNANo new player Notes TB - 2B,SS 7:07 pm @ TOR",@ TOR,FA,-,2284,1785,0%,-/-,-,-,-,-,-,
"Dom KeeganNANo new player Notes BAL - C L, 3-6 @ BOS; 7:10 pm @ BOS","@ BOS,@ BOS",FA,-,2359,1786,0%,-/-,-,-,-,-,-,
"Drew WatersNANo new player Notes KC - OF W, 5-4 vs SF",SF,FA,-,1794,1787,0%,-/-,-,-,-,-,-,
Anthony GutierrezNANo new player Notes TEX - OF 8:05 pm vs CWS,CWS,FA,-,2132,1788,0%,-/-,-,-,-,-,-,
Nick MontgomeryNANo new player Notes ATL - C 7:15 pm vs SD,SD,FA,-,2252,1789,0%,-/-,-,-,-,-,-,
"Triston CasasIL60No new player Notes BOS - 1B W, 6-3 vs BAL; 7:10 pm vs BAL","BAL,BAL",FA,-,1865,1790,1%,-/-,-,-,-,-,-,
Gleider FiguereoNANo new player Notes TEX - 3B 8:05 pm vs CWS,CWS,FA,-,2187,1791,0%,-/-,-,-,-,-,-,
Carter MathisonNANo new player Notes PHI - OF 6:40 pm vs LAD,LAD,FA,-,1951,1792,0%,-/-,-,-,-,-,-,
"Sam PetersenNANo new player Notes WSH - OF Top 8, 8-0 @ COL",@ COL,FA,-,2303,1793,0%,-/-,-,-,-,-,-,
"Josh KasevichNANo new player Notes TOR - 3B,SS 7:07 pm vs TB",TB,FA,-,2318,1794,0%,-/-,-,-,-,-,-,
"Jakob ChristianNANo new player Notes SF - 1B,OF L, 4-5 @ KC",@ KC,FA,-,2435,1795,0%,-/-,-,-,-,-,-,
"Devin Fitz-GeraldNANo new player Notes WSH - Util Top 8, 8-0 @ COL",@ COL,FA,-,2023,1796,0%,-/-,-,-,-,-,-,
"Ivan LucianoNANo new player Notes AZ - C Bot 6, 9-2 vs ATH",ATH,FA,-,2242,1797,0%,-/-,-,-,-,-,-,
Zach EhrhardNANo new player Notes LAD - OF 6:40 pm @ PHI,@ PHI,FA,-,2135,1798,0%,-/-,-,-,-,-,-,
"Bobby BoserNANo new player Notes ATH - SS Bot 6, 2-9 @ AZ",@ AZ,FA,-,2386,1799,0%,-/-,-,-,-,-,-,
Nathan FlewellingNANo new player Notes TB - C 7:07 pm @ TOR,@ TOR,FA,-,2277,1800,0%,-/-,-,-,-,-,-,
Fenwick TrimbleNANo new player Notes MIA - OF 8:10 pm @ HOU,@ HOU,FA,-,2380,1801,0%,-/-,-,-,-,-,-,
Tirso OrnelasNANo new player Notes SD - OF 7:15 pm @ ATL,@ ATL,FA,-,2481,1802,0%,-/-,-,-,-,-,-,
"Cobb HightowerNANo new player Notes BAL - 2B,SS L, 3-6 @ BOS; 7:10 pm @ BOS","@ BOS,@ BOS",FA,-,2248,1803,0%,-/-,-,-,-,-,-,
"Ronny CruzNANo new player Notes WSH - SS Top 8, 8-0 @ COL",@ COL,FA,-,2339,1804,0%,-/-,-,-,-,-,-,
"Elijah GreenNANo new player Notes WSH - OF Top 8, 8-0 @ COL",@ COL,FA,-,2332,1805,0%,-/-,-,-,-,-,-,
"Cristhian VaqueroNANo new player Notes WSH - OF Top 8, 8-0 @ COL",@ COL,FA,-,2216,1806,0%,-/-,-,-,-,-,-,
"Marco LucianoNANo new player Notes NYY - 2B,SS L, 3-5 vs PIT; 7:05 pm vs PIT","PIT,PIT",FA,-,1925,1807,0%,-/-,-,-,-,-,-,
"Andrew KniznerNANo new player Notes BOS - C W, 6-3 vs BAL; 7:10 pm vs BAL","BAL,BAL",FA,-,1877,1808,0%,-/-,-,-,-,-,-,
"Ivan MelendezNANo new player Notes AZ - 1B Bot 6, 9-2 vs ATH",ATH,FA,-,2177,1809,0%,-/-,-,-,-,-,-,
"Ruben SantanaNANo new player Notes AZ - 1B,3B Bot 6, 9-2 vs ATH",ATH,FA,-,2296,1810,0%,-/-,-,-,-,-,-,
"Orelvis MartinezNANo new player Notes WSH - 2B,3B Top 8, 8-0 @ COL",@ COL,FA,-,1926,1811,0%,-/-,-,-,-,-,-,
Andrew PintarNANo new player Notes MIA - OF 8:10 pm @ HOU,@ HOU,FA,-,2141,1812,0%,-/-,-,-,-,-,-,
"Michael ArroyoNANo new player Notes SEA - 2B Bot 7, 3-5 vs CIN",CIN,FA,-,2404,1813,1%,-/-,-,-,-,-,-,
"Carlos JimenezNANo new player Notes SEA - OF Bot 7, 3-5 vs CIN",CIN,FA,-,2424,1814,0%,-/-,-,-,-,-,-,
"Gabriel RodriguezNANo new player Notes CLE - 3B,SS 6:40 pm vs MIN",MIN,FA,-,2381,1815,0%,-/-,-,-,-,-,-,
Brendan TuninkNANo new player Notes LAD - OF 6:40 pm @ PHI,@ PHI,FA,-,1935,1816,0%,-/-,-,-,-,-,-,
"Jacob BerryNANo new player Notes MIA - 2B,3B,OF 8:10 pm @ HOU",@ HOU,FA,-,2400,1817,0%,-/-,-,-,-,-,-,
"DJ LaytonNANo new player Notes BAL - 2B,SS L, 3-6 @ BOS; 7:10 pm @ BOS","@ BOS,@ BOS",FA,-,2146,1818,0%,-/-,-,-,-,-,-,
Carlos RodríguezNANo new player Notes SD - OF 7:15 pm @ ATL,@ ATL,FA,-,2067,1819,0%,-/-,-,-,-,-,-,
"Caden PowellNANo new player Notes HOU - 3B,SS 8:10 pm vs MIA",MIA,FA,-,1984,1820,0%,-/-,-,-,-,-,-,
Joseph SullivanNANo new player Notes HOU - OF 8:10 pm vs MIA,MIA,FA,-,2457,1821,0%,-/-,-,-,-,-,-,
"Marco VargasNANo new player Notes NYM - 2B,SS L, 3-4 @ MIL",@ MIL,FA,-,2266,1822,0%,-/-,-,-,-,-,-,
"Max WagnerNANo new player Notes BAL - 2B,3B L, 3-6 @ BOS; 7:10 pm @ BOS","@ BOS,@ BOS",FA,-,2456,1823,0%,-/-,-,-,-,-,-,
"Aron EstradaNANo new player Notes BAL - 2B,OF L, 3-6 @ BOS; 7:10 pm @ BOS","@ BOS,@ BOS",FA,-,2192,1824,0%,-/-,-,-,-,-,-,
"Braylin TaveraNANo new player Notes BAL - OF L, 3-6 @ BOS; 7:10 pm @ BOS","@ BOS,@ BOS",FA,-,2099,1825,0%,-/-,-,-,-,-,-,
"Leandro AriasNANo new player Notes BAL - 2B,3B,SS L, 3-6 @ BOS; 7:10 pm @ BOS","@ BOS,@ BOS",FA,-,2379,1826,0%,-/-,-,-,-,-,-,
"Coco MontesNANo new player Notes TB - 2B,3B,OF 7:07 pm @ TOR",@ TOR,FA,-,2463,1827,0%,-/-,-,-,-,-,-,
"Axiel PlazNANo new player Notes PIT - C,1B W, 5-3 @ NYY; 7:05 pm @ NYY","@ NYY,@ NYY",FA,-,2306,1828,0%,-/-,-,-,-,-,-,
"Tony Blanco Jr.NANo new player Notes PIT - 1B W, 5-3 @ NYY; 7:05 pm @ NYY","@ NYY,@ NYY",FA,-,1989,1829,0%,-/-,-,-,-,-,-,
"Yordany De Los SantosNANo new player Notes PIT - 2B,3B,SS W, 5-3 @ NYY; 7:05 pm @ NYY","@ NYY,@ NYY",FA,-,2253,1830,0%,-/-,-,-,-,-,-,
"Brennan MiloneNANo new player Notes ATH - 1B Bot 6, 2-9 @ AZ",@ AZ,FA,-,2052,1831,0%,-/-,-,-,-,-,-,
"Carlos PachecoNANo new player Notes ATH - OF Bot 6, 2-9 @ AZ",@ AZ,FA,-,2351,1832,0%,-/-,-,-,-,-,-,
"Javi VazNANo new player Notes KC - 2B,OF W, 5-4 vs SF",SF,FA,-,2234,1833,0%,-/-,-,-,-,-,-,
Mason McCoyNANo new player Notes SD - SS 7:15 pm @ ATL,@ ATL,FA,-,1904,1834,0%,-/-,-,-,-,-,-,
"Jesús MadeNANo new player Notes MIL - 2B,3B,SS W, 4-3 vs NYM",NYM,The Eds,-,2060,1835,9%,-/-,-,-,-,-,-,
"Luis PeñaNANo new player Notes MIL - 2B,3B,SS W, 4-3 vs NYM",NYM,FA,-,2173,1836,1%,-/-,-,-,-,-,-,
"Jorge QuintanaNANo new player Notes SD - 3B,SS 7:15 pm @ ATL",@ ATL,FA,-,2319,1837,0%,-/-,-,-,-,-,-,
"Joswa LugoNANo new player Notes LAA - SS Top 6, 0-1 vs STL",STL,FA,-,2246,1838,0%,-/-,-,-,-,-,-,
"Hayden AlvarezNANo new player Notes LAA - OF Top 6, 0-1 vs STL",STL,FA,-,2447,1839,0%,-/-,-,-,-,-,-,
"Pascanel FerrerasNANo new player Notes HOU - 2B,3B,SS 8:10 pm vs MIA",MIA,FA,-,2387,1840,0%,-/-,-,-,-,-,-,
"Jancel VillarroelNANo new player Notes SF - C,OF L, 4-5 @ KC",@ KC,FA,-,1947,1841,0%,-/-,-,-,-,-,-,
Jose PerdomoNANo new player Notes ATL - SS 7:15 pm vs SD,SD,FA,-,2327,1842,0%,-/-,-,-,-,-,-,
"Rainiel RodriguezNANo new player Notes STL - C Top 6, 1-0 @ LAA",@ LAA,FA,-,2261,1843,1%,-/-,-,-,-,-,-,
"Yairo PadillaNANo new player Notes STL - SS Top 6, 1-0 @ LAA",@ LAA,FA,-,2406,1844,0%,-/-,-,-,-,-,-,
"Adriel RadneyNANo new player Notes AZ - OF Bot 6, 9-2 vs ATH",ATH,FA,-,2176,1845,0%,-/-,-,-,-,-,-,
"Yassel SolerNANo new player Notes AZ - 3B Bot 6, 9-2 vs ATH",ATH,FA,-,1960,1846,0%,-/-,-,-,-,-,-,
"Demetrio CrisantesNANo new player Notes AZ - 2B,3B Bot 6, 9-2 vs ATH",ATH,FA,-,2231,1847,0%,-/-,-,-,-,-,-,
"Alberto BarrigaNANo new player Notes AZ - C Bot 6, 9-2 vs ATH",ATH,FA,-,2024,1848,0%,-/-,-,-,-,-,-,
Fernando CruzNANo new player Notes CHC - SS 8:10 pm vs DET,DET,FA,-,2389,1849,0%,-/-,-,-,-,-,-,
Eli LovichNANo new player Notes CHC - OF 8:10 pm vs DET,DET,FA,-,1965,1850,0%,-/-,-,-,-,-,-,
"Stiven MartinezNANo new player Notes BAL - OF L, 3-6 @ BOS; 7:10 pm @ BOS","@ BOS,@ BOS",FA,-,2143,1851,0%,-/-,-,-,-,-,-,
"Thomas SosaNANo new player Notes BAL - OF L, 3-6 @ BOS; 7:10 pm @ BOS","@ BOS,@ BOS",FA,-,2398,1852,0%,-/-,-,-,-,-,-,
"Joshua LiranzoNANo new player Notes BAL - 1B,3B,SS L, 3-6 @ BOS; 7:10 pm @ BOS","@ BOS,@ BOS",FA,-,2181,1853,0%,-/-,-,-,-,-,-,
"Emilio SanchezNANo new player Notes BAL - 3B,SS L, 3-6 @ BOS; 7:10 pm @ BOS","@ BOS,@ BOS",FA,-,2453,1854,0%,-/-,-,-,-,-,-,
"Jordan SanchezNANo new player Notes BAL - OF L, 3-6 @ BOS; 7:10 pm @ BOS","@ BOS,@ BOS",FA,-,2364,1855,0%,-/-,-,-,-,-,-,
"Nelly TaylorNANo new player Notes BOS - OF W, 6-3 vs BAL; 7:10 pm vs BAL","BAL,BAL",FA,-,2361,1856,0%,-/-,-,-,-,-,-,
"Angel CepedaNANo new player Notes CHC - 2B,3B,SS 8:10 pm vs DET",DET,FA,-,2078,1857,0%,-/-,-,-,-,-,-,
Robert AriasNANo new player Notes CLE - OF 6:40 pm vs MIN,MIN,FA,-,2036,1858,0%,-/-,-,-,-,-,-,
"Ashly AndujarNANo new player Notes COL - SS Top 8, 0-8 vs WSH",WSH,FA,-,2433,1859,0%,-/-,-,-,-,-,-,
"Franyerber MontillaNANo new player Notes DET - 2B,SS 8:10 pm @ CHC",@ CHC,FA,-,2355,1860,0%,-/-,-,-,-,-,-,
Nestor MirandaNANo new player Notes DET - Util 8:10 pm @ CHC,@ CHC,FA,-,2191,1861,0%,-/-,-,-,-,-,-,
"Yandel RicardoNANo new player Notes KC - SS W, 5-4 vs SF",SF,FA,-,2271,1862,0%,-/-,-,-,-,-,-,
"Ramon RamirezNANo new player Notes KC - C W, 5-4 vs SF",SF,FA,-,2330,1863,0%,-/-,-,-,-,-,-,
"Jhonayker UgarteNANo new player Notes KC - 3B,SS W, 5-4 vs SF",SF,FA,-,2341,1864,0%,-/-,-,-,-,-,-,
"Asbel GonzalezNANo new player Notes KC - OF W, 5-4 vs SF",SF,FA,-,2197,1865,0%,-/-,-,-,-,-,-,
"Hyungchan UmNANo new player Notes KC - C W, 5-4 vs SF",SF,FA,-,2417,1866,0%,-/-,-,-,-,-,-,
Emil MoralesNANo new player Notes LAD - SS 6:40 pm @ PHI,@ PHI,FA,-,2281,1867,0%,-/-,-,-,-,-,-,
Eduardo QuinteroNANo new player Notes LAD - OF 6:40 pm @ PHI,@ PHI,FA,-,2126,1868,1%,-/-,-,-,-,-,-,
Ching-Hsien KoNANo new player Notes LAD - OF 6:40 pm @ PHI,@ PHI,FA,-,1966,1869,0%,-/-,-,-,-,-,-,
Luis CovaNANo new player Notes MIA - OF 8:10 pm @ HOU,@ HOU,FA,-,2373,1870,0%,-/-,-,-,-,-,-,
Eduardo BeltreNANo new player Notes MIN - OF 6:40 pm @ CLE,@ CLE,FA,-,2105,1871,0%,-/-,-,-,-,-,-,
"Dameury PenaNANo new player Notes MIN - 2B,OF 6:40 pm @ CLE",@ CLE,FA,-,2218,1872,0%,-/-,-,-,-,-,-,
"Daiverson GutierrezNANo new player Notes NYM - C L, 3-4 @ MIL",@ MIL,FA,-,1961,1873,0%,-/-,-,-,-,-,-,
"Edward LantiguaNANo new player Notes NYM - 2B,3B,SS L, 3-4 @ MIL",@ MIL,FA,-,2350,1874,0%,-/-,-,-,-,-,-,
"Yovanny RodriguezNANo new player Notes NYM - C L, 3-4 @ MIL",@ MIL,FA,-,2131,1875,0%,-/-,-,-,-,-,-,
"Francisco VilorioNANo new player Notes NYY - OF L, 3-5 vs PIT; 7:05 pm vs PIT","PIT,PIT",FA,-,1985,1876,0%,-/-,-,-,-,-,-,
"Edgleen PerezNANo new player Notes PIT - C W, 5-3 @ NYY; 7:05 pm @ NYY","@ NYY,@ NYY",FA,-,2362,1877,0%,-/-,-,-,-,-,-,
"Matthew LugoNANo new player Notes KC - OF W, 5-4 vs SF",SF,FA,-,1841,1878,0%,-/-,-,-,-,-,-,
Ryan FitzgeraldNANo new player Notes LAD - SS 6:40 pm @ PHI,@ PHI,FA,-,1836,1879,0%,-/-,-,-,-,-,-,
"Engelth UrenaNANo new player Notes NYY - C L, 3-5 vs PIT; 7:05 pm vs PIT","PIT,PIT",FA,-,2256,1880,0%,-/-,-,-,-,-,-,
"Aroon EscobarNANo new player Notes PHI - 2B,3B 6:40 pm vs LAD",LAD,FA,-,2090,1881,0%,-/-,-,-,-,-,-,
"Alirio FerrebusNANo new player Notes PHI - C,1B 6:40 pm vs LAD",LAD,FA,-,2229,1882,0%,-/-,-,-,-,-,-,
"Edward FlorentinoNANo new player Notes PIT - 1B,OF W, 5-3 @ NYY; 7:05 pm @ NYY","@ NYY,@ NYY",FA,-,2415,1883,1%,-/-,-,-,-,-,-,
Romeo SanabriaNANo new player Notes SD - 1B 7:15 pm @ ATL,@ ATL,FA,-,2113,1884,0%,-/-,-,-,-,-,-,
"Jhonny LevelNANo new player Notes SF - SS L, 4-5 @ KC",@ KC,FA,-,2345,1885,0%,-/-,-,-,-,-,-,
"Yohendry SanchezNANo new player Notes SF - C L, 4-5 @ KC",@ KC,FA,-,2369,1886,0%,-/-,-,-,-,-,-,
"Jose OrtizNANo new player Notes SF - OF L, 4-5 @ KC",@ KC,FA,-,2030,1887,0%,-/-,-,-,-,-,-,
"Bo DavidsonNANo new player Notes SF - OF L, 4-5 @ KC",@ KC,FA,-,1934,1888,0%,-/-,-,-,-,-,-,
"Oliver TejadaNANo new player Notes SF - OF L, 4-5 @ KC",@ KC,FA,-,2440,1889,0%,-/-,-,-,-,-,-,
"Dawel JosephNANo new player Notes SEA - 3B,SS Bot 7, 3-5 vs CIN",CIN,FA,-,2282,1890,0%,-/-,-,-,-,-,-,
"Michael TogliaNANo new player Notes CIN - 1B Bot 7, 5-3 @ SEA",@ SEA,FA,-,1766,1891,0%,-/-,-,-,-,-,-,
Paulino SantanaNANo new player Notes TEX - OF 8:05 pm vs CWS,CWS,FA,-,2136,1892,0%,-/-,-,-,-,-,-,
"Yolfran CastilloNANo new player Notes TEX - 3B,SS 8:05 pm vs CWS",CWS,FA,-,1938,1893,0%,-/-,-,-,-,-,-,
Braylin MorelNANo new player Notes TEX - OF 8:05 pm vs CWS,CWS,FA,-,1983,1894,0%,-/-,-,-,-,-,-,
"Yeremy CabreraNANo new player Notes WSH - OF Top 8, 8-0 @ COL",@ COL,FA,-,2354,1895,0%,-/-,-,-,-,-,-,
"Victor HurtadoNANo new player Notes WSH - OF Top 8, 8-0 @ COL",@ COL,FA,-,2210,1896,0%,-/-,-,-,-,-,-,
"Angel FelizNANo new player Notes WSH - 2B,SS Top 8, 8-0 @ COL",@ COL,FA,-,2202,1897,0%,-/-,-,-,-,-,-,
Korey LeeNANo new player Notes CWS - C 8:05 pm @ TEX,@ TEX,FA,-,1835,1898,0%,-/-,-,-,-,-,-,
"Adolfo SanchezNANo new player Notes CIN - OF Bot 7, 5-3 @ SEA",@ SEA,FA,-,2275,1899,0%,-/-,-,-,-,-,-,
"Naibel MarianoNANo new player Notes CIN - 3B,SS Bot 7, 5-3 @ SEA",@ SEA,FA,-,1997,1900,0%,-/-,-,-,-,-,-,
"Eli Serrano IIINANo new player Notes NYM - OF L, 3-4 @ MIL",@ MIL,FA,-,1972,1901,0%,-/-,-,-,-,-,-,
James Tibbs IIINANo new player Notes LAD - OF 6:40 pm @ PHI,@ PHI,Detroit Fastballs,-,2214,1902,4%,-/-,-,-,-,-,-,
"Kyren ParisNANo new player Notes LAA - 2B,OF Top 6, 0-1 vs STL",STL,FA,-,1796,1903,0%,-/-,-,-,-,-,-,
"Shotaro MoriiNANo new player Notes ATH - SS Bot 6, 2-9 @ AZ",@ AZ,FA,-,2241,1904,0%,-/-,-,-,-,-,-,
"Josuar GonzalezNANo new player Notes SF - SS L, 4-5 @ KC",@ KC,FA,-,2079,1905,1%,-/-,-,-,-,-,-,
"Logan DavidsonNANo new player Notes TB - 1B,3B 7:07 pm @ TOR",@ TOR,FA,-,1923,1906,0%,-/-,-,-,-,-,-,
"Ji Hwan BaeNANo new player Notes NYM - OF L, 3-4 @ MIL",@ MIL,FA,-,1901,1907,0%,-/-,-,-,-,-,-,
"Arnoldo LantiguaNANo new player Notes CIN - OF Bot 7, 5-3 @ SEA",@ SEA,FA,-,2207,1908,0%,-/-,-,-,-,-,-,
"Edgar MonteroNANo new player Notes ATH - SS Bot 6, 2-9 @ AZ",@ AZ,FA,-,2217,1909,0%,-/-,-,-,-,-,-,
Maximo AcostaNANo new player Notes MIA - SS 8:10 pm @ HOU,@ HOU,FA,-,1873,1910,0%,-/-,-,-,-,-,-,
"Alex RamírezNANo new player Notes NYM - OF L, 3-4 @ MIL",@ MIL,FA,-,2438,1911,0%,-/-,-,-,-,-,-,
"Kevin HidalgoNANo new player Notes COL - 3B,SS Top 8, 0-8 vs WSH",WSH,FA,-,1993,1912,0%,-/-,-,-,-,-,-,
"Andy PerezNANo new player Notes COL - SS Top 8, 0-8 vs WSH",WSH,FA,-,2288,1913,0%,-/-,-,-,-,-,-,
"Mani CedenoNANo new player Notes NYY - SS L, 3-5 vs PIT; 7:05 pm vs PIT","PIT,PIT",FA,-,1932,1914,0%,-/-,-,-,-,-,-,
"Robert Hassell IIINAPlayer Note PIT - OF W, 5-3 @ NYY; 7:05 pm @ NYY","@ NYY,@ NYY",FA,-,1797,1915,0%,-/-,-,-,-,-,-,
"Riley AdamsNANo new player Notes WSH - C Top 8, 8-0 @ COL",@ COL,FA,-,1810,1916,0%,-/-,-,-,-,-,-,
"Brayan BuelvasNANo new player Notes ATH - OF Bot 6, 2-9 @ AZ",@ AZ,FA,-,2055,1917,0%,-/-,-,-,-,-,-,
John GilNANo new player Notes ATL - SS 7:15 pm vs SD,SD,FA,-,2031,1918,0%,-/-,-,-,-,-,-,
"Chris SueroNANo new player Notes NYM - C,1B,OF L, 3-4 @ MIL",@ MIL,FA,-,2121,1919,0%,-/-,-,-,-,-,-,
Willie MacIverNANo new player Notes TOR - C 7:07 pm vs TB,TB,FA,-,1882,1920,0%,-/-,-,-,-,-,-,
Braedon KarpathiosNANo new player Notes SD - OF 7:15 pm @ ATL,@ ATL,FA,-,1963,1921,0%,-/-,-,-,-,-,-,
Brendan JonesNANo new player Notes MIA - OF 8:10 pm @ HOU,@ HOU,FA,-,2211,1922,0%,-/-,-,-,-,-,-,
"Heston KjerstadNANo new player Notes BAL - OF L, 3-6 @ BOS; 7:10 pm @ BOS","@ BOS,@ BOS",FA,-,1823,1923,0%,-/-,-,-,-,-,-,
"Jordan WestburgIL60No new player Notes BAL - 2B,3B L, 3-6 @ BOS; 7:10 pm @ BOS","@ BOS,@ BOS",Joe Byron,-,1646,1924,9%,-/-,-,-,-,-,-,
"Zac VeenNANo new player Notes COL - OF Top 8, 0-8 vs WSH",WSH,Ranger danger,-,2476,1925,1%,-/-,-,-,-,-,-,
"Will BushNANo new player Notes HOU - C,1B 8:10 pm vs MIA",MIA,FA,-,2407,1926,0%,-/-,-,-,-,-,-,
"Tyler FitzgeraldNANo new player Notes SF - 2B L, 4-5 @ KC",@ KC,FA,-,1762,1927,0%,-/-,-,-,-,-,-,
"Josh AdamczewskiNANo new player Notes MIL - 2B W, 4-3 vs NYM",NYM,FA,-,2384,1928,0%,-/-,-,-,-,-,-,
Pedro LeónNANo new player Notes PHI - OF 6:40 pm vs LAD,LAD,FA,-,2461,1929,0%,-/-,-,-,-,-,-,
Bryan De La CruzNew Player Note PHI - OF 6:40 pm vs LAD,LAD,FA,-,1876,1930,0%,-/-,-,-,-,-,-,
Diego TornesNANo new player Notes ATL - OF 7:15 pm vs SD,SD,FA,-,2108,1931,0%,-/-,-,-,-,-,-,
