Pitchers,Opp: 7/9,Roster Status,GP*,Rankings_Pre-Season,Rankings_Current,Trends_% Ros,Season (total)_IP*,Season (total)_SV,Season (total)_K,Season (total)_ERA,Season (total)_WHIP,Season (total)_QS,
"Josh FlemingNAPlayer Note CHC - P Top 9, 2-3 @ BAL",@ BAL,FA,1,1351,779,0%,3.0,0,1,12.0,2.67,0,
Jaden HillIL15Player Note COL - P 9:45 pm @ SF,@ SF,FA,32,1359,780,0%,26.2,2,28,5.06,1.65,0,
"Andrew WantzNANo new player Notes CHC - P Top 9, 2-3 @ BAL",@ BAL,FA,1,1347,781,0%,1.2,0,1,27.0,2.4,0,
"Peyton PalletteNANo new player Notes CWS - P Top 7, 1-2 vs BOS",BOS,FA,16,1306,782,0%,20.2,0,22,5.23,1.6,0,
Calvin FaucherNo new player Notes MIA - P 6:40 pm vs SEA,SEA,FA,38,512,783,1%,37.0,1,39,4.62,1.57,0,
Trevor McDonaldPlayer Note SF - P 9:45 pm vs COL,COL,Detroit Fastballs,12,1358,784,7%,59.1,0,50,5.46,1.38,4,
Coleman CrowIL15Player Note MIL - P 7:45 pm @ STL,@ STL,FA,5,1368,785,0%,18.2,0,10,5.3,1.45,0,
Seth JohnsonNANew Player Note PHI - P 7:10 pm @ CIN,@ CIN,FA,11,1287,786,0%,11.1,0,14,7.15,1.68,0,
Beau BrieskePlayer Note DET - P 6:40 pm vs ATH,ATH,FA,6,1440,787,0%,7.0,0,6,9.0,1.71,0,
Tomoyuki SuganoIL15Player Note COL - P 9:45 pm @ SF,@ SF,FA,16,1300,788,4%,84.1,0,48,4.8,1.32,4,
David MorganIL15Player Note SD - P 9:40 pm vs AZ,AZ,FA,18,672,789,0%,22.0,0,26,4.5,1.77,0,
Justin VerlanderIL60Player Note DET - P 6:40 pm vs ATH,ATH,No Longer Rowdy,1,1435,790,3%,3.2,0,1,12.27,2.18,0,
Yunior MarteNAPlayer Note CIN - P 7:10 pm vs PHI,PHI,FA,1,1376,792,0%,0.1,0,1,108.0,12.0,0,
Brandon LeibrandtNANo new player Notes CIN - P 7:10 pm vs PHI,PHI,FA,1,1366,793,0%,6.0,0,3,7.5,2.17,0,
"Danny CoulombeNo new player Notes BOS - P Top 7, 2-1 @ CWS",@ CWS,FA,28,1145,795,0%,20.0,0,10,4.95,1.5,0,
"Yaramil HiraldoIL60Player Note BAL - P Top 9, 3-2 vs CHC",CHC,FA,3,1380,797,0%,1.2,0,2,21.6,4.2,0,
"Matt StrahmNo new player Notes KC - P L, 3-7 @ NYM",@ NYM,FA,33,499,799,8%,30.0,0,22,5.4,1.33,0,
Shaun AndersonNANo new player Notes LAA - P 8:05 pm @ TEX,@ TEX,FA,9,1451,800,0%,16.2,0,12,5.94,1.5,0,
"Cole SulserNo new player Notes TB - P L, 4-12 vs NYY",NYY,FA,34,1248,802,0%,39.1,2,41,5.49,1.45,0,
Philip AbnerNANo new player Notes AZ - P 9:40 pm @ SD,@ SD,FA,3,1394,803,0%,6.1,0,4,9.95,1.74,0,
Cole WilcoxPlayer Note SEA - P 6:40 pm @ MIA,@ MIA,FA,12,1432,804,0%,15.0,0,16,4.8,1.93,0,
"Eli MorganNANo new player Notes KC - P L, 3-7 @ NYM",@ NYM,FA,14,1454,805,0%,17.1,1,15,5.19,1.79,0,
Jose CabreraNew Player Note AZ - P 9:40 pm @ SD,@ SD,FA,4,1381,806,1%,17.2,0,12,5.6,1.53,0,
José SuarezNew Player Note ATH - P 6:40 pm @ DET,@ DET,FA,29,1322,807,0%,47.1,1,52,4.56,1.56,0,
Jose CorniellNANo new player Notes TEX - P 8:05 pm vs LAA,LAA,FA,1,1401,808,0%,3.1,0,3,13.5,2.7,0,
"Justin SlatenNo new player Notes BOS - P Top 7, 2-1 @ CWS",@ CWS,FA,24,1212,809,0%,20.2,0,28,6.1,1.6,0,
Cody BoltonNA7No new player Notes HOU - P,,FA,8,1420,810,0%,20.0,1,22,5.4,1.75,0,
"Brendan BeckNAPlayer Note NYY - P W, 12-4 @ TB",@ TB,FA,2,1375,811,1%,6.2,0,4,9.45,1.8,0,
Valente BellozoNANo new player Notes COL - P 9:45 pm @ SF,@ SF,FA,3,1487,812,0%,10.2,0,8,7.59,1.59,0,
"Travis AdamsNo new player Notes MIN - P L, 2-5 vs CLE",CLE,FA,17,1501,814,0%,23.2,2,31,6.46,1.61,0,
Cade GibsonNo new player Notes MIA - P 6:40 pm vs SEA,SEA,FA,16,620,815,0%,21.0,0,20,6.0,1.48,0,
"Carlos CarrascoNAPlayer Note ATL - P Top 9, 6-5 @ PIT",@ PIT,FA,8,1548,816,0%,16.2,0,7,5.94,1.44,0,
Ryan BoruckiNANo new player Notes SF - P 9:45 pm vs COL,COL,FA,21,1377,819,0%,23.2,0,15,4.94,1.52,0,
Robby AhlstromNo new player Notes TEX - P 8:05 pm vs LAA,LAA,FA,15,1164,820,0%,12.2,0,8,6.39,1.66,0,
Walker BuehlerPlayer Note SD - P 9:40 pm vs AZ,AZ,Joey Spierer's Team,18,1532,822,17%,87.0,0,80,5.07,1.39,3,
Tatsuya ImaiPlayer Note HOU - P,,Joe Byron,13,262,825,37%,52.0,0,63,6.06,1.5,4,
"Elmer RodríguezNANo new player Notes NYY - P W, 12-4 @ TB",@ TB,FA,4,1397,826,2%,17.0,0,10,4.76,1.76,0,
Luis CurveloNANo new player Notes TEX - P 8:05 pm vs LAA,LAA,FA,8,1422,828,0%,8.1,0,4,7.56,1.92,0,
"Jedixson PaezNANo new player Notes BOS - P Top 7, 2-1 @ CWS",@ CWS,FA,3,1388,830,0%,3.0,0,0,18.0,2.33,0,
Josh WhiteNANo new player Notes MIA - P 6:40 pm vs SEA,SEA,FA,1,1385,831,0%,0.2,0,1,67.5,7.5,0,
"José UrquidyNANo new player Notes PIT - P Top 9, 5-6 vs ATL",ATL,FA,5,1418,832,0%,6.1,1,6,8.53,2.68,0,
Eric CerantolaNAPlayer Note SF - P 9:45 pm vs COL,COL,FA,4,1396,833,0%,5.1,0,7,10.13,2.63,0,
Alex HoppeNANo new player Notes SEA - P 6:40 pm @ MIA,@ MIA,FA,21,1426,836,0%,24.0,0,26,6.38,1.46,0,
Cole WinnNo new player Notes TEX - P 8:05 pm vs LAA,LAA,FA,33,608,838,0%,31.0,1,32,6.39,1.39,0,
Zak KentNAPlayer Note WSH - P,,FA,10,1428,839,0%,14.1,0,11,6.28,1.74,0,
José ButtóIL60No new player Notes SF - P 9:45 pm vs COL,COL,FA,3,1334,840,0%,2.0,0,5,22.5,5.0,0,
Sam AldegheriNAPlayer Note LAA - P 8:05 pm @ TEX,@ TEX,FA,9,1419,842,0%,33.2,0,22,5.08,1.43,0,
"Cionel PérezPlayer Note NYM - P W, 7-3 vs KC",KC,FA,30,1480,843,0%,35.1,0,31,5.35,1.44,0,
"Scott BarlowNAPlayer Note KC - P L, 3-7 @ NYM",@ NYM,FA,36,1290,845,0%,33.1,2,29,6.48,1.35,0,
Wilkin RamosNAPlayer Note SF - P 9:45 pm vs COL,COL,FA,2,1405,846,0%,2.0,0,1,22.5,4.5,0,
Ryan GustoNew Player Note MIA - P 6:40 pm vs SEA,SEA,FA,8,1539,847,0%,24.1,0,22,5.55,1.6,0,
Brady BassoNANo new player Notes ATH - P 6:40 pm @ DET,@ DET,FA,4,1410,848,0%,4.1,0,2,12.46,2.77,0,
Yusei KikuchiIL60Player Note LAA - P 8:05 pm @ TEX,@ TEX,FA,7,368,849,8%,31.0,0,33,5.81,1.58,1,
"Tommy KahnleNAPlayer Note BOS - P Top 7, 2-1 @ CWS",@ CWS,FA,8,1406,850,0%,9.0,0,5,8.0,2.0,0,
Yariel RodriguezNA7No new player Notes TOR - P,,FA,10,1255,852,0%,9.1,0,6,7.71,2.04,0,
Joey LucchesiNANo new player Notes LAA - P 8:05 pm @ TEX,@ TEX,FA,5,1429,853,0%,3.1,0,4,13.5,3.9,0,
Matt KrookPlayer Note WSH - P,,FA,6,1439,854,0%,4.1,0,6,14.54,2.77,0,
Seth HalvorsenIL15Player Note COL - P 9:45 pm @ SF,@ SF,FA,21,1448,855,0%,19.0,0,17,4.74,1.95,0,
"Keegan AkinIL15Player Note BAL - P Top 9, 3-2 vs CHC",CHC,FA,24,1275,857,0%,25.1,0,17,5.68,1.5,0,
"Hunter BiggeNANo new player Notes TB - P L, 4-12 vs NYY",NYY,FA,18,1356,859,0%,19.1,0,14,6.98,1.45,0,
Germán MárquezNew Player Note SD - P 9:40 pm vs AZ,AZ,FA,8,1641,861,1%,37.2,0,24,5.02,1.43,0,
Keegan ThompsonNANo new player Notes COL - P 9:45 pm @ SF,@ SF,FA,5,1421,863,0%,12.0,0,11,8.25,1.75,0,
Jose FrancoNANo new player Notes CIN - P 7:10 pm vs PHI,PHI,FA,9,1443,864,0%,16.2,0,13,5.4,1.92,0,
Alek ManoahNANo new player Notes LAA - P 8:05 pm @ TEX,@ TEX,FA,3,1423,865,0%,7.1,0,5,9.82,2.18,0,
"Brandan BidoisNAPlayer Note PIT - P Top 9, 5-6 vs ATL",ATL,FA,15,1444,866,0%,15.2,0,20,6.32,1.98,0,
Jared ShusterNANew Player Note STL - P 7:45 pm vs MIL,MIL,FA,5,1518,867,0%,9.0,0,4,9.0,1.89,0,
Cole HenryNAPlayer Note WSH - P,,FA,11,1474,868,0%,13.2,0,15,7.9,1.76,0,
"Drew PomeranzPlayer Note CHC - P Top 9, 2-3 @ BAL",@ BAL,FA,28,1158,869,1%,26.2,0,17,5.4,1.54,0,
"Connor SeaboldIL15Player Note KC - P L, 3-7 @ NYM",@ NYM,FA,21,1442,870,0%,24.0,0,20,5.25,1.71,0,
"Tyler GilbertIL15No new player Notes CWS - P Top 7, 1-2 vs BOS",BOS,FA,4,1365,872,0%,3.2,0,3,17.18,3.0,0,
"Bubba ChandlerPlayer Note PIT - P  Top 9, 5-6 vs ATL",ATL,Joe Byron,18,159,873,58%,89.2,0,79,4.82,1.44,2,
Chris MartinPlayer Note TEX - P 8:05 pm vs LAA,LAA,FA,14,1249,874,1%,12.1,0,8,7.3,1.86,0,
Nick SandlinNANo new player Notes DET - P 6:40 pm vs ATH,ATH,FA,8,1382,875,0%,8.2,0,6,11.42,1.62,0,
"Carlos EstévezIL60Player Note KC - P L, 3-7 @ NYM",@ NYM,FA,1,464,876,37%,0.1,0,0,162.0,18.0,0,
Roddery MuñozNANo new player Notes HOU - P,,FA,3,1508,879,0%,4.0,0,6,15.75,3.25,0,
Jack LeiterIL15No new player Notes TEX - P 8:05 pm vs LAA,LAA,FA,15,1417,881,16%,80.0,0,83,5.29,1.44,2,
Matt GageIL15Player Note SF - P 9:45 pm vs COL,COL,FA,34,1278,883,0%,27.1,1,22,5.6,1.65,0,
"Jordan WicksNAPlayer Note CHC - P Top 9, 2-3 @ BAL",@ BAL,FA,4,1502,884,0%,10.1,2,8,10.45,1.94,0,
Andrew HoffmannNA7No new player Notes AZ - P 9:40 pm @ SD,@ SD,FA,8,1456,885,0%,11.2,0,12,7.71,2.06,0,
Gus VarlandNANo new player Notes WSH - P,,FA,32,1430,886,1%,31.2,6,30,6.25,1.77,0,
Hunter GreenePlayer Note CIN - P 7:10 pm vs PHI,PHI,Stealth Bomber,1,393,887,77%,3.1,0,7,21.6,3.3,0,
Juan MejiaNo new player Notes COL - P 9:45 pm @ SF,@ SF,FA,37,1362,888,0%,42.0,3,44,5.79,1.57,0,
Carson SeymourNANo new player Notes SF - P 9:45 pm vs COL,COL,FA,2,1486,891,0%,4.1,0,2,14.54,3.0,0,
"Noah SchultzPlayer Note CWS - P Top 7, 1-2 vs BOS",BOS,W (Jul 10),10,1470,892,10%,48.0,0,43,6.0,1.42,2,
"Hunter BarcoNA7No new player Notes PIT - P Top 9, 5-6 vs ATL",ATL,FA,5,1425,894,0%,11.2,0,8,7.71,1.97,0,
"Matt SeelingerNANo new player Notes NYM - P W, 7-3 vs KC",KC,W (Jul 10),1,1452,895,0%,2.0,0,2,31.5,4.5,0,
George KlassenNANo new player Notes LAA - P 8:05 pm @ TEX,@ TEX,FA,2,1453,896,0%,4.2,0,6,11.57,3.64,0,
"Taylor RogersNo new player Notes MIN - P L, 2-5 vs CLE",CLE,FA,40,729,898,1%,33.2,2,30,5.61,1.63,0,
Jackson RutledgeNANo new player Notes PHI - P 7:10 pm @ CIN,@ CIN,FA,1,1541,899,0%,1.1,0,2,47.25,6.0,0,
Paxton SchultzNANo new player Notes WSH - P,,FA,25,1466,900,0%,30.2,1,31,5.87,1.63,0,
Connor PhillipsNANo new player Notes CIN - P 7:10 pm vs PHI,PHI,FA,25,1226,902,0%,27.2,1,28,5.53,1.77,0,
Randy VásquezIL15Player Note SD - P 9:40 pm vs AZ,AZ,FA,17,1467,903,13%,84.0,0,60,4.71,1.5,4,
"Erick FeddePlayer Note CWS - P Top 7, 1-2 vs BOS",BOS,FA,18,1594,905,2%,85.0,0,57,4.34,1.45,1,
Kyle NicolasNAPlayer Note WSH - P,,FA,7,1462,907,0%,7.1,0,7,8.59,2.86,0,
Charlie BarnesNAPlayer Note LAD - P,,FA,4,1465,908,0%,12.0,0,4,7.5,1.92,0,
Braxton GarrettNANew Player Note MIA - P 6:40 pm vs SEA,SEA,FA,2,1461,909,1%,4.1,0,5,14.54,3.46,0,
Ron MarinaccioNo new player Notes SD - P 9:40 pm vs AZ,AZ,FA,30,1338,911,0%,44.0,0,36,5.11,1.5,0,
Kolby AllardNANo new player Notes PHI - P 7:10 pm @ CIN,@ CIN,FA,4,1386,912,0%,8.2,0,9,10.38,2.19,0,
Victor VodnikNo new player Notes COL - P 9:45 pm @ SF,@ SF,FA,25,663,913,1%,26.2,4,19,6.08,1.8,0,
"Hurston WaldrepPlayer Note ATL - P Top 9, 6-5 @ PIT",@ PIT,Ranger danger,3,1303,915,6%,10.2,0,9,8.44,2.16,0,
Riley CornelioNo new player Notes WSH - P,,FA,6,1471,916,0%,12.2,0,12,7.82,2.05,0,
Adrian HouserPlayer Note SF - P 9:45 pm vs COL,COL,FA,18,1454,918,1%,80.0,0,55,4.95,1.4,2,
"Aaron BummerNANo new player Notes CHC - P Top 9, 2-3 @ BAL",@ BAL,FA,19,1387,919,0%,15.1,0,13,7.63,1.83,0,
Yilber DíazNANo new player Notes DET - P 6:40 pm vs ATH,ATH,FA,1,1491,923,0%,0.2,0,0,94.5,12.0,0,
"Colin ReaNew Player Note CHC - P Top 9, 2-3 @ BAL",@ BAL,Fightin Farmers,19,1173,924,10%,94.2,1,70,4.75,1.45,2,
Rhett LowderPlayer Note CIN - P 7:10 pm vs PHI,PHI,FA,15,383,926,4%,67.2,0,58,5.05,1.55,3,
"Eric OrzeNo new player Notes MIN - P L, 2-5 vs CLE",CLE,FA,36,1407,927,0%,41.1,1,36,5.66,1.52,0,
"Phil MatonIL15Player Note CHC - P Top 9, 2-3 @ BAL",@ BAL,FA,30,1202,928,1%,26.2,0,31,6.08,1.76,0,
Brandon WilliamsonIL60No new player Notes CIN - P 7:10 pm vs PHI,PHI,FA,6,1447,929,0%,28.0,0,19,6.11,1.64,1,
Joe RossNAPlayer Note TEX - P 8:05 pm vs LAA,LAA,FA,8,1526,930,0%,11.2,0,7,9.26,1.89,0,
"Shane SmithNA7Player Note CWS - P Top 7, 1-2 vs BOS",BOS,FA,3,1336,931,4%,8.1,0,11,10.8,2.52,0,
Zack LittellNew Player Note WSH - P,,FA,18,539,934,7%,86.0,0,52,5.02,1.31,1,
"Steven MatzIL15Player Note TB - P L, 4-12 vs NYY",NYY,FA,15,1288,936,4%,53.0,0,41,6.28,1.4,3,
Brady SingerPlayer Note CIN - P 7:10 pm vs PHI,PHI,FA,17,384,937,17%,82.1,0,71,5.03,1.54,4,
Zach MaxwellNANo new player Notes CIN - P 7:10 pm vs PHI,PHI,FA,10,1491,942,0%,10.0,1,9,9.9,2.4,0,
Ryan JohnsonPlayer Note LAA - P 8:05 pm @ TEX,@ TEX,FA,8,1522,943,3%,28.1,0,24,6.99,1.55,1,
Jose QuintanaIL60Player Note COL - P 9:45 pm @ SF,@ SF,FA,9,1391,944,0%,41.0,0,20,5.27,1.51,1,
Andre GranilloNAPlayer Note WSH - P,,FA,8,1494,946,0%,9.1,0,3,9.64,2.25,0,
Lance McCullers Jr.IL15Player Note HOU - P,,FA,8,1594,947,3%,39.1,0,43,6.86,1.53,2,
Jack PerkinsPlayer Note ATH - P 6:40 pm @ DET,@ DET,FA,23,320,948,6%,54.2,3,70,6.75,1.45,0,
Lou TrivinoIL15New Player Note PHI - P 7:10 pm @ CIN,@ CIN,FA,5,1485,950,0%,6.0,0,7,15.0,2.83,0,
Aaron NolaPlayer Note PHI - P 7:10 pm @ CIN,@ CIN,Rafael Devers,18,388,951,47%,92.0,0,94,5.87,1.46,5,
"Cameron FosterNA7No new player Notes BAL - P Top 9, 3-2 vs CHC",CHC,FA,6,1490,952,0%,9.0,0,9,9.0,2.78,0,
"Tobias MyersNANew Player Note NYM - P W, 7-3 vs KC",KC,FA,25,1513,954,0%,44.0,1,33,6.14,1.41,0,
"Jake WoodfordPlayer Note CHC - P Top 9, 2-3 @ BAL",@ BAL,FA,16,1558,955,0%,23.1,1,20,6.94,1.76,0,
Jason AlexanderNA7Player Note HOU - P,,FA,4,1519,956,0%,18.1,0,14,9.33,1.58,1,
Jonathan HernándezNAPlayer Note LAD - P,,FA,12,1507,959,0%,17.2,0,15,8.15,1.75,0,
"Luinder AvilaPlayer Note KC - P L, 3-7 @ NYM",@ NYM,FA,17,1304,962,3%,51.2,0,47,5.05,1.59,0,
Michael KellyNAPlayer Note ATH - P 6:40 pm @ DET,@ DET,FA,5,1436,963,0%,5.0,0,6,16.2,3.6,0,
"Luis GarcíaNANo new player Notes MIN - P L, 2-5 vs CLE",CLE,FA,15,1504,964,0%,15.0,2,6,9.0,1.93,0,
Shane BieberPlayer Note TOR - P,,Joe Byron,3,1408,966,40%,13.0,0,9,9.0,2.08,0,
Patrick CorbinPlayer Note TOR - P,,FA,17,375,967,2%,76.1,1,59,5.07,1.48,1,
Mitchell ParkerIL60Player Note WSH - P,,FA,22,1607,975,0%,39.2,1,34,6.58,1.49,0,
Colton GordonNANo new player Notes HOU - P,,FA,4,1553,979,0%,9.1,0,11,11.57,2.57,0,
Lucas GiolitoIL15Player Note SD - P 9:40 pm vs AZ,AZ,FA,7,342,984,2%,29.2,0,18,5.16,1.85,0,
José AlvaradoNo new player Notes PHI - P 7:10 pm @ CIN,@ CIN,FA,38,1316,985,1%,32.0,1,45,7.03,1.78,0,
Austin VothNAPlayer Note TEX - P 8:05 pm vs LAA,LAA,FA,3,1511,988,0%,10.0,0,3,9.9,2.5,0,
Matthew LiberatorePlayer Note STL - P 7:45 pm vs MIL,MIL,Trust The Process,18,356,989,8%,87.2,0,82,5.34,1.53,3,
"Justin TopaNAPlayer Note KC - P L, 3-7 @ NYM",@ NYM,FA,23,1533,992,0%,19.0,2,12,8.05,2.0,0,
"Chris RoycroftPlayer Note TB - P L, 4-12 vs NYY",NYY,FA,8,1571,993,0%,7.1,0,8,13.5,3.14,0,
Ricky VanascoNANo new player Notes DET - P 6:40 pm vs ATH,ATH,FA,5,1516,996,0%,6.1,0,4,15.63,3.16,0,
Ryan WalkerNew Player Note SF - P 9:45 pm vs COL,COL,FA,27,1371,1001,25%,26.1,3,19,7.52,1.82,0,
Tyler MahlePlayer Note SF - P 9:45 pm vs COL,COL,FA,14,389,1002,3%,71.0,0,69,5.7,1.49,1,
Cristian JavierNew Player Note HOU - P,,FA,5,1525,1003,2%,12.1,0,8,10.22,2.27,0,
Kade MorrisNAPlayer Note ATH - P 6:40 pm @ DET,@ DET,FA,3,1521,1005,0%,10.0,0,6,11.7,2.5,0,
"Chris BassittIL15No new player Notes BAL - P Top 9, 3-2 vs CHC",CHC,FA,12,1475,1014,7%,56.1,0,37,5.27,1.63,2,
Matt WaldronIL15Player Note SD - P 9:40 pm vs AZ,AZ,FA,6,1542,1018,0%,23.1,0,22,8.49,1.71,0,
Matt SvansonPlayer Note STL - P 7:45 pm vs MIL,MIL,FA,35,1221,1020,1%,38.2,0,39,6.52,1.66,0,
"Jayden MurrayNANo new player Notes CHC - P Top 9, 2-3 @ BAL",@ BAL,FA,10,1524,1022,0%,16.1,0,14,9.37,2.08,0,
Jack KochanowiczIL60No new player Notes LAA - P 8:05 pm @ TEX,@ TEX,FA,13,2485,1026,1%,64.0,0,47,6.19,1.58,5,
Aaron CivalePlayer Note ATH - P 6:40 pm @ DET,@ DET,FA,15,1528,1031,5%,72.1,0,54,5.1,1.58,1,
Jeffrey SpringsNew Player Note ATH - P 6:40 pm @ DET,@ DET,FA,19,1574,1035,13%,97.2,0,84,6.08,1.42,4,
Brendon LittleNANo new player Notes TOR - P,,FA,6,1497,1036,0%,4.2,0,7,27.0,3.86,0,
Max ScherzerIL15New Player Note TOR - P,,FA,6,1575,1037,3%,22.0,0,14,10.23,1.73,2,
Grayson RodriguezIL15Player Note LAA - P 8:05 pm @ TEX,@ TEX,Tm Mndlsn nd Mtchn,6,1512,1039,6%,25.2,0,24,8.06,1.83,0,
Justin LawrenceNo new player Notes WSH - P,,FA,35,1543,1045,0%,32.2,1,41,7.44,1.9,0,
Tanner GordonPlayer Note COL - P 9:45 pm @ SF,@ SF,FA,11,1660,1055,0%,45.1,0,46,6.95,1.59,0,
Tanner BanksIL15New Player Note PHI - P 7:10 pm @ CIN,@ CIN,FA,28,1473,1056,0%,29.0,0,32,7.14,2.0,0,
Griffin CanningPlayer Note SD - P 9:40 pm vs AZ,AZ,FA,12,1579,1062,2%,51.0,0,50,6.71,1.61,1,
Merrill KellyPlayer Note AZ - P 9:40 pm @ SD,@ SD,Rafael Devers,15,376,1066,36%,86.2,0,53,5.71,1.56,6,
Ryan WeissNANo new player Notes HOU - P,,FA,9,1573,1068,0%,26.0,0,30,7.62,2.12,0,
Luis MoralesNANo new player Notes ATH - P 6:40 pm @ DET,@ DET,FA,3,1520,1073,0%,9.1,0,7,14.46,3.11,0,
"Bailey FalterNANo new player Notes KC - P L, 3-7 @ NYM",@ NYM,FA,5,1583,1077,0%,9.2,0,6,13.97,3.1,0,
Sean SullivanNAPlayer Note COL - P 9:45 pm @ SF,@ SF,FA,5,1577,1081,0%,22.1,0,16,8.87,2.01,0,
Miles MikolasPlayer Note WSH - P,,FA,19,1637,1085,1%,90.1,0,50,5.78,1.33,0,
"Trey GibsonNAPlayer Note BAL - P Top 9, 3-2 vs CHC",CHC,FA,8,1576,1096,0%,33.0,0,30,7.36,1.91,0,
Taijuan WalkerNANo new player Notes PHI - P 7:10 pm @ CIN,@ CIN,FA,5,1624,1097,0%,22.2,0,17,9.13,2.07,0,
Zach AgnosNo new player Notes COL - P 9:45 pm @ SF,@ SF,FA,24,1654,1101,0%,56.1,2,38,6.71,1.56,0,
Mike BurrowsNAPlayer Note HOU - P,,W (Jul 10),18,359,1106,9%,94.2,0,75,5.99,1.55,4,
"Kodai SengaPlayer Note NYM - P W, 7-3 vs KC",KC,FA,10,400,1136,10%,38.1,0,46,8.92,1.8,1,
"Brayan BelloNAVideo ForecastNew Player Note BOS - P Top 7, 2-1 @ CWS",@ CWS,FA,12,1555,1142,4%,61.0,0,44,6.34,1.67,1,
"Mitch SpenceNANo new player Notes KC - P L, 3-7 @ NYM",@ NYM,FA,3,1668,1163,0%,9.1,0,6,21.21,3.0,0,
Chris PaddackNAPlayer Note TEX - P 8:05 pm vs LAA,LAA,FA,14,1766,1164,0%,57.0,0,40,6.79,1.67,1,
Andrew PainterNANo new player Notes PHI - P 7:10 pm @ CIN,@ CIN,FA,14,340,1203,7%,65.0,0,53,7.06,1.66,2,
S. Woods RichardsonNAPlayer Note TOR - P,,FA,15,1639,1212,0%,57.2,0,31,6.4,1.75,1,
Jacob LopezPlayer Note ATH - P 6:40 pm @ DET,@ DET,FA,13,1586,1280,1%,53.2,0,42,7.04,1.84,0,
Zac GallenPlayer Note AZ - P 9:40 pm @ SD,@ SD,Rafael Devers,19,184,1283,35%,98.0,0,61,6.34,1.56,3,
"David PetersonPlayer Note CHC - P Top 9, 2-3 @ BAL",@ BAL,FA,18,303,1285,11%,77.1,1,68,6.75,1.67,0,
Kyle FreelandPlayer Note COL - P 9:45 pm @ SF,@ SF,FA,16,2497,1291,2%,82.0,0,70,7.46,1.61,2,
M. Lorenzen (Pitcher)Player Note COL - P 9:45 pm @ SF,@ SF,FA,20,2460,1294,1%,92.0,0,72,6.46,1.78,2,
"Elvin RodríguezNANo new player Notes BAL - P Top 9, 3-2 vs CHC",CHC,FA,-,1373,1923,0%,-,-,-,-,-,-,
Alexis DíazNANo new player Notes TEX - P 8:05 pm vs LAA,LAA,FA,-,1247,1924,0%,-,-,-,-,-,-,
Randy RodríguezIL60No new player Notes SF - P 9:45 pm vs COL,COL,FA,-,472,1925,1%,-,-,-,-,-,-,
"Steven WilsonIL60No new player Notes TB - P L, 4-12 vs NYY",NYY,FA,-,654,1926,0%,-,-,-,-,-,-,
"James McArthurIL60No new player Notes KC - P L, 3-7 @ NYM",@ NYM,FA,-,698,1927,0%,-,-,-,-,-,-,
Ronny HenriquezIL60No new player Notes MIA - P 6:40 pm vs SEA,SEA,FA,-,450,1928,1%,-,-,-,-,-,-,
Josh WinckowskiNA60No new player Notes TOR - P,,FA,-,1175,1929,0%,-,-,-,-,-,-,
"Félix BautistaIL60Player Note BAL - P Top 9, 3-2 vs CHC",CHC,Tm Mndlsn nd Mtchn,-,511,1930,2%,-,-,-,-,-,-,
"Spencer SchwellenbachIL60Player Note ATL - P Top 9, 6-5 @ PIT",@ PIT,Joe Byron,-,444,1931,23%,-,-,-,-,-,-,
"AJ Smith-ShawverIL60Player Note ATL - P Top 9, 6-5 @ PIT",@ PIT,Joey Spierer's Team,-,705,1932,11%,-,-,-,-,-,-,
"Wikelman GonzálezNAPlayer Note CWS - P Top 7, 1-2 vs BOS",BOS,FA,-,632,1933,0%,-,-,-,-,-,-,
Brandon WalterIL60No new player Notes HOU - P,,FA,-,560,1934,0%,-,-,-,-,-,-,
David RobertsonNANo new player Notes PHI - P 7:10 pm @ CIN,@ CIN,FA,-,623,1935,0%,-,-,-,-,-,-,
"Tanner McDougalNA7Player Note CWS - P Top 7, 1-2 vs BOS",BOS,FA,-,900,1936,0%,-,-,-,-,-,-,
Jackson JobeIL60Player Note DET - P 6:40 pm vs ATH,ATH,Stealth Bomber,-,1194,1937,4%,-,-,-,-,-,-,
Tzu-Chen ShaNANo new player Notes ATH - P 6:40 pm @ DET,@ DET,FA,-,1001,1938,0%,-,-,-,-,-,-,
Reese OlsonIL60No new player Notes DET - P 6:40 pm vs ATH,ATH,FA,-,553,1939,1%,-,-,-,-,-,-,
"Frank MozzicatoNANo new player Notes KC - P L, 3-7 @ NYM",@ NYM,FA,-,785,1940,0%,-,-,-,-,-,-,
"Ben KudrnaNA60No new player Notes KC - P L, 3-7 @ NYM",@ NYM,FA,-,836,1941,0%,-,-,-,-,-,-,
"Alec MarshIL60No new player Notes KC - P L, 3-7 @ NYM",@ NYM,FA,-,708,1942,0%,-,-,-,-,-,-,
"Ky BushIL60Player Note CWS - P Top 7, 1-2 vs BOS",BOS,FA,-,1171,1943,0%,-,-,-,-,-,-,
Maddux BrunsNANo new player Notes LAD - P,,FA,-,957,1944,0%,-,-,-,-,-,-,
Ben ShieldsNANo new player Notes COL - P 9:45 pm @ SF,@ SF,FA,-,988,1945,0%,-,-,-,-,-,-,
Jamie ArnoldNANo new player Notes ATH - P 6:40 pm @ DET,@ DET,FA,-,1091,1946,1%,-,-,-,-,-,-,
"Seth HernandezNANo new player Notes PIT - P Top 9, 5-6 vs ATL",ATL,FA,-,804,1947,4%,-,-,-,-,-,-,
"Allan WinansNANo new player Notes NYY - P W, 12-4 @ TB",@ TB,FA,-,1294,1948,0%,-,-,-,-,-,-,
Kade AndersonNANo new player Notes SEA - P 6:40 pm @ MIA,@ MIA,Joe Byron,-,857,1949,13%,-,-,-,-,-,-,
"Kyson WitherspoonNANo new player Notes BOS - P Top 7, 2-1 @ CWS",@ CWS,FA,-,946,1950,1%,-,-,-,-,-,-,
Kruz SchoolcraftNANo new player Notes SD - P 9:40 pm vs AZ,AZ,FA,-,951,1951,0%,-,-,-,-,-,-,
Liam DoyleNANo new player Notes STL - P 7:45 pm vs MIL,MIL,FA,-,1078,1952,2%,-,-,-,-,-,-,
Tyler BremnerNANo new player Notes LAA - P 8:05 pm @ TEX,@ TEX,FA,-,788,1953,1%,-,-,-,-,-,-,
"Dom HamelNANo new player Notes NYY - P W, 12-4 @ TB",@ TB,FA,-,1154,1954,0%,-,-,-,-,-,-,
Hayden WesneskiIL60Player Note HOU - P,,FA,-,660,1955,0%,-,-,-,-,-,-,
"Brock SelvidgeNANo new player Notes NYY - P W, 12-4 @ TB",@ TB,FA,-,1090,1956,0%,-,-,-,-,-,-,
JB MiddletonNANo new player Notes COL - P 9:45 pm @ SF,@ SF,FA,-,1006,1957,0%,-,-,-,-,-,-,
Grant HolmanNA7No new player Notes PHI - P 7:10 pm @ CIN,@ CIN,FA,-,1141,1958,0%,-,-,-,-,-,-,
Patrick ForbesNANo new player Notes AZ - P 9:40 pm @ SD,@ SD,FA,-,914,1959,0%,-,-,-,-,-,-,
"Riley QuickNANo new player Notes MIN - P L, 2-5 vs CLE",CLE,FA,-,827,1960,0%,-,-,-,-,-,-,
Aaron WatsonNANo new player Notes CIN - P 7:10 pm vs PHI,PHI,FA,-,968,1961,0%,-,-,-,-,-,-,
"Anthony SolometoNANo new player Notes PIT - P Top 9, 5-6 vs ATL",ATL,FA,-,786,1962,0%,-,-,-,-,-,-,
Zachary RootNANo new player Notes LAD - P,,FA,-,737,1963,0%,-,-,-,-,-,-,
Matthew FisherNANo new player Notes PHI - P 7:10 pm @ CIN,@ CIN,FA,-,858,1964,0%,-,-,-,-,-,-,
Landon HarmonNANo new player Notes WSH - P,,FA,-,855,1965,0%,-,-,-,-,-,-,
AJ RussellNANo new player Notes TEX - P 8:05 pm vs LAA,LAA,FA,-,1117,1966,0%,-,-,-,-,-,-,
Victor LizarragaNANo new player Notes SD - P 9:40 pm vs AZ,AZ,FA,-,904,1967,0%,-,-,-,-,-,-,
"Briggs McKenzieNANo new player Notes ATL - P Top 9, 6-5 @ PIT",@ PIT,FA,-,1040,1968,0%,-,-,-,-,-,-,
Johnny SlawinskiNANo new player Notes LAA - P 8:05 pm @ TEX,@ TEX,FA,-,960,1969,0%,-,-,-,-,-,-,
"Evan ReifertNANo new player Notes TB - P L, 4-12 vs NYY",NYY,FA,-,911,1970,0%,-,-,-,-,-,-,
Michael MoralesNANo new player Notes SEA - P 6:40 pm @ MIA,@ MIA,FA,-,843,1971,0%,-,-,-,-,-,-,
"Marcus PhillipsNANo new player Notes BOS - P Top 7, 2-1 @ CWS",@ CWS,FA,-,1019,1972,0%,-,-,-,-,-,-,
J.D. ThompsonNANo new player Notes MIL - P 7:45 pm @ STL,@ STL,FA,-,774,1973,0%,-,-,-,-,-,-,
Chase ShoresNANo new player Notes LAA - P 8:05 pm @ TEX,@ TEX,FA,-,993,1974,0%,-,-,-,-,-,-,
Dean LivingstonNANo new player Notes AZ - P 9:40 pm @ SD,@ SD,FA,-,761,1975,0%,-,-,-,-,-,-,
Cam LeiterNANo new player Notes LAD - P,,FA,-,878,1976,0%,-,-,-,-,-,-,
Ian BedellNANo new player Notes STL - P 7:45 pm vs MIL,MIL,FA,-,990,1977,0%,-,-,-,-,-,-,
"Kaleb WingNANo new player Notes CHC - P Top 9, 2-3 @ BAL",@ BAL,FA,-,875,1978,0%,-,-,-,-,-,-,
Miguel Sime Jr.NANo new player Notes WSH - P,,FA,-,1026,1979,0%,-,-,-,-,-,-,
Talon HaleyNANo new player Notes LAA - P 8:05 pm @ TEX,@ TEX,FA,-,883,1980,0%,-,-,-,-,-,-,
Ben JacobsNANo new player Notes DET - P 6:40 pm vs ATH,ATH,FA,-,1051,1981,0%,-,-,-,-,-,-,
Gunnar HoglundIL60No new player Notes ATH - P 6:40 pm @ DET,@ DET,FA,-,1345,1982,0%,-,-,-,-,-,-,
"Justin LamkinNANo new player Notes KC - P L, 3-7 @ NYM",@ NYM,FA,-,961,1983,0%,-,-,-,-,-,-,
"Pico KohnNANo new player Notes NYY - P W, 12-4 @ TB",@ TB,FA,-,991,1984,0%,-,-,-,-,-,-,
Ricky TiedemannNA7Player Note TOR - P,,FA,-,1054,1985,1%,-,-,-,-,-,-,
Tanner FranklinNANo new player Notes STL - P 7:45 pm vs MIL,MIL,FA,-,922,1986,0%,-,-,-,-,-,-,
"Michael LombardiNANo new player Notes KC - P L, 3-7 @ NYM",@ NYM,FA,-,820,1987,0%,-,-,-,-,-,-,
Nate SneadNANo new player Notes LAA - P 8:05 pm @ TEX,@ TEX,FA,-,995,1988,0%,-,-,-,-,-,-,
Mason MorrisNANo new player Notes CIN - P 7:10 pm vs PHI,PHI,FA,-,913,1989,0%,-,-,-,-,-,-,
Micah BucknamNANo new player Notes TOR - P,,FA,-,947,1990,0%,-,-,-,-,-,-,
Ronel BlancoIL60Player Note HOU - P,,FA,-,565,1991,1%,-,-,-,-,-,-,
Riley KellyNANo new player Notes COL - P 9:45 pm @ SF,@ SF,FA,-,882,1992,0%,-,-,-,-,-,-,
"Justin HagenmanIL60No new player Notes NYM - P W, 7-3 vs KC",KC,FA,-,709,1993,0%,-,-,-,-,-,-,
Malachi WitherspoonNANo new player Notes DET - P 6:40 pm vs ATH,ATH,FA,-,969,1994,0%,-,-,-,-,-,-,
"Anthony EyansonNANo new player Notes BOS - P Top 7, 2-1 @ CWS",@ CWS,FA,-,949,1995,1%,-,-,-,-,-,-,
Andrew SaalfrankIL60No new player Notes AZ - P 9:40 pm @ SD,@ SD,FA,-,549,1996,0%,-,-,-,-,-,-,
"Matt BarrNANo new player Notes MIN - P L, 2-5 vs CLE",CLE,FA,-,902,1997,0%,-,-,-,-,-,-,
"Will HynesNANo new player Notes CLE - P W, 5-2 @ MIN",@ MIN,FA,-,992,1998,0%,-,-,-,-,-,-,
Anthony MaldonadoNANo new player Notes HOU - P,,FA,-,1304,1999,0%,-,-,-,-,-,-,
Griffin HugusNANo new player Notes SEA - P 6:40 pm @ MIA,@ MIA,FA,-,1111,2000,0%,-,-,-,-,-,-,
"Luis GuerreroNANo new player Notes TB - P L, 4-12 vs NYY",NYY,FA,-,1186,2001,0%,-,-,-,-,-,-,
Gage WoodNANo new player Notes PHI - P 7:10 pm @ CIN,@ CIN,FA,-,1031,2002,1%,-,-,-,-,-,-,
Brian CurleyNANo new player Notes AZ - P 9:40 pm @ SD,@ SD,FA,-,1107,2003,0%,-,-,-,-,-,-,
Sean YoungermanNANo new player Notes PHI - P 7:10 pm @ CIN,@ CIN,FA,-,832,2004,0%,-,-,-,-,-,-,
"JT QuinnNANo new player Notes BAL - P Top 9, 3-2 vs CHC",CHC,FA,-,920,2005,0%,-,-,-,-,-,-,
CJ GrayNANo new player Notes LAA - P 8:05 pm @ TEX,@ TEX,FA,-,791,2006,0%,-,-,-,-,-,-,
Cody BowkerNANo new player Notes PHI - P 7:10 pm @ CIN,@ CIN,FA,-,1063,2007,0%,-,-,-,-,-,-,
Grayson GrinsellNANo new player Notes DET - P 6:40 pm vs ATH,ATH,FA,-,899,2008,0%,-,-,-,-,-,-,
Bryan HoeingIL60No new player Notes SD - P 9:40 pm vs AZ,AZ,FA,-,675,2009,0%,-,-,-,-,-,-,
Zane TaylorNANo new player Notes ATH - P 6:40 pm @ DET,@ DET,FA,-,839,2010,0%,-,-,-,-,-,-,
"Luis L. OrtizNANo new player Notes CLE - P W, 5-2 @ MIN",@ MIN,FA,-,1153,2011,0%,-,-,-,-,-,-,
"Prelander BerroaIL60Player Note CWS - P Top 7, 1-2 vs BOS",BOS,FA,-,731,2012,0%,-,-,-,-,-,-,
"Camden LohmanNANo new player Notes NYM - P W, 7-3 vs KC",KC,FA,-,1014,2013,0%,-,-,-,-,-,-,
"Yosver ZuluetaNANo new player Notes BAL - P Top 9, 3-2 vs CHC",CHC,FA,-,1156,2014,0%,-,-,-,-,-,-,
"Alex CarrilloNAPlayer Note NYM - P W, 7-3 vs KC",KC,FA,-,1251,2015,0%,-,-,-,-,-,-,
