Batters,Opp: 7/22,Roster Status,GP*,Rankings_Pre-Season,Rankings_Current,Trends_% Ros,Season (total)_H/AB*,Season (total)_R,Season (total)_HR,Season (total)_RBI,Season (total)_SB,Season (total)_OPS,
"James WoodPlayer Note WSH - OF  Bot 7, 7-0 @ COL",@ COL,Cookie Monster ,102,4,1,99%,107/392,94,28,68,15,0.957,
Yordan AlvarezPlayer Note HOU - OF 8:10 pm vs MIA,MIA,Ranger danger,101,2,2,99%,120/368,68,33,75,1,1.081,
Pete Crow-ArmstrongVideo ForecastNew Player Note CHC - OF  8:10 pm vs DET,DET,Detroit Fastballs,101,19,4,99%,107/376,66,21,55,25,0.905,
"CJ AbramsNew Player Note WSH - SS  Bot 7, 7-0 @ COL",@ COL,Stealth Bomber,98,57,5,98%,102/366,61,24,76,15,0.892,
"Ben RiceNew Player Note NYY - C,1B  L, 3-5 vs PIT; 7:05 pm vs PIT","PIT,PIT",Tm Mndlsn nd Mtchn,95,34,6,99%,99/352,65,29,68,2,0.966,
"Jordan WalkerPlayer Note STL - OF Top 6, 1-0 @ LAA",@ LAA,The Eds,98,48,7,95%,110/377,64,22,76,14,0.877,
Junior CamineroPlayer Note TB - 3B  7:07 pm @ TOR,@ TOR,Ranger danger,100,17,8,99%,109/379,64,29,62,2,0.939,
Kyle SchwarberPlayer Note PHI - OF  6:40 pm vs LAD,LAD,Cash is King,98,5,9,99%,91/367,59,33,61,2,0.913,
Shohei Ohtani (Batter)Video ForecastNew Player Note LAD - Util  6:40 pm @ PHI,@ PHI,Trust The Process,93,1,10,99%,102/356,66,22,60,6,0.925,
"Hunter GoodmanNew Player Note COL - C  Bot 7, 0-7 vs WSH",WSH,Detroit Fastballs,94,54,11,98%,91/354,64,31,57,5,0.891,
"Miguel VargasPlayer Note CWS - 1B,3B 8:05 pm @ TEX",@ TEX,Detroit Fastballs,99,42,12,94%,90/364,68,21,61,11,0.845,
"Nick KurtzIL10Video ForecastPlayer Note ATH - 1B  Top 6, 2-9 @ AZ",@ AZ,Ranger danger,92,11,13,99%,89/334,61,20,66,7,0.902,
Matt OlsonPlayer Note ATL - 1B 7:15 pm vs SD,SD,Joey Spierer's Team,100,16,14,99%,104/390,67,26,59,2,0.873,
"Bryan ReynoldsNo new player Notes PIT - OF W, 5-3 @ NYY; 7:05 pm @ NYY","@ NYY,@ NYY",Joe Byron,101,97,16,94%,103/365,71,14,59,7,0.873,
Bryce HarperPlayer Note PHI - 1B 6:40 pm vs LAD,LAD,Tm Mndlsn nd Mtchn,102,25,17,99%,93/360,61,21,60,5,0.861,
"Brice TurangPlayer Note MIL - 2B W, 4-3 vs NYM",NYM,The Eds,95,24,18,99%,96/372,68,14,61,15,0.805,
"Willson ContrerasPlayer Note BOS - 1B W, 6-3 vs BAL; 7:10 pm vs BAL","BAL,BAL",Cookie Monster ,92,60,19,94%,94/325,50,22,66,2,0.941,
"Sal StewartPlayer Note CIN - 1B,2B,3B  Bot 7, 5-3 @ SEA",@ SEA,NY Bombsquad,100,55,20,94%,95/382,52,20,71,11,0.794,
"Pete AlonsoNo new player Notes BAL - 1B L, 3-6 @ BOS; 7:10 pm @ BOS","@ BOS,@ BOS",Stealth Bomber,101,44,23,99%,92/374,61,21,66,4,0.807,
Byron BuxtonNew Player Note MIN - OF  6:40 pm @ CLE,@ CLE,Trust The Process,77,31,24,97%,86/313,57,25,45,7,0.902,
"Juan SotoNew Player Note NYM - OF  L, 3-4 @ MIL",@ MIL,The Eds,83,3,25,99%,83/293,46,21,52,7,0.943,
Andy PagesNo new player Notes LAD - OF  6:40 pm @ PHI,@ PHI,Stealth Bomber,101,49,26,96%,104/387,59,17,68,8,0.798,
"Bobby Witt Jr.IL10New Player Note KC - SS W, 5-4 vs SF",SF,Cash is King,94,7,27,99%,103/369,51,13,39,30,0.8,
"Randy ArozarenaPlayer Note SEA - OF Bot 7, 3-5 vs CIN",CIN,No Longer Rowdy,94,67,28,98%,96/341,62,11,45,19,0.828,
"Zach NetoPlayer Note LAA - SS  Top 6, 0-1 vs STL",STL,Cookie Monster ,99,28,29,98%,93/391,69,19,46,13,0.772,
"Elly De La CruzNew Player Note CIN - SS  Bot 7, 5-3 @ SEA",@ SEA,Tm Mndlsn nd Mtchn,81,18,30,99%,90/322,55,17,46,15,0.863,
"Jake BauersPlayer Note MIL - 1B,OF W, 4-3 vs NYM",NYM,Detroit Fastballs,92,168,31,74%,80/309,57,18,59,6,0.855,
"Otto LopezPlayer Note MIA - 2B,SS 8:10 pm @ HOU",@ HOU,Cookie Monster ,98,63,32,93%,130/391,62,9,46,18,0.869,
Dillon DinglerNew Player Note DET - C 8:10 pm @ CHC,@ CHC,Joey Spierer's Team,92,132,33,89%,93/343,53,22,65,0,0.872,
"Brandon LowePlayer Note PIT - 2B W, 5-3 @ NYY; 7:05 pm @ NYY","@ NYY,@ NYY",Stealth Bomber,93,152,36,92%,90/368,61,21,65,1,0.791,
Dansby SwansonNew Player Note CHC - SS 8:10 pm vs DET,DET,NY Bombsquad,97,239,38,81%,71/331,63,16,58,14,0.71,
"Jazz Chisholm Jr.Player Note NYY - 2B,3B  L, 3-5 vs PIT; 7:05 pm vs PIT","PIT,PIT",Detroit Fastballs,95,39,39,98%,76/334,51,16,43,26,0.726,
"Luis García Jr.Player Note WSH - 1B,2B Bot 7, 7-0 @ COL",@ COL,Rafael Devers,94,209,40,85%,89/317,45,20,68,4,0.858,
"Mike TroutPlayer Note LAA - OF Top 6, 0-1 vs STL",STL,No Longer Rowdy,83,166,41,95%,70/300,59,18,39,8,0.847,
Yandy DíazNew Player Note TB - 1B 7:07 pm @ TOR,@ TOR,Fightin Farmers,96,72,43,96%,116/372,55,14,60,2,0.864,
"Shea LangeliersNew Player Note ATH - C  Top 6, 2-9 @ AZ",@ AZ,Cookie Monster ,91,52,44,99%,96/369,55,23,51,2,0.826,
"Jake McCarthyNew Player Note COL - OF Bot 7, 0-7 vs WSH",WSH,No Longer Rowdy,88,216,45,66%,92/300,44,10,56,17,0.864,
"Oneil CruzIL60Video ForecastPlayer Note PIT - OF W, 5-3 @ NYY; 7:05 pm @ NYY","@ NYY,@ NYY",NY Bombsquad,64,61,46,96%,66/250,45,14,44,21,0.822,
"Alec BurlesonNew Player Note STL - 1B,OF  Top 6, 1-0 @ LAA",@ LAA,Joe Byron,99,64,47,93%,107/380,53,15,69,3,0.809,
Michael Harris IIPlayer Note ATL - OF 7:15 pm vs SD,SD,Joey Spierer's Team,94,37,48,96%,107/356,49,18,59,6,0.836,
"Corbin CarrollNew Player Note AZ - OF Top 6, 9-2 vs ATH",ATH,Cash is King,97,10,51,99%,90/361,56,14,47,11,0.818,
Jonathan ArandaPlayer Note TB - 1B  7:07 pm @ TOR,@ TOR,Cash is King,99,174,53,86%,105/363,48,14,65,0,0.837,
Drake BaldwinPlayer Note ATL - C 7:15 pm vs SD,SD,Joe Byron,77,68,54,96%,81/299,54,18,54,2,0.834,
"Fernando Tatis Jr.New Player Note SD - 2B,OF 7:15 pm @ ATL",@ ATL,Stealth Bomber,100,32,56,99%,112/392,51,8,44,25,0.752,
Max MuncyNew Player Note LAD - 3B  6:40 pm @ PHI,@ PHI,Ranger danger,94,220,58,85%,81/308,57,19,45,1,0.865,
"Ketel MartePlayer Note AZ - 2B  Top 6, 9-2 vs ATH",ATH,Cash is King,97,29,59,99%,100/391,55,18,59,4,0.769,
"Ryan O'HearnNo new player Notes PIT - 1B,OF W, 5-3 @ NYY; 7:05 pm @ NYY","@ NYY,@ NYY",Joe Byron,86,301,61,73%,90/320,51,16,64,1,0.818,
"Colson MontgomeryNew Player Note CWS - 3B,SS  8:05 pm @ TEX",@ TEX,Joey Spierer's Team,95,130,63,90%,79/356,48,24,57,1,0.776,
"Liam HicksPlayer Note MIA - C,1B 8:10 pm @ HOU",@ HOU,Cookie Monster ,90,154,65,84%,90/316,53,14,60,2,0.812,
Freddie FreemanPlayer Note LAD - 1B 6:40 pm @ PHI,@ PHI,Ranger danger,99,35,66,99%,106/373,52,15,51,3,0.84,
"Curtis MeadNew Player Note WSH - 1B,2B,3B Bot 7, 7-0 @ COL",@ COL,The Eds,85,266,69,52%,72/279,48,17,48,6,0.858,
"Kazuma OkamotoNew Player Note TOR - 1B,3B 7:07 pm vs TB",TB,Detroit Fastballs,98,271,70,87%,81/357,50,22,62,0,0.755,
Ian HappPlayer Note CHC - OF 8:10 pm vs DET,DET,Tm Mndlsn nd Mtchn,97,110,71,86%,78/357,63,18,45,4,0.761,
Riley GreenePlayer Note DET - OF  8:10 pm @ CHC,@ CHC,Detroit Fastballs,100,50,72,98%,103/361,52,15,50,2,0.847,
"Munetaka MurakamiPlayer Note CWS - 1B,3B 8:05 pm @ TEX",@ TEX,Fightin Farmers,65,102,74,95%,53/227,48,20,42,1,0.906,
Manny MachadoNew Player Note SD - 3B 7:15 pm @ ATL,@ ATL,No Longer Rowdy,98,77,75,97%,73/358,50,22,59,2,0.727,
Trea TurnerPlayer Note PHI - SS 6:40 pm vs LAD,LAD,Cash is King,99,33,77,98%,100/406,68,14,40,17,0.689,
Brandon MarshNew Player Note PHI - OF 6:40 pm vs LAD,LAD,Trust The Process,97,123,78,69%,104/359,53,16,47,8,0.804,
Seiya SuzukiNew Player Note CHC - OF 8:10 pm vs DET,DET,Rafael Devers,85,86,80,92%,86/318,53,16,52,1,0.832,
"Wilyer AbreuVideo ForecastPlayer Note BOS - OF  W, 6-3 vs BAL; 7:10 pm vs BAL","BAL,BAL",Fightin Farmers,97,90,81,85%,99/371,52,15,50,6,0.8,
"Casey SchmittPlayer Note SF - 1B,2B,3B,OF L, 4-5 @ KC",@ KC,Trust The Process,93,82,83,81%,101/370,44,19,50,9,0.782,
Ozzie AlbiesNew Player Note ATL - 2B 7:15 pm vs SD,SD,Cookie Monster ,100,94,86,95%,102/389,63,15,54,1,0.745,
"Kevin McGoniglePlayer Note DET - 3B,SS  8:10 pm @ CHC",@ CHC,Detroit Fastballs,98,74,87,93%,104/369,61,9,35,11,0.816,
"JJ WetherholtNo new player Notes STL - 2B,3B,SS  Top 6, 1-0 @ LAA",@ LAA,Tm Mndlsn nd Mtchn,95,83,88,93%,96/373,61,14,39,10,0.75,
"Cody BellingerPlayer Note NYY - OF L, 3-5 vs PIT; 7:05 pm vs PIT","PIT,PIT",NY Bombsquad,98,46,90,98%,92/361,51,11,52,10,0.76,
Christian WalkerPlayer Note HOU - 1B 8:10 pm vs MIA,MIA,Joey Spierer's Team,100,111,91,85%,86/368,50,20,58,0,0.764,
"Rafael DeversPlayer Note SF - 1B  L, 4-5 @ KC",@ KC,Rafael Devers,101,115,92,95%,93/386,50,20,53,0,0.776,
"Aaron JudgeIL60Video ForecastPlayer Note NYY - OF L, 3-5 vs PIT; 7:05 pm vs PIT","PIT,PIT",Joey Spierer's Team,59,116,93,99%,53/214,43,17,38,5,0.908,
José RamírezNew Player Note CLE - 3B  6:40 pm vs MIN,MIN,Fightin Farmers,72,101,94,99%,64/268,42,10,33,24,0.757,
"Kody ClemensPlayer Note MIN - 1B,2B,OF 6:40 pm @ CLE",@ CLE,Cash is King,88,295,95,42%,77/320,47,18,48,6,0.782,
"Julio RodríguezNew Player Note SEA - OF Bot 7, 3-5 vs CIN",CIN,The Eds,91,6,100,99%,92/357,48,15,43,12,0.747,
"TJ RumfieldPlayer Note COL - 1B Bot 7, 0-7 vs WSH",WSH,NY Bombsquad,100,265,101,46%,105/354,45,13,52,0,0.855,
"Jackson ChourioPlayer Note MIL - OF  W, 4-3 vs NYM",NYM,NY Bombsquad,67,15,102,99%,77/278,49,13,39,10,0.816,
"Tyler SoderstromPlayer Note ATH - 1B,OF  Top 6, 2-9 @ AZ",@ AZ,The Eds,89,62,103,92%,79/320,48,16,47,1,0.821,
Michael BuschPlayer Note CHC - 1B 8:10 pm vs DET,DET,NY Bombsquad,100,76,104,82%,90/369,46,13,54,2,0.775,
"Ivan HerreraPlayer Note STL - C Top 6, 1-0 @ LAA",@ LAA,Stealth Bomber,100,268,105,91%,90/369,62,11,41,5,0.746,
"Gunnar HendersonVideo ForecastPlayer Note BAL - SS L, 3-6 @ BOS; 7:10 pm @ BOS","@ BOS,@ BOS",The Eds,100,45,106,99%,93/415,58,17,44,8,0.695,
"Carson BengePlayer Note NYM - OF L, 3-4 @ MIL",@ MIL,Joe Byron,98,124,108,52%,97/369,52,11,40,16,0.722,
"Xavier EdwardsNo new player Notes MIA - 2B,SS 8:10 pm @ HOU",@ HOU,Joey Spierer's Team,102,80,112,93%,109/372,51,6,37,14,0.784,
"Brayan RocchioPlayer Note CLE - 2B,SS 6:40 pm vs MIN",MIN,Fightin Farmers,99,277,118,36%,93/340,42,9,47,15,0.743,
Jake BurgerNo new player Notes TEX - 1B 8:05 pm vs CWS,CWS,Stealth Bomber,97,229,119,22%,86/360,42,17,61,2,0.721,
"Spencer SteerNew Player Note CIN - 1B,2B,OF Bot 7, 5-3 @ SEA",@ SEA,Joey Spierer's Team,95,218,120,36%,81/331,54,16,40,3,0.756,
"JJ BledayNo new player Notes CIN - OF Bot 7, 5-3 @ SEA",@ SEA,Tm Mndlsn nd Mtchn,72,294,121,28%,61/258,37,16,43,5,0.816,
Josh BellNo new player Notes MIN - 1B 6:40 pm @ CLE,@ CLE,Ranger danger,99,354,124,21%,91/362,50,13,60,1,0.737,
"Garrett MitchellPlayer Note MIL - OF W, 4-3 vs NYM",NYM,Joey Spierer's Team,91,283,125,24%,81/289,44,8,48,7,0.825,
"Brooks LeeNo new player Notes MIN - 2B,3B,SS 6:40 pm @ CLE",@ CLE,Detroit Fastballs,97,350,127,50%,90/357,45,14,52,6,0.738,
Jackson MerrillNew Player Note SD - OF  7:15 pm @ ATL,@ ATL,Trust The Process,98,147,128,93%,85/383,46,13,43,20,0.646,
"Geraldo PerdomoPlayer Note AZ - SS  Top 6, 9-2 vs ATH",ATH,Joe Byron,97,164,132,91%,82/341,48,7,36,16,0.716,
"José CaballeroPlayer Note NYY - 2B,3B,SS,OF L, 3-5 vs PIT; 7:05 pm vs PIT","PIT,PIT",Rafael Devers,86,382,134,67%,70/283,36,10,37,23,0.691,
"Daylen LilePlayer Note WSH - OF Bot 7, 7-0 @ COL",@ COL,The Eds,100,125,135,61%,96/389,51,11,49,9,0.707,
"Nasim NuñezPlayer Note WSH - 2B,SS Bot 7, 7-0 @ COL",@ COL,No Longer Rowdy,94,436,136,26%,71/284,43,1,28,37,0.627,
"Sam AntonacciPlayer Note CWS - 2B,3B,OF 8:05 pm @ TEX",@ TEX,The Eds,80,242,137,47%,79/280,52,7,30,13,0.789,
"Trent GrishamPlayer Note NYY - OF  L, 3-5 vs PIT; 7:05 pm vs PIT","PIT,PIT",Rafael Devers,80,182,139,46%,62/274,50,11,41,7,0.74,
"Isaac ParedesNew Player Note HOU - 1B,3B 8:10 pm vs MIA",MIA,Fightin Farmers,96,162,141,55%,91/350,41,13,53,0,0.781,
"Ezequiel DuranNew Player Note TEX - 1B,2B,3B,SS,OF 8:05 pm vs CWS",CWS,Cookie Monster ,92,233,142,41%,84/314,43,10,51,7,0.756,
"William ContrerasPlayer Note MIL - C W, 4-3 vs NYM",NYM,Tm Mndlsn nd Mtchn,94,51,144,98%,99/360,49,10,57,1,0.739,
"Ceddanne RafaelaNo new player Notes BOS - 2B,OF W, 6-3 vs BAL; 7:10 pm vs BAL","BAL,BAL",Cash is King,95,114,147,85%,102/363,46,8,42,13,0.759,
"Carter JensenNew Player Note KC - C W, 5-4 vs SF",SF,Ranger danger,94,321,149,63%,80/330,44,14,52,1,0.745,
"Mickey MoniakNew Player Note COL - OF Bot 7, 0-7 vs WSH",WSH,Tm Mndlsn nd Mtchn,66,175,150,38%,63/225,34,16,42,1,0.894,
Joc PedersonPlayer Note TEX - Util 8:05 pm vs CWS,CWS,No Longer Rowdy,91,292,151,4%,64/262,40,17,36,1,0.828,
"Jac CaglianoneDTDNew Player Note KC - 1B,OF  W, 5-4 vs SF",SF,Trust The Process,95,157,158,70%,87/337,46,16,37,3,0.779,
Chase DeLauterPlayer Note CLE - OF 6:40 pm vs MIN,MIN,Fightin Farmers,85,247,162,63%,92/319,34,11,50,4,0.811,
"Jo AdellNew Player Note LAA - OF Top 6, 0-1 vs STL",STL,Rafael Devers,101,100,163,72%,95/391,44,15,57,3,0.691,
"Willy AdamesPlayer Note SF - SS L, 4-5 @ KC",@ KC,Tm Mndlsn nd Mtchn,96,91,166,71%,85/377,49,18,44,2,0.707,
"Nolan ArenadoPlayer Note AZ - 3B Top 6, 9-2 vs ATH",ATH,Joey Spierer's Team,95,280,167,21%,80/329,46,13,45,3,0.734,
Spencer TorkelsonPlayer Note DET - 1B  8:10 pm @ CHC,@ CHC,Trust The Process,100,259,169,42%,70/342,40,18,49,0,0.714,
"Bryson StottPlayer Note PHI - 2B,SS 6:40 pm vs LAD",LAD,Trust The Process,96,326,170,48%,85/338,40,7,42,17,0.705,
Kyle TuckerPlayer Note LAD - OF  6:40 pm @ PHI,@ PHI,Cash is King,95,30,171,98%,82/344,54,7,47,6,0.695,
"Cole YoungPlayer Note SEA - 2B Bot 7, 3-5 vs CIN",CIN,Stealth Bomber,102,318,172,13%,92/367,48,13,48,3,0.711,
"Nick GonzalesNew Player Note PIT - 2B,3B,SS W, 5-3 @ NYY; 7:05 pm @ NYY","@ NYY,@ NYY",Trust The Process,95,312,173,42%,110/356,55,5,45,4,0.772,
"Jarren DuranNew Player Note BOS - OF  W, 6-3 vs BAL; 7:10 pm vs BAL","BAL,BAL",Cookie Monster ,92,179,174,86%,68/356,43,13,49,14,0.594,
"Luis ArraezVideo ForecastPlayer Note SF - 1B,2B L, 4-5 @ KC",@ KC,Rafael Devers,95,328,175,82%,122/378,48,4,36,8,0.812,
Ty FrancePlayer Note SD - 1B 7:15 pm @ ATL,@ ATL,NY Bombsquad,75,450,177,16%,64/227,29,15,41,1,0.89,
"Dominic CanzoneNo new player Notes SEA - OF Bot 7, 3-5 vs CIN",CIN,Cookie Monster ,87,484,180,13%,62/241,34,15,40,1,0.841,
Travis BazzanaPlayer Note CLE - 2B  6:40 pm vs MIN,MIN,Joe Byron,70,199,185,37%,65/262,34,9,33,14,0.762,
"Caleb DurbinPlayer Note BOS - 2B,3B W, 6-3 vs BAL; 7:10 pm vs BAL","BAL,BAL",Tm Mndlsn nd Mtchn,92,269,186,40%,72/305,42,10,42,11,0.699,
"Mauricio DubónNo new player Notes ATL - 2B,3B,SS,OF 7:15 pm vs SD",SD,Rafael Devers,96,380,187,47%,95/362,46,10,53,3,0.727,
"Taylor WardPlayer Note BAL - OF L, 3-6 @ BOS; 7:10 pm @ BOS","@ BOS,@ BOS",Stealth Bomber,100,92,188,83%,93/371,61,7,27,3,0.747,
Owen CaissieIL10No new player Notes MIA - OF 8:10 pm @ HOU,@ HOU,Stealth Bomber,80,367,189,7%,52/218,30,12,50,4,0.756,
"Kyle KarrosPlayer Note COL - 3B Bot 7, 0-7 vs WSH",WSH,Stealth Bomber,97,649,190,23%,75/291,49,9,35,3,0.783,
"Paul GoldschmidtNew Player Note NYY - 1B L, 3-5 vs PIT; 7:05 pm vs PIT","PIT,PIT",NY Bombsquad,71,227,196,11%,65/251,34,15,42,1,0.804,
"Josh NaylorNew Player Note SEA - 1B Bot 7, 3-5 vs CIN",CIN,No Longer Rowdy,95,36,197,88%,96/372,37,8,37,20,0.676,
"Zack GelofIL10Video ForecastPlayer Note ATH - 2B,3B,OF Top 6, 2-9 @ AZ",@ AZ,Joey Spierer's Team,67,261,202,34%,62/227,41,11,29,8,0.803,
"Samuel BasalloIL10New Player Note BAL - C L, 3-6 @ BOS; 7:10 pm @ BOS","@ BOS,@ BOS",The Eds,86,126,203,44%,68/282,34,16,46,0,0.755,
"Willi CastroPlayer Note COL - 1B,2B,3B,SS,OF Bot 7, 0-7 vs WSH",WSH,Ranger danger,87,224,205,31%,81/308,43,9,43,6,0.73,
Alex BregmanPlayer Note CHC - 3B 8:10 pm vs DET,DET,Joey Spierer's Team,99,127,206,90%,94/390,50,10,44,2,0.699,
Vladimir Guerrero Jr.Player Note TOR - 1B  7:07 pm vs TB,TB,The Eds,96,56,210,99%,91/355,52,6,41,7,0.688,
"Gavin SheetsNew Player Note SD - 1B,OF 7:15 pm @ ATL",@ ATL,W (Jul 24),95,479,211,9%,63/293,37,14,40,4,0.728,
Josh JungDTDNew Player Note TEX - 3B 8:05 pm vs CWS,CWS,Cookie Monster ,92,198,213,38%,104/354,46,9,35,1,0.802,
Andrew BenintendiNo new player Notes CWS - OF 8:05 pm @ TEX,@ TEX,FA,88,298,215,2%,66/273,40,10,50,1,0.729,
"Bo BichettePlayer Note NYM - 3B,SS L, 3-4 @ MIL",@ MIL,Cookie Monster ,101,109,216,93%,102/399,51,10,51,1,0.678,
Brandon NimmoNew Player Note TEX - OF 8:05 pm vs CWS,CWS,NY Bombsquad,95,140,220,72%,98/365,40,10,39,4,0.769,
"Konnor GriffinIL60No new player Notes PIT - SS,OF  W, 5-3 @ NYY; 7:05 pm @ NYY","@ NYY,@ NYY",NY Bombsquad,59,145,223,69%,62/225,35,5,25,20,0.736,
Trevor LarnachPlayer Note MIN - OF 6:40 pm @ CLE,@ CLE,No Longer Rowdy,84,267,225,7%,77/265,45,7,34,2,0.829,
"Spencer HorwitzIL10New Player Note PIT - 1B W, 5-3 @ NYY; 7:05 pm @ NYY","@ NYY,@ NYY",Trust The Process,74,214,226,13%,69/246,36,10,33,1,0.841,
Austin RileyPlayer Note ATL - 3B 7:15 pm vs SD,SD,Fightin Farmers,100,201,228,84%,77/361,43,12,47,6,0.649,
"Esmerlyn ValdezPlayer Note PIT - 1B,OF W, 5-3 @ NYY; 7:05 pm @ NYY","@ NYY,@ NYY",Tm Mndlsn nd Mtchn,32,1436,229,67%,33/108,24,13,34,0,1.127,
"Kyle StowersNo new player Notes MIA - 1B,OF  8:10 pm @ HOU",@ HOU,Detroit Fastballs,77,160,231,75%,67/288,36,12,43,1,0.754,
Ronald Acuña Jr.IL10Video ForecastNew Player Note ATL - OF  7:15 pm vs SD,SD,Ranger danger,53,53,232,99%,49/195,31,7,22,15,0.794,
Jeremy PeñaNew Player Note HOU - SS  8:10 pm vs MIA,MIA,Rafael Devers,55,137,233,83%,61/208,40,8,27,8,0.807,
"Gabriel MorenoPlayer Note AZ - C Top 6, 9-2 vs ATH",ATH,Cash is King,74,334,235,52%,77/254,39,6,33,4,0.824,
Heriberto HernándezNo new player Notes MIA - OF 8:10 pm @ HOU,@ HOU,NY Bombsquad,72,557,238,7%,54/224,25,13,37,6,0.785,
Cedric MullinsPlayer Note TB - OF 7:07 pm @ TOR,@ TOR,Ranger danger,87,471,239,5%,60/297,35,12,31,16,0.627,
"Luke KeaschallPlayer Note MIN - 2B,OF  6:40 pm @ CLE",@ CLE,FA,95,309,240,58%,83/319,49,4,28,12,0.697,
Xander BogaertsPlayer Note SD - SS 7:15 pm @ ATL,@ ATL,Ranger danger,96,192,245,34%,74/336,40,9,38,12,0.639,
Tristan PetersNo new player Notes CWS - OF 8:05 pm @ TEX,@ TEX,Joey Spierer's Team,96,1198,247,8%,77/266,38,6,37,5,0.803,
Wyatt LangfordNew Player Note TEX - OF  8:05 pm vs CWS,CWS,The Eds,49,99,252,92%,57/199,31,11,27,7,0.848,
"Jung Hoo LeeNo new player Notes SF - OF L, 4-5 @ KC",@ KC,Trust The Process,93,263,253,30%,106/350,49,5,33,6,0.759,
Cam SmithPlayer Note HOU - OF 8:10 pm vs MIA,MIA,Joe Byron,101,281,257,9%,70/334,39,12,34,10,0.645,
"Chase MeidrothPlayer Note CWS - 2B,3B,SS 8:05 pm @ TEX",@ TEX,Detroit Fastballs,97,231,258,27%,97/360,57,7,32,2,0.716,
"Nico HoernerPlayer Note CHC - 2B,SS 8:10 pm vs DET",DET,Tm Mndlsn nd Mtchn,99,118,262,89%,98/397,40,4,43,14,0.654,
"Christian YelichPlayer Note MIL - OF W, 4-3 vs NYM",NYM,NY Bombsquad,66,136,264,87%,62/258,43,6,33,8,0.71,
Jakob MarseeNew Player Note MIA - OF  8:10 pm @ HOU,@ HOU,Joe Byron,98,258,267,52%,65/338,48,5,25,19,0.6,
Ryan JeffersNew Player Note MIN - C 6:40 pm @ CLE,@ CLE,Trust The Process,43,205,268,36%,41/143,28,9,32,1,0.95,
"Adley RutschmanIL10Player Note BAL - C L, 3-6 @ BOS; 7:10 pm @ BOS","@ BOS,@ BOS",NY Bombsquad,67,113,273,70%,62/247,30,8,47,0,0.764,
Mookie BettsPlayer Note LAD - SS 6:40 pm @ PHI,@ PHI,No Longer Rowdy,65,129,276,97%,60/256,39,13,34,1,0.722,
"Ildemaro VargasNew Player Note AZ - 1B,2B Top 6, 9-2 vs ATH",ATH,FA,87,323,279,10%,75/291,41,7,48,2,0.697,
"Jose AltuveNew Player Note HOU - 2B,OF 8:10 pm vs MIA",MIA,Cookie Monster ,79,188,284,83%,71/306,47,12,29,2,0.702,
"Jacob YoungNew Player Note WSH - OF Bot 7, 7-0 @ COL",@ COL,Joe Byron,90,355,285,1%,65/283,37,9,33,11,0.667,
"Angel MartínezIL10New Player Note CLE - 2B,OF 6:40 pm vs MIN",MIN,Stealth Bomber,66,240,288,14%,54/226,28,11,33,9,0.718,
"Luke RaleyPlayer Note SEA - 1B,OF Bot 7, 3-5 vs CIN",CIN,Fightin Farmers,87,390,291,9%,57/248,27,15,37,1,0.742,
"Ernie ClementPlayer Note TOR - 1B,2B,3B,SS 7:07 pm vs TB",TB,Cookie Monster ,98,187,293,67%,113/377,44,8,32,3,0.754,
Esteury RuizPlayer Note MIA - OF 8:10 pm @ HOU,@ HOU,Fightin Farmers,62,1498,295,2%,25/103,25,5,10,20,0.848,
"Troy JohnstonNew Player Note COL - 1B,OF Bot 7, 0-7 vs WSH",WSH,W (Jul 23),92,238,296,7%,86/291,33,3,41,4,0.775,
"Lane ThomasPlayer Note KC - OF W, 5-4 vs SF",SF,No Longer Rowdy,87,1452,297,11%,60/250,29,9,34,5,0.75,
"Leody TaverasNew Player Note BAL - OF L, 3-6 @ BOS; 7:10 pm @ BOS","@ BOS,@ BOS",FA,86,1239,300,1%,63/262,37,4,37,10,0.683,
"Jorge SolerNew Player Note LAA - OF Top 6, 0-1 vs STL",STL,No Longer Rowdy,79,1382,308,11%,59/288,34,11,45,0,0.669,
"Blaze AlexanderIL10Player Note BAL - 2B,3B,SS,OF L, 3-6 @ BOS; 7:10 pm @ BOS","@ BOS,@ BOS",The Eds,82,543,310,8%,69/221,31,4,29,9,0.807,
Chandler SimpsonNew Player Note TB - OF  7:07 pm @ TOR,@ TOR,Ranger danger,94,234,312,54%,101/349,42,0,18,24,0.676,
"Jake MangumPlayer Note PIT - OF W, 5-3 @ NYY; 7:05 pm @ NYY","@ NYY,@ NYY",Fightin Farmers,80,270,316,12%,74/246,35,2,20,18,0.726,
"A.J. EwingNo new player Notes NYM - 2B,OF L, 3-4 @ MIL",@ MIL,Joe Byron,62,165,317,32%,59/218,27,7,25,11,0.766,
Teoscar HernándezPlayer Note LAD - OF 6:40 pm @ PHI,@ PHI,Cookie Monster ,67,96,320,80%,57/237,38,8,37,2,0.692,
"Alec BohmNew Player Note PHI - 1B,3B 6:40 pm vs LAD",LAD,Rafael Devers,97,311,324,38%,80/360,32,12,50,1,0.645,
"Masyn WinnPlayer Note STL - SS Top 6, 1-0 @ LAA",@ LAA,Rafael Devers,92,244,327,34%,79/332,39,4,42,8,0.635,
"Isaac CollinsPlayer Note KC - OF W, 5-4 vs SF",SF,FA,91,525,331,1%,70/283,36,5,32,6,0.715,
"Bryce EldridgePlayer Note SF - 1B L, 4-5 @ KC",@ KC,Cash is King,59,200,333,23%,56/207,30,10,23,1,0.842,
George SpringerPlayer Note TOR - OF  7:07 pm vs TB,TB,Joey Spierer's Team,70,181,337,69%,62/272,34,10,25,7,0.7,
"Royce LewisPlayer Note MIN - 1B,3B 6:40 pm @ CLE",@ CLE,Cash is King,67,248,338,31%,52/241,31,10,30,6,0.684,
"Coby MayoNew Player Note BAL - 1B,3B L, 3-6 @ BOS; 7:10 pm @ BOS","@ BOS,@ BOS",Stealth Bomber,78,357,339,2%,46/235,32,13,35,2,0.664,
Dalton RushingPlayer Note LAD - C 6:40 pm @ PHI,@ PHI,Fightin Farmers,66,302,340,17%,46/190,31,10,30,0,0.788,
Rhys HoskinsNew Player Note CLE - 1B 6:40 pm vs MIN,MIN,FA,80,1483,345,1%,41/227,30,11,33,1,0.695,
Evan CarterPlayer Note TEX - OF 8:05 pm vs CWS,CWS,NY Bombsquad,83,361,352,2%,45/235,33,8,25,11,0.643,
"Nathaniel LoweNew Player Note CIN - 1B Bot 7, 5-3 @ SEA",@ SEA,FA,73,560,353,1%,52/209,23,12,31,0,0.815,
"Keibert RuizPlayer Note WSH - C Bot 7, 7-0 @ COL",@ COL,FA,65,1267,354,9%,57/207,31,7,35,2,0.769,
Kerry CarpenterNew Player Note DET - OF 8:10 pm @ CHC,@ CHC,Stealth Bomber,77,241,358,35%,45/218,26,13,36,0,0.706,
Carson KellyPlayer Note CHC - C 8:10 pm vs DET,DET,FA,74,394,364,10%,62/231,36,6,35,0,0.752,
"Matt ChapmanIL10Player Note SF - 3B L, 4-5 @ KC",@ KC,The Eds,84,81,370,62%,72/307,35,7,42,0,0.692,
"J.P. CrawfordDTDNew Player Note SEA - 3B,SS Bot 7, 3-5 vs CIN",CIN,W (Jul 23),82,369,375,9%,63/293,38,10,28,1,0.69,
Jonny DeLucaNew Player Note TB - OF 7:07 pm @ TOR,@ TOR,FA,61,1401,377,1%,48/184,24,6,31,10,0.73,
"Heliot RamosPlayer Note SF - OF L, 4-5 @ KC",@ KC,Detroit Fastballs,63,235,387,43%,66/242,33,9,31,0,0.772,
Daulton VarshoNo new player Notes TOR - OF 7:07 pm vs TB,TB,Tm Mndlsn nd Mtchn,88,161,399,22%,71/297,36,7,25,9,0.684,
"Michael MasseyPlayer Note KC - 2B,OF W, 5-4 vs SF",SF,FA,82,1313,413,2%,65/244,33,7,33,2,0.727,
"Nolan SchanuelPlayer Note LAA - 1B Top 6, 0-1 vs STL",STL,W (Jul 23),82,290,417,10%,86/303,32,6,35,0,0.757,
"Eugenio SuárezNew Player Note CIN - 3B Bot 7, 5-3 @ SEA",@ SEA,NY Bombsquad,72,155,425,70%,54/259,26,13,37,0,0.682,
Derek HillNo new player Notes PHI - OF 6:40 pm vs LAD,LAD,FA,76,1478,426,1%,35/139,23,8,17,11,0.757,
"Matt McLainIL10New Player Note CIN - 2B,SS Bot 7, 5-3 @ SEA",@ SEA,Joey Spierer's Team,83,299,430,28%,51/268,32,8,25,11,0.621,
"Cole CarriggNew Player Note COL - OF Bot 7, 0-7 vs WSH",WSH,Ranger danger,35,1551,445,24%,34/113,27,4,24,3,0.898,
"Andrés GiménezNo new player Notes TOR - 2B,SS 7:07 pm vs TB",TB,Rafael Devers,95,371,446,12%,68/301,25,7,38,11,0.621,
"David HamiltonIL10New Player Note MIL - 2B,3B,SS W, 4-3 vs NYM",NYM,FA,74,1242,449,1%,49/204,31,3,15,18,0.65,
"Colt KeithPlayer Note DET - 1B,2B,3B 8:10 pm @ CHC",@ CHC,Fightin Farmers,91,322,456,8%,67/263,37,8,24,4,0.699,
Dominic SmithNew Player Note ATL - 1B 7:15 pm vs SD,SD,FA,82,1220,457,2%,56/216,34,6,35,0,0.695,
"Jacob WilsonNew Player Note ATH - SS Top 6, 2-9 @ AZ",@ AZ,Trust The Process,61,143,460,61%,72/247,30,7,32,2,0.748,
"Salvador PerezNew Player Note KC - C,1B  W, 5-4 vs SF",SF,Rafael Devers,94,153,464,75%,77/365,35,13,41,0,0.614,
"Gary SánchezNo new player Notes MIL - C W, 4-3 vs NYM",NYM,FA,56,385,466,1%,32/146,26,8,25,0,0.807,
"Vinnie PasquantinoPlayer Note KC - 1B  W, 5-4 vs SF",SF,Stealth Bomber,74,206,494,61%,62/274,32,6,33,4,0.659,
"Oswald PerazaPlayer Note LAA - 1B,2B,3B,SS Top 6, 0-1 vs STL",STL,FA,88,1493,502,3%,64/267,27,7,24,12,0.659,
"Richie PalaciosPlayer Note TB - 2B,OF 7:07 pm @ TOR",@ TOR,FA,73,1512,520,1%,49/208,29,3,27,9,0.67,
Taylor WallsPlayer Note TB - SS 7:07 pm @ TOR,@ TOR,FA,81,1399,525,1%,53/242,38,0,21,15,0.601,
"Austin MartinNo new player Notes MIN - 2B,OF 6:40 pm @ CLE",@ CLE,FA,89,310,526,1%,58/241,35,2,20,10,0.668,
Michael ConfortoNew Player Note CHC - OF 8:10 pm vs DET,DET,FA,66,1495,531,1%,36/148,21,9,24,1,0.824,
"Ryan ViladeNo new player Notes TB - 1B,OF 7:07 pm @ TOR",@ TOR,FA,55,1573,540,0%,38/148,17,7,31,3,0.778,
Kyle ManzardoPlayer Note CLE - 1B 6:40 pm vs MIN,MIN,FA,92,293,550,6%,59/282,34,10,30,0,0.652,
"Victor CaratiniNew Player Note MIN - C,1B 6:40 pm @ CLE",@ CLE,FA,74,1415,556,5%,56/237,23,7,36,0,0.688,
"Colton CowserNew Player Note BAL - OF L, 3-6 @ BOS; 7:10 pm @ BOS","@ BOS,@ BOS",FA,88,329,558,4%,44/211,28,8,27,5,0.638,
Joe MackNew Player Note MIA - C 8:10 pm @ HOU,@ HOU,FA,58,1568,565,3%,41/169,26,9,28,0,0.739,
"Sal FrelickIL10Player Note MIL - OF W, 4-3 vs NYM",NYM,FA,90,250,569,7%,65/276,33,4,34,6,0.631,
"Vaughn GrissomNo new player Notes LAA - 1B,2B,3B Top 6, 0-1 vs STL",STL,Cash is King,61,1558,571,1%,52/203,24,5,38,0,0.717,
"Francisco AlvarezNew Player Note NYM - C L, 3-4 @ MIL",@ MIL,Ranger danger,67,245,574,21%,56/218,22,11,24,0,0.766,
Corey SeagerIL10Player Note TEX - SS 8:05 pm vs CWS,CWS,Ranger danger,51,78,576,80%,34/187,28,10,25,1,0.666,
"Brett BatyNew Player Note NYM - 1B,2B,3B,OF L, 3-4 @ MIL",@ MIL,Detroit Fastballs,96,316,595,6%,67/303,37,5,32,5,0.614,
"Nathan ChurchNew Player Note STL - OF Top 6, 1-0 @ LAA",@ LAA,FA,82,1546,597,1%,58/253,30,8,29,5,0.638,
"Maikel GarciaIL10Player Note KC - 2B,3B,SS,OF  W, 5-4 vs SF",SF,Detroit Fastballs,69,189,598,82%,70/268,32,3,30,5,0.693,
"Carlos CortesVideo ForecastPlayer Note ATH - OF Top 6, 2-9 @ AZ",@ AZ,FA,77,276,600,3%,60/214,22,7,25,1,0.801,
