Pitchers,Opp: 7/12,Roster Status,GP*,Rankings_Pre-Season,Rankings_Current,Trends_% Ros,Season (total)_IP*,Season (total)_SV,Season (total)_K,Season (total)_ERA,Season (total)_WHIP,Season (total)_QS,
"Jacob MisiorowskiPlayer Note MIL - P  L, 6-7 @ PIT; Bot 4, 0-2 @ PIT",@ PIT,The Eds,18,9,3,98%,111.0,0,167,1.62,0.76,12,
"Cam SchlittlerPlayer Note NYY - P Bot 4, 0-2 @ WSH",@ WSH,Detroit Fastballs,19,14,14,98%,112.0,0,131,2.01,0.93,11,
Yoshinobu YamamotoPlayer Note LAD - P  8:10 pm vs AZ,AZ,NY Bombsquad,16,13,23,99%,104.2,0,100,2.49,0.88,13,
Shohei Ohtani (Pitcher)Video ForecastNew Player Note LAD - P  8:10 pm vs AZ,AZ,Detroit Fastballs,86,58,27,98%,85.2,0,95,1.79,0.95,12,
Mason MillerPlayer Note SD - P  7:40 pm vs TOR,TOR,Stealth Bomber,36,21,36,99%,37.2,23,69,0.96,0.8,0,
Zack WheelerVideo ForecastNew Player Note PHI - P 5:10 pm @ DET,@ DET,The Eds,14,27,38,97%,87.0,0,98,2.28,0.91,10,
Cristopher SánchezPlayer Note PHI - P  5:10 pm @ DET,@ DET,Cookie Monster ,19,8,39,99%,120.1,0,137,2.62,1.16,13,
Chris SaleNew Player Note ATL - P  6:15 pm @ STL,@ STL,Rafael Devers,17,26,43,99%,98.0,0,117,2.2,1.11,10,
"Joe RyanPlayer Note MIN - P W, 5-3 vs LAA",LAA,Cash is King,19,40,47,99%,104.1,0,122,2.85,1.04,10,
"Foster GriffinPlayer Note WSH - P Bot 4, 2-0 vs NYY",NYY,Joey Spierer's Team,19,254,48,82%,110.1,0,109,2.77,1.02,10,
Louis VarlandNew Player Note TOR - P 7:40 pm @ SD,@ SD,Trust The Process,44,98,49,84%,49.0,19,67,1.1,0.98,0,
Dylan CeasePlayer Note TOR - P 7:40 pm @ SD,@ SD,Rafael Devers,17,133,51,99%,98.1,0,148,2.56,1.13,7,
Jacob LatzNo new player Notes TEX - P 6:05 pm vs HOU,HOU,Joe Byron,34,197,52,66%,43.2,18,46,1.65,0.64,0,
"Bryan BakerPlayer Note TB - P Bot 3, 1-1 vs SEA",SEA,Stealth Bomber,38,144,57,79%,36.1,25,41,1.73,0.83,0,
Chase BurnsNew Player Note CIN - P  6:10 pm vs CHC,CHC,Cash is King,18,20,60,98%,102.2,0,118,2.54,1.11,9,
"Logan GilbertPlayer Note SEA - P Bot 3, 1-1 @ TB",@ TB,Stealth Bomber,18,43,61,99%,107.1,0,114,3.19,0.95,8,
"Drew RasmussenPlayer Note TB - P Bot 3, 1-1 vs SEA",SEA,Tm Mndlsn nd Mtchn,18,104,64,94%,99.1,0,98,3.26,0.95,10,
"Cade SmithNew Player Note CLE - P Top 4, 0-0 @ MIA",@ MIA,Tm Mndlsn nd Mtchn,41,47,66,98%,43.1,28,61,2.7,1.08,0,
"Sonny GrayNew Player Note BOS - P Bot 4, 2-0 @ NYM",@ NYM,Cash is King,17,142,68,96%,95.2,0,85,2.54,1.1,12,
Jhoan DuranPlayer Note PHI - P 5:10 pm @ DET,@ DET,Tm Mndlsn nd Mtchn,33,95,72,98%,31.2,23,50,1.42,0.95,0,
Justin WrobleskiNew Player Note LAD - P 8:10 pm vs AZ,AZ,NY Bombsquad,16,317,76,79%,100.1,0,73,2.69,1.02,11,
Eduardo RodriguezNew Player Note AZ - P 8:10 pm @ LAD,@ LAD,Fightin Farmers,19,279,77,67%,114.0,0,79,2.29,1.17,12,
"Max MeyerPlayer Note MIA - P Top 4, 0-0 vs CLE",CLE,Stealth Bomber,19,185,80,88%,108.0,0,116,2.58,1.11,7,
"Parker MessickNew Player Note CLE - P Top 4, 0-0 @ MIA",@ MIA,Cookie Monster ,19,89,83,91%,112.0,0,110,2.73,1.07,7,
"Braxton AshcraftNew Player Note PIT - P W, 7-6 vs MIL; Bot 4, 2-0 vs MIL",MIL,Cash is King,18,93,86,90%,108.1,0,122,3.24,1.1,10,
Jacob deGromDTDNew Player Note TEX - P  6:05 pm vs HOU,HOU,Trust The Process,18,22,89,99%,100.2,0,122,3.49,1.01,8,
"Paul SkenesPlayer Note PIT - P  W, 7-6 vs MIL; Bot 4, 2-0 vs MIL",MIL,Ranger danger,19,12,90,99%,103.0,0,123,3.58,1.04,9,
"Emerson HancockPlayer Note SEA - P Bot 3, 1-1 @ TB",@ TB,Trust The Process,17,171,93,81%,97.2,0,92,3.23,1.01,9,
"Nolan McLeanNew Player Note NYM - P  Bot 4, 0-2 vs BOS",BOS,NY Bombsquad,19,84,94,97%,107.1,0,125,3.52,1.12,10,
Ben BrownIL15No new player Notes CHC - P 6:10 pm @ CIN,@ CIN,Ranger danger,20,180,99,43%,68.0,1,65,1.85,0.94,3,
Casey MizePlayer Note DET - P 5:10 pm vs PHI,PHI,Detroit Fastballs,13,284,100,71%,71.2,0,72,2.64,0.98,7,
Michael McGreevyPlayer Note STL - P 6:15 pm vs ATL,ATL,Joey Spierer's Team,18,313,103,32%,101.2,0,66,3.01,1.1,12,
Tarik SkubalPlayer Note DET - P  5:10 pm vs PHI,PHI,Ranger danger,12,23,106,99%,70.2,0,84,3.06,0.95,6,
Jesús LuzardoPlayer Note PHI - P 5:10 pm @ DET,@ DET,Tm Mndlsn nd Mtchn,19,66,108,98%,110.1,0,136,3.51,1.22,10,
"Bryce MillerPlayer Note SEA - P Bot 3, 1-1 @ TB",@ TB,Tm Mndlsn nd Mtchn,10,88,110,83%,57.2,0,65,2.18,0.83,3,
"Kyle HarrisonIL15New Player Note MIL - P L, 6-7 @ PIT; Bot 4, 0-2 @ PIT",@ PIT,Ranger danger,17,59,111,84%,83.2,0,101,3.01,1.08,6,
Tanner ScottPlayer Note LAD - P 8:10 pm vs AZ,AZ,Fightin Farmers,40,213,113,53%,37.2,13,49,2.63,0.8,0,
"Nick MartinezNew Player Note TB - P Bot 3, 1-1 vs SEA",SEA,Fightin Farmers,18,196,114,62%,105.1,0,62,2.65,1.12,9,
Troy MeltonPlayer Note DET - P 5:10 pm vs PHI,PHI,Detroit Fastballs,8,275,115,60%,49.1,0,41,1.82,0.81,5,
"Payton TollePlayer Note BOS - P Bot 4, 2-0 @ NYM",@ NYM,Ranger danger,14,210,123,60%,80.1,0,80,3.14,1.07,8,
Keider MonteroPlayer Note DET - P 5:10 pm vs PHI,PHI,Joe Byron,19,251,124,15%,94.1,1,60,3.15,0.99,7,
"Gavin WilliamsPlayer Note CLE - P Top 4, 0-0 @ MIA",@ MIA,Fightin Farmers,19,112,130,95%,113.1,0,134,3.81,1.15,7,
Michael SorokaIL15New Player Note AZ - P 8:10 pm @ LAD,@ LAD,Detroit Fastballs,15,167,131,68%,82.0,0,79,3.07,1.09,7,
Riley O'BrienNew Player Note STL - P 6:15 pm vs ATL,ATL,NY Bombsquad,38,177,132,78%,38.1,23,38,3.52,1.12,0,
"Ranger SuarezIL15Video ForecastPlayer Note BOS - P  Bot 4, 2-0 @ NYM",@ NYM,Fightin Farmers,17,119,133,86%,91.1,0,97,3.15,1.16,7,
Dylan LeeNo new player Notes ATL - P 6:15 pm @ STL,@ STL,W (Jul 12),43,378,134,24%,41.1,0,51,1.52,0.68,0,
Michael KingPlayer Note SD - P 7:40 pm vs TOR,TOR,Trust The Process,19,85,137,91%,108.1,0,92,3.41,1.15,9,
Raisel IglesiasPlayer Note ATL - P 6:15 pm @ STL,@ STL,Rafael Devers,30,128,138,92%,31.1,18,35,2.3,1.12,0,
"David BednarNew Player Note NYY - P  Bot 4, 0-2 @ WSH",@ WSH,Rafael Devers,36,75,140,95%,39.0,17,44,2.77,1.1,0,
Paul SewaldPlayer Note AZ - P 8:10 pm @ LAD,@ LAD,NY Bombsquad,36,106,141,64%,33.0,21,37,4.36,0.91,0,
"Bryan WooPlayer Note SEA - P  Bot 3, 1-1 @ TB",@ TB,The Eds,18,38,143,98%,104.1,0,102,4.23,1.07,10,
"Sean BurkeNew Player Note CWS - P W, 1-0 vs ATH",ATH,NY Bombsquad,19,297,146,66%,105.2,0,115,3.41,1.17,6,
"Aroldis ChapmanPlayer Note BOS - P Bot 4, 2-0 @ NYM",@ NYM,Detroit Fastballs,29,70,149,96%,27.2,19,35,2.28,1.23,0,
"Trevor MegillPlayer Note MIL - P L, 6-7 @ PIT; Bot 4, 0-2 @ PIT",@ PIT,Joey Spierer's Team,37,117,150,80%,36.0,14,46,3.0,0.97,0,
Nathan EovaldiPlayer Note TEX - P  6:05 pm vs HOU,HOU,Trust The Process,18,79,151,94%,111.1,0,120,4.04,1.18,10,
Michael WachaPlayer Note KC - P 6:05 pm @ BAL,@ BAL,Stealth Bomber,19,186,155,62%,119.1,0,96,3.77,1.19,12,
"Shane McClanahanPlayer Note TB - P Bot 3, 1-1 vs SEA",SEA,Trust The Process,17,103,159,86%,86.0,0,82,2.83,1.13,4,
"J.T. GinnPlayer Note ATH - P L, 0-1 @ CWS",@ CWS,Tm Mndlsn nd Mtchn,20,430,160,43%,98.2,0,86,3.1,1.22,8,
Tyler GlasnowIL60No new player Notes LAD - P 8:10 pm vs AZ,AZ,The Eds,7,194,162,88%,39.2,0,49,2.72,0.83,4,
"Sandy AlcantaraNew Player Note MIA - P Top 4, 0-0 vs CLE",CLE,Joe Byron,20,172,163,93%,130.2,0,100,3.99,1.22,14,
Robert SuarezIL15Player Note ATL - P 6:15 pm @ STL,@ STL,W (Jul 12),31,304,169,48%,32.0,4,26,0.56,0.84,0,
"Taj BradleyPlayer Note MIN - P W, 5-3 vs LAA",LAA,Tm Mndlsn nd Mtchn,17,306,172,72%,95.2,0,112,3.67,1.22,7,
Josh HaderPlayer Note HOU - P 6:05 pm @ TEX,@ TEX,Cash is King,16,107,173,92%,15.1,10,25,0.59,0.72,0,
"Davis MartinPlayer Note CWS - P W, 1-0 vs ATH",ATH,Joey Spierer's Team,18,237,174,71%,100.1,0,92,3.41,1.29,10,
"Max FriedIL15Player Note NYY - P  Bot 4, 0-2 @ WSH",@ WSH,Cash is King,10,131,175,98%,61.2,0,50,3.21,1.01,6,
"José SorianoPlayer Note LAA - P L, 3-5 @ MIN",@ MIN,NY Bombsquad,19,150,176,84%,106.0,0,115,3.4,1.28,7,
"Logan WebbPlayer Note SF - P Top 5, 0-1 vs COL",COL,Ranger danger,16,41,178,97%,100.1,0,80,3.86,1.16,10,
"Brandon WoodruffIL15Player Note MIL - P L, 6-7 @ PIT; Bot 4, 0-2 @ PIT",@ PIT,Trust The Process,9,195,183,81%,45.1,0,47,2.98,0.84,3,
Trey YesavagePlayer Note TOR - P 7:40 pm @ SD,@ SD,Detroit Fastballs,13,139,187,92%,73.1,0,68,3.31,1.08,5,
"Tanner BibeePlayer Note CLE - P Top 4, 0-0 @ MIA",@ MIA,Fightin Farmers,19,203,189,80%,106.1,0,84,4.06,1.14,10,
Rico GarciaPlayer Note BAL - P 6:05 pm vs KC,KC,W (Jul 12),43,351,192,23%,40.1,4,43,2.68,0.84,0,
"Reid DetmersPlayer Note LAA - P L, 3-5 @ MIN",@ MIN,Cash is King,19,327,193,61%,108.2,0,123,4.39,1.14,7,
Shota ImanagaNew Player Note CHC - P 6:10 pm @ CIN,@ CIN,Fightin Farmers,19,87,194,89%,108.0,0,105,4.17,1.12,7,
"Luke WeaverPlayer Note NYM - P Bot 4, 0-2 vs BOS",BOS,W (Jul 12),36,402,197,13%,38.0,1,42,1.89,0.84,0,
"Eury PérezVideo ForecastPlayer Note MIA - P  Top 4, 0-0 vs CLE",CLE,Tm Mndlsn nd Mtchn,15,336,198,89%,79.2,0,89,3.84,1.1,5,
"Jake BennettVideo ForecastPlayer Note BOS - P Bot 4, 2-0 @ NYM",@ NYM,Joe Byron,8,423,199,48%,47.2,0,35,2.64,0.94,4,
"Connelly EarlyIL15Video ForecastPlayer Note BOS - P Bot 4, 2-0 @ NYM",@ NYM,No Longer Rowdy,17,225,201,47%,91.2,0,93,3.44,1.25,7,
Peter LambertPlayer Note HOU - P 6:05 pm @ TEX,@ TEX,Stealth Bomber,14,217,202,46%,80.0,0,74,3.26,1.15,5,
Steven OkertNo new player Notes HOU - P 6:05 pm @ TEX,@ TEX,W (Jul 12),45,404,203,4%,45.2,0,46,2.36,0.85,0,
"Clay HolmesIL60Player Note NYM - P Bot 4, 0-2 vs BOS",BOS,W (Jul 12),9,366,204,25%,52.2,0,45,2.39,1.1,4,
"Kevin KellyPlayer Note TB - P Bot 3, 1-1 vs SEA",SEA,W (Jul 12),40,411,211,17%,44.0,4,32,2.45,0.91,0,
"George KirbyPlayer Note SEA - P Bot 3, 1-1 @ TB",@ TB,Trust The Process,18,120,212,97%,110.0,0,98,3.76,1.32,11,
"Walbert UreñaPlayer Note LAA - P L, 3-5 @ MIN",@ MIN,Tm Mndlsn nd Mtchn,17,441,213,31%,81.1,0,78,2.88,1.32,6,
"Robbie RayNew Player Note SF - P Top 5, 0-1 vs COL",COL,Joey Spierer's Team,19,156,217,87%,106.2,0,90,3.38,1.27,7,
"Sean NewcombPlayer Note CWS - P W, 1-0 vs ATH",ATH,W (Jul 12),34,433,218,3%,52.1,3,51,2.58,1.05,0,
"John KingIL15Player Note MIA - P Top 4, 0-0 vs CLE",CLE,W (Jul 12),40,415,219,2%,40.0,1,30,2.48,0.75,0,
"Brent HeadrickNo new player Notes NYY - P Bot 4, 0-2 @ WSH",@ WSH,W (Jul 12),46,407,220,3%,46.0,0,52,1.57,1.13,0,
"Andrés MuñozPlayer Note SEA - P Bot 3, 1-1 @ TB",@ TB,Detroit Fastballs,36,163,222,94%,33.1,16,49,4.32,1.29,0,
"Colin HoldermanNo new player Notes CLE - P Top 4, 0-0 @ MIA",@ MIA,W (Jul 12),34,440,223,4%,34.1,0,39,1.83,0.87,0,
Kevin GausmanPlayer Note TOR - P 7:40 pm @ SD,@ SD,Ranger danger,19,71,226,95%,106.1,0,108,4.32,1.22,9,
"Grant TaylorPlayer Note CWS - P W, 1-0 vs ATH",ATH,W (Jul 12),35,289,227,20%,46.2,3,65,2.89,1.11,0,
"Abner UribePlayer Note MIL - P L, 6-7 @ PIT; Bot 4, 0-2 @ PIT",@ PIT,Rafael Devers,38,272,228,57%,37.2,6,35,2.63,1.01,0,
"Gregory SotoNew Player Note PIT - P W, 7-6 vs MIL; Bot 4, 2-0 vs MIL",MIL,W (Jul 12),39,169,230,36%,39.0,11,44,4.15,1.05,0,
Edgardo HenriquezNo new player Notes LAD - P 8:10 pm vs AZ,AZ,W (Jul 12),36,408,231,2%,38.2,1,37,2.33,0.91,0,
Bryce ElderPlayer Note ATL - P 6:15 pm @ STL,@ STL,No Longer Rowdy,18,1342,237,36%,102.2,0,86,4.12,1.25,10,
"Ryan WeathersNew Player Note NYY - P Bot 4, 0-2 @ WSH",@ WSH,The Eds,18,314,239,46%,97.2,0,110,4.15,1.24,6,
"Anthony BenderIL15No new player Notes MIA - P Top 4, 0-0 vs CLE",CLE,W (Jul 12),35,414,241,2%,34.1,2,41,2.62,0.96,0,
Daniel Lynch IVNo new player Notes KC - P 6:05 pm @ BAL,@ BAL,W (Jul 12),39,421,243,3%,38.1,1,33,2.35,0.94,0,
"Michael PetersenNo new player Notes MIA - P Top 4, 0-0 vs CLE",CLE,W (Jul 12),38,458,244,9%,40.0,1,48,2.93,0.98,0,
Dylan DoddPlayer Note ATL - P 6:15 pm @ STL,@ STL,W (Jul 12),21,427,245,1%,26.0,1,27,2.08,0.77,0,
Alex VesiaNo new player Notes LAD - P 8:10 pm vs AZ,AZ,W (Jul 12),42,338,246,20%,31.2,3,45,2.27,1.14,0,
"Garrett WhitlockNo new player Notes BOS - P Bot 4, 2-0 @ NYM",@ NYM,W (Jul 12),33,401,250,20%,32.0,1,36,2.25,0.97,0,
Brandyn GarciaNo new player Notes AZ - P 8:10 pm @ LAD,@ LAD,W (Jul 12),27,522,252,2%,23.0,1,26,1.96,0.78,0,
Jakob JunisIL15Player Note TEX - P 6:05 pm vs HOU,HOU,W (Jul 12),31,204,253,8%,35.1,5,27,2.8,1.02,0,
Spencer MilesPlayer Note TOR - P 7:40 pm @ SD,@ SD,W (Jul 12),25,431,255,3%,58.0,0,56,2.95,1.09,0,
"Shane DrohanPlayer Note MIL - P L, 6-7 @ PIT; Bot 4, 0-2 @ PIT",@ PIT,No Longer Rowdy,18,444,257,37%,63.2,1,61,2.97,1.24,2,
"Ian SeymourPlayer Note TB - P Bot 3, 1-1 vs SEA",SEA,Stealth Bomber,32,377,259,53%,61.1,2,72,4.11,1.08,1,
Tyler WellsPlayer Note BAL - P 6:05 pm vs KC,KC,NY Bombsquad,34,434,261,17%,43.2,2,45,3.09,1.05,0,
"Landen RouppPlayer Note SF - P Top 5, 0-1 vs COL",COL,No Longer Rowdy,18,349,263,42%,97.0,0,104,4.27,1.31,8,
"Chad PatrickNo new player Notes MIL - P L, 6-7 @ PIT; Bot 4, 0-2 @ PIT",@ PIT,W (Jul 12),28,421,265,9%,72.1,4,61,3.48,1.19,1,
Tyler RogersNo new player Notes TOR - P 7:40 pm @ SD,@ SD,W (Jul 12),44,412,266,21%,42.2,2,21,1.69,1.15,0,
Jack DreyerPlayer Note LAD - P 8:10 pm vs AZ,AZ,W (Jul 12),38,410,267,3%,38.2,0,44,3.03,0.98,0,
"Cade CavalliSUSPPlayer Note WSH - P Bot 4, 2-0 vs NYY",NYY,The Eds,19,379,268,27%,92.2,0,105,3.88,1.38,7,
Jonathan LoáisigaNo new player Notes AZ - P 8:10 pm @ LAD,@ LAD,W (Jul 12),39,481,270,0%,36.1,1,24,2.23,0.99,0,
"Clayton BeeterPlayer Note WSH - P Bot 4, 2-0 vs NYY",NYY,W (Jul 12),28,399,271,13%,27.1,7,31,2.96,1.21,0,
"Yoendrys GómezPlayer Note MIN - P W, 5-3 vs LAA",LAA,Fightin Farmers,38,260,272,27%,42.2,10,37,3.59,1.24,0,
"Jovani MoránNo new player Notes BOS - P Bot 4, 2-0 @ NYM",@ NYM,W (Jul 12),24,483,273,0%,36.2,0,45,2.95,1.01,0,
Taylor ClarkeNo new player Notes AZ - P 8:10 pm @ LAD,@ LAD,W (Jul 12),41,423,274,3%,40.1,0,21,2.68,0.87,0,
Dustin MayPlayer Note STL - P 6:15 pm vs ATL,ATL,No Longer Rowdy,17,252,275,28%,89.0,0,85,4.55,1.25,9,
Kyle BradishPlayer Note BAL - P  6:05 pm vs KC,KC,Tm Mndlsn nd Mtchn,18,73,276,92%,100.2,0,101,3.75,1.4,8,
Bradgley RodriguezNo new player Notes SD - P 7:40 pm vs TOR,TOR,W (Jul 12),36,457,277,1%,39.0,0,37,2.08,1.13,0,
Framber ValdezPlayer Note DET - P 5:10 pm vs PHI,PHI,No Longer Rowdy,19,183,278,89%,107.2,0,87,4.1,1.32,10,
"Fernando CruzNo new player Notes NYY - P Bot 4, 0-2 @ WSH",@ WSH,W (Jul 12),43,419,280,11%,39.0,1,50,2.31,1.26,0,
Adrian MorejonNo new player Notes SD - P 7:40 pm vs TOR,TOR,W (Jul 12),42,395,282,16%,47.0,1,56,3.45,1.09,0,
Brandon YoungNew Player Note BAL - P 6:05 pm vs KC,KC,Cookie Monster ,15,604,283,32%,84.1,0,67,3.42,1.35,7,
Tejay AntoneNo new player Notes CIN - P 6:10 pm vs CHC,CHC,W (Jul 12),27,478,286,0%,27.0,1,24,2.33,0.93,0,
"Evan SiskIL15Player Note PIT - P W, 7-6 vs MIL; Bot 4, 2-0 vs MIL",MIL,W (Jul 12),32,476,288,0%,36.1,0,43,2.23,1.18,0,
Tyler AlexanderNo new player Notes TEX - P 6:05 pm vs HOU,HOU,W (Jul 12),41,554,290,4%,39.1,4,36,2.29,1.3,0,
"Paul BlackburnPlayer Note NYY - P Bot 4, 0-2 @ WSH",@ WSH,W (Jul 12),31,538,291,0%,46.2,0,35,2.31,1.14,0,
"Eduard BazardoNo new player Notes SEA - P Bot 3, 1-1 @ TB",@ TB,W (Jul 12),43,406,293,12%,40.1,0,39,2.01,1.21,0,
"Carlos RodónIL15Player Note NYY - P Bot 4, 0-2 @ WSH",@ WSH,The Eds,9,141,294,83%,46.1,0,52,3.3,1.25,3,
"Matt BrashIL15No new player Notes SEA - P Bot 3, 1-1 @ TB",@ TB,W (Jul 12),20,425,295,5%,16.2,0,15,0.54,0.84,0,
"Bryan HudsonNew Player Note CWS - P W, 1-0 vs ATH",ATH,W (Jul 12),41,453,296,2%,40.0,3,39,2.25,1.3,0,
"Huascar BrazobánNo new player Notes NYM - P Bot 4, 0-2 vs BOS",BOS,W (Jul 12),38,420,297,2%,45.0,0,43,2.8,1.11,0,
"Logan HendersonPlayer Note MIL - P L, 6-7 @ PIT; Bot 4, 0-2 @ PIT",@ PIT,The Eds,6,207,298,55%,28.1,0,34,3.18,0.99,1,
"Kirby YatesNew Player Note LAA - P L, 3-5 @ MIN",@ MIN,W (Jul 12),24,461,299,6%,21.0,3,28,3.0,1.0,0,
Juan MorilloNo new player Notes AZ - P 8:10 pm @ LAD,@ LAD,W (Jul 12),39,505,300,4%,35.1,1,43,3.06,1.1,0,
"Lake BacharPlayer Note MIA - P Top 4, 0-0 vs CLE",CLE,W (Jul 12),31,439,302,1%,49.0,1,52,3.67,1.06,0,
Bryan KingNo new player Notes HOU - P 6:05 pm @ TEX,@ TEX,W (Jul 12),39,417,303,13%,41.0,6,32,2.85,1.27,0,
"Antonio SenzatelaNo new player Notes COL - P Top 5, 1-0 @ SF",@ SF,W (Jul 12),29,1358,304,10%,48.0,3,41,3.0,1.19,0,
Orion KerkeringNo new player Notes PHI - P 5:10 pm @ DET,@ DET,W (Jul 12),38,405,306,5%,36.0,1,40,2.5,1.19,0,
Grant HolmesPlayer Note ATL - P 6:15 pm @ STL,@ STL,Cookie Monster ,18,509,308,21%,87.1,0,76,3.61,1.32,5,
Yennier CanoNo new player Notes BAL - P 6:05 pm vs KC,KC,W (Jul 12),40,533,309,2%,30.0,1,27,2.4,1.07,0,
Kenley JansenPlayer Note DET - P 5:10 pm vs PHI,PHI,Joey Spierer's Team,26,148,311,68%,22.2,11,24,4.76,1.24,0,
Braydon FisherNew Player Note TOR - P 7:40 pm @ SD,@ SD,W (Jul 12),43,413,312,3%,46.0,1,46,3.33,1.11,0,
Didier FuentesNo new player Notes ATL - P 6:15 pm @ STL,@ STL,W (Jul 12),30,519,314,9%,36.2,1,42,2.7,1.2,0,
"Seranthony DomínguezPlayer Note CWS - P W, 1-0 vs ATH",ATH,W (Jul 12),35,146,315,35%,31.2,12,39,4.55,1.39,0,
"Brooks RaleyNo new player Notes NYM - P Bot 4, 0-2 vs BOS",BOS,W (Jul 12),37,418,317,3%,33.1,0,36,2.16,1.2,0,
"A.J. MinterNo new player Notes NYM - P Bot 4, 0-2 vs BOS",BOS,W (Jul 12),18,467,318,1%,18.0,0,15,1.5,0.83,0,
Martín PérezIL15Player Note ATL - P 6:15 pm @ STL,@ STL,W (Jul 12),18,300,320,15%,81.1,0,62,3.54,1.19,2,
Jacob WebbPlayer Note CHC - P 6:10 pm @ CIN,@ CIN,Detroit Fastballs,40,419,323,8%,39.2,4,47,3.18,1.31,0,
"Griffin JaxVideo ForecastPlayer Note TB - P Bot 3, 1-1 vs SEA",SEA,The Eds,24,345,324,65%,65.0,0,68,3.6,1.22,1,
"Cam BooserNo new player Notes TB - P Bot 3, 1-1 vs SEA",SEA,W (Jul 12),14,555,325,0%,15.0,0,18,1.8,0.8,0,
Will KleinPlayer Note LAD - P 8:10 pm vs AZ,AZ,W (Jul 12),32,462,327,3%,37.1,2,43,2.41,1.37,0,
"Keaton WinnNew Player Note SF - P Top 5, 0-1 vs COL",COL,W (Jul 12),30,498,328,3%,31.1,1,26,3.16,0.99,0,
"DL HallIL15No new player Notes MIL - P L, 6-7 @ PIT; Bot 4, 0-2 @ PIT",@ PIT,W (Jul 12),24,514,329,0%,31.0,0,32,2.03,1.23,0,
"Gerrit ColePlayer Note NYY - P  Bot 4, 0-2 @ WSH",@ WSH,NY Bombsquad,9,65,330,88%,49.0,0,47,4.04,1.2,4,
"Trevor RichardsNAPlayer Note CWS - P W, 1-0 vs ATH",ATH,W (Jul 12),24,572,331,0%,35.1,0,35,3.31,1.02,0,
Trent ThorntonPlayer Note CHC - P 6:10 pm @ CIN,@ CIN,W (Jul 12),24,468,332,0%,28.2,2,13,2.51,1.01,0,
Andre PallantePlayer Note STL - P 6:15 pm vs ATL,ATL,Cash is King,18,325,333,35%,100.0,0,72,3.96,1.26,6,
Kris BubicIL60Player Note KC - P 6:05 pm @ BAL,@ BAL,Cash is King,9,274,335,39%,50.1,0,51,4.11,1.23,4,
"Ryan ZeferjahnNo new player Notes LAA - P L, 3-5 @ MIN",@ MIN,W (Jul 12),37,449,337,2%,42.2,2,59,3.8,1.24,0,
Kevin GinkelNo new player Notes AZ - P 8:10 pm @ LAD,@ LAD,W (Jul 12),39,499,338,1%,36.1,0,39,2.97,1.16,0,
"Christian ScottPlayer Note NYM - P Bot 4, 0-2 vs BOS",BOS,W (Jul 12),12,504,339,15%,54.0,0,65,3.17,1.3,0,
Jason AdamIL15Player Note SD - P 7:40 pm vs TOR,TOR,W (Jul 12),36,412,340,12%,32.1,2,22,2.51,1.18,0,
"Zebby MatthewsNew Player Note MIN - P W, 5-3 vs LAA",LAA,Ranger danger,11,253,341,21%,67.0,0,54,4.57,1.22,7,
Tim MayzaNo new player Notes PHI - P 5:10 pm @ DET,@ DET,W (Jul 12),37,516,342,0%,42.2,0,43,3.59,1.08,0,
Jonathan BowlanPlayer Note PHI - P 5:10 pm @ DET,@ DET,W (Jul 12),31,485,344,0%,28.2,0,37,3.14,1.12,0,
"Joey CantilloPlayer Note CLE - P Top 4, 0-0 @ MIA",@ MIA,Joey Spierer's Team,19,347,345,52%,96.0,0,96,3.66,1.39,4,
Jacob WaguespackNo new player Notes DET - P 5:10 pm vs PHI,PHI,W (Jul 12),9,548,346,0%,12.1,0,8,1.46,0.65,0,
Ryan HelsleyIL15New Player Note BAL - P 6:05 pm vs KC,KC,W (Jul 12),17,190,347,64%,15.1,8,21,4.11,1.43,0,
"Tyron GuerreroNo new player Notes BOS - P Bot 4, 2-0 @ NYM",@ NYM,W (Jul 12),19,515,348,4%,19.1,0,23,2.33,1.03,0,
Gordon GraceffoPlayer Note STL - P 6:15 pm vs ATL,ATL,W (Jul 12),38,456,349,0%,45.0,1,24,3.0,1.09,0,
Jeff HoffmanPlayer Note TOR - P 7:40 pm @ SD,@ SD,W (Jul 12),43,403,351,53%,40.1,5,64,4.24,1.36,0,
"Gabe SpeierNo new player Notes SEA - P Bot 3, 1-1 @ TB",@ TB,W (Jul 12),28,428,352,5%,23.0,1,19,1.96,1.17,0,
George SorianoNo new player Notes STL - P 6:15 pm vs ATL,ATL,W (Jul 12),40,621,353,2%,39.2,2,33,3.4,1.13,0,
"Devin WilliamsPlayer Note NYM - P Bot 4, 0-2 vs BOS",BOS,Cookie Monster ,34,108,354,89%,30.2,13,44,4.7,1.63,0,
Alimber SantaPlayer Note HOU - P 6:05 pm @ TEX,@ TEX,W (Jul 12),10,546,355,0%,15.1,0,9,1.17,0.91,0,
"JT BrubakerNo new player Notes SF - P Top 5, 0-1 vs COL",COL,W (Jul 12),29,562,356,0%,45.0,0,31,2.8,1.16,0,
Reynaldo LópezPlayer Note ATL - P 6:15 pm @ STL,@ STL,Cookie Monster ,21,396,357,39%,56.2,0,51,3.18,1.27,1,
Dean KremerPlayer Note BAL - P 6:05 pm vs KC,KC,W (Jul 12),4,492,358,14%,22.0,0,24,4.09,1.0,2,
Wandy PeraltaPlayer Note SD - P 7:40 pm vs TOR,TOR,W (Jul 12),41,480,359,0%,48.1,0,31,2.23,1.28,0,
Cal QuantrillNew Player Note TEX - P 6:05 pm vs HOU,HOU,Cookie Monster ,19,1374,360,2%,46.1,0,28,3.11,1.14,1,
Yuki MatsuiNo new player Notes SD - P 7:40 pm vs TOR,TOR,W (Jul 12),24,550,363,0%,32.1,0,35,2.23,1.33,0,
Peyton GrayNo new player Notes TEX - P 6:05 pm vs HOU,HOU,W (Jul 12),26,463,365,1%,33.0,0,37,3.27,1.15,0,
Ryan RolisonNo new player Notes CHC - P 6:10 pm @ CIN,@ CIN,W (Jul 12),31,570,368,1%,34.2,1,35,2.86,1.27,0,
"Samy Natera Jr.Player Note LAA - P L, 3-5 @ MIN",@ MIN,W (Jul 12),12,535,371,0%,15.0,1,22,3.0,1.07,0,
"Aaron AshbyNo new player Notes MIL - P L, 6-7 @ PIT; Bot 4, 0-2 @ PIT",@ PIT,W (Jul 12),44,341,372,36%,54.2,0,72,3.13,1.41,0,
MacKenzie GorePlayer Note TEX - P 6:05 pm vs HOU,HOU,No Longer Rowdy,19,191,374,79%,101.0,0,111,4.72,1.31,6,
"Andrew MorrisNo new player Notes MIN - P W, 5-3 vs LAA",LAA,W (Jul 12),34,472,375,6%,44.0,2,46,3.48,1.27,0,
"Grant AndersonNo new player Notes MIL - P L, 6-7 @ PIT; Bot 4, 0-2 @ PIT",@ PIT,W (Jul 12),36,488,376,0%,40.2,0,31,3.32,1.11,0,
"Carmen MlodzinskiNo new player Notes PIT - P W, 7-6 vs MIL; Bot 4, 2-0 vs MIL",MIL,W (Jul 12),19,452,377,4%,77.2,2,62,3.24,1.35,1,
"Tyler PhillipsPlayer Note MIA - P Top 4, 0-0 vs CLE",CLE,Joey Spierer's Team,24,507,380,4%,74.0,2,55,3.28,1.36,2,
"Gage JumpPlayer Note ATH - P L, 0-1 @ CWS",@ CWS,Trust The Process,8,236,382,33%,43.0,0,41,3.77,1.3,3,
Ty MaddenNANo new player Notes DET - P 5:10 pm vs PHI,PHI,W (Jul 12),7,580,383,0%,20.0,0,23,3.15,1.05,0,
"William KempnerPlayer Note MIA - P Top 4, 0-0 vs CLE",CLE,W (Jul 12),8,541,384,0%,10.1,0,11,1.74,0.87,0,
Hunter BrownNew Player Note HOU - P  6:05 pm @ TEX,@ TEX,Joe Byron,7,69,385,96%,35.1,0,39,3.57,1.39,3,
Joe MantiplyIL60No new player Notes TOR - P 7:40 pm @ SD,@ SD,W (Jul 12),17,1197,386,0%,17.2,0,16,2.04,1.13,0,
"Orlando RibaltaNo new player Notes WSH - P Bot 4, 2-0 vs NYY",NYY,W (Jul 12),29,1241,387,0%,27.1,2,23,3.29,1.17,0,
Brant HurterIL60No new player Notes DET - P 5:10 pm vs PHI,PHI,W (Jul 12),21,429,388,1%,25.1,0,18,2.84,1.07,0,
"Yohan RamírezNo new player Notes PIT - P W, 7-6 vs MIL; Bot 4, 2-0 vs MIL",MIL,W (Jul 12),39,479,390,1%,50.2,1,58,3.38,1.34,0,
Graham AshcraftIL60No new player Notes CIN - P 6:10 pm vs CHC,CHC,W (Jul 12),26,524,391,1%,27.0,1,32,3.33,1.22,0,
"Nick DavilaNo new player Notes SEA - P Bot 3, 1-1 @ TB",@ TB,W (Jul 12),16,584,393,0%,17.1,1,9,2.08,1.1,0,
"Garrett CleavingerPlayer Note TB - P Bot 3, 1-1 vs SEA",SEA,W (Jul 12),30,435,395,9%,26.2,2,36,3.71,1.28,0,
"Yovanny CruzNAPlayer Note NYY - P Bot 4, 0-2 @ WSH",@ WSH,W (Jul 12),3,570,396,0%,4.1,0,6,0.0,0.23,0,
"Will WarrenPlayer Note NYY - P Bot 4, 0-2 @ WSH",@ WSH,NY Bombsquad,18,264,397,62%,93.1,0,94,4.15,1.37,5,
Daniel PalenciaIL15No new player Notes CHC - P  6:10 pm @ CIN,@ CIN,Ranger danger,19,228,398,60%,16.2,3,19,2.7,1.38,0,
Enyel De Los SantosNo new player Notes HOU - P 6:05 pm @ TEX,@ TEX,W (Jul 12),39,576,399,2%,41.2,5,39,4.54,1.18,0,
Spencer ArrighettiPlayer Note HOU - P 6:05 pm @ TEX,@ TEX,W (Jul 12),15,151,400,34%,82.0,0,81,4.5,1.33,6,
Victor MederosPlayer Note ATL - P 6:15 pm @ STL,@ STL,W (Jul 12),3,1254,401,0%,5.0,0,5,0.0,0.4,0,
AJ BlubaughNo new player Notes HOU - P 6:05 pm @ TEX,@ TEX,W (Jul 12),35,436,402,1%,58.0,0,56,3.57,1.24,0,
"Robert GasserNew Player Note MIL - P L, 6-7 @ PIT; Bot 4, 0-2 @ PIT",@ PIT,Fightin Farmers,8,572,403,4%,43.1,0,40,4.15,1.18,2,
Jeremiah EstradaIL15Player Note SD - P 7:40 pm vs TOR,TOR,W (Jul 12),21,438,404,5%,20.2,1,23,3.48,1.11,0,
"Gabriel HughesPlayer Note COL - P Top 5, 1-0 @ SF",@ SF,W (Jul 12),2,605,405,1%,9.0,1,8,3.0,1.0,1,
"PJ PoulinNew Player Note WSH - P Bot 4, 2-0 vs NYY",NYY,W (Jul 12),34,487,406,1%,35.0,3,22,2.83,1.31,0,
"Caleb KilianNew Player Note SF - P Top 5, 0-1 vs COL",COL,No Longer Rowdy,38,219,410,14%,38.0,8,47,4.74,1.39,0,
Emmet SheehanPlayer Note LAD - P 8:10 pm vs AZ,AZ,Stealth Bomber,16,134,411,75%,77.0,0,86,4.91,1.27,5,
"Daniel DuarteNANo new player Notes NYM - P Bot 4, 0-2 vs BOS",BOS,W (Jul 12),3,577,412,0%,5.0,0,3,0.0,0.4,0,
Julian GarciaNo new player Notes CIN - P 6:10 pm vs CHC,CHC,W (Jul 12),6,580,413,0%,9.1,0,9,1.93,0.86,0,
Caleb FergusonNo new player Notes CIN - P 6:10 pm vs CHC,CHC,W (Jul 12),18,496,414,0%,18.0,1,17,2.0,1.33,0,
"Erik SabrowskiNo new player Notes CLE - P Top 4, 0-0 @ MIA",@ MIA,W (Jul 12),35,453,415,15%,27.1,0,48,3.62,1.35,0,
Andrew AbbottPlayer Note CIN - P 6:10 pm vs CHC,CHC,Detroit Fastballs,19,170,416,63%,101.0,0,81,3.92,1.41,7,
"Bailey OberPlayer Note MIN - P W, 5-3 vs LAA",LAA,W (Jul 12),13,346,417,19%,71.2,0,51,4.4,1.19,4,
Kumar RockerPlayer Note TEX - P 6:05 pm vs HOU,HOU,Cookie Monster ,17,1399,418,14%,84.1,0,74,3.95,1.34,4,
"Hogan HarrisNo new player Notes ATH - P L, 0-1 @ CWS",@ CWS,W (Jul 12),44,246,419,8%,41.0,6,54,3.51,1.59,0,
Miguel UllolaNAPlayer Note HOU - P 6:05 pm @ TEX,@ TEX,W (Jul 12),2,588,421,0%,4.0,0,7,0.0,0.5,0,
Riley MartinIL15No new player Notes CHC - P 6:10 pm @ CIN,@ CIN,W (Jul 12),8,590,422,0%,8.1,0,10,2.16,0.84,0,
Cade HortonIL60No new player Notes CHC - P  6:10 pm @ CIN,@ CIN,W (Jul 12),2,426,423,23%,7.1,0,4,2.45,0.82,1,
"José A. FerrerNo new player Notes SEA - P Bot 3, 1-1 @ TB",@ TB,W (Jul 12),43,520,424,4%,38.1,3,32,3.05,1.38,0,
"Jared JonesVideo ForecastPlayer Note PIT - P W, 7-6 vs MIL; Bot 4, 2-0 vs MIL",MIL,The Eds,8,585,425,27%,35.0,0,39,4.37,1.14,1,
James KarinchakNew Player Note ATL - P 6:15 pm @ STL,@ STL,W (Jul 12),9,592,426,0%,9.2,0,8,1.86,0.93,0,
Tyler KinleyPlayer Note ATL - P 6:15 pm @ STL,@ STL,W (Jul 12),37,442,427,1%,33.1,0,34,3.51,1.2,0,
Shane BazPlayer Note BAL - P 6:05 pm vs KC,KC,No Longer Rowdy,18,288,428,51%,107.0,0,90,4.21,1.37,7,
"Pete FairbanksPlayer Note MIA - P Top 4, 0-0 vs CLE",CLE,W (Jul 12),30,149,429,68%,28.0,13,38,6.75,1.43,0,
