"Brad LordIL15Player Note WSH - P Bot 4, 2-0 vs NYY",NYY,W (Jul 12),27,495,430,2%,58.0,1,52,3.88,1.22,0,
"Angel ChivilliPlayer Note NYY - P Bot 4, 0-2 @ WSH",@ WSH,W (Jul 12),5,1462,433,0%,6.2,0,7,1.35,0.9,0,
Kyle FinneganNo new player Notes DET - P 5:10 pm vs PHI,PHI,W (Jul 12),40,432,434,6%,42.1,1,32,2.13,1.49,0,
Trevor RogersPlayer Note BAL - P 6:05 pm vs KC,KC,Fightin Farmers,17,215,435,73%,90.1,0,69,4.48,1.31,7,
JoJo RomeroPlayer Note STL - P 6:15 pm vs ATL,ATL,W (Jul 12),43,460,437,13%,42.0,0,43,3.43,1.29,0,
Sam MollNo new player Notes CIN - P 6:10 pm vs CHC,CHC,W (Jul 12),43,608,439,0%,38.1,1,42,3.76,1.28,0,
"Eduardo RiveraNew Player Note BOS - P Bot 4, 2-0 @ NYM",@ NYM,W (Jul 12),1,600,440,1%,3.1,0,3,0.0,0.3,0,
"Blade TidwellNANo new player Notes SF - P Top 5, 0-1 vs COL",COL,W (Jul 12),8,1259,441,0%,12.0,1,10,3.0,1.08,0,
"Cooper CriswellIL60Player Note SEA - P Bot 3, 1-1 @ TB",@ TB,W (Jul 12),26,553,442,0%,30.2,1,23,3.52,1.17,0,
"Hunter GaddisNo new player Notes CLE - P Top 4, 0-0 @ MIA",@ MIA,W (Jul 12),35,477,443,11%,29.2,1,27,2.73,1.38,0,
"Craig YohoPlayer Note MIL - P L, 6-7 @ PIT; Bot 4, 0-2 @ PIT",@ PIT,W (Jul 12),7,712,444,0%,10.0,0,10,3.6,0.8,0,
"Michael GroveNANo new player Notes TB - P Bot 3, 1-1 vs SEA",SEA,W (Jul 12),1,564,446,0%,3.0,0,4,0.0,0.33,0,
"Brennan BernardinoPlayer Note COL - P Top 5, 1-0 @ SF",@ SF,W (Jul 12),45,474,447,0%,38.1,1,26,3.05,1.28,0,
"Elvis AlvaradoNo new player Notes ATH - P L, 0-1 @ CWS",@ CWS,W (Jul 12),25,496,448,4%,27.1,2,35,4.94,1.13,0,
Carl Edwards Jr.NANo new player Notes DET - P 5:10 pm vs PHI,PHI,W (Jul 12),2,611,449,0%,6.0,0,11,1.5,1.17,0,
Logan VanWeyNANo new player Notes HOU - P 6:05 pm @ TEX,@ TEX,W (Jul 12),5,601,450,0%,6.0,0,5,1.5,0.83,0,
"Chase DollanderIL60No new player Notes COL - P Top 5, 1-0 @ SF",@ SF,W (Jul 12),10,1469,451,4%,44.0,0,47,3.89,1.3,1,
"José FerminNo new player Notes LAA - P L, 3-5 @ MIN",@ MIN,W (Jul 12),25,543,452,0%,27.0,0,29,3.33,1.26,0,
Drew AndersonNo new player Notes DET - P 5:10 pm vs PHI,PHI,W (Jul 12),33,542,453,1%,54.2,2,68,4.28,1.32,0,
Brock BurkeNo new player Notes CIN - P 6:10 pm vs CHC,CHC,W (Jul 12),46,469,454,0%,44.1,1,39,3.05,1.38,0,
Vince VelasquezNANo new player Notes CHC - P 6:10 pm @ CIN,@ CIN,W (Jul 12),2,610,455,0%,3.1,0,1,0.0,0.3,0,
Albert SuárezNo new player Notes BAL - P 6:05 pm vs KC,KC,W (Jul 12),16,506,456,0%,40.2,1,28,3.54,1.2,0,
Stephen KolekNAPlayer Note KC - P 6:05 pm @ BAL,@ BAL,No Longer Rowdy,10,255,458,9%,54.0,0,34,4.5,1.24,5,
Ryan FernandezNAPlayer Note STL - P 6:15 pm vs ATL,ATL,W (Jul 12),11,1255,459,0%,13.1,0,20,2.7,1.35,0,
Ty BlachNANo new player Notes CHC - P 6:10 pm @ CIN,@ CIN,W (Jul 12),1,689,460,0%,3.0,0,2,0.0,0.33,0,
"Jimmy HergetNo new player Notes COL - P Top 5, 1-0 @ SF",@ SF,W (Jul 12),24,526,462,2%,24.0,3,25,3.75,1.38,0,
Javier AssadPlayer Note CHC - P 6:10 pm @ CIN,@ CIN,Trust The Process,14,455,463,14%,56.1,0,33,4.15,1.1,1,
"Dax FultonNANo new player Notes MIA - P Top 4, 0-0 vs CLE",CLE,W (Jul 12),3,619,464,0%,7.0,0,6,2.57,0.86,0,
Caleb ThielbarNo new player Notes CHC - P 6:10 pm @ CIN,@ CIN,W (Jul 12),30,451,465,2%,26.1,2,33,4.44,1.25,0,
"Garrett StallingsPlayer Note MIL - P L, 6-7 @ PIT; Bot 4, 0-2 @ PIT",@ PIT,W (Jul 12),2,617,467,0%,3.0,0,4,0.0,0.67,0,
Ryan ThompsonNo new player Notes AZ - P 8:10 pm @ LAD,@ LAD,W (Jul 12),37,497,469,0%,33.1,0,25,2.97,1.29,0,
Matthew BoydPlayer Note CHC - P  6:10 pm @ CIN,@ CIN,Ranger danger,8,331,470,64%,39.2,0,44,4.31,1.31,2,
"Tim HerrinIL15Player Note CLE - P Top 4, 0-0 @ MIA",@ MIA,W (Jul 12),41,587,471,1%,32.1,0,27,3.06,1.3,0,
"Dylan SmithPlayer Note SF - P Top 5, 0-1 vs COL",COL,W (Jul 12),14,571,472,0%,12.2,1,13,3.55,1.18,0,
"Mason MontgomeryNo new player Notes PIT - P W, 7-6 vs MIL; Bot 4, 2-0 vs MIL",MIL,W (Jul 12),37,1164,473,2%,36.0,0,53,4.25,1.31,0,
"Jonathan PintaroNA7No new player Notes NYM - P Bot 4, 0-2 vs BOS",BOS,W (Jul 12),5,691,474,0%,12.1,0,12,5.11,0.73,0,
"Garrett ActonIL60Player Note MIN - P W, 5-3 vs LAA",LAA,W (Jul 12),4,583,475,0%,6.2,0,9,2.7,1.05,0,
Brad KellerPlayer Note PHI - P 5:10 pm @ DET,@ DET,W (Jul 12),32,437,476,6%,31.1,3,32,4.02,1.34,0,
Ben PeoplesPlayer Note TEX - P 6:05 pm vs HOU,HOU,W (Jul 12),2,624,478,0%,3.0,0,2,0.0,0.67,0,
Nick PivettaIL60Player Note SD - P 7:40 pm vs TOR,TOR,Cookie Monster ,4,222,479,72%,16.0,0,24,4.5,1.13,0,
"Josh EknessIL60No new player Notes MIA - P Top 4, 0-0 vs CLE",CLE,W (Jul 12),6,626,480,0%,5.1,1,5,1.69,1.31,0,
"Mark Leiter Jr.Player Note ATH - P L, 0-1 @ CWS",@ CWS,W (Jul 12),34,655,481,0%,31.2,4,35,4.55,1.33,0,
Brock StewartNo new player Notes LAD - P 8:10 pm vs AZ,AZ,W (Jul 12),9,556,482,0%,8.2,0,9,3.12,1.04,0,
"Yerry De los SantosNANo new player Notes NYY - P Bot 4, 0-2 @ WSH",@ WSH,W (Jul 12),5,720,483,0%,8.2,0,7,1.04,1.38,0,
"Franco AlemanPlayer Note CLE - P Top 4, 0-0 @ MIA",@ MIA,W (Jul 12),5,636,484,0%,6.0,0,3,1.5,1.0,0,
Yacksel RíosNANo new player Notes CHC - P 6:10 pm @ CIN,@ CIN,W (Jul 12),1,634,486,0%,1.2,0,2,0.0,0.0,0,
"Eiberson CastellanoNANo new player Notes COL - P Top 5, 1-0 @ SF",@ SF,W (Jul 12),1,635,488,0%,3.0,1,2,0.0,1.33,0,
Lazaro EstradaNANo new player Notes TOR - P 7:40 pm @ SD,@ SD,W (Jul 12),2,718,490,0%,6.1,0,3,2.84,0.79,0,
"Eddy YeanNAPlayer Note WSH - P Bot 4, 2-0 vs NYY",NYY,W (Jul 12),1,637,491,0%,2.0,0,3,0.0,0.5,0,
"Erik MillerNo new player Notes SF - P Top 5, 0-1 vs COL",COL,W (Jul 12),31,537,493,1%,26.0,2,36,3.46,1.54,0,
Blake TreinenIL15Player Note LAD - P 8:10 pm vs AZ,AZ,W (Jul 12),29,517,494,1%,23.0,1,25,3.52,1.35,0,
"Chase SilsethNo new player Notes LAA - P L, 3-5 @ MIN",@ MIN,W (Jul 12),41,534,495,0%,34.0,0,41,3.18,1.44,0,
"Logan AllenNANo new player Notes CLE - P Top 4, 0-0 @ MIA",@ MIA,W (Jul 12),1,1301,497,0%,4.0,0,7,0.0,1.5,0,
"Greg WeissertNo new player Notes BOS - P Bot 4, 2-0 @ NYM",@ NYM,W (Jul 12),38,481,499,0%,36.2,0,33,3.93,1.2,0,
"Zach ThorntonNANew Player Note NYM - P Bot 4, 0-2 vs BOS",BOS,W (Jul 12),2,721,502,1%,10.1,0,10,4.35,1.16,1,
Emilio PagánPlayer Note CIN - P 6:10 pm vs CHC,CHC,Cash is King,18,287,503,66%,16.1,7,16,6.06,1.41,0,
Enmanuel De JesúsNANo new player Notes DET - P 5:10 pm vs PHI,PHI,W (Jul 12),22,568,504,0%,31.2,1,31,3.98,1.26,0,
"Sam HentgesNo new player Notes SF - P Top 5, 0-1 vs COL",COL,W (Jul 12),23,593,505,0%,17.2,0,21,2.04,1.58,0,
"Ryan FeltnerPlayer Note COL - P Top 5, 1-0 @ SF",@ SF,W (Jul 12),13,1355,507,5%,63.1,0,47,4.55,1.29,5,
"Ryan YarbroughNo new player Notes NYY - P Bot 4, 0-2 @ WSH",@ WSH,W (Jul 12),23,576,509,0%,36.2,2,27,4.17,1.2,0,
"Tommy NanceNew Player Note MIN - P W, 5-3 vs LAA",LAA,W (Jul 12),32,527,510,0%,33.0,0,34,3.82,1.27,0,
John SchreiberNo new player Notes KC - P 6:05 pm @ BAL,@ BAL,W (Jul 12),39,591,511,0%,35.2,1,27,3.53,1.29,0,
Tanner AndrewsNANo new player Notes TOR - P 7:40 pm @ SD,@ SD,W (Jul 12),2,647,512,0%,3.0,0,1,0.0,1.0,0,
Hoby MilnerIL15No new player Notes CHC - P 6:10 pm @ CIN,@ CIN,W (Jul 12),38,595,513,0%,35.2,1,18,3.53,1.21,0,
"Andrew AlvarezPlayer Note WSH - P Bot 4, 2-0 vs NYY",NYY,W (Jul 12),12,545,515,4%,47.0,1,51,3.64,1.4,0,
Chad DallasPlayer Note TOR - P 7:40 pm @ SD,@ SD,W (Jul 12),2,596,517,0%,4.2,0,3,1.93,1.07,0,
"Joe BoyleNANo new player Notes TB - P Bot 3, 1-1 vs SEA",SEA,W (Jul 12),3,1287,518,1%,15.2,0,16,5.17,1.09,1,
"Brooks KriskeIL60No new player Notes ATH - P L, 0-1 @ CWS",@ CWS,W (Jul 12),2,1302,519,0%,2.2,0,2,0.0,1.13,0,
"Joel PegueroIL60No new player Notes SF - P Top 5, 0-1 vs COL",COL,W (Jul 12),11,565,520,0%,11.1,0,5,2.38,1.24,0,
"Sam BachmanNo new player Notes LAA - P L, 3-5 @ MIN",@ MIN,W (Jul 12),35,1154,521,1%,41.1,1,42,4.14,1.28,0,
Tyler HoltonNo new player Notes DET - P 5:10 pm vs PHI,PHI,W (Jul 12),39,475,522,8%,41.0,0,34,3.29,1.34,0,
Danny YoungPlayer Note ATL - P 6:15 pm @ STL,@ STL,W (Jul 12),4,664,523,0%,3.1,0,3,2.7,0.9,0,
Seth LugoPlayer Note KC - P 6:05 pm @ BAL,@ BAL,Rafael Devers,18,256,524,24%,100.2,0,80,4.56,1.43,10,
"Tyler DavisPlayer Note CWS - P W, 1-0 vs ATH",ATH,W (Jul 12),24,577,525,0%,26.1,1,22,4.1,1.22,0,
Kyle LeahyNew Player Note STL - P 6:15 pm vs ATL,ATL,Cookie Monster ,18,471,526,19%,89.1,0,75,3.73,1.41,3,
"Easton McGeeNAPlayer Note MIL - P L, 6-7 @ PIT; Bot 4, 0-2 @ PIT",@ PIT,W (Jul 12),2,1169,529,0%,2.0,0,1,0.0,1.0,0,
"Welinton HerreraIL60No new player Notes COL - P Top 5, 1-0 @ SF",@ SF,W (Jul 12),3,673,530,0%,2.1,0,2,0.0,1.29,0,
Cole RagansIL60Player Note KC - P  6:05 pm @ BAL,@ BAL,W (Jul 12),8,613,531,54%,35.1,0,45,4.84,1.42,3,
Randy DobnakPlayer Note KC - P 6:05 pm @ BAL,@ BAL,W (Jul 12),2,648,532,0%,9.2,0,4,1.86,1.34,0,
"Zack KellyNA7Player Note BOS - P Bot 4, 2-0 @ NYM",@ NYM,W (Jul 12),17,1137,533,0%,16.1,0,14,3.31,1.29,0,
Ryne NelsonIL60No new player Notes AZ - P 8:10 pm @ LAD,@ LAD,W (Jul 12),15,392,534,31%,83.1,0,62,4.97,1.24,6,
"Tyler ZuberNo new player Notes MIA - P Top 4, 0-0 vs CLE",CLE,W (Jul 12),13,1317,535,0%,11.1,1,12,3.97,1.32,0,
Andrew KittredgeNew Player Note BAL - P 6:05 pm vs KC,KC,W (Jul 12),28,494,536,3%,24.0,3,23,4.5,1.33,0,
"Brian FitzpatrickIL60Player Note MIL - P L, 6-7 @ PIT; Bot 4, 0-2 @ PIT",@ PIT,W (Jul 12),5,681,537,0%,6.2,0,5,1.35,1.5,0,
Jake EderNAPlayer Note LAD - P 8:10 pm vs AZ,AZ,W (Jul 12),4,644,538,0%,4.0,0,1,2.25,1.0,0,
"Zach PopNANo new player Notes MIA - P Top 4, 0-0 vs CLE",CLE,W (Jul 12),7,1325,540,0%,7.1,0,6,3.68,1.09,0,
"Patrick SandovalPlayer Note BOS - P Bot 4, 2-0 @ NYM",@ NYM,W (Jul 12),1,1141,541,5%,4.1,0,5,2.08,1.38,0,
Cody PonceIL60No new player Notes TOR - P 7:40 pm @ SD,@ SD,W (Jul 12),1,686,543,3%,2.1,0,3,3.86,0.86,0,
"Julian FernándezNANo new player Notes WSH - P Bot 4, 2-0 vs NYY",NYY,W (Jul 12),3,654,544,0%,4.0,0,3,2.25,1.25,0,
"Jeff CriswellNew Player Note COL - P Top 5, 1-0 @ SF",@ SF,W (Jul 12),2,680,546,0%,2.0,0,2,0.0,1.5,0,
"Guillo ZuñigaNAPlayer Note NYM - P Bot 4, 0-2 vs BOS",BOS,W (Jul 12),1,694,547,0%,1.0,0,1,0.0,1.0,0,
Cameron WestonNAPlayer Note BAL - P 6:05 pm vs KC,KC,W (Jul 12),1,692,548,0%,1.0,0,1,0.0,1.0,0,
Jhony BritoPlayer Note SD - P 7:40 pm vs TOR,TOR,W (Jul 12),2,704,549,0%,4.1,0,3,4.15,0.92,0,
Zach EflinIL60No new player Notes BAL - P 6:05 pm vs KC,KC,W (Jul 12),1,1300,550,2%,3.2,0,7,2.45,1.64,0,
Burch SmithIL60No new player Notes DET - P 5:10 pm vs PHI,PHI,W (Jul 12),13,1140,551,0%,17.0,0,20,3.18,1.47,0,
"Duncan DavittNANo new player Notes CWS - P W, 1-0 vs ATH",ATH,W (Jul 12),1,696,552,0%,1.0,0,0,0.0,1.0,0,
"Tyler SamaniegoNANo new player Notes BOS - P Bot 4, 2-0 @ NYM",@ NYM,W (Jul 12),20,1136,553,0%,20.1,0,17,2.66,1.48,0,
Adam MackoNo new player Notes TOR - P 7:40 pm @ SD,@ SD,W (Jul 12),17,584,555,0%,17.1,0,17,3.63,1.33,0,
"Jack AndersonNANew Player Note BOS - P Bot 4, 2-0 @ NYM",@ NYM,W (Jul 12),3,709,556,0%,8.0,0,6,3.38,1.25,0,
"Mick AbelIL15New Player Note MIN - P W, 5-3 vs LAA",LAA,W (Jul 12),4,363,557,8%,20.1,0,23,3.98,1.57,2,
Paul GervaseNAPlayer Note LAD - P 8:10 pm vs AZ,AZ,W (Jul 12),4,1186,558,0%,7.2,0,8,2.35,1.57,0,
Jose CuasNAPlayer Note KC - P 6:05 pm @ BAL,@ BAL,W (Jul 12),5,1162,559,0%,6.1,0,9,2.84,1.58,0,
"Spencer BivensPlayer Note SF - P Top 5, 0-1 vs COL",COL,W (Jul 12),2,670,560,0%,2.0,0,3,0.0,2.0,0,
Josh WalkerNANo new player Notes BAL - P 6:05 pm vs KC,KC,W (Jul 12),5,1207,561,0%,6.0,0,7,4.5,1.17,0,
Pierce JohnsonNo new player Notes CIN - P 6:10 pm vs CHC,CHC,W (Jul 12),29,510,562,0%,26.0,1,25,4.15,1.31,0,
Mitch BrattNANo new player Notes AZ - P 8:10 pm @ LAD,@ LAD,Stealth Bomber,1,708,563,1%,3.0,0,3,3.0,1.33,0,
"Kervin CastroNANo new player Notes NYY - P Bot 4, 0-2 @ WSH",@ WSH,W (Jul 12),1,710,564,0%,2.0,0,2,4.5,1.0,0,
"Marco RayaIL15Player Note MIN - P W, 5-3 vs LAA",LAA,W (Jul 12),3,722,566,0%,6.0,0,4,3.0,1.33,0,
"Connor BrogdonNANo new player Notes CLE - P Top 4, 0-0 @ MIA",@ MIA,W (Jul 12),15,652,568,0%,15.1,1,14,5.28,1.11,0,
"Joey GerberNAPlayer Note NYM - P Bot 4, 0-2 vs BOS",BOS,W (Jul 12),7,684,569,0%,8.1,0,8,4.32,1.2,0,
"Brett KerryNANo new player Notes LAA - P L, 3-5 @ MIN",@ MIN,W (Jul 12),1,1134,570,0%,4.0,0,2,4.5,1.0,0,
"Jesse ScholtensIL15Player Note TB - P Bot 3, 2-1 vs SEA",SEA,W (Jul 12),9,512,571,1%,37.2,0,30,3.82,1.27,0,
"Matt FestaNo new player Notes CLE - P Top 4, 0-0 @ MIA",@ MIA,W (Jul 12),40,524,572,0%,38.1,1,38,3.99,1.36,0,
"Mason EnglertNAPlayer Note TB - P Bot 3, 2-1 vs SEA",SEA,W (Jul 12),13,1189,574,0%,30.2,1,28,3.82,1.37,0,
Evan PhillipsPlayer Note LAD - P 8:10 pm vs AZ,AZ,W (Jul 12),2,612,575,2%,2.0,0,4,4.5,1.5,0,
"Drew RomNAPlayer Note MIL - P L, 6-7 @ PIT; Bot 4, 0-2 @ PIT",@ PIT,W (Jul 12),5,627,576,0%,5.2,0,11,3.18,1.76,0,
Nate PearsonNo new player Notes HOU - P 6:05 pm @ TEX,@ TEX,W (Jul 12),16,1334,577,0%,20.0,1,16,3.6,1.4,0,
"Mitch FarrisNo new player Notes LAA - P L, 3-5 @ MIN",@ MIN,W (Jul 12),18,1316,578,0%,38.1,0,38,3.52,1.41,0,
Hunter DobbinsNAPlayer Note STL - P 6:15 pm vs ATL,ATL,W (Jul 12),5,632,579,1%,22.1,1,23,4.03,1.39,0,
Chase PettyNAPlayer Note CIN - P 6:10 pm vs CHC,CHC,W (Jul 12),10,1346,580,0%,22.2,1,9,4.37,1.1,0,
Jose EspadaNANo new player Notes BAL - P 6:05 pm vs KC,KC,W (Jul 12),1,669,581,0%,1.0,0,0,0.0,2.0,0,
"Tyler UberstineNANo new player Notes BOS - P Bot 4, 2-0 @ NYM",@ NYM,W (Jul 12),1,1151,583,0%,2.2,0,2,3.38,1.5,0,
"Alec GamboaNAPlayer Note BOS - P Bot 4, 2-0 @ NYM",@ NYM,W (Jul 12),4,1153,584,0%,5.0,0,4,3.6,1.4,0,
"Zach BrzykcyNAPlayer Note MIA - P Top 4, 0-0 vs CLE",CLE,W (Jul 12),1,1416,585,0%,2.0,0,2,4.5,1.5,0,
"Mason BarnettNo new player Notes ATH - P L, 0-1 @ CWS",@ CWS,W (Jul 12),13,1270,586,1%,21.1,2,21,4.64,1.36,0,
"Woo-Suk GoPlayer Note MIN - P W, 5-3 vs LAA",LAA,W (Jul 12),1,1161,587,0%,1.0,0,1,9.0,1.0,0,
Owen MurphyNANew Player Note ATL - P 6:15 pm @ STL,@ STL,W (Jul 12),1,1160,588,1%,1.0,0,1,9.0,1.0,0,
"Tayler SaucedoNANew Player Note LAA - P L, 3-5 @ MIN",@ MIN,W (Jul 12),6,1299,589,0%,3.1,0,6,5.4,1.5,0,
"Tom CosgrovePlayer Note WSH - P Bot 4, 2-0 vs NYY",NYY,W (Jul 13),1,1188,590,0%,0.2,0,0,0.0,3.0,0,
"Cole SandsIL15Player Note MIN - P W, 5-3 vs LAA",LAA,W (Jul 12),12,560,591,1%,11.2,1,11,4.63,1.37,0,
Doug NikhazyNANo new player Notes CHC - P 6:10 pm @ CIN,@ CIN,W (Jul 12),1,1274,592,0%,2.0,0,1,4.5,1.5,0,
"Anthony BandaIL15New Player Note MIN - P W, 5-3 vs LAA",LAA,W (Jul 12),39,522,594,0%,34.1,2,33,4.46,1.34,0,
Kai-Wei TengIL15Player Note HOU - P 6:05 pm @ TEX,@ TEX,No Longer Rowdy,23,1221,595,2%,64.0,0,63,4.36,1.36,2,
"Xzavion CurryPlayer Note NYM - P Bot 4, 0-2 vs BOS",BOS,W (Jul 12),2,1215,596,0%,1.1,0,1,6.75,1.5,0,
Robert GarciaIL60No new player Notes TEX - P 6:05 pm vs HOU,HOU,W (Jul 12),9,539,597,4%,8.0,0,6,3.38,1.5,0,
"Kendry RojasPlayer Note MIN - P W, 5-3 vs LAA",LAA,W (Jul 12),7,677,598,0%,18.1,0,21,2.95,1.64,0,
"Luis SeverinoIL60No new player Notes ATH - P L, 0-1 @ CWS",@ CWS,W (Jul 12),12,1385,599,6%,62.2,0,65,4.16,1.47,3,
"Carson WhisenhuntNANew Player Note SF - P Top 5, 0-1 vs COL",COL,W (Jul 12),2,633,600,1%,10.2,0,6,3.38,1.41,0,
Jack FlahertyNew Player Note DET - P 5:10 pm vs PHI,PHI,No Longer Rowdy,18,687,601,58%,82.1,0,98,4.48,1.41,2,
Juan BurgosNANo new player Notes AZ - P 8:10 pm @ LAD,@ LAD,W (Jul 12),1,1265,602,0%,1.1,0,0,6.75,1.5,0,
Luis GastelumPlayer Note STL - P 6:15 pm vs ATL,ATL,W (Jul 12),2,1184,603,0%,1.2,0,1,5.4,1.8,0,
"Sean ManaeaPlayer Note NYM - P Bot 4, 0-2 vs BOS",BOS,W (Jul 12),20,373,604,15%,75.0,0,74,4.56,1.32,2,
"Daniel EspinoNAPlayer Note CLE - P Top 4, 0-0 @ MIA",@ MIA,W (Jul 12),5,1191,605,0%,5.0,0,9,5.4,1.6,0,
Alan RangelPlayer Note PHI - P 5:10 pm @ DET,@ DET,W (Jul 12),5,1204,606,0%,19.1,0,22,4.19,1.4,0,
Alek JacobNAPlayer Note SD - P 7:40 pm vs TOR,TOR,W (Jul 12),3,1231,607,0%,5.0,0,6,5.4,1.4,0,
Carter BaumlerIL60No new player Notes TEX - P 6:05 pm vs HOU,HOU,W (Jul 12),4,1190,609,0%,5.2,0,6,3.18,1.76,0,
"Tim HillNo new player Notes NYY - P Bot 4, 0-2 @ WSH",@ WSH,W (Jul 12),42,502,610,1%,35.1,0,16,4.33,1.1,0,
Luke LittleNANo new player Notes CHC - P 6:10 pm @ CIN,@ CIN,W (Jul 12),1,1201,611,0%,1.0,0,1,9.0,2.0,0,
Kyle HartNo new player Notes SD - P 7:40 pm vs TOR,TOR,W (Jul 12),22,1275,612,0%,32.2,0,28,5.23,1.07,0,
"Joe La SorsaNANo new player Notes BOS - P Bot 4, 2-0 @ NYM",@ NYM,W (Jul 12),1,1320,614,0%,0.1,0,1,27.0,3.0,0,
Brenan HanifeeNANo new player Notes DET - P 5:10 pm vs PHI,PHI,W (Jul 12),14,671,615,0%,13.2,0,6,3.29,1.39,0,
"Blas CastañoIL15Player Note COL - P Top 5, 1-0 @ SF",@ SF,W (Jul 12),10,1182,616,0%,20.2,0,17,3.92,1.35,0,
Justin BruihlPlayer Note STL - P 6:15 pm vs ATL,ATL,W (Jul 12),41,1340,617,0%,45.0,0,31,3.6,1.33,0,
"Cody LawerysonNAPlayer Note MIN - P W, 5-3 vs LAA",LAA,W (Jul 12),15,616,618,0%,16.2,1,18,4.86,1.38,0,
Lucas ErcegNo new player Notes KC - P 6:05 pm @ BAL,@ BAL,W (Jul 12),37,364,619,17%,36.0,12,25,5.0,1.64,0,
"Carlos RodriguezIL15Player Note MIL - P L, 6-7 @ PIT; Bot 4, 0-2 @ PIT",@ PIT,W (Jul 12),4,1303,620,0%,9.1,0,8,3.86,1.5,0,
"Tyler SchweitzerNew Player Note CWS - P W, 1-0 vs ATH",ATH,W (Jul 12),5,1203,621,0%,8.0,1,4,4.5,1.5,0,
Chayce McDermottNANo new player Notes LAD - P 8:10 pm vs AZ,AZ,W (Jul 12),2,1418,622,0%,2.1,0,1,7.71,1.29,0,
"Antwone KellyPlayer Note PIT - P W, 7-6 vs MIL; Bot 4, 2-0 vs MIL",MIL,W (Jul 12),1,1199,623,0%,2.1,0,1,7.71,1.29,0,
Hunter GreeneNew Player Note CIN - P 6:10 pm vs CHC,CHC,Stealth Bomber,2,393,624,79%,10.1,0,19,6.97,1.45,1,
"Jonah TongNANo new player Notes NYM - P Bot 4, 0-2 vs BOS",BOS,W (Jul 12),3,1252,626,3%,10.0,0,7,3.6,1.5,0,
Gavin CollyerNo new player Notes TEX - P 6:05 pm vs HOU,HOU,W (Jul 12),21,701,627,0%,20.2,0,19,3.92,1.4,0,
"Luis MedinaNo new player Notes ATH - P L, 0-1 @ CWS",@ CWS,W (Jul 12),30,1202,628,0%,41.1,0,49,3.7,1.5,0,
"David SandlinNANo new player Notes CWS - P W, 1-0 vs ATH",ATH,W (Jul 12),4,1163,629,1%,19.1,0,20,6.05,1.29,2,
Gavin HollowellNo new player Notes CHC - P 6:10 pm @ CIN,@ CIN,W (Jul 12),7,1248,630,0%,8.0,0,6,3.38,1.63,0,
"John KleinNANo new player Notes MIN - P W, 5-3 vs LAA",LAA,W (Jul 12),3,1205,631,0%,4.1,0,2,4.15,1.62,0,
Anthony NunezPlayer Note BAL - P 6:05 pm vs KC,KC,W (Jul 12),33,646,632,0%,36.1,3,40,5.2,1.32,0,
Tony SantillanIL15No new player Notes CIN - P 6:10 pm vs CHC,CHC,W (Jul 12),34,508,633,5%,31.0,5,28,5.23,1.39,0,
Max RajcicIL60Player Note STL - P 6:15 pm vs ATL,ATL,W (Jul 12),6,1211,634,0%,9.0,0,8,5.0,1.33,0,
"Gregory SantosNAPlayer Note SF - P Top 5, 0-1 vs COL",COL,W (Jul 12),3,1264,635,0%,5.0,0,1,3.6,1.6,0,
Jalen BeeksIL15Player Note TEX - P 6:05 pm vs HOU,HOU,W (Jul 12),29,531,636,0%,26.0,0,21,3.81,1.38,0,
"Hunter StrattonNAPlayer Note PIT - P W, 7-6 vs MIL; Bot 4, 2-0 vs MIL",MIL,W (Jul 12),3,1258,637,0%,3.1,0,3,5.4,1.8,0,
Winston SantosNAPlayer Note TEX - P 6:05 pm vs HOU,HOU,W (Jul 12),1,1210,638,0%,2.0,0,1,9.0,1.5,0,
Drey JamesonNo new player Notes AZ - P 8:10 pm @ LAD,@ LAD,W (Jul 12),10,1240,639,0%,15.1,0,11,4.11,1.37,0,
"Matt PushardNANo new player Notes MIA - P Top 4, 0-0 vs CLE",CLE,W (Jul 12),6,1218,640,0%,7.0,0,6,5.14,1.43,0,
Beck WayNo new player Notes KC - P 6:05 pm @ BAL,@ BAL,W (Jul 12),15,723,641,0%,18.2,0,17,3.38,1.55,0,
Tyler FergusonNo new player Notes CHC - P 6:10 pm @ CIN,@ CIN,W (Jul 12),10,1195,642,0%,9.2,0,13,7.45,1.03,0,
Anthony MolinaNAPlayer Note ATL - P 6:15 pm @ STL,@ STL,W (Jul 12),3,1474,643,0%,5.0,0,2,5.4,1.4,0,
Bruce ZimmermannNAPlayer Note STL - P 6:15 pm vs ATL,ATL,W (Jul 12),1,1267,644,0%,5.0,0,2,5.4,1.4,0,
Hunter HarveyIL60No new player Notes CHC - P 6:10 pm @ CIN,@ CIN,W (Jul 12),4,628,645,0%,4.0,0,4,6.75,1.5,0,
"Reiver SanmartinNANo new player Notes SF - P Top 5, 0-1 vs COL",COL,W (Jul 12),2,699,646,0%,3.1,0,4,8.1,1.5,0,
"Taylor RashiNANo new player Notes MIN - P W, 5-3 vs LAA",LAA,W (Jul 12),3,1143,648,0%,3.2,0,4,9.82,1.09,0,
"Mitch KellerPlayer Note PIT - P W, 7-6 vs MIL; Bot 4, 2-0 vs MIL",MIL,W (Jul 12),19,230,651,28%,103.1,0,77,5.14,1.33,9,
"Chris DevenskiIL60No new player Notes PIT - P W, 7-6 vs MIL; Bot 4, 2-0 vs MIL",MIL,W (Jul 12),3,1148,652,0%,2.1,0,3,7.71,2.14,0,
Nick RaquetPlayer Note BAL - P 6:05 pm vs KC,KC,W (Jul 12),4,1208,654,0%,3.2,0,1,7.36,1.36,0,
"Carson PalmquistPlayer Note WSH - P Bot 4, 2-0 vs NYY",NYY,W (Jul 12),5,1527,655,0%,9.1,0,11,5.79,1.39,0,
Brycen MautzNANo new player Notes STL - P 6:15 pm vs ATL,ATL,W (Jul 12),1,1228,656,0%,3.0,0,2,6.0,2.0,0,
Nolan HoffmanNANo new player Notes PHI - P 5:10 pm @ DET,@ DET,W (Jul 12),3,1282,658,0%,4.2,0,2,3.86,1.93,0,
Kade StrowdNANo new player Notes AZ - P 8:10 pm @ LAD,@ LAD,W (Jul 12),1,675,659,0%,1.0,0,1,9.0,4.0,0,
Spencer StriderIL60No new player Notes ATL - P 6:15 pm @ STL,@ STL,Tm Mndlsn nd Mtchn,8,344,660,56%,39.0,0,46,5.31,1.36,2,
"Camilo DovalNo new player Notes NYY - P Bot 4, 0-2 @ WSH",@ WSH,W (Jul 12),40,490,662,3%,35.1,1,35,4.58,1.36,0,
"Jared KoenigNo new player Notes MIL - P L, 6-7 @ PIT; Bot 4, 0-2 @ PIT",@ PIT,W (Jul 12),8,530,663,2%,7.0,0,7,2.57,2.14,0,
Dietrich EnnsNANo new player Notes BAL - P 6:05 pm vs KC,KC,W (Jul 12),13,579,664,0%,16.0,0,13,3.94,1.50,0,
"Casey LeguminaNo new player Notes TB - P Bot 3, 2-1 vs SEA",SEA,W (Jul 12),30,1238,665,0%,38.1,0,28,3.99,1.33,0,
"Lucas SimsNANo new player Notes CWS - P W, 1-0 vs ATH",ATH,W (Jul 12),9,1450,666,0%,10.0,0,10,4.50,1.60,0,
"Chase SoleskyNANo new player Notes TB - P Bot 3, 2-1 vs SEA",SEA,W (Jul 12),1,1233,667,0%,3.0,0,4,6.00,2.33,0,
Kyle HurtPlayer Note LAD - P 8:10 pm vs AZ,AZ,W (Jul 12),32,607,668,1%,31.1,1,38,4.88,1.40,0,
"Joey EstesNANo new player Notes ATH - P L, 0-1 @ CWS",@ CWS,W (Jul 12),1,1407,670,0%,4.1,0,4,8.31,1.38,0,
"Justin SternerNo new player Notes ATH - P L, 0-1 @ CWS",@ CWS,W (Jul 12),44,529,671,2%,41.1,1,40,5.01,1.26,0,
"Craig KimbrelNo new player Notes TB - P Bot 3, 2-1 vs SEA",SEA,W (Jul 12),26,1216,672,0%,26.1,0,24,4.78,1.29,0,
"Sammy PeraltaNANo new player Notes LAA - P L, 3-5 @ MIN",@ MIN,W (Jul 12),2,1362,673,0%,2.2,0,4,10.13,1.88,0,
Max LazarPlayer Note PHI - P 5:10 pm @ DET,@ DET,W (Jul 12),5,1315,674,0%,6.1,0,4,7.11,1.26,0,
"Jake BirdNo new player Notes NYY - P Bot 4, 0-2 @ WSH",@ WSH,W (Jul 12),35,1361,675,0%,30.0,0,30,4.50,1.37,0,
"Anthony KayPlayer Note CWS - P W, 1-0 vs ATH",ATH,W (Jul 12),19,679,676,11%,89.1,0,71,4.23,1.38,3,
Drew SommersNo new player Notes DET - P 5:10 pm vs PHI,PHI,W (Jul 12),16,1359,677,0%,9.1,0,14,5.79,1.61,0,
"Kody FunderburkNo new player Notes MIN - P W, 5-3 vs LAA",LAA,W (Jul 12),26,1183,678,0%,24.1,1,16,4.07,1.44,0,
"Trevor MartinNAPlayer Note TB - P Bot 3, 2-1 vs SEA",SEA,W (Jul 12),6,1251,679,0%,11.1,0,7,3.97,1.59,0,
Chase ShugartPlayer Note PHI - P 5:10 pm @ DET,@ DET,W (Jul 12),26,569,680,0%,29.0,0,34,4.97,1.34,0,
"Connor PrielippIL15Player Note MIN - P W, 5-3 vs LAA",LAA,W (Jul 12),13,1378,681,6%,66.2,0,71,5.00,1.37,3,
"Jonathan CannonNANo new player Notes CWS - P W, 1-0 vs ATH",ATH,W (Jul 12),1,1499,682,0%,0.0,0,0,-,-,0,
"Robby SnellingIL60No new player Notes MIA - P Top 4, 0-0 vs CLE",CLE,W (Jul 12),1,1249,683,2%,5.0,0,2,5.40,1.80,0,
Cade PovichNANo new player Notes BAL - P 6:05 pm vs KC,KC,W (Jul 12),4,1508,684,0%,19.1,0,12,5.12,1.34,1,
Steven CruzPlayer Note KC - P 6:05 pm @ BAL,@ BAL,W (Jul 12),28,603,685,0%,30.1,0,40,5.04,1.38,0,
"Josh SimpsonNANo new player Notes SEA - P Bot 3, 1-2 @ TB",@ TB,W (Jul 12),4,1412,686,0%,3.0,0,3,9.00,2.00,0,
Chase LeeNANo new player Notes TOR - P 7:40 pm @ SD,@ SD,W (Jul 12),3,690,688,0%,3.1,0,1,8.10,1.80,0,
Jameson TaillonIL15Player Note CHC - P 6:10 pm @ CIN,@ CIN,W (Jul 12),13,557,689,7%,67.2,0,59,5.19,1.30,4,
"Chris MurphyPlayer Note CWS - P W, 1-0 vs ATH",ATH,W (Jul 12),20,589,692,0%,20.2,1,21,4.79,1.5,0,
"Joel KuhnelIL15Player Note MIL - P L, 6-7 @ PIT; Bot 4, 0-2 @ PIT",@ PIT,W (Jul 12),35,1235,694,1%,35.1,6,22,4.84,1.47,0,
Grant WolframNo new player Notes BAL - P 6:05 pm vs KC,KC,W (Jul 12),33,1328,696,0%,26.2,0,29,5.06,1.35,0,
"Hayden JuengerNANo new player Notes ATH - P L, 0-1 @ CWS",@ CWS,W (Jul 12),2,1266,697,0%,2.0,0,0,13.5,2.0,0,
"Janson JunkPlayer Note MIA - P Top 4, 0-0 vs CLE",CLE,Detroit Fastballs,12,640,699,4%,65.0,0,48,4.57,1.31,2,
"Andrew NardiIL60No new player Notes MIA - P Top 4, 0-0 vs CLE",CLE,W (Jul 12),25,620,700,0%,22.2,0,27,5.16,1.41,0,
"Domingo GonzálezNANo new player Notes SEA - P Bot 3, 1-2 @ TB",@ TB,W (Jul 12),5,1276,701,0%,7.2,0,5,4.7,1.83,0,
Mason FluhartyNo new player Notes TOR - P 7:40 pm @ SD,@ SD,W (Jul 12),49,532,702,1%,35.2,1,44,4.54,1.51,0,
Connor ThomasNAPlayer Note ATL - P 6:15 pm @ STL,@ STL,W (Jul 12),1,1427,703,0%,3.2,0,2,9.82,1.64,0,
Edwin DíazIL60New Player Note LAD - P 8:10 pm vs AZ,AZ,Joey Spierer's Team,7,360,704,81%,6.0,4,10,10.5,2.33,0,
"Jordan HicksNo new player Notes CWS - P W, 1-0 vs ATH",ATH,W (Jul 12),27,1544,705,0%,24.2,1,27,4.01,1.66,0,
Bennett SousaIL60Player Note HOU - P 6:05 pm @ TEX,@ TEX,W (Jul 12),5,549,707,0%,3.1,0,4,8.1,2.4,0,
Mason BlackNANo new player Notes KC - P 6:05 pm @ BAL,@ BAL,W (Jul 12),12,1335,708,0%,17.2,0,15,3.57,1.7,0,
Ethan RobertsIL15No new player Notes CHC - P 6:10 pm @ CIN,@ CIN,W (Jul 12),23,1321,709,0%,25.2,0,17,4.21,1.4,0,
Wyatt MillsNANo new player Notes LAD - P 8:10 pm vs AZ,AZ,W (Jul 12),5,1281,711,0%,4.1,0,4,6.23,2.31,0,
Ian HamiltonNAPlayer Note ATL - P 6:15 pm @ STL,@ STL,W (Jul 12),4,1263,714,0%,4.2,0,4,7.71,1.93,0,
"Geoff HartliebNAPlayer Note ATH - P L, 0-1 @ CWS",@ CWS,W (Jul 12),4,1376,715,0%,8.2,0,3,5.19,1.62,0,
"Jordan RomanoNew Player Note COL - P Top 5, 1-0 @ SF",@ SF,Joe Byron,15,1444,716,5%,11.2,6,17,7.71,2.14,0,
"Johan OviedoIL60Player Note BOS - P Bot 4, 2-0 @ NYM",@ NYM,W (Jul 12),1,1212,717,0%,3.2,0,3,9.82,1.91,0,
Eric LauerPlayer Note LAD - P 8:10 pm vs AZ,AZ,Cash is King,15,540,719,16%,76.2,0,47,4.81,1.28,4,
"Brandon EisertNew Player Note PIT - P W, 7-6 vs MIL; Bot 4, 2-0 vs MIL",MIL,W (Jul 12),25,1239,720,0%,27.1,0,32,5.93,1.24,0,
Rolddy MuñozNANo new player Notes ATL - P 6:15 pm @ STL,@ STL,W (Jul 12),1,1360,721,0%,2.0,0,3,13.5,3.0,0,
"Joe RockNANo new player Notes CWS - P W, 1-0 vs ATH",ATH,W (Jul 12),4,1269,722,0%,10.1,0,12,3.48,2.13,0,
"Shawn ArmstrongNo new player Notes CLE - P Top 4, 0-0 @ MIA",@ MIA,W (Jul 12),32,447,723,2%,28.1,0,28,4.76,1.41,0,
JP SearsNew Player Note SD - P 7:40 pm vs TOR,TOR,Cash is King,4,1292,724,5%,19.2,0,17,5.03,1.42,0,
"Jordan LeasureIL60No new player Notes CWS - P W, 1-0 vs ATH",ATH,W (Jul 12),18,561,725,0%,18.2,0,18,6.27,1.23,0,
