Yacksel RíosNANo new player Notes CHC - P 7:10 pm @ NYM,@ NYM,FA,1,640,454,0%,1.2,0,2,0.0,0.0,0,
Matt FestaNo new player Notes CLE - P 7:40 pm @ CWS,@ CWS,FA,33,501,455,0%,32.0,1,35,4.22,1.22,0,
Eiberson CastellanoNAPlayer Note COL - P 8:40 pm vs BOS,BOS,FA,1,641,458,0%,3.0,1,2,0.0,1.33,0,
Brock StewartPlayer Note LAD - P 7:40 pm @ MIN,@ MIN,FA,2,558,459,0%,2.0,0,3,0.0,0.5,0,
Vince VelasquezNANo new player Notes CHC - P 7:10 pm @ NYM,@ NYM,FA,1,646,460,0%,2.1,0,1,0.0,0.43,0,
"Lazaro EstradaNANew Player Note TOR - P Bot 6, 2-4 vs HOU",HOU,FA,2,1141,461,0%,6.1,0,3,2.84,0.79,0,
Ethan RobertsNo new player Notes CHC - P 7:10 pm @ NYM,@ NYM,FA,20,677,462,0%,23.2,0,17,3.04,1.23,0,
Hogan HarrisNo new player Notes ATH - P 9:45 pm @ SF,@ SF,FA,39,242,463,12%,36.0,6,43,3.75,1.61,0,
Logan AllenNANo new player Notes CLE - P 7:40 pm @ CWS,@ CWS,FA,1,1333,464,0%,4.0,0,7,0.0,1.5,0,
Michael RuckerNo new player Notes SEA - P 6:40 pm @ PIT,@ PIT,FA,4,648,466,0%,4.0,0,8,4.5,0.75,0,
Trent ThorntonNo new player Notes CHC - P 7:10 pm @ NYM,@ NYM,FA,15,565,468,0%,20.0,0,9,3.15,1.1,0,
Tyler AlexanderPlayer Note TEX - P 6:40 pm @ MIA,@ MIA,FA,32,1256,469,3%,31.1,2,24,2.87,1.44,0,
Blake TreinenIL15Player Note LAD - P 7:40 pm @ MIN,@ MIN,FA,29,507,470,1%,23.0,1,25,3.52,1.35,0,
Joey GerberNANo new player Notes NYM - P 7:10 pm vs CHC,CHC,FA,3,625,471,0%,5.0,0,6,1.8,1.2,0,
Greg WeissertNo new player Notes BOS - P 8:40 pm @ COL,@ COL,FA,32,479,472,0%,30.0,0,30,3.6,1.27,0,
"Logan VanWeyPlayer Note HOU - P Bot 6, 4-2 @ TOR",@ TOR,FA,4,1169,473,0%,4.0,0,5,2.25,1.0,0,
John BrebbiaPlayer Note COL - P 8:40 pm vs BOS,BOS,FA,1,1336,474,0%,2.0,0,1,0.0,0.5,0,
Brad KellerIL15Player Note PHI - P 6:45 pm @ WSH,@ WSH,FA,31,431,476,6%,30.1,3,31,4.15,1.35,0,
"Tanner AndrewsNANo new player Notes TOR - P Bot 6, 2-4 vs HOU",HOU,FA,2,661,478,0%,3.0,0,1,0.0,1.0,0,
Victor MederosNANo new player Notes ATL - P 9:40 pm @ SD,@ SD,FA,1,1310,479,0%,2.0,0,0,0.0,0.5,0,
Yerry De los SantosPlayer Note NYY - P 6:40 pm @ DET,@ DET,FA,2,1183,480,0%,5.1,0,6,1.69,1.31,0,
Brock BurkeNo new player Notes CIN - P 7:10 pm vs MIL,MIL,FA,38,484,481,0%,36.1,1,32,2.97,1.43,0,
Garrett CleavingerNo new player Notes TB - P 6:40 pm vs KC,KC,FA,22,437,482,7%,19.1,2,27,4.66,1.34,0,
Brooks KriskeIL60Player Note ATH - P 9:45 pm @ SF,@ SF,FA,2,1328,483,0%,2.2,0,2,0.0,1.13,0,
Anthony BandaPlayer Note MIN - P 7:40 pm vs LAD,LAD,FA,36,472,484,2%,32.0,2,29,4.22,1.25,0,
Bailey OberIL15New Player Note MIN - P 7:40 pm vs LAD,LAD,Joey Spierer's Team,12,344,485,18%,66.2,0,46,4.59,1.22,4,
Joe BoyleNANo new player Notes TB - P 6:40 pm vs KC,KC,FA,3,1299,487,1%,15.2,0,16,5.17,1.09,1,
Joel PegueroIL60No new player Notes SF - P 9:45 pm vs ATH,ATH,FA,11,566,493,0%,11.1,0,5,2.38,1.24,0,
"Jeff HoffmanNo new player Notes TOR - P Bot 6, 2-4 vs HOU",HOU,FA,36,402,494,54%,33.1,5,54,5.13,1.5,0,
Easton McGeeNANo new player Notes MIL - P 7:10 pm @ CIN,@ CIN,FA,2,1182,495,0%,2.0,0,1,0.0,1.0,0,
Reynaldo LópezPlayer Note ATL - P 9:40 pm @ SD,@ SD,FA,18,394,497,8%,43.2,0,39,3.5,1.37,1,
Max LazarNAPlayer Note PHI - P 6:45 pm @ WSH,@ WSH,FA,3,1207,498,0%,4.0,0,4,4.5,0.75,0,
Elvis AlvaradoPlayer Note ATH - P 9:45 pm @ SF,@ SF,W (Jun 25),17,509,499,14%,19.2,2,25,5.49,1.17,0,
Welinton HerreraIL60No new player Notes COL - P 8:40 pm vs BOS,BOS,FA,3,684,500,0%,2.1,0,2,0.0,1.29,0,
Griffin JaxPlayer Note TB - P 6:40 pm vs KC,KC,The Eds,21,343,501,35%,49.0,0,46,3.67,1.31,0,
Hunter DobbinsNANo new player Notes STL - P 7:45 pm vs AZ,AZ,FA,4,593,502,1%,17.1,1,19,3.63,1.38,0,
Kyle FinneganNo new player Notes DET - P 6:40 pm vs NYY,NYY,FA,34,400,504,7%,35.2,1,22,2.02,1.54,0,
Ryan ZeferjahnNo new player Notes LAA - P 9:38 pm vs BAL,BAL,FA,30,525,506,1%,35.2,2,46,4.54,1.35,0,
Paul GervaseNANo new player Notes LAD - P 7:40 pm @ MIN,@ MIN,FA,2,1162,507,0%,5.0,0,5,1.8,1.4,0,
Tyler ZuberNo new player Notes MIA - P 6:40 pm vs TEX,TEX,FA,7,1330,508,0%,5.2,1,7,4.76,1.24,0,
Bryse WilsonNAPlayer Note PHI - P 6:45 pm @ WSH,@ WSH,FA,1,1491,510,0%,2.0,0,0,0.0,1.0,0,
Jake EderNANo new player Notes LAD - P 7:40 pm @ MIN,@ MIN,FA,4,652,511,0%,4.0,0,1,2.25,1.0,0,
Brian FitzpatrickIL60No new player Notes MIL - P 7:10 pm @ CIN,@ CIN,FA,5,690,513,0%,6.2,0,5,1.35,1.5,0,
Zach PopNANo new player Notes MIA - P 6:40 pm vs TEX,TEX,FA,7,1352,514,0%,7.1,0,6,3.68,1.09,0,
Jared ShusterNANo new player Notes STL - P 7:45 pm vs AZ,AZ,FA,4,1379,515,0%,7.2,0,2,2.35,1.17,0,
"Cody PonceIL60No new player Notes TOR - P Bot 6, 2-4 vs HOU",HOU,FA,1,689,516,3%,2.1,0,3,3.86,0.86,0,
Zack KellyNANo new player Notes BOS - P 8:40 pm @ COL,@ COL,FA,17,1143,517,0%,16.1,0,14,3.31,1.29,0,
Grant HolmesNew Player Note ATL - P 9:40 pm @ SD,@ SD,Detroit Fastballs,15,718,518,24%,73.1,0,65,4.17,1.42,5,
"Chad DallasNAPlayer Note TOR - P Bot 6, 2-4 vs HOU",HOU,FA,1,616,519,0%,3.2,0,2,2.45,1.09,0,
Cole RagansIL60New Player Note KC - P  6:40 pm @ TB,@ TB,Joe Byron,8,580,520,80%,35.1,0,45,4.84,1.42,3,
Julian FernándezNAPlayer Note WSH - P 6:45 pm vs PHI,PHI,FA,3,662,521,0%,4.0,0,3,2.25,1.25,0,
Jeff CriswellNANo new player Notes COL - P 8:40 pm vs BOS,BOS,FA,2,688,522,0%,2.0,0,2,0.0,1.5,0,
Hunter StrattonNAPlayer Note PIT - P 6:40 pm vs SEA,SEA,FA,1,1193,523,0%,1.0,0,1,0.0,1.0,0,
Cameron WestonNANo new player Notes BAL - P 9:38 pm @ LAA,@ LAA,FA,1,694,524,0%,1.0,0,1,0.0,1.0,0,
JoJo RomeroNo new player Notes STL - P 7:45 pm vs AZ,AZ,FA,35,398,525,12%,34.0,0,34,3.97,1.26,0,
Jacob WaguespackNo new player Notes DET - P 6:40 pm vs NYY,NYY,FA,3,720,526,0%,4.1,0,3,4.15,0.92,0,
Zach EflinIL60No new player Notes BAL - P 9:38 pm @ LAA,@ LAA,FA,1,1316,527,2%,3.2,0,7,2.45,1.64,0,
PJ PoulinNew Player Note WSH - P 6:45 pm vs PHI,PHI,FA,29,532,528,0%,29.1,2,19,3.07,1.43,0,
Emmet SheehanPlayer Note LAD - P 7:40 pm @ MIN,@ MIN,Stealth Bomber,14,135,529,78%,67.2,0,76,5.32,1.3,5,
Ryne NelsonIL15Player Note AZ - P 7:45 pm @ STL,@ STL,Joey Spierer's Team,15,391,531,39%,83.1,0,62,4.97,1.24,6,
"AJ BlubaughNo new player Notes HOU - P Bot 6, 4-2 @ TOR",@ TOR,FA,31,455,532,1%,49.2,0,45,3.81,1.29,0,
Tim HerrinNo new player Notes CLE - P 7:40 pm @ CWS,@ CWS,FA,33,687,533,3%,26.1,0,24,3.08,1.41,0,
Matt KrookPlayer Note ATH - P 9:45 pm @ SF,@ SF,W (Jun 24),1,1168,534,0%,1.0,0,0,0.0,1.0,0,
Duncan DavittNANo new player Notes CWS - P 7:40 pm vs CLE,CLE,FA,1,700,535,0%,1.0,0,0,0.0,1.0,0,
Tayler SaucedoNANo new player Notes LAA - P 9:38 pm vs BAL,BAL,FA,4,1290,537,0%,2.0,0,3,4.5,1.0,0,
Ron MarinaccioPlayer Note SD - P 9:40 pm vs ATL,ATL,FA,26,574,538,0%,38.2,0,32,3.72,1.27,0,
Robert GasserPlayer Note MIL - P 7:10 pm @ CIN,@ CIN,Fightin Farmers,6,672,539,5%,30.0,0,31,4.5,1.27,1,
Joel KuhnelNew Player Note MIL - P 7:10 pm @ CIN,@ CIN,FA,31,621,540,2%,31.0,5,20,4.35,1.35,0,
Roki SasakiPlayer Note LAD - P 7:40 pm @ MIN,@ MIN,No Longer Rowdy,13,327,541,53%,68.0,0,70,4.76,1.29,3,
Carlos CarrascoPlayer Note ATL - P 9:40 pm @ SD,@ SD,FA,6,1482,542,0%,13.0,0,6,3.46,1.15,0,
Burch SmithIL60New Player Note DET - P 6:40 pm vs NYY,NYY,FA,13,1153,543,0%,17.0,0,20,3.18,1.47,0,
Jack AndersonNANo new player Notes BOS - P 8:40 pm @ COL,@ COL,FA,3,706,544,0%,8.0,0,6,3.38,1.25,0,
Anthony NunezNAPlayer Note BAL - P 9:38 pm @ LAA,@ LAA,FA,32,576,546,0%,34.1,3,38,4.98,1.28,0,
Caleb ThielbarNo new player Notes CHC - P 7:10 pm @ NYM,@ NYM,FA,23,454,547,2%,20.0,2,23,4.95,1.3,0,
Kervin CastroNANo new player Notes NYY - P 6:40 pm @ DET,@ DET,FA,1,707,548,0%,2.0,0,2,4.5,1.0,0,
Joey CantilloPlayer Note CLE - P 7:40 pm @ CWS,@ CWS,Cash is King,16,362,549,28%,80.0,0,76,4.05,1.4,3,
Jared KoenigIL15No new player Notes MIL - P 7:10 pm @ CIN,@ CIN,FA,3,481,550,2%,2.1,0,4,0.0,2.14,0,
Emilio PagánIL15Player Note CIN - P 7:10 pm vs MIL,MIL,Cash is King,15,349,551,63%,14.0,6,11,6.43,1.43,0,
Brent SuterNo new player Notes LAA - P 9:38 pm vs BAL,BAL,FA,30,1181,552,0%,45.2,0,38,4.14,1.2,0,
Tyler SamaniegoNANo new player Notes BOS - P 8:40 pm @ COL,@ COL,FA,20,1155,555,0%,20.1,0,17,2.66,1.48,0,
Mick AbelIL15New Player Note MIN - P 7:40 pm vs LAD,LAD,Trust The Process,4,361,557,16%,20.1,0,23,3.98,1.57,2,
Josh WalkerNANo new player Notes BAL - P 9:38 pm @ LAA,@ LAA,FA,3,1227,558,0%,4.0,0,5,4.5,1.25,0,
Brett KerryNAPlayer Note LAA - P 9:38 pm vs BAL,BAL,FA,1,726,559,0%,4.0,0,2,4.5,1.0,0,
"Tommy NanceNo new player Notes TOR - P Bot 6, 2-4 vs HOU",HOU,FA,26,531,560,0%,26.0,0,27,4.15,1.27,0,
Connor BrogdonNANo new player Notes CLE - P 7:40 pm @ CWS,@ CWS,FA,15,650,561,0%,15.1,1,14,5.28,1.11,0,
TJ ShookNANo new player Notes COL - P 8:40 pm vs BOS,BOS,FA,3,1147,562,0%,3.2,0,3,4.91,1.09,0,
Mark Leiter Jr.IL15Player Note ATH - P 9:45 pm @ SF,@ SF,FA,32,713,563,1%,29.2,4,31,4.85,1.38,0,
Geoff HartliebPlayer Note ATH - P 9:45 pm @ SF,@ SF,FA,1,1357,565,0%,3.0,0,1,3.0,1.33,0,
Jose EspadaNANo new player Notes BAL - P 9:38 pm @ LAA,@ LAA,FA,1,674,566,0%,1.0,0,0,0.0,2.0,0,
Grant WolframNo new player Notes BAL - P 9:38 pm @ LAA,@ LAA,FA,27,1216,567,0%,21.2,0,24,3.74,1.38,0,
Chase PettyPlayer Note CIN - P 7:10 pm vs MIL,MIL,FA,6,1356,568,0%,16.1,0,5,4.41,0.98,0,
Jimmy HergetPlayer Note COL - P 8:40 pm vs BOS,BOS,FA,17,550,569,0%,18.1,1,21,4.42,1.36,0,
"Nate PearsonNo new player Notes HOU - P Bot 6, 4-2 @ TOR",@ TOR,FA,9,1353,570,0%,10.2,1,10,4.22,1.41,0,
Cody LawerysonNANew Player Note MIN - P 7:40 pm vs LAD,LAD,FA,14,582,571,0%,16.0,1,18,5.06,1.25,0,
Tyler UberstineNAPlayer Note BOS - P 8:40 pm @ COL,@ COL,FA,1,1160,572,0%,2.2,0,2,3.38,1.5,0,
Jesse ScholtensIL15No new player Notes TB - P 6:40 pm vs KC,KC,FA,9,503,573,1%,37.2,0,30,3.82,1.27,0,
"Mason FluhartyPlayer Note TOR - P Bot 6, 2-4 vs HOU",HOU,FA,41,496,574,2%,29.2,1,38,3.94,1.48,0,
Max RajcicNo new player Notes STL - P 7:45 pm vs AZ,AZ,FA,2,1165,575,0%,3.1,0,3,5.4,1.2,0,
Kyle BackhusPlayer Note PHI - P 6:45 pm @ WSH,@ WSH,FA,10,1236,576,0%,9.2,0,10,4.66,1.24,0,
Mitch KellerPlayer Note PIT - P 6:40 pm vs SEA,SEA,NY Bombsquad,15,229,577,33%,82.1,0,65,4.92,1.32,7,
Franco AlemanNANo new player Notes CLE - P 7:40 pm @ CWS,@ CWS,FA,2,1173,578,0%,2.2,0,1,3.38,1.5,0,
Kumar RockerNew Player Note TEX - P 6:40 pm @ MIA,@ MIA,Joey Spierer's Team,15,1439,580,8%,74.0,0,65,4.14,1.38,3,
Doug NikhazyNAPlayer Note CHC - P 7:10 pm @ NYM,@ NYM,FA,1,1294,581,0%,2.0,0,1,4.5,1.5,0,
Drew RomNAPlayer Note MIL - P 7:10 pm @ CIN,@ CIN,FA,4,1178,582,0%,5.1,0,10,3.38,1.88,0,
Cal QuantrillNew Player Note TEX - P 6:40 pm @ MIA,@ MIA,FA,15,1488,583,0%,29.1,0,19,3.68,1.26,0,
Cole SandsIL15Player Note MIN - P 7:40 pm vs LAD,LAD,FA,12,551,584,1%,11.2,1,11,4.63,1.37,0,
Casey LeguminaPlayer Note TB - P 6:40 pm vs KC,KC,FA,24,1152,585,0%,31.1,0,23,3.45,1.34,0,
Richard LoveladyNo new player Notes WSH - P 6:45 pm vs PHI,PHI,FA,30,725,586,1%,29.1,4,26,2.76,1.77,0,
Beck WayNo new player Notes KC - P 6:40 pm @ TB,@ TB,FA,6,1187,587,0%,9.1,0,11,3.86,1.5,0,
Tyler DavisNAPlayer Note CWS - P 7:40 pm vs CLE,CLE,FA,22,596,588,0%,23.1,1,20,4.63,1.24,0,
Tyler HoltonPlayer Note DET - P 6:40 pm vs NYY,NYY,FA,33,468,589,7%,35.0,0,31,3.6,1.37,0,
Josh SimpsonNANo new player Notes SEA - P 6:40 pm @ PIT,@ PIT,FA,3,1384,591,0%,2.1,0,3,7.71,1.29,0,
Robert GarciaIL60No new player Notes TEX - P 6:40 pm @ MIA,@ MIA,FA,9,529,592,4%,8.0,0,6,3.38,1.5,0,
Mike ParedesPlayer Note MIN - P 7:40 pm vs LAD,LAD,Trust The Process,5,1200,594,1%,20.0,0,11,4.05,1.2,0,
Luke LittleNANo new player Notes CHC - P 7:10 pm @ NYM,@ NYM,FA,1,1209,595,0%,1.0,0,1,9.0,2.0,0,
Daniel EspinoPlayer Note CLE - P 7:40 pm @ CWS,@ CWS,FA,2,1194,596,1%,2.0,0,4,9.0,1.5,0,
Angel ChivilliNANo new player Notes NYY - P 6:40 pm @ DET,@ DET,FA,2,1522,597,0%,2.1,0,3,3.86,2.14,0,
Carter BaumlerIL60No new player Notes TEX - P 6:40 pm @ MIA,@ MIA,FA,4,1201,598,0%,5.2,0,6,3.18,1.76,0,
Joe La SorsaNANo new player Notes BOS - P 8:40 pm @ COL,@ COL,FA,1,1337,599,0%,0.1,0,1,27.0,3.0,0,
Gavin CollyerNANo new player Notes TEX - P 6:40 pm @ MIA,@ MIA,FA,18,676,600,0%,17.0,0,15,3.71,1.41,0,
Luis SeverinoIL60Player Note ATH - P 9:45 pm @ SF,@ SF,FA,12,1376,601,8%,62.2,0,65,4.16,1.47,3,
Chayce McDermottNAPlayer Note LAD - P 7:40 pm @ MIN,@ MIN,FA,2,1435,602,0%,2.1,0,1,7.71,1.29,0,
Antwone KellyNANo new player Notes PIT - P 6:40 pm vs SEA,SEA,FA,1,1205,603,0%,2.1,0,1,7.71,1.29,0,
Brenan HanifeeNANo new player Notes DET - P 6:40 pm vs NYY,NYY,FA,14,666,604,0%,13.2,0,6,3.29,1.39,0,
Carson WhisenhuntNAPlayer Note SF - P 9:45 pm vs ATH,ATH,FA,1,1170,605,0%,5.0,0,2,3.6,1.6,0,
Carlos RodriguezIL15No new player Notes MIL - P 7:10 pm @ CIN,@ CIN,FA,4,1322,606,0%,9.1,0,8,3.86,1.5,0,
Blas CastañoIL15Player Note COL - P 8:40 pm vs BOS,BOS,FA,10,1179,607,0%,20.2,0,17,3.92,1.35,0,
John KleinNANo new player Notes MIN - P 7:40 pm vs LAD,LAD,FA,3,1214,608,0%,4.1,0,2,4.15,1.62,0,
Tim HillNo new player Notes NYY - P 6:40 pm @ DET,@ DET,FA,36,488,609,2%,29.0,0,15,4.34,1.14,0,
Jonah TongNANo new player Notes NYM - P 7:10 pm vs CHC,CHC,FA,3,1271,610,3%,10.0,0,7,3.6,1.5,0,
Tony SantillanNew Player Note CIN - P 7:10 pm vs MIL,MIL,FA,34,482,611,12%,31.0,5,28,5.23,1.39,0,
Gregory SantosNA7Player Note SF - P 9:45 pm vs ATH,ATH,FA,3,1282,612,0%,5.0,0,1,3.6,1.6,0,
Kody FunderburkNANo new player Notes MIN - P 7:40 pm vs LAD,LAD,FA,21,679,613,0%,18.1,1,10,3.44,1.47,0,
Tomoyuki SuganoPlayer Note COL - P 8:40 pm vs BOS,BOS,FA,15,606,614,6%,79.1,0,46,4.31,1.29,4,
Trevor McDonaldPlayer Note SF - P 9:45 pm vs ATH,ATH,FA,9,692,615,6%,45.2,0,42,4.93,1.34,3,
Matt PushardNANo new player Notes MIA - P 6:40 pm vs TEX,TEX,FA,6,1222,617,0%,7.0,0,6,5.14,1.43,0,
Anthony MolinaNAPlayer Note ATL - P 9:40 pm @ SD,@ SD,FA,3,1483,618,0%,5.0,0,2,5.4,1.4,0,
Brendan BeckNANo new player Notes NYY - P 6:40 pm @ DET,@ DET,FA,1,1224,619,0%,3.0,0,1,6.0,1.67,0,
Hunter HarveyIL60No new player Notes CHC - P 7:10 pm @ NYM,@ NYM,FA,4,626,620,0%,4.0,0,4,6.75,1.5,0,
Ryan FeltnerNew Player Note COL - P 8:40 pm vs BOS,BOS,FA,10,1402,621,1%,47.0,0,35,4.79,1.3,3,
Lucas ErcegNo new player Notes KC - P 6:40 pm @ TB,@ TB,FA,30,358,623,22%,28.2,12,24,5.34,1.81,0,
Jalen BeeksIL15No new player Notes TEX - P 6:40 pm @ MIA,@ MIA,FA,29,524,624,0%,26.0,0,21,3.81,1.38,0,
Reiver SanmartinNAPlayer Note SF - P 9:45 pm vs ATH,ATH,FA,2,693,625,0%,3.1,0,4,8.1,1.5,0,
Taylor RashiNANo new player Notes MIN - P 7:40 pm vs LAD,LAD,FA,3,722,626,0%,3.2,0,4,9.82,1.09,0,
Sam HentgesNo new player Notes SF - P 9:45 pm vs ATH,ATH,FA,16,699,627,0%,12.2,0,14,2.84,1.82,0,
Hunter GaddisPlayer Note CLE - P 7:40 pm @ CWS,@ CWS,FA,25,517,628,9%,21.1,1,17,3.8,1.5,0,
Chris DevenskiIL60No new player Notes PIT - P 6:40 pm vs SEA,SEA,FA,3,1151,629,0%,2.1,0,3,7.71,2.14,0,
Ian SeymourPlayer Note TB - P 6:40 pm vs KC,KC,FA,29,375,630,7%,43.1,2,45,4.98,1.29,0,
Carmen MlodzinskiNo new player Notes PIT - P 6:40 pm vs SEA,SEA,FA,15,537,631,4%,67.2,1,56,3.72,1.43,1,
Tommy KahnleNo new player Notes BOS - P 8:40 pm @ COL,@ COL,FA,6,1213,632,0%,7.0,0,5,3.86,1.71,0,
Enmanuel De JesúsNo new player Notes DET - P 6:40 pm vs NYY,NYY,FA,19,629,633,0%,27.1,1,26,4.61,1.35,0,
Camilo DovalPlayer Note NYY - P 6:40 pm @ DET,@ DET,FA,33,465,634,3%,29.1,1,28,5.22,1.23,0,
Brycen MautzNANo new player Notes STL - P 7:45 pm vs AZ,AZ,FA,1,1235,635,0%,3.0,0,2,6.0,2.0,0,
Calvin FaucherNew Player Note MIA - P 6:40 pm vs TEX,TEX,FA,33,450,636,2%,32.2,1,34,3.58,1.56,0,
Kade StrowdNANo new player Notes AZ - P 7:45 pm @ STL,@ STL,FA,1,671,637,0%,1.0,0,1,9.0,4.0,0,
Nolan HoffmanNANo new player Notes PHI - P 6:45 pm @ WSH,@ WSH,FA,3,1297,638,0%,4.2,0,2,3.86,1.93,0,
Mason EnglertNAPlayer Note TB - P 6:40 pm vs KC,KC,FA,12,1249,639,0%,25.0,1,19,3.96,1.44,0,
Randy VásquezPlayer Note SD - P 9:40 pm vs ATL,ATL,Cookie Monster ,15,1175,640,26%,77.2,0,59,4.17,1.4,4,
Erik MillerNo new player Notes SF - P 9:45 pm vs ATH,ATH,FA,25,635,641,1%,20.0,2,28,4.5,1.7,0,
Chase SoleskyNANo new player Notes TB - P 6:40 pm vs KC,KC,FA,1,1239,642,0%,3.0,0,4,6.0,2.33,0,
Jake BirdNAPlayer Note NYY - P 6:40 pm @ DET,@ DET,FA,29,1343,643,0%,24.0,0,27,4.88,1.33,0,
Alek JacobNANo new player Notes SD - P 9:40 pm vs ATL,ATL,FA,2,1288,644,0%,2.0,0,3,9.0,2.5,0,
Lucas SimsNANo new player Notes CWS - P 7:40 pm vs CLE,CLE,FA,9,1454,645,0%,10.0,0,10,4.5,1.6,0,
Alex HoppeNo new player Notes SEA - P 6:40 pm @ PIT,@ PIT,FA,19,1245,646,0%,22.0,0,25,5.32,1.27,0,
Spencer StriderIL60Player Note ATL - P 9:40 pm @ SD,@ SD,FA,8,342,647,65%,39.0,0,46,5.31,1.36,2,
Joey EstesNAPlayer Note ATH - P 9:45 pm @ SF,@ SF,FA,1,1418,648,0%,4.1,0,4,8.31,1.38,0,
Dietrich EnnsNANo new player Notes BAL - P 9:38 pm @ LAA,@ LAA,FA,13,570,649,0%,16.0,0,13,3.94,1.5,0,
Matthew BoydIL15New Player Note CHC - P  7:10 pm @ NYM,@ NYM,Ranger danger,5,328,650,56%,24.0,0,31,6.0,1.29,1,
Brennan BernardinoNo new player Notes COL - P 8:40 pm vs BOS,BOS,FA,37,559,651,0%,31.1,0,24,3.73,1.4,0,
Sammy PeraltaNAPlayer Note COL - P 8:40 pm vs BOS,BOS,FA,2,1383,652,0%,2.2,0,4,10.13,1.88,0,
Drey JamesonNo new player Notes AZ - P 7:45 pm @ STL,@ STL,FA,4,1269,654,0%,7.1,0,6,4.91,1.64,0,
Anthony KayNew Player Note CWS - P 7:40 pm vs CLE,CLE,Cash is King,16,595,655,15%,76.1,0,63,4.24,1.39,3,
Danny CoulombeNo new player Notes BOS - P 8:40 pm @ COL,@ COL,FA,23,578,656,0%,17.1,0,10,4.67,1.27,0,
Gavin HollowellNANew Player Note CHC - P 7:10 pm @ NYM,@ NYM,FA,3,1300,657,0%,3.2,0,2,4.91,2.18,0,
Zach ThorntonNANo new player Notes NYM - P 7:10 pm vs CHC,CHC,FA,1,1247,658,0%,4.1,0,3,8.31,1.38,0,
Jonathan CannonNANo new player Notes CWS - P 7:40 pm vs CLE,CLE,FA,1,1500,659,0%,0.0,0,0,-,-,0,
Eric CerantolaNANo new player Notes KC - P 6:40 pm @ TB,@ TB,FA,3,1252,660,0%,4.0,0,7,9.00,1.75,0,
Sean ManaeaPlayer Note NYM - P 7:10 pm vs CHC,CHC,Cookie Monster ,16,371,661,16%,54.1,0,56,4.64,1.34,1,
Robby SnellingIL60No new player Notes MIA - P 6:40 pm vs TEX,TEX,FA,1,1263,663,2%,5.0,0,2,5.40,1.80,0,
Charlie BarnesNANo new player Notes LAD - P 7:40 pm @ MIN,@ MIN,FA,3,1262,664,0%,5.0,0,2,5.40,1.80,0,
Zach McCambleyNANo new player Notes CIN - P 7:10 pm vs MIL,MIL,FA,3,1260,665,0%,4.0,0,4,6.75,2.00,0,
Connor SeaboldPlayer Note KC - P 6:40 pm @ TB,@ TB,FA,18,1248,666,0%,21.1,0,17,3.80,1.50,0,
"Chase LeeNANo new player Notes TOR - P Bot 6, 2-4 vs HOU",HOU,FA,3,678,667,0%,3.1,0,1,8.10,1.80,0,
Cade PovichIL15Player Note BAL - P 9:38 pm @ LAA,@ LAA,FA,4,1507,669,1%,19.1,0,12,5.12,1.34,1,
Isaac MattsonNo new player Notes PIT - P 6:40 pm vs SEA,SEA,FA,23,613,670,0%,22.0,0,18,4.09,1.45,0,
Nick RaquetNANo new player Notes BAL - P 9:38 pm @ LAA,@ LAA,FA,3,1243,671,0%,2.2,0,1,10.13,1.88,0,
Matt GagePlayer Note SF - P 9:45 pm vs ATH,ATH,FA,31,588,672,0%,25.0,1,20,3.96,1.52,0,
Will VestNew Player Note DET - P 6:40 pm vs NYY,NYY,FA,26,428,674,4%,25.2,2,25,5.61,1.32,0,
JR RitchiePlayer Note ATL - P 9:40 pm @ SD,@ SD,Stealth Bomber,7,1266,675,8%,35.2,0,30,4.54,1.37,1,
Jameson TaillonIL15No new player Notes CHC - P 7:10 pm @ NYM,@ NYM,FA,13,522,676,8%,67.2,0,59,5.19,1.30,4,
Mason MontgomeryPlayer Note PIT - P 6:40 pm vs SEA,SEA,FA,29,1346,677,1%,28.2,0,37,4.71,1.47,0,
Mitch FarrisNo new player Notes LAA - P 9:38 pm vs BAL,BAL,FA,13,1409,678,0%,29.1,0,30,3.68,1.57,0,
"Hayden JuengerNANew Player Note TOR - P Bot 6, 2-4 vs HOU",HOU,FA,2,1273,679,0%,2.0,0,0,13.50,2.00,0,
Seth HalvorsenNAPlayer Note COL - P 8:40 pm vs BOS,BOS,FA,18,1305,680,0%,16.1,0,16,3.31,1.78,0,
Andrew MorrisNo new player Notes MIN - P 7:40 pm vs LAD,LAD,FA,26,697,681,2%,34.2,2,38,4.41,1.53,0,
Trevor MartinNANo new player Notes TB - P 6:40 pm vs KC,KC,FA,5,1283,682,0%,10.1,0,6,4.35,1.65,0,
Edwin DíazIL60Player Note LAD - P 7:40 pm @ MIN,@ MIN,FA,7,357,683,79%,6.0,4,10,10.5,2.33,0,
Domingo GonzálezNAPlayer Note SEA - P 6:40 pm @ PIT,@ PIT,FA,5,1286,685,0%,7.2,0,5,4.7,1.83,0,
Joe RockNo new player Notes CWS - P 7:40 pm vs CLE,CLE,FA,3,1261,686,0%,8.1,0,8,3.24,2.16,0,
"Bennett SousaIL15No new player Notes HOU - P Bot 6, 4-2 @ TOR",@ TOR,FA,5,540,687,0%,3.1,0,4,8.1,2.4,0,
Andrew NardiIL60No new player Notes MIA - P 6:40 pm vs TEX,TEX,FA,25,611,688,0%,22.2,0,27,5.16,1.41,0,
Ryan WalkerNo new player Notes SF - P 9:45 pm vs ATH,ATH,FA,20,528,693,27%,19.0,3,17,5.21,1.63,0,
Mason BlackNAPlayer Note KC - P 6:40 pm @ TB,@ TB,FA,12,1358,694,0%,17.2,0,15,3.57,1.7,0,
Johan OviedoIL60No new player Notes BOS - P 8:40 pm @ COL,@ COL,FA,1,1210,696,0%,3.2,0,3,9.82,1.91,0,
Rolddy MuñozNANo new player Notes ATL - P 9:40 pm @ SD,@ SD,FA,1,1372,697,0%,2.0,0,3,13.5,3.0,0,
Luis MedinaNo new player Notes ATH - P 9:45 pm @ SF,@ SF,FA,25,1268,698,0%,34.2,0,39,4.41,1.47,0,
Freddy PeraltaPlayer Note NYM - P 7:10 pm vs CHC,CHC,Rafael Devers,16,136,699,92%,85.2,0,83,4.83,1.39,4,
Zak KentNANo new player Notes WSH - P 6:45 pm vs PHI,PHI,FA,6,1325,700,0%,9.1,0,7,5.79,1.61,0,
Ian HamiltonNANo new player Notes ATL - P 9:40 pm @ SD,@ SD,FA,1,1275,701,0%,1.0,0,1,27.0,4.0,0,
Craig KimbrelPlayer Note TB - P 6:40 pm vs KC,KC,FA,19,1240,702,0%,19.0,0,18,5.21,1.42,0,
Tristan BeckPlayer Note SF - P 9:45 pm vs ATH,ATH,FA,8,1292,703,0%,10.2,1,5,6.75,1.41,0,
Jordan LeasureIL60No new player Notes CWS - P 7:40 pm vs CLE,CLE,FA,18,547,704,0%,18.2,0,18,6.27,1.23,0,
Ken WaldichukIL60No new player Notes WSH - P 6:45 pm vs PHI,PHI,FA,5,1304,707,0%,9.1,0,8,6.75,1.5,0,
Aaron BrooksNANo new player Notes TB - P 6:40 pm vs KC,KC,FA,1,1329,710,0%,0.1,0,0,81.0,9.0,0,
Wilber DotelIL15Player Note PIT - P 6:40 pm vs SEA,SEA,FA,9,1237,711,0%,18.1,0,19,5.89,1.36,0,
Tyler SchweitzerNANo new player Notes CWS - P 7:40 pm vs CLE,CLE,FA,4,1313,712,0%,4.0,0,1,9.0,2.0,0,
José FerminPlayer Note LAA - P 9:38 pm vs BAL,BAL,FA,19,716,713,0%,18.1,0,21,4.42,1.69,0,
Eric LauerNew Player Note LAD - P 7:40 pm @ MIN,@ MIN,W (Jun 25),13,485,714,15%,64.2,0,42,4.87,1.24,2,
Chris MurphyNo new player Notes CWS - P 7:40 pm vs CLE,CLE,FA,13,601,715,0%,13.2,1,14,5.27,1.76,0,
Codi HeuerNANo new player Notes CLE - P 7:40 pm @ CWS,@ CWS,FA,7,1332,716,0%,8.0,0,6,5.63,1.88,0,
Slade CecconiPlayer Note CLE - P 7:40 pm @ CWS,@ CWS,No Longer Rowdy,16,1385,718,14%,84.1,0,66,4.48,1.4,4,
Garrett CrochetIL60New Player Note BOS - P  8:40 pm @ COL,@ COL,Stealth Bomber,6,139,719,96%,30.0,0,37,6.3,1.47,3,
Seth JohnsonPlayer Note PHI - P 6:45 pm @ WSH,@ WSH,FA,5,1306,720,0%,5.2,0,6,7.94,1.94,0,
Gus VarlandPlayer Note WSH - P 6:45 pm vs PHI,PHI,FA,31,1264,722,4%,29.2,6,28,5.16,1.69,0,
Bubba ChandlerPlayer Note PIT - P  6:40 pm vs SEA,SEA,Joe Byron,15,160,723,61%,74.0,0,69,4.62,1.38,2,
Cole WinnNo new player Notes TEX - P 6:40 pm @ MIA,@ MIA,FA,27,562,724,0%,23.1,1,26,5.79,1.41,0,
Blake SnellIL60Player Note LAD - P 7:40 pm @ MIN,@ MIN,The Eds,1,209,726,75%,3.0,0,5,12.0,2.67,0,
Jordan RomanoNANo new player Notes COL - P 8:40 pm vs BOS,BOS,FA,11,1453,729,3%,8.0,4,12,10.13,2.13,0,
Janson JunkIL15Player Note MIA - P 6:40 pm vs TEX,TEX,Detroit Fastballs,11,727,731,3%,60.0,0,43,4.8,1.3,2,
Cam SandersNANo new player Notes PIT - P 6:40 pm vs SEA,SEA,FA,6,1410,732,0%,6.0,0,8,9.0,1.83,0,
Justin SlatenNo new player Notes BOS - P 8:40 pm @ COL,@ COL,FA,17,1191,733,1%,14.2,0,19,6.14,1.57,0,
"J.P. FranceNANo new player Notes HOU - P Bot 6, 4-2 @ TOR",@ TOR,FA,3,1317,734,0%,6.2,0,4,8.1,1.65,0,
Albert SuárezNo new player Notes BAL - P 9:38 pm @ LAA,@ LAA,FA,12,615,735,0%,30.2,1,19,4.4,1.43,0,
Christian RoaNANo new player Notes CHC - P 7:10 pm @ NYM,@ NYM,FA,7,1319,736,0%,8.2,0,6,5.19,1.96,0,
Cole HenryNANo new player Notes WSH - P 6:45 pm vs PHI,PHI,FA,10,1401,737,0%,12.0,0,13,6.0,1.67,0,
Corbin MartinNANo new player Notes CHC - P 7:10 pm @ NYM,@ NYM,FA,7,1398,738,0%,5.0,1,4,10.8,2.0,0,
Lyon RichardsonNANo new player Notes MIL - P 7:10 pm @ CIN,@ CIN,FA,2,1440,739,0%,1.2,0,3,27.0,2.4,0,
Joel PayampsNANo new player Notes ATL - P 9:40 pm @ SD,@ SD,FA,12,1432,740,0%,7.2,0,9,8.22,1.7,0,
Wyatt MillsNANo new player Notes LAD - P 7:40 pm @ MIN,@ MIN,FA,4,1339,742,0%,3.1,0,1,8.1,3.0,0,
Jonathan HeasleyIL60No new player Notes TB - P 6:40 pm vs KC,KC,FA,1,1359,743,0%,4.0,0,2,11.25,2.0,0,
Andrew KittredgeNo new player Notes BAL - P 9:38 pm @ LAA,@ LAA,FA,21,563,744,1%,17.2,1,16,6.11,1.47,0,
Will DionNAPlayer Note CLE - P 7:40 pm @ CWS,@ CWS,FA,6,1344,745,0%,11.1,0,13,5.56,1.85,0,
Ben CaspariusIL60No new player Notes LAD - P 7:40 pm @ MIN,@ MIN,FA,5,1255,746,0%,4.2,0,4,9.64,2.14,0,
Taylor RogersNo new player Notes MIN - P 7:40 pm vs LAD,LAD,FA,34,605,749,1%,29.0,2,25,4.97,1.52,0,
"Josh FlemingNANo new player Notes TOR - P Bot 6, 2-4 vs HOU",HOU,FA,1,1355,750,0%,3.0,0,1,12.0,2.67,0,
Luis MeyNANo new player Notes CIN - P 7:10 pm vs MIL,MIL,FA,7,1345,751,0%,8.2,0,14,7.27,1.96,0,
Andrew WantzNANo new player Notes CHC - P 7:10 pm @ NYM,@ NYM,FA,1,1341,752,0%,1.2,0,1,27.0,2.4,0,
Brandon EisertPlayer Note CWS - P 7:40 pm vs CLE,CLE,FA,18,1347,753,0%,18.0,0,21,6.0,1.5,0,
Nick MearsIL15Player Note KC - P 6:40 pm @ TB,@ TB,FA,21,561,754,0%,19.1,0,15,5.12,1.5,0,
Luis GilNA7No new player Notes NYY - P 6:40 pm @ DET,@ DET,FA,4,1195,755,3%,19.1,0,9,6.05,1.34,1,
David SandlinNANo new player Notes CWS - P 7:40 pm vs CLE,CLE,FA,3,1318,756,1%,13.1,0,14,8.1,1.43,1,
Angel ZerpaIL60No new player Notes MIL - P 7:10 pm @ CIN,@ CIN,FA,12,1349,758,0%,12.2,2,8,6.39,1.74,0,
Tyler FergusonNANo new player Notes CHC - P 7:10 pm @ NYM,@ NYM,FA,2,1315,761,0%,2.2,0,4,16.88,2.63,0,
Ryne StanekNo new player Notes STL - P 7:45 pm vs AZ,AZ,FA,34,1334,762,2%,31.0,1,37,5.23,1.52,0,
Osvaldo BidoNANo new player Notes CWS - P 7:40 pm vs CLE,CLE,FA,11,1496,763,0%,18.2,1,11,6.27,1.34,0,
Brandan BidoisNo new player Notes PIT - P 6:40 pm vs SEA,SEA,FA,13,1363,764,0%,14.0,0,17,5.14,1.86,0,
Justin VerlanderIL60Player Note DET - P 6:40 pm vs NYY,NYY,No Longer Rowdy,1,1436,766,4%,3.2,0,1,12.27,2.18,0,
Yunior MarteNANo new player Notes PIT - P 6:40 pm vs SEA,SEA,FA,1,1390,767,0%,0.1,0,1,108.0,12.0,0,
Jonathan HernándezNo new player Notes LAD - P 7:40 pm @ MIN,@ MIN,FA,10,1381,768,0%,15.1,0,13,6.46,1.43,0,
Brandon LeibrandtNANo new player Notes CIN - P 7:10 pm vs MIL,MIL,FA,1,1377,771,0%,6.0,0,3,7.5,2.17,0,
Coleman CrowIL15New Player Note MIL - P 7:10 pm @ CIN,@ CIN,FA,5,1371,772,0%,18.2,0,10,5.3,1.45,0,
Rhett LowderPlayer Note CIN - P 7:10 pm vs MIL,MIL,Cookie Monster ,11,381,773,6%,52.1,0,42,4.82,1.45,3,
Yaramil HiraldoIL60Player Note BAL - P 9:38 pm @ LAA,@ LAA,FA,3,1395,774,0%,1.2,0,2,21.6,4.2,0,
Peyton PalletteNANo new player Notes CWS - P 7:40 pm vs CLE,CLE,FA,16,1303,776,0%,20.2,0,22,5.23,1.6,0,
