Batters,Opp: 7/5,Roster Status,GP*,Rankings_Pre-Season,Rankings_Current,Trends_% Ros,Season (total)_H/AB*,Season (total)_R,Season (total)_HR,Season (total)_RBI,Season (total)_SB,Season (total)_OPS,
Will SmithIL10Player Note LAD - C 7:20 pm vs SD,SD,Trust The Process,52,221,632,80%,43/173,23,6,23,0,0.72,
"Henry BoltePlayer Note ATH - OF Top 3, 0-5 vs MIA",MIA,Joe Byron,47,1557,633,13%,46/154,16,2,14,11,0.756,
"Heliot RamosPlayer Note SF - OF Top 5, 5-4 @ COL",@ COL,Detroit Fastballs,50,235,635,39%,50/188,24,6,23,0,0.757,
"Brady HouseNANo new player Notes WSH - 3B L, 5-11 vs PIT",PIT,FA,44,1524,652,2%,37/163,22,7,25,1,0.681,
"Max MuncyPlayer Note ATH - 2B,3B,SS Top 3, 0-5 vs MIA",MIA,FA,44,1551,667,6%,35/149,22,5,20,3,0.708,
"Matt ShawIL10New Player Note CHC - 3B,OF W, 6-4 vs STL",STL,NY Bombsquad,56,211,671,8%,32/130,20,4,20,4,0.737,
"Lawrence ButlerPlayer Note ATH - OF  Top 3, 0-5 vs MIA",MIA,The Eds,81,273,677,34%,44/220,29,5,22,6,0.593,
"Esmerlyn ValdezPlayer Note PIT - 1B,OF W, 11-5 @ WSH",@ WSH,Tm Mndlsn nd Mtchn,21,1597,682,49%,22/66,13,6,17,0,1.096,
"J.T. RealmutoNew Player Note PHI - C Top 9, 2-5 @ KC",@ KC,FA,62,381,685,16%,42/208,23,6,27,3,0.617,
"Lane ThomasPlayer Note KC - OF Top 9, 5-2 vs PHI",PHI,FA,74,1573,688,1%,43/201,21,5,23,4,0.657,
"Mike YastrzemskiPlayer Note ATL - OF L, 9-10 vs NYM",NYM,FA,79,1396,692,1%,48/212,29,5,22,1,0.664,
"Francisco AlvarezNew Player Note NYM - C W, 10-9 @ ATL",@ ATL,Ranger danger,59,245,698,19%,47/191,19,9,19,0,0.734,
"Eugenio SuárezPlayer Note CIN - 3B W, 3-2 vs BAL",BAL,NY Bombsquad,60,155,702,70%,45/216,19,8,31,0,0.646,
"Ryan McMahonNew Player Note NYY - 3B L, 1-6 vs MIN",MIN,FA,71,1383,706,1%,40/191,21,8,23,3,0.635,
"Endy RodríguezPlayer Note PIT - C,1B W, 11-5 @ WSH",@ WSH,Fightin Farmers,34,1614,709,3%,25/96,15,5,16,2,0.872,
"Derek HillPlayer Note PHI - OF Top 9, 2-5 @ KC",@ KC,FA,67,1546,713,0%,27/113,17,6,13,7,0.711,
"Vaughn GrissomPlayer Note LAA - 1B,2B,3B 9:30 pm vs BOS",BOS,No Longer Rowdy,51,1590,719,1%,39/164,19,4,30,0,0.688,
"Cal RaleighNew Player Note SEA - C Bot 2, 0-0 vs TOR",TOR,No Longer Rowdy,58,105,723,96%,35/217,22,9,27,2,0.573,
"Jacob WilsonIL10Player Note ATH - SS Top 3, 0-5 vs MIA",MIA,Trust The Process,50,143,727,53%,56/202,23,4,26,2,0.696,
"Edouard JulienPlayer Note COL - 1B,2B Top 5, 4-5 vs SF",SF,FA,73,1567,731,0%,45/199,31,2,19,4,0.644,
"Nick LoftinNew Player Note KC - 2B,3B,OF Top 9, 5-2 vs PHI",PHI,FA,52,1583,737,1%,34/151,21,3,25,1,0.699,
"Colt EmersonPlayer Note SEA - 3B,SS Bot 2, 0-0 vs TOR",TOR,Joe Byron,40,362,744,16%,28/129,17,7,19,2,0.723,
"Justin CrawfordPlayer Note PHI - OF Top 9, 2-5 @ KC",@ KC,FA,83,365,745,6%,64/253,26,2,19,10,0.643,
"Ryan KreidlerPlayer Note MIN - SS,OF W, 6-1 @ NYY",@ NYY,FA,46,1599,748,2%,29/113,17,5,23,0,0.779,
"Brandon ValenzuelaNo new player Notes TOR - C,1B Bot 2, 0-0 @ SEA",@ SEA,FA,54,1613,750,4%,36/153,17,7,19,1,0.734,
Jose SiriPlayer Note LAA - OF 9:30 pm vs BOS,BOS,FA,38,1587,756,0%,20/76,18,5,17,1,0.821,
"Carlos CorreaIL60No new player Notes HOU - 3B,SS Bot 6, 2-0 vs TB",TB,FA,32,1171,775,11%,34/122,22,3,16,1,0.787,
"Dane MyersIL10New Player Note CIN - OF W, 3-2 vs BAL",BAL,FA,63,1505,780,0%,30/117,18,3,14,5,0.743,
"Ben WilliamsonPlayer Note TB - 2B,3B,SS Bot 6, 0-2 @ HOU",@ HOU,FA,62,1523,784,0%,43/181,25,2,21,5,0.639,
"Salvador PerezNew Player Note KC - C,1B  Top 9, 5-2 vs PHI",PHI,Rafael Devers,81,153,785,70%,64/318,29,10,30,0,0.568,
"Moisés BallesterosNANo new player Notes CHC - C W, 6-4 vs STL",STL,Trust The Process,59,1582,789,4%,36/156,16,6,23,1,0.688,
"Dylan CrewsPlayer Note WSH - OF L, 5-11 vs PIT",PIT,Joe Byron,40,370,790,35%,35/152,21,5,17,5,0.644,
"Brett BatyPlayer Note NYM - 1B,2B,3B,OF W, 10-9 @ ATL",@ ATL,FA,85,316,804,4%,55/258,28,3,27,3,0.595,
"Tyler StephensonPlayer Note CIN - C W, 3-2 vs BAL",BAL,FA,67,337,806,5%,47/207,18,6,24,0,0.678,
"Edmundo SosaNo new player Notes PHI - 2B,3B,SS,OF Top 9, 2-5 @ KC",@ KC,FA,48,1483,807,1%,30/135,17,5,24,2,0.642,
"Isiah Kiner-FalefaIL10Player Note BOS - 2B,3B,SS 9:30 pm @ LAA",@ LAA,FA,47,1355,810,1%,33/119,19,2,13,7,0.705,
"Jose FernandezNANo new player Notes AZ - 1B,3B,SS Top 5, 1-0 vs MIL",MIL,FA,55,1576,814,2%,42/165,23,3,15,7,0.641,
"Henry DavisPlayer Note PIT - C W, 11-5 @ WSH",@ WSH,FA,56,1648,818,0%,23/150,19,7,22,2,0.574,
"Jackson HollidayNew Player Note BAL - 2B,SS L, 2-3 @ CIN",@ CIN,Joey Spierer's Team,38,319,821,26%,20/107,17,5,14,4,0.652,
"Myles StrawNo new player Notes TOR - OF Bot 2, 0-0 @ SEA",@ SEA,FA,77,1470,822,0%,32/134,25,3,16,2,0.651,
"Wenceel PérezIL60Player Note DET - OF Bot 6, 6-2 @ TEX",@ TEX,FA,53,1498,824,0%,29/161,22,7,17,3,0.594,
"Matt VierlingNo new player Notes DET - OF Bot 6, 6-2 @ TEX",@ TEX,FA,74,1584,825,0%,43/217,20,5,28,3,0.579,
"Adolis GarcíaIL60No new player Notes PHI - OF Top 9, 2-5 @ KC",@ KC,Rafael Devers,67,286,829,13%,45/231,21,7,21,3,0.599,
"Nolan GormanNANo new player Notes STL - 2B,3B L, 4-6 @ CHC",@ CHC,FA,62,1542,830,1%,39/201,19,7,26,0,0.597,
"Miguel AndujarPlayer Note SD - 3B,OF 7:20 pm @ LAD",@ LAD,FA,67,372,833,2%,56/215,19,5,19,2,0.714,
"José TenaPlayer Note WSH - 2B,3B L, 5-11 vs PIT",PIT,FA,66,1579,836,0%,36/159,22,4,18,2,0.673,
"Eli WhiteNew Player Note ATL - OF L, 9-10 vs NYM",NYM,FA,52,1549,846,0%,25/109,14,4,18,4,0.678,
"Joey WiemerNANo new player Notes WSH - OF L, 5-11 vs PIT",PIT,FA,32,1608,847,1%,20/70,16,3,12,1,0.912,
"Tristan GrayNew Player Note MIN - 2B,3B,SS W, 6-1 @ NYY",@ NYY,FA,58,1591,855,0%,36/159,15,4,28,2,0.6,
"Samad TaylorNew Player Note SD - 2B,OF 7:20 pm @ LAD",@ LAD,W (Jul 7),24,173,858,14%,27/82,14,1,11,6,0.817,
"Connor NorbyNAPlayer Note MIA - 1B,3B Top 3, 5-0 @ ATH",@ ATH,FA,65,1539,859,1%,41/200,17,4,16,6,0.638,
"Anthony VolpePlayer Note NYY - SS L, 1-6 vs MIN",MIN,FA,39,291,864,5%,31/126,18,1,13,7,0.673,
"Justin FoscuePlayer Note TEX - 1B,2B Bot 6, 2-6 vs DET",DET,FA,40,1645,866,0%,25/93,12,5,15,0,0.838,
"Nathan LukesPlayer Note TOR - OF Bot 2, 0-0 @ SEA",@ SEA,Detroit Fastballs,55,1265,876,2%,50/175,19,4,17,0,0.733,
"Marcell OzunaNo new player Notes PIT - Util W, 11-5 @ WSH",@ WSH,FA,58,335,877,4%,43/213,17,7,26,0,0.61,
"Blake DunnIL10New Player Note CIN - OF W, 3-2 vs BAL",BAL,FA,38,1594,886,1%,40/142,20,2,7,6,0.722,
"José FermínNew Player Note STL - 2B,3B,OF L, 4-6 @ CHC",@ CHC,FA,52,1588,889,0%,36/133,15,3,16,3,0.717,
Josh LoweNew Player Note LAA - OF 9:30 pm vs BOS,BOS,FA,54,1507,890,2%,33/152,13,7,19,2,0.637,
Alex CallNo new player Notes LAD - OF 7:20 pm vs SD,SD,FA,51,1527,895,0%,28/105,19,1,16,1,0.716,
"David FryPlayer Note CLE - OF Bot 6, 6-7 vs CWS",CWS,FA,59,1604,897,0%,26/123,16,6,13,0,0.712,
Wade MecklerNo new player Notes LAA - OF 9:30 pm vs BOS,BOS,FA,37,1617,899,1%,32/112,16,2,15,2,0.762,
"Miguel RojasPlayer Note LAD - 2B,3B,SS 7:20 pm vs SD",SD,FA,58,1516,903,1%,37/127,15,3,15,0,0.768,
"Luisangel AcuñaNo new player Notes CWS - 2B,SS,OF Bot 6, 7-6 @ CLE",@ CLE,FA,62,1553,904,1%,31/140,16,1,10,14,0.517,
"Miguel AmayaPlayer Note CHC - C W, 6-4 vs STL",STL,FA,49,1585,906,1%,27/121,21,3,13,0,0.699,
"Austin HedgesNew Player Note CLE - C Bot 6, 6-7 vs CWS",CWS,FA,44,1646,909,0%,34/121,16,3,14,1,0.756,
"Steven KwanPlayer Note CLE - OF Bot 6, 6-7 vs CWS",CWS,Rafael Devers,82,343,911,44%,61/279,35,1,14,3,0.601,
Logan O'HoppeDTDNew Player Note LAA - C 9:30 pm vs BOS,BOS,FA,62,386,914,4%,43/189,20,4,23,0,0.623,
"Yohendrick PiñangoPlayer Note TOR - OF Bot 2, 0-0 @ SEA",@ SEA,FA,50,1619,921,1%,40/149,11,5,20,0,0.726,
"Elias DíazPlayer Note TEX - C Bot 6, 2-6 vs DET",DET,FA,31,1569,922,1%,21/73,10,4,16,0,0.837,
"Jorbit VivasNo new player Notes WSH - 2B,3B L, 5-11 vs PIT",PIT,FA,65,1630,923,0%,41/163,21,3,15,0,0.68,
"Alex FreelandPlayer Note LAD - 2B,3B,SS 7:20 pm vs SD",SD,FA,65,1635,924,1%,41/182,23,3,17,1,0.622,
"Jeff McNeilNew Player Note ATH - 2B,OF Top 3, 0-5 vs MIA",MIA,FA,81,1469,927,5%,58/256,23,3,26,1,0.597,
"Jared YoungNew Player Note NYM - 1B,OF W, 10-9 @ ATL",@ ATL,No Longer Rowdy,44,1651,928,1%,26/119,14,6,14,0,0.691,
"Marcelo MayerIL10Player Note BOS - 2B,3B,SS 9:30 pm @ LAA",@ LAA,FA,70,397,929,3%,45/205,19,3,22,3,0.594,
"Joey OrtizPlayer Note MIL - 3B,SS Top 5, 0-1 @ AZ",@ AZ,FA,74,1501,938,1%,38/183,20,2,19,5,0.55,
"Tyler CallihanPlayer Note PIT - 2B,CI,OF W, 11-5 @ WSH",@ WSH,FA,24,1681,940,1%,15/62,10,3,13,1,0.826,
"Dylan BeaversNew Player Note BAL - OF L, 2-3 @ CIN",@ CIN,FA,37,1618,943,1%,26/117,17,2,13,3,0.65,
"Drew GilbertPlayer Note SF - OF Top 5, 5-4 @ COL",@ COL,FA,69,1642,944,0%,38/169,20,3,16,0,0.662,
"Brice MatthewsNo new player Notes HOU - 2B,OF Bot 6, 2-0 vs TB",TB,FA,75,1649,945,1%,37/194,20,6,18,2,0.564,
"Jared TrioloPlayer Note PIT - 1B,2B,3B,SS W, 11-5 @ WSH",@ WSH,FA,56,1538,946,1%,40/168,18,1,14,6,0.627,
"Francisco LindorPlayer Note NYM - SS W, 10-9 @ ATL",@ ATL,No Longer Rowdy,32,122,948,97%,28/125,17,4,9,2,0.691,
"Donovan WaltonPlayer Note LAA - 2B,3B 9:30 pm vs BOS",BOS,FA,31,1643,949,1%,28/90,13,3,12,0,0.836,
"Hyeseong KimNANo new player Notes LAD - 2B,SS,OF 7:20 pm vs SD",SD,FA,43,352,951,2%,30/116,16,1,11,5,0.651,
"Noelvi MartePlayer Note CIN - 3B,OF W, 3-2 vs BAL",BAL,Cash is King,35,308,952,30%,22/109,14,5,9,4,0.632,
Connor WongNo new player Notes BOS - C 9:30 pm @ LAA,@ LAA,FA,37,1615,953,0%,29/101,12,1,14,2,0.767,
"Agustín RamírezNANo new player Notes MIA - C Top 3, 5-0 @ ATH",@ ATH,NY Bombsquad,31,1434,954,33%,26/113,14,2,14,3,0.663,
"Kyle IsbelIL10Player Note KC - OF Top 9, 5-2 vs PHI",PHI,FA,56,1532,955,1%,40/164,16,3,11,5,0.652,
"Kyle HigashiokaNew Player Note TEX - C Bot 6, 2-6 vs DET",DET,FA,48,1554,958,1%,31/146,17,5,15,0,0.635,
"Brenton DoyleIL10Player Note COL - OF Top 5, 4-5 vs SF",SF,Detroit Fastballs,43,278,959,31%,23/111,21,1,4,9,0.549,
"Max SchuemannNew Player Note NYY - 2B,3B,SS,OF L, 1-6 vs MIN",MIN,FA,26,1672,960,0%,9/39,13,2,6,2,0.91,
"Victor Scott IINANo new player Notes STL - OF L, 4-6 @ CHC",@ CHC,FA,61,1525,961,1%,30/155,19,2,9,9,0.534,
Masataka YoshidaPlayer Note BOS - OF 9:30 pm @ LAA,@ LAA,FA,56,1568,963,1%,40/160,19,2,11,2,0.681,
"Nick FortesPlayer Note TB - C Bot 6, 0-2 @ HOU",@ HOU,FA,66,1570,964,1%,50/192,21,2,19,0,0.651,
"Jasson DomínguezPlayer Note NYY - OF L, 1-6 vs MIN",MIN,Cookie Monster ,28,1509,967,13%,23/103,9,4,10,5,0.676,
"Taylor TrammellPlayer Note HOU - OF Bot 6, 2-0 vs TB",TB,FA,40,1640,969,0%,27/105,14,3,11,1,0.732,
"Sung-Mun SongPlayer Note SD - 2B,3B 7:20 pm @ LAD",@ LAD,FA,35,1668,970,0%,15/64,9,1,9,7,0.657,
"Griffin ConineNew Player Note MIA - OF Top 3, 5-0 @ ATH",@ ATH,Ranger danger,23,1656,971,1%,14/60,9,3,10,2,0.785,
"Jacob GonzalezPlayer Note CWS - 1B,2B,SS Bot 6, 7-6 @ CLE",@ CLE,Fightin Farmers,27,1664,975,7%,21/81,11,2,17,0,0.724,
"Brendan DonovanIL10Player Note SEA - 2B,3B,SS,OF Bot 2, 0-0 vs TOR",TOR,Ranger danger,25,1464,976,49%,23/84,9,3,8,1,0.838,
Trevor StoryIL60No new player Notes BOS - SS  9:30 pm @ LAA,@ LAA,Joey Spierer's Team,41,307,977,39%,34/165,16,3,19,4,0.547,
"Alejandro OsunaNew Player Note TEX - OF Bot 6, 2-6 vs DET",DET,FA,55,1610,980,0%,39/155,18,0,15,4,0.618,
Luis CampusanoPlayer Note SD - C 7:20 pm @ LAD,@ LAD,FA,19,1684,981,1%,15/54,9,3,10,0,0.924,
"Christian VázquezNo new player Notes HOU - C Bot 6, 2-0 vs TB",TB,FA,56,1651,983,1%,35/162,17,4,19,0,0.601,
"Bryan TorresPlayer Note STL - 2B,OF L, 4-6 @ CHC",@ CHC,FA,22,1686,984,0%,12/49,9,4,8,1,0.846,
"Hao-Yu LeeNew Player Note DET - 2B,3B Bot 6, 6-2 @ TEX",@ TEX,FA,50,1658,985,1%,35/137,11,4,15,1,0.693,
"MJ MelendezNAPlayer Note NYM - OF W, 10-9 @ ATL",@ ATL,FA,56,1719,988,0%,23/120,14,4,11,0,0.665,
Nick CastellanosNANo new player Notes SD - OF 7:20 pm @ LAD,@ LAD,FA,39,1430,989,1%,22/115,9,4,20,2,0.56,
"Yainer DiazNew Player Note HOU - C Bot 6, 2-0 vs TB",TB,FA,39,121,990,41%,35/149,13,4,19,0,0.623,
"Adrian Del CastilloNew Player Note AZ - C Top 5, 1-0 vs MIL",MIL,FA,51,1653,991,0%,28/151,12,5,23,0,0.555,
"Brandon LockridgeIL10No new player Notes MIL - OF Top 5, 0-1 @ AZ",@ AZ,FA,28,1604,992,0%,25/85,9,0,12,5,0.709,
"James OutmanPlayer Note DET - OF Bot 6, 6-2 @ TEX",@ TEX,FA,67,1685,993,0%,17/109,15,3,11,5,0.527,
"Davis SchneiderNAPlayer Note TOR - 2B,OF Bot 2, 0-0 @ SEA",@ SEA,FA,49,1605,994,0%,15/98,16,3,12,1,0.578,
"Lars NootbaarPlayer Note STL - OF L, 4-6 @ CHC",@ CHC,Trust The Process,24,315,995,5%,24/84,13,2,8,0,0.811,
"Nelson VelázquezPlayer Note STL - OF L, 4-6 @ CHC",@ CHC,FA,18,1682,996,0%,12/42,8,3,9,0,0.928,
"Tommy TroyPlayer Note AZ - 2B,OF Top 5, 1-0 vs MIL",MIL,FA,34,1681,999,1%,23/105,19,3,7,1,0.645,
"Mitch GarverPlayer Note SEA - C Bot 2, 0-0 vs TOR",TOR,FA,39,1628,1000,0%,19/100,15,3,12,0,0.625,
"Giancarlo StantonIL10Player Note NYY - OF L, 1-6 vs MIN",MIN,Joe Byron,24,296,1001,23%,23/90,8,3,14,1,0.724,
"Nicky LopezPlayer Note TEX - 2B,3B,SS Bot 6, 2-6 vs DET",DET,FA,36,1637,1003,1%,32/101,12,1,9,4,0.715,
"Colby ThomasPlayer Note ATH - OF Top 3, 0-5 vs MIA",MIA,The Eds,41,1627,1006,0%,20/88,11,4,11,1,0.659,
"Tyler TolbertNew Player Note KC - MI,OF Top 9, 5-2 vs PHI",PHI,FA,28,1602,1008,0%,9/37,10,0,1,9,0.553,
"Braxton FulfordNo new player Notes COL - C Top 5, 4-5 vs SF",SF,FA,30,1677,1011,0%,9/48,11,1,7,4,0.594,
"Ryan WardNAPlayer Note LAD - 1B,OF 7:20 pm vs SD",SD,FA,20,1703,1013,0%,12/55,8,3,12,0,0.738,
"TJ FriedlNew Player Note CIN - OF W, 3-2 vs BAL",BAL,FA,53,1473,1014,8%,31/171,17,3,11,5,0.543,
"Tommy EdmanDTDNew Player Note LAD - 2B,3B,OF 7:20 pm vs SD",SD,No Longer Rowdy,15,1564,1015,25%,17/48,6,1,9,1,0.967,
"Denzer GuzmanPlayer Note LAA - 3B,SS 9:30 pm vs BOS",BOS,FA,21,1678,1016,3%,21/83,7,3,13,1,0.701,
"Victor Mesa Jr.Player Note TB - OF Bot 6, 0-2 @ HOU",@ HOU,FA,27,1697,1017,0%,13/74,11,3,9,2,0.59,
"Andruw MonasterioPlayer Note BOS - 1B,2B,3B,SS 9:30 pm @ LAA",@ LAA,FA,53,1623,1018,0%,31/141,16,3,12,1,0.624,
"Joey LoperfidoNAPlayer Note HOU - OF Bot 6, 2-0 vs TB",TB,FA,39,1645,1021,0%,22/102,13,1,12,1,0.647,
"Brett SullivanNo new player Notes COL - C Top 5, 4-5 vs SF",SF,FA,44,1695,1022,0%,25/114,9,4,14,0,0.637,
"Luis TorrensNew Player Note NYM - C W, 10-9 @ ATL",@ ATL,FA,54,1633,1024,0%,32/147,17,2,16,0,0.597,
"Joey BartNo new player Notes ATL - C L, 9-10 vs NYM",NYM,FA,28,1618,1025,0%,18/77,11,3,10,0,0.663,
Alek ThomasNANo new player Notes LAD - OF 7:20 pm vs SD,SD,FA,28,1580,1026,0%,17/94,12,2,10,4,0.562,
"Pedro PagésNo new player Notes STL - C L, 4-6 @ CHC",@ CHC,FA,49,1593,1027,0%,30/139,12,4,11,2,0.6,
"Alika WilliamsNew Player Note ATH - 3B,SS Top 3, 0-5 vs MIA",MIA,FA,32,1679,1028,0%,22/77,12,2,8,0,0.768,
"Braden MontgomeryPlayer Note CWS - OF Bot 6, 7-6 @ CLE",@ CLE,Trust The Process,23,232,1030,15%,20/82,12,2,8,0,0.73,
"Zach McKinstryPlayer Note DET - 2B,3B,SS,OF Bot 6, 6-2 @ TEX",@ TEX,FA,64,1504,1031,3%,39/195,17,3,16,1,0.576,
"Luis RengifoNAPlayer Note SD - 2B,3B,OF 7:20 pm @ LAD",@ LAD,FA,57,1545,1034,1%,38/185,19,0,19,3,0.534,
"Drew RomoNo new player Notes CWS - C Bot 6, 7-6 @ CLE",@ CLE,FA,33,1770,1035,0%,14/100,9,5,11,1,0.567,
"Victor BericotoNew Player Note SF - OF Top 5, 5-4 @ COL",@ COL,Trust The Process,21,1705,1036,1%,14/47,5,4,6,0,0.93,
"Ryan WaldschmidtNANo new player Notes AZ - OF Top 5, 1-0 vs MIL",MIL,Ranger danger,33,353,1037,3%,29/112,11,0,8,5,0.671,
"Jordan LawlarIL10Player Note AZ - 3B,MI,OF Top 5, 1-0 vs MIL",MIL,FA,12,391,1038,6%,12/38,6,1,4,4,0.856,
"Harrison BaderIL10Player Note SF - OF Top 5, 5-4 @ COL",@ COL,FA,30,332,1039,2%,18/106,10,5,14,0,0.556,
"Tyrone TaylorPlayer Note NYM - OF W, 10-9 @ ATL",@ ATL,FA,48,1606,1041,0%,22/107,10,4,15,0,0.589,
"Luis Robert Jr.IL60Player Note NYM - OF W, 10-9 @ ATL",@ ATL,Trust The Process,24,226,1042,41%,19/85,10,2,8,2,0.656,
"Jorge BarrosaNo new player Notes AZ - OF Top 5, 1-0 vs MIL",MIL,FA,60,1727,1043,0%,20/109,17,2,10,0,0.607,
"Tyler O'NeillPlayer Note BAL - OF L, 2-3 @ CIN",@ CIN,FA,52,1635,1044,1%,26/139,17,3,9,1,0.584,
"Lourdes Gurriel Jr.New Player Note AZ - OF Top 5, 1-0 vs MIL",MIL,FA,39,1447,1046,2%,32/146,10,2,19,1,0.585,
"Blake PerkinsNo new player Notes MIL - OF Top 5, 0-1 @ AZ",@ AZ,FA,53,1639,1047,0%,14/89,14,1,11,3,0.508,
"Everson PereiraIL7Player Note CWS - OF Bot 6, 7-6 @ CLE",@ CLE,FA,21,1706,1048,0%,16/69,7,3,7,1,0.719,
"Blaze JordanNew Player Note STL - 1B,3B L, 4-6 @ CHC",@ CHC,W (Jul 6),18,1702,1049,6%,15/61,8,1,13,0,0.642,
"Eric HaaseNew Player Note SF - C Top 5, 5-4 @ COL",@ COL,FA,26,1694,1050,0%,12/69,8,4,9,0,0.641,
"Anthony SeiglerPlayer Note BOS - 2B,3B 9:30 pm @ LAA",@ LAA,Detroit Fastballs,15,1712,1051,4%,15/47,9,1,3,1,0.918,
"Danny JansenIL10No new player Notes TEX - C Bot 6, 2-6 vs DET",DET,FA,41,1647,1052,0%,21/123,11,3,12,1,0.586,
"Will BensonNAPlayer Note CIN - OF W, 3-2 vs BAL",BAL,FA,51,1621,1053,0%,18/96,11,3,6,1,0.643,
"Jake MeyersNAPlayer Note HOU - OF Bot 6, 2-0 vs TB",TB,FA,52,1543,1054,0%,28/136,14,3,11,1,0.58,
Roman AnthonyIL60Player Note BOS - OF  9:30 pm @ LAA,@ LAA,Tm Mndlsn nd Mtchn,30,178,1055,79%,25/109,12,1,5,2,0.675,
"Matt WallnerNANo new player Notes MIN - OF W, 6-1 @ NYY",@ NYY,FA,34,1602,1057,1%,20/120,14,4,10,0,0.551,
Yoán MoncadaIL60No new player Notes LAA - 3B 9:30 pm vs BOS,BOS,FA,41,1638,1058,0%,21/111,9,3,10,1,0.605,
"Sterlin ThompsonNANo new player Notes COL - 1B,OF Top 5, 4-5 vs SF",SF,FA,27,1729,1059,0%,16/69,7,2,10,0,0.689,
"Drew MillasPlayer Note WSH - C L, 5-11 vs PIT",PIT,FA,47,1689,1061,0%,23/124,18,2,10,0,0.545,
"Javier BáezIL60No new player Notes DET - 2B,3B,SS,OF Bot 6, 6-2 @ TEX",@ TEX,FA,24,1542,1062,3%,20/78,10,2,6,1,0.677,
"Nick AllenNew Player Note HOU - 2B,SS Bot 6, 2-0 vs TB",TB,FA,42,1665,1063,0%,19/78,14,1,6,1,0.615,
"Kahlil WatsonPlayer Note CLE - OF Bot 6, 6-7 vs CWS",CWS,W (Jul 7),16,1726,1066,3%,13/52,3,1,9,4,0.643,
"Braden ShewmakeIL10Player Note HOU - 2B,3B,SS Bot 6, 2-0 vs TB",TB,FA,28,1713,1067,0%,18/74,8,3,8,0,0.665,
"Adam FrazierIL10Player Note LAA - 2B,OF 9:30 pm vs BOS",BOS,FA,40,1581,1068,0%,17/81,15,1,6,0,0.63,
"Jake FraleyIL10Player Note TB - OF Bot 6, 0-2 @ HOU",@ HOU,FA,28,1626,1069,0%,19/82,6,2,5,3,0.69,
"Jonathan IndiaIL60No new player Notes KC - 2B,3B,OF Top 9, 5-2 vs PHI",PHI,FA,17,1598,1070,1%,8/48,8,2,8,0,0.623,
"Pedro RamirezNo new player Notes CHC - 2B,3B W, 6-4 vs STL",STL,FA,24,1715,1071,1%,14/55,8,1,6,2,0.693,
"Starling MarteNew Player Note KC - OF Top 9, 5-2 vs PHI",PHI,FA,41,1564,1072,0%,27/103,11,1,7,1,0.658,
"Darell HernaizNAPlayer Note ATH - 2B,3B,SS Top 3, 0-5 vs MIA",MIA,FA,47,1662,1073,0%,28/118,12,1,7,3,0.606,
"Weston WilsonPlayer Note SEA - 2B,3B,OF Bot 2, 0-0 vs TOR",TOR,FA,26,1679,1075,0%,11/53,7,1,5,4,0.583,
"Dustin HarrisNAPlayer Note HOU - OF Bot 6, 2-0 vs TB",TB,FA,17,1725,1076,0%,10/43,6,0,5,4,0.635,
Freddy FerminIL10Player Note SD - C 7:20 pm @ LAD,@ LAD,FA,58,1671,1079,0%,21/138,15,3,11,0,0.52,
"Spencer JonesNAPlayer Note NYY - OF L, 1-6 vs MIN",MIN,NY Bombsquad,30,1742,1080,4%,17/73,6,2,7,1,0.687,
"Hunter FeducciaPlayer Note TB - C Bot 6, 0-2 @ HOU",@ HOU,FA,48,1727,1081,0%,25/108,12,1,9,0,0.626,
"Jonah CoxNo new player Notes SF - OF Top 5, 5-4 @ COL",@ COL,FA,23,1738,1082,0%,7/26,5,1,3,3,0.769,
"Andrés ChaparroPlayer Note WSH - 1B L, 5-11 vs PIT",PIT,FA,27,1762,1083,0%,8/48,9,1,7,0,0.614,
"Gabriel AriasPlayer Note CLE - 2B,3B,SS Bot 6, 6-7 vs CWS",CWS,FA,25,1610,1084,0%,15/72,7,3,6,1,0.621,
"Jesus RodriguezNANo new player Notes SF - C Top 5, 5-4 @ COL",@ COL,FA,14,1752,1085,0%,9/39,3,2,7,1,0.687,
"Daniel SusacIL10Player Note SF - C Top 5, 5-4 @ COL",@ COL,FA,37,1705,1086,1%,27/103,5,0,14,1,0.64,
"Ramón UríasIL60No new player Notes STL - 2B,3B L, 4-6 @ CHC",@ CHC,FA,25,1637,1087,0%,9/57,9,2,5,0,0.595,
"Cooper PrattNew Player Note MIL - SS Top 5, 0-1 @ AZ",@ AZ,Ranger danger,17,1761,1088,4%,10/50,5,0,2,6,0.537,
"Edgar QueroNANo new player Notes CWS - C Bot 6, 7-6 @ CLE",@ CLE,FA,55,1641,1089,0%,28/150,12,2,15,1,0.486,
Rodolfo DuránPlayer Note SD - C 7:20 pm @ LAD,@ LAD,FA,32,1810,1091,0%,10/73,8,3,8,0,0.537,
"Jhonny PeredaNANo new player Notes SEA - C Bot 2, 0-0 vs TOR",TOR,FA,19,1724,1092,0%,17/63,8,2,4,0,0.689,
"Jake CronenworthPlayer Note SD - 1B,2B,SS 7:20 pm @ LAD",@ LAD,Rafael Devers,38,1565,1094,5%,20/117,14,2,7,1,0.52,
"Jordan BeckNAPlayer Note COL - OF Top 5, 4-5 vs SF",SF,FA,30,339,1095,3%,15/82,7,1,10,2,0.532,
"Josh SmithPlayer Note TEX - 1B,2B,3B,SS,OF Bot 6, 2-6 vs DET",DET,FA,37,1547,1096,2%,25/109,7,1,8,2,0.604,
"Victor RoblesPlayer Note SEA - OF Bot 2, 0-0 vs TOR",TOR,FA,34,1660,1097,0%,19/79,6,0,4,6,0.552,
"Nate EatonPlayer Note BOS - 3B,OF 9:30 pm @ LAA",@ LAA,FA,12,1703,1098,0%,4/28,3,1,5,2,0.615,
"Jose TrevinoPlayer Note CIN - C W, 3-2 vs BAL",BAL,FA,20,1678,1099,0%,16/60,7,1,8,0,0.646,
"Kyle TeelPlayer Note CWS - C Bot 6, 7-6 @ CLE",@ CLE,FA,10,324,1100,18%,8/36,4,1,8,0,0.65,
"Austin WellsPlayer Note NYY - C L, 1-6 vs MIN",MIN,FA,59,1595,1101,5%,26/173,16,4,10,1,0.48,
"Zach ColeNANo new player Notes HOU - OF Bot 6, 2-0 vs TB",TB,FA,19,1723,1102,0%,8/51,4,3,8,0,0.542,
"Austin SlaterNAPlayer Note TB - OF Bot 6, 0-2 @ HOU",@ HOU,FA,28,1691,1103,0%,15/65,6,0,3,4,0.588,
"Alejandro KirkPlayer Note TOR - C Bot 2, 0-0 @ SEA",@ SEA,FA,20,305,1104,24%,14/70,7,2,7,0,0.574,
"Enrique HernándezIL10No new player Notes LAD - 1B,2B,3B,OF 7:20 pm vs SD",SD,FA,2,1661,1105,1%,4/4,2,1,2,0,3.25,
"Graham PauleyNAPlayer Note MIA - 3B Top 3, 5-0 @ ATH",@ ATH,FA,36,1714,1106,0%,16/91,9,1,11,1,0.516,
"Eric WagamanPlayer Note NYM - 1B,OF W, 10-9 @ ATL",@ ATL,FA,18,1609,1107,0%,6/28,3,2,4,0,0.742,
"Alex JacksonNo new player Notes MIN - C W, 6-1 @ NYY",@ NYY,FA,19,1711,1108,0%,15/50,6,1,4,0,0.747,
"Patrick BaileyPlayer Note CLE - C Bot 6, 6-7 vs CWS",CWS,FA,59,1633,1109,1%,29/162,14,2,12,2,0.487,
"Junior PerezNo new player Notes CWS - OF Bot 6, 7-6 @ CLE",@ CLE,FA,13,1783,1110,0%,4/21,3,2,4,0,0.703,
"Santiago EspinalNAPlayer Note TEX - 2B,3B,OF Bot 6, 2-6 vs DET",DET,FA,36,1676,1111,0%,15/56,5,1,7,0,0.651,
"Rafael Flores Jr.NANo new player Notes PIT - C,1B W, 11-5 @ WSH",@ WSH,FA,2,1805,1112,0%,2/3,2,1,2,0,2.8,
Carlos NarváezPlayer Note BOS - C 9:30 pm @ LAA,@ LAA,FA,50,1613,1113,1%,28/144,15,2,5,1,0.541,
"Nick MadrigalNAPlayer Note TB - 2B Bot 6, 0-2 @ HOU",@ HOU,FA,15,1764,1114,0%,12/44,7,0,2,1,0.68,
"Tyler BlackNANo new player Notes MIL - 1B Top 5, 0-1 @ AZ",@ AZ,FA,9,1758,1115,0%,9/27,2,0,7,0,0.838,
Mickey GasperNAPlayer Note BOS - C 9:30 pm @ LAA,@ LAA,FA,34,1721,1116,0%,26/107,11,0,7,0,0.613,
"Luis UríasPlayer Note TOR - 2B,3B Bot 2, 0-0 @ SEA",@ SEA,FA,9,1686,1117,0%,6/16,2,1,2,0,1.099,
Bryce JohnsonNANo new player Notes SD - OF 7:20 pm @ LAD,@ LAD,FA,32,1701,1118,0%,8/45,5,0,2,5,0.451,
"LaMonte Wade Jr.Player Note HOU - 1B,OF Bot 6, 2-0 vs TB",TB,FA,5,1749,1119,0%,4/15,2,1,4,0,0.913,
"Tim TawaNew Player Note AZ - 1B,2B,OF Top 5, 1-0 vs MIL",MIL,FA,33,1699,1120,0%,11/64,6,1,8,0,0.536,
"Romy GonzalezNew Player Note BOS - 1B,2B 9:30 pm @ LAA",@ LAA,Cash is King,5,1578,1121,2%,6/20,2,1,4,0,0.85,
"Shay WhitcombNANo new player Notes HOU - 2B,3B Bot 6, 2-0 vs TB",TB,FA,17,1827,1122,0%,3/23,2,2,5,0,0.558,
Bryce TeodosioNANo new player Notes LAA - OF 9:30 pm vs BOS,BOS,FA,34,1739,1123,0%,10/47,5,0,2,4,0.515,
"Parker MeadowsIL60Player Note DET - OF Bot 6, 6-2 @ TEX",@ TEX,FA,12,1692,1124,0%,9/36,3,0,2,3,0.641,
"Gabriel Rincones Jr.New Player Note PHI - OF Top 9, 2-5 @ KC",@ KC,FA,15,1879,1125,0%,9/48,5,2,5,0,0.553,
"Rowdy TellezNANew Player Note ATL - 1B L, 9-10 vs NYM",NYM,FA,7,1627,1126,0%,2/10,2,1,4,0,0.773,
"Billy CookNo new player Notes PIT - OF W, 11-5 @ WSH",@ WSH,FA,50,1773,1127,0%,5/31,7,0,0,4,0.355,
"Raynel DelgadoDTDPlayer Note HOU - 2B,3B,SS Bot 6, 2-0 vs TB",TB,FA,16,1789,1128,0%,8/30,3,1,4,0,0.713,
"John RaveNAPlayer Note KC - OF Top 9, 5-2 vs PHI",PHI,FA,9,1747,1129,0%,4/18,3,1,1,0,0.944,
"Connor JoeNANo new player Notes SEA - OF Bot 2, 0-0 vs TOR",TOR,FA,21,1797,1130,0%,7/39,2,1,3,2,0.597,
"Josh RojasNo new player Notes KC - 2B,3B Top 9, 5-2 vs PHI",PHI,FA,9,1761,1131,0%,4/16,2,1,4,0,0.75,
"Justin DeanNo new player Notes CHC - OF W, 6-4 vs STL",STL,FA,8,1803,1132,0%,2/5,3,0,3,0,1.3,
Travis d'ArnaudIL60Player Note LAA - C 9:30 pm vs BOS,BOS,FA,14,1734,1133,0%,7/35,5,1,3,0,0.614,
"Stuart FairchildNAPlayer Note CLE - OF Bot 6, 6-7 vs CWS",CWS,FA,14,1782,1134,0%,3/19,3,0,1,2,0.565,
"Gage WorkmanNANo new player Notes DET - 3B,SS,OF Bot 6, 6-2 @ TEX",@ TEX,FA,16,1822,1135,0%,6/38,3,2,5,0,0.553,
"Austin HaysIL60No new player Notes CWS - OF Bot 6, 7-6 @ CLE",@ CLE,FA,12,1553,1136,1%,10/43,3,1,7,0,0.576,
"Andrew McCutchenNAPlayer Note ATL - OF L, 9-10 vs NYM",NYM,FA,37,1607,1137,0%,14/73,8,1,5,0,0.537,
Sebastián RiveroIL10No new player Notes LAA - C 9:30 pm vs BOS,BOS,FA,24,1762,1138,0%,13/53,5,0,8,0,0.569,
"CJ KayfusNANo new player Notes CLE - 1B,OF Bot 6, 6-7 vs CWS",CWS,FA,9,1732,1139,0%,4/22,4,1,2,0,0.644,
"Thomas SaggeseNANo new player Notes STL - 2B,3B,SS,OF L, 4-6 @ CHC",@ CHC,FA,32,1689,1140,0%,14/76,9,1,4,1,0.52,
"Orlando ArciaNANo new player Notes MIN - 1B,2B,3B,SS W, 6-1 @ NYY",@ NYY,FA,19,1736,1142,0%,13/48,6,1,2,0,0.654,
"Sean KeysNew Player Note TOR - 1B,3B Bot 2, 0-0 @ SEA",@ SEA,FA,5,1816,1143,2%,4/19,3,1,3,0,0.632,
"Joshua Kuroda-GrauerNew Player Note ATH - SS Top 3, 0-5 vs MIA",MIA,Joey Spierer's Team,5,1786,1144,1%,8/18,3,0,1,0,1.03,
"Will WilsonIL60No new player Notes SEA - 2B,3B,SS Bot 2, 0-0 vs TOR",TOR,FA,2,1834,1145,0%,1/5,1,1,2,0,1.133,
"Nick YorkeNANo new player Notes PIT - 2B,3B W, 11-5 @ WSH",@ WSH,FA,27,1779,1146,0%,15/76,6,1,6,0,0.555,
"Zach DezenzoPlayer Note HOU - OF Top 7, 2-0 vs TB",TB,FA,22,1742,1147,0%,10/48,5,1,3,0,0.623,
"Jake RogersNo new player Notes DET - C Bot 6, 6-2 @ TEX",@ TEX,FA,26,1766,1148,0%,11/75,7,1,6,1,0.464,
"Kameron MisnerNo new player Notes KC - OF Top 9, 5-2 vs PHI",PHI,FA,16,1688,1150,0%,9/37,1,0,4,3,0.533,
"Rob RefsnyderIL10Player Note SEA - OF Bot 2, 0-0 vs TOR",TOR,FA,49,1671,1151,0%,14/105,8,3,9,0,0.422,
"Jarred KelenicNAPlayer Note TEX - OF Bot 6, 2-6 vs DET",DET,FA,26,1774,1152,0%,13/61,5,1,4,0,0.599,
"Pavin SmithNew Player Note AZ - 1B Top 5, 1-0 vs MIL",MIL,FA,24,1670,1153,0%,10/66,5,1,6,1,0.472,
"Will WagnerNAPlayer Note SD - 1B,3B 7:20 pm @ LAD",@ LAD,FA,16,1781,1154,0%,9/35,5,0,0,0,0.708,
"Edwin ArroyoPlayer Note CIN - 2B,SS W, 3-2 vs BAL",BAL,Joey Spierer's Team,27,1777,1155,2%,19/78,9,0,4,0,0.576,
