Chase SilsethNo new player Notes LAA - P 10:07 pm vs DET,DET,W (Jul 19),42,505,430,0%,35.2,0,45,3.03,1.4,0,
"Logan VanWeyNANo new player Notes HOU - P Bot 4, 0-1 vs BAL",BAL,W (Jul 19),5,601,431,0%,6.0,0,5,1.5,0.83,0,
"Vince VelasquezNANo new player Notes CHC - P W, 6-2 vs MIN",MIN,W (Jul 19),2,615,432,0%,3.1,0,1,0.0,0.3,0,
Carl Edwards Jr.NANo new player Notes DET - P 10:07 pm @ LAA,@ LAA,W (Jul 19),2,613,433,0%,6.0,0,11,1.5,1.17,0,
Cooper CriswellIL60No new player Notes SEA - P 8:08 pm vs SF,SF,W (Jul 19),26,549,435,0%,30.2,1,23,3.52,1.17,0,
"Ty BlachNANo new player Notes CHC - P W, 6-2 vs MIN",MIN,W (Jul 19),1,688,436,0%,3.0,0,2,0.0,0.33,0,
"Grant AndersonNo new player Notes MIL - P Bot 3, 2-3 vs MIA",MIA,W (Jul 19),38,520,437,0%,42.1,0,32,3.61,1.16,0,
"Eduardo RiveraNew Player Note BOS - P Bot 1, 0-0 vs TB",TB,W (Jul 19),3,619,438,1%,9.1,0,9,2.89,0.96,0,
Kyle FinneganNo new player Notes DET - P 10:07 pm @ LAA,@ LAA,W (Jul 19),40,432,439,6%,42.1,1,32,2.13,1.49,0,
Brad LordIL15Player Note WSH - P 10:05 pm @ ATH,@ ATH,W (Jul 19),27,495,440,1%,58.0,1,52,3.88,1.22,0,
Mark Leiter Jr.No new player Notes ATH - P 10:05 pm vs WSH,WSH,W (Jul 19),35,610,441,0%,32.2,4,36,4.41,1.29,0,
Brock StewartNo new player Notes LAD - P PPD @ NYY,",",W (Jul 19),10,551,442,0%,9.2,0,10,2.79,1.03,0,
"Griffin JaxNew Player Note TB - P Bot 1, 0-0 @ BOS",@ BOS,The Eds,26,345,443,59%,75.0,0,77,4.08,1.27,1,
Elvis AlvaradoNo new player Notes ATH - P 10:05 pm vs WSH,WSH,W (Jul 19),25,499,444,3%,27.1,2,35,4.94,1.13,0,
"Aaron AshbyNo new player Notes MIL - P Bot 3, 2-3 vs MIA",MIA,W (Jul 19),46,341,445,35%,56.2,0,77,3.49,1.43,0,
"Dax FultonPlayer Note MIA - P Bot 3, 3-2 @ MIL",@ MIL,W (Jul 19),3,625,446,0%,7.0,0,6,2.57,0.86,0,
"Brock BurkeNo new player Notes CIN - P Top 8, 3-10 @ COL",@ COL,W (Jul 19),48,468,447,0%,45.2,1,40,2.96,1.38,0,
"Garrett StallingsNAPlayer Note MIL - P Bot 3, 2-3 vs MIA",MIA,W (Jul 19),2,623,448,0%,3.0,0,4,0.0,0.67,0,
"JoJo RomeroIL15New Player Note STL - P Bot 4, 0-5 @ AZ",@ AZ,W (Jul 19),44,469,449,11%,43.0,0,43,3.35,1.3,0,
"Caleb FergusonNo new player Notes CIN - P Top 8, 3-10 @ COL",@ COL,W (Jul 19),19,522,450,0%,18.2,1,17,2.41,1.39,0,
"Alec GamboaNANew Player Note BOS - P Bot 1, 0-0 vs TB",TB,W (Jul 19),5,621,451,0%,8.0,1,5,2.25,1.13,0,
"Ryan FernandezNANo new player Notes STL - P Bot 4, 0-5 @ AZ",@ AZ,W (Jul 19),11,1243,452,0%,13.1,0,20,2.7,1.35,0,
"Julian GarciaNo new player Notes CIN - P Top 8, 3-10 @ COL",@ COL,W (Jul 19),7,627,453,0%,10.1,0,11,3.48,0.97,0,
"Seth LugoNew Player Note KC - P Bot 4, 3-1 vs SD",SD,Rafael Devers,20,256,454,26%,110.2,0,89,4.39,1.41,11,
"Pete FairbanksPlayer Note MIA - P Bot 3, 3-2 @ MIL",@ MIL,Joe Byron,32,149,455,68%,30.0,13,40,6.6,1.43,0,
"AJ BlubaughNo new player Notes HOU - P Bot 4, 0-1 vs BAL",BAL,W (Jul 19),36,442,456,1%,60.0,0,60,3.75,1.27,0,
Erik MillerPlayer Note SF - P 8:08 pm @ SEA,@ SEA,W (Jul 19),32,496,457,1%,27.1,2,38,3.29,1.5,0,
"Albert SuárezNo new player Notes BAL - P Bot 4, 1-0 @ HOU",@ HOU,W (Jul 19),16,506,460,0%,40.2,1,28,3.54,1.2,0,
"Chase DollanderIL60No new player Notes COL - P Top 8, 10-3 vs CIN",CIN,W (Jul 19),10,1459,461,4%,44.0,0,47,3.89,1.3,1,
"Jonathan PintaroNAPlayer Note NYM - P Top 7, 1-6 @ PHI",@ PHI,W (Jul 19),5,690,462,0%,12.1,0,12,5.11,0.73,0,
"Garrett ActonIL60Player Note MIN - P L, 2-6 @ CHC",@ CHC,W (Jul 19),4,586,463,0%,6.2,0,9,2.7,1.05,0,
Dylan SmithNo new player Notes SF - P 8:08 pm @ SEA,@ SEA,W (Jul 19),14,575,464,0%,12.2,1,13,3.55,1.18,0,
"Ben PeoplesNo new player Notes TEX - P Top 4, 3-5 @ ATL",@ ATL,W (Jul 19),4,636,465,0%,4.1,0,3,2.08,0.69,0,
"Caleb ThielbarNo new player Notes CHC - P W, 6-2 vs MIN",MIN,W (Jul 19),32,454,466,2%,27.2,2,35,4.23,1.3,0,
"Josh EknessIL60No new player Notes MIA - P Bot 3, 3-2 @ MIL",@ MIL,W (Jul 19),6,633,467,0%,5.1,1,5,1.69,1.31,0,
"Yacksel RíosNANo new player Notes CHC - P W, 6-2 vs MIN",MIN,W (Jul 19),1,643,468,0%,1.2,0,2,0.0,0.0,0,
"Andrew KittredgePlayer Note BAL - P Bot 4, 1-0 @ HOU",@ HOU,Joe Byron,30,487,470,6%,26.0,3,24,4.15,1.27,0,
Eddy YeanNANo new player Notes WSH - P 10:05 pm @ ATH,@ ATH,W (Jul 19),1,645,471,0%,2.0,0,3,0.0,0.5,0,
Orlando RibaltaNo new player Notes WSH - P 10:05 pm @ ATH,@ ATH,W (Jul 19),30,1329,472,0%,27.2,2,23,3.9,1.23,0,
Yerry De los SantosNANo new player Notes NYY - P PPD vs LAD,",",W (Jul 19),5,718,473,0%,8.2,0,7,1.04,1.38,0,
"Lazaro EstradaNew Player Note TOR - P Bot 6, 1-0 vs CWS",CWS,W (Jul 19),2,719,474,0%,6.1,0,3,2.84,0.79,0,
"Tim HerrinIL15Player Note CLE - P L, 1-7 vs PIT; 7:10 pm vs PIT",PIT,W (Jul 19),41,584,475,1%,32.1,0,27,3.06,1.3,0,
"Eiberson CastellanoNANo new player Notes COL - P Top 8, 10-3 vs CIN",CIN,W (Jul 19),1,642,476,0%,3.0,1,2,0.0,1.33,0,
"Stephen KolekNANew Player Note KC - P Bot 4, 3-1 vs SD",SD,No Longer Rowdy,10,255,477,8%,54.0,0,34,4.5,1.24,5,
"Nick PivettaIL60No new player Notes SD - P Bot 4, 1-3 @ KC",@ KC,Cookie Monster ,4,222,478,72%,16.0,0,24,4.5,1.13,0,
"Shane BazPlayer Note BAL - P Bot 4, 1-0 @ HOU",@ HOU,No Longer Rowdy,19,288,479,53%,111.2,0,99,4.19,1.39,7,
"Tyler SchweitzerPlayer Note CWS - P Bot 6, 0-1 @ TOR",@ TOR,W (Jul 19),7,588,480,0%,13.0,1,7,2.77,1.23,0,
"Javier AssadPlayer Note CHC - P W, 6-2 vs MIN",MIN,Trust The Process,15,459,481,11%,61.1,0,37,4.11,1.13,1,
"Logan AllenNew Player Note CLE - P L, 1-7 vs PIT; 7:10 pm vs PIT",PIT,W (Jul 19),1,1304,482,2%,4.0,0,7,0.0,1.5,0,
"Trevor RogersPlayer Note BAL - P Bot 4, 1-0 @ HOU",@ HOU,Fightin Farmers,17,215,483,76%,90.1,0,69,4.48,1.31,7,
"Tyler PhillipsPlayer Note MIA - P Bot 3, 3-2 @ MIL",@ MIL,Joey Spierer's Team,25,540,484,5%,75.0,2,56,3.48,1.39,2,
"Brad KellerIL15Player Note PHI - P Top 7, 6-1 vs NYM",NYM,W (Jul 19),32,438,485,3%,31.1,3,32,4.02,1.34,0,
"John SchreiberNo new player Notes KC - P Bot 4, 3-1 vs SD",SD,W (Jul 19),41,580,486,0%,37.1,1,28,3.38,1.29,0,
"CJ Van EykNANew Player Note TOR - P Bot 6, 1-0 vs CWS",CWS,W (Jul 19),1,653,487,0%,2.0,0,1,0.0,0.5,0,
"Greg WeissertNo new player Notes BOS - P Bot 1, 0-0 vs TB",TB,W (Jul 19),40,464,488,0%,38.1,0,35,3.76,1.23,0,
Blake TreinenIL15No new player Notes LAD - P PPD @ NYY,",",W (Jul 19),29,518,490,1%,23.0,1,25,3.52,1.35,0,
Sam BachmanNo new player Notes LAA - P 10:07 pm vs DET,DET,W (Jul 19),36,666,493,1%,42.1,1,45,4.04,1.28,0,
"Tanner AndrewsNANo new player Notes TOR - P Bot 6, 1-0 vs CWS",CWS,W (Jul 19),2,655,494,0%,3.0,0,1,0.0,1.0,0,
"Chad DallasNAPlayer Note TOR - P Bot 6, 1-0 vs CWS",CWS,W (Jul 19),2,598,497,0%,4.2,0,3,1.93,1.07,0,
Brooks KriskeIL60No new player Notes ATH - P 10:05 pm vs WSH,WSH,W (Jul 19),2,1311,498,0%,2.2,0,2,0.0,1.13,0,
Sam HentgesNo new player Notes SF - P 8:08 pm @ SEA,@ SEA,W (Jul 19),23,593,499,0%,17.2,0,21,2.04,1.58,0,
Tom CosgrovePlayer Note WSH - P 10:05 pm @ ATH,@ ATH,W (Jul 19),2,694,501,0%,2.0,0,2,0.0,1.0,0,
"Emilio PagánNo new player Notes CIN - P Top 8, 3-10 @ COL",@ COL,Cash is King,18,287,502,66%,16.1,7,16,6.06,1.41,0,
"Gavin HollowellNo new player Notes CHC - P W, 6-2 vs MIN",MIN,W (Jul 19),9,1144,503,0%,10.1,0,11,2.61,1.35,0,
Jason FoleyPlayer Note SF - P 8:08 pm @ SEA,@ SEA,W (Jul 19),1,622,504,0%,1.0,0,1,0.0,0.0,0,
Enmanuel De JesúsNANo new player Notes DET - P 10:07 pm @ LAA,@ LAA,W (Jul 19),22,562,507,0%,31.2,1,31,3.98,1.26,0,
Tyler HoltonNo new player Notes DET - P 10:07 pm @ LAA,@ LAA,W (Jul 19),40,479,508,8%,42.0,0,35,3.21,1.33,0,
Joel PegueroIL60No new player Notes SF - P 8:08 pm @ SEA,@ SEA,W (Jul 19),11,571,509,0%,11.1,0,5,2.38,1.24,0,
"Joe BoyleNANo new player Notes TB - P Bot 1, 0-0 @ BOS",@ BOS,W (Jul 19),3,1292,512,1%,15.2,0,16,5.17,1.09,1,
"Easton McGeeNAPlayer Note KC - P Bot 4, 3-1 vs SD",SD,W (Jul 19),2,1171,513,0%,2.0,0,1,0.0,1.0,0,
"Welinton HerreraIL60No new player Notes COL - P Top 8, 10-3 vs CIN",CIN,W (Jul 19),3,677,514,0%,2.1,0,2,0.0,1.29,0,
"Hoby MilnerIL15New Player Note CHC - P W, 6-2 vs MIN",MIN,W (Jul 19),38,591,516,0%,35.2,1,18,3.53,1.21,0,
Nick DavilaNo new player Notes SEA - P 8:08 pm vs SF,SF,W (Jul 19),18,682,517,0%,20.1,1,9,3.54,1.18,0,
Jake EderNANo new player Notes LAD - P PPD @ NYY,"@ NYY,@ NYY",W (Jul 19),4,649,518,0%,4.0,0,1,2.25,1.0,0,
"Randy DobnakNew Player Note KC - P Bot 4, 3-1 vs SD",SD,W (Jul 19),2,654,519,1%,9.2,0,4,1.86,1.34,0,
Ryan YarbroughNo new player Notes NYY - P PPD vs LAD,"LAD,LAD",W (Jul 19),24,545,521,0%,37.0,2,27,4.14,1.22,0,
"Brian FitzpatrickIL60No new player Notes MIL - P Bot 3, 2-3 vs MIA",MIA,W (Jul 19),5,687,522,0%,6.2,0,5,1.35,1.5,0,
"Zach PopNANo new player Notes MIA - P Bot 3, 3-2 @ MIL",@ MIL,W (Jul 19),7,1327,523,0%,7.1,0,6,3.68,1.09,0,
"Patrick SandovalPlayer Note BOS - P Bot 1, 0-0 vs TB",TB,W (Jul 19),1,1147,524,6%,4.1,0,5,2.08,1.38,0,
"Tyler DavisNAPlayer Note CWS - P Bot 6, 0-1 @ TOR",@ TOR,W (Jul 19),24,573,525,0%,26.1,1,22,4.1,1.22,0,
"Cody PonceIL60No new player Notes TOR - P Bot 6, 1-0 vs CWS",CWS,W (Jul 19),1,695,526,3%,2.1,0,3,3.86,0.86,0,
"Zack KellyNA7No new player Notes BOS - P Bot 1, 0-0 vs TB",TB,W (Jul 19),17,1139,528,0%,16.1,0,14,3.31,1.29,0,
"Matthew BoydPlayer Note CHC - P  W, 6-2 vs MIN",MIN,Ranger danger,9,331,529,70%,46.0,0,47,4.5,1.28,2,
Julian FernándezNANo new player Notes WSH - P 10:05 pm @ ATH,@ ATH,W (Jul 19),3,660,531,0%,4.0,0,3,2.25,1.25,0,
"Guillo ZuñigaNAPlayer Note NYM - P Top 7, 1-6 @ PHI",@ PHI,W (Jul 19),1,704,532,0%,1.0,0,1,0.0,1.0,0,
"Cameron WestonNANo new player Notes BAL - P Bot 4, 1-0 @ HOU",@ HOU,W (Jul 19),1,700,533,0%,1.0,0,1,0.0,1.0,0,
"Tommy NancePlayer Note MIN - P L, 2-6 @ CHC",@ CHC,W (Jul 19),34,503,534,0%,35.1,0,37,3.82,1.3,0,
"Jhony BritoPlayer Note SD - P Bot 4, 1-3 @ KC",@ KC,W (Jul 19),2,709,535,0%,4.1,0,3,4.15,0.92,0,
"Jimmy HergetNo new player Notes COL - P Top 8, 10-3 vs CIN",CIN,W (Jul 19),26,547,536,2%,25.2,3,27,4.21,1.4,0,
"Ryan FeltnerPlayer Note COL - P Top 8, 10-3 vs CIN",CIN,W (Jul 19),13,1326,539,4%,63.1,0,47,4.55,1.29,5,
"Zach EflinIL60No new player Notes BAL - P Bot 4, 1-0 @ HOU",@ HOU,W (Jul 19),1,1310,540,2%,3.2,0,7,2.45,1.64,0,
"Duncan DavittNANo new player Notes CWS - P Bot 6, 0-1 @ TOR",@ TOR,W (Jul 19),1,706,541,0%,1.0,0,0,0.0,1.0,0,
"Jack AndersonNAPlayer Note MIN - P L, 2-6 @ CHC",@ CHC,W (Jul 19),3,711,543,0%,8.0,0,6,3.38,1.25,0,
Spencer BivensNAPlayer Note SF - P 8:08 pm @ SEA,@ SEA,W (Jul 19),2,676,544,0%,2.0,0,3,0.0,2.0,0,
"Tyler ZuberNo new player Notes MIA - P Top 4, 3-2 @ MIL",@ MIL,W (Jul 19),14,1338,545,0%,12.0,1,12,3.75,1.42,0,
Kervin CastroNANo new player Notes NYY - P PPD vs LAD,"LAD,LAD",W (Jul 19),1,717,546,0%,2.0,0,2,4.5,1.0,0,
"Josh WalkerNANo new player Notes BAL - P Bot 4, 1-0 @ HOU",@ HOU,W (Jul 19),5,1203,547,0%,6.0,0,7,4.5,1.17,0,
"Sam MollNo new player Notes CIN - P Top 8, 3-10 @ COL",@ COL,W (Jul 19),44,681,548,0%,38.2,1,43,4.19,1.32,0,
Burch SmithIL60New Player Note DET - P 10:07 pm @ LAA,@ LAA,W (Jul 19),13,730,549,0%,17.0,0,20,3.18,1.47,0,
"Jose CuasNAPlayer Note KC - P Bot 4, 3-1 vs SD",SD,W (Jul 19),5,1161,550,0%,6.1,0,9,2.84,1.58,0,
Paul GervaseNANo new player Notes LAD - P PPD @ NYY,"@ NYY,@ NYY",W (Jul 19),4,1184,551,0%,7.2,0,8,2.35,1.57,0,
"Cole RagansIL60Player Note KC - P  Bot 4, 3-1 vs SD",SD,W (Jul 19),8,605,552,51%,35.1,0,45,4.84,1.42,3,
"Marco RayaIL15Player Note MIN - P L, 2-6 @ CHC",@ CHC,W (Jul 19),3,726,553,0%,6.0,0,4,3.0,1.33,0,
"Tyler SamaniegoNANo new player Notes BOS - P Bot 1, 0-0 vs TB",TB,W (Jul 19),20,729,554,0%,20.1,0,17,2.66,1.48,0,
Brett KerryNANo new player Notes LAA - P 10:07 pm vs DET,DET,W (Jul 19),1,1138,555,0%,4.0,0,2,4.5,1.0,0,
"Joey GerberNANo new player Notes NYM - P Top 7, 1-6 @ PHI",@ PHI,W (Jul 19),7,689,556,0%,8.1,0,8,4.32,1.2,0,
"Anthony NunezNo new player Notes BAL - P Bot 4, 1-0 @ HOU",@ HOU,W (Jul 19),35,589,557,0%,39.1,3,41,4.81,1.27,0,
"Connor BrogdonNANo new player Notes CLE - P L, 1-7 vs PIT; 7:10 pm vs PIT",PIT,W (Jul 19),15,647,558,0%,15.1,1,14,5.28,1.11,0,
"Chase PettyPlayer Note CIN - P Top 8, 3-10 @ COL",@ COL,W (Jul 19),11,1334,559,0%,24.2,1,11,4.38,1.09,0,
"Drew RomNAPlayer Note MIL - P Top 4, 2-3 vs MIA",MIA,W (Jul 19),5,631,560,0%,5.2,0,11,3.18,1.76,0,
"Jose EspadaNANo new player Notes BAL - P Bot 4, 1-0 @ HOU",@ HOU,W (Jul 19),1,675,561,0%,1.0,0,0,0.0,2.0,0,
"Mick AbelIL60Player Note MIN - P L, 2-6 @ CHC",@ CHC,W (Jul 19),4,363,562,7%,20.1,0,23,3.98,1.57,2,
"Tyler UberstineNANo new player Notes BOS - P Bot 1, 0-0 vs TB",TB,W (Jul 19),1,1157,566,0%,2.2,0,2,3.38,1.5,0,
"Andrew AbbottPlayer Note CIN - P Top 8, 3-10 @ COL",@ COL,Detroit Fastballs,20,170,570,63%,105.0,0,84,4.11,1.42,7,
"Zach BrzykcyNAPlayer Note MIA - P Top 4, 3-2 @ MIL",@ MIL,W (Jul 19),1,1424,571,0%,2.0,0,2,4.5,1.5,0,
"Nate PearsonNo new player Notes HOU - P Bot 4, 0-1 vs BAL",BAL,W (Jul 19),16,1331,572,0%,20.0,1,16,3.6,1.4,0,
"Hunter DobbinsNANo new player Notes STL - P Bot 4, 0-5 @ AZ",@ AZ,W (Jul 19),5,628,575,1%,22.1,1,23,4.03,1.39,0,
"Ryne NelsonIL60New Player Note AZ - P Bot 4, 5-0 vs STL",STL,W (Jul 19),15,392,576,30%,83.1,0,62,4.97,1.24,6,
Luis MedinaNo new player Notes ATH - P 10:05 pm vs WSH,WSH,W (Jul 19),31,671,577,0%,42.2,0,51,3.59,1.45,0,
Tayler SaucedoNAPlayer Note LAA - P 10:07 pm vs DET,DET,W (Jul 19),6,1307,578,0%,3.1,0,6,5.4,1.5,0,
"Jesse ScholtensIL15No new player Notes TB - P Bot 1, 0-0 @ BOS",@ BOS,W (Jul 19),9,507,579,1%,37.2,0,30,3.82,1.27,0,
"Kyle LeahyPlayer Note STL - P Bot 4, 0-5 @ AZ",@ AZ,Cookie Monster ,18,466,580,17%,89.1,0,75,3.73,1.41,3,
"Doug NikhazyNANo new player Notes CHC - P W, 6-2 vs MIN",MIN,W (Jul 19),1,1283,581,0%,2.0,0,1,4.5,1.5,0,
"Woo-Suk GoNo new player Notes MIN - P L, 2-6 @ CHC",@ CHC,W (Jul 19),2,1172,582,0%,2.0,0,1,4.5,1.5,0,
Evan PhillipsNo new player Notes LAD - P PPD @ NYY,"@ NYY,@ NYY",W (Jul 19),3,638,584,2%,3.0,0,4,6.0,1.33,0,
"Tyler FergusonNo new player Notes CHC - P W, 6-2 vs MIN",MIN,W (Jul 19),11,728,585,0%,10.2,0,14,6.75,0.94,0,
"Pierce JohnsonNo new player Notes CIN - P Top 8, 3-10 @ COL",@ COL,W (Jul 19),31,519,586,0%,27.2,1,25,4.23,1.3,0,
"Matt FestaNo new player Notes CLE - P L, 1-7 vs PIT; 7:10 pm vs PIT",PIT,W (Jul 19),40,529,587,0%,38.1,1,38,3.99,1.36,0,
"Xzavion CurryNo new player Notes NYM - P Top 7, 1-6 @ PHI",@ PHI,W (Jul 19),2,1214,588,0%,1.1,0,1,6.75,1.5,0,
"Cole SandsIL15Player Note MIN - P L, 2-6 @ CHC",@ CHC,W (Jul 19),12,563,590,1%,11.2,1,11,4.63,1.37,0,
"Danny YoungPlayer Note ATL - P Top 4, 5-3 vs TEX",TEX,W (Jul 19),5,1180,591,0%,4.0,0,4,4.5,1.5,0,
Mason BarnettNAPlayer Note ATH - P 10:05 pm vs WSH,WSH,W (Jul 19),13,1252,592,0%,21.1,2,21,4.64,1.36,0,
"Juan BurgosNANo new player Notes AZ - P Bot 4, 5-0 vs STL",STL,W (Jul 19),1,1269,593,0%,1.1,0,0,6.75,1.5,0,
"Robert GarciaIL60No new player Notes TEX - P Top 4, 3-5 @ ATL",@ ATL,W (Jul 19),9,543,594,4%,8.0,0,6,3.38,1.5,0,
Carson WhisenhuntNAPlayer Note SF - P 8:08 pm @ SEA,@ SEA,W (Jul 19),2,630,595,1%,10.2,0,6,3.38,1.41,0,
"Alek JacobNANo new player Notes SD - P Bot 4, 1-3 @ KC",@ KC,W (Jul 19),3,1223,596,0%,5.0,0,6,5.4,1.4,0,
"Luke LittleNANo new player Notes CHC - P W, 6-2 vs MIN",MIN,W (Jul 19),1,1202,597,0%,1.0,0,1,9.0,2.0,0,
"Bryse WilsonPlayer Note MIL - P Top 4, 2-3 vs MIA",MIA,W (Jul 19),5,1507,598,0%,13.2,0,12,4.61,1.24,0,
"Daniel EspinoNANo new player Notes CLE - P L, 1-7 vs PIT; 7:10 pm vs PIT",PIT,W (Jul 19),5,1188,599,0%,5.0,0,9,5.4,1.6,0,
"Carter BaumlerIL60No new player Notes TEX - P Top 4, 3-5 @ ATL",@ ATL,W (Jul 19),4,1190,600,0%,5.2,0,6,3.18,1.76,0,
"Joe La SorsaNANo new player Notes BOS - P Bot 1, 0-0 vs TB",TB,W (Jul 19),1,1325,601,0%,0.1,0,1,27.0,3.0,0,
"Kendry RojasPlayer Note MIN - P L, 2-6 @ CHC",@ CHC,W (Jul 19),7,665,603,0%,18.1,0,21,2.95,1.64,0,
"Anthony BandaIL15Player Note MIN - P L, 2-6 @ CHC",@ CHC,W (Jul 19),39,525,605,0%,34.1,2,33,4.46,1.34,0,
Chayce McDermottNANo new player Notes LAD - P PPD @ NYY,"@ NYY,@ NYY",W (Jul 19),2,1427,606,0%,2.1,0,1,7.71,1.29,0,
"Alan RangelNew Player Note PHI - P Top 7, 6-1 vs NYM",NYM,W (Jul 19),5,1193,607,0%,19.1,0,22,4.19,1.4,0,
Brenan HanifeeNew Player Note DET - P 10:07 pm @ LAA,@ LAA,W (Jul 19),14,670,608,0%,13.2,0,6,3.29,1.39,0,
"Carlos RodriguezNA15No new player Notes MIL - P Top 4, 2-3 vs MIA",MIA,W (Jul 19),4,1306,609,0%,9.1,0,8,3.86,1.5,0,
"John KleinNANo new player Notes MIN - P L, 2-6 @ CHC",@ CHC,W (Jul 19),3,1201,610,0%,4.1,0,2,4.15,1.62,0,
"Blas CastañoIL15No new player Notes COL - P Top 8, 10-3 vs CIN",CIN,W (Jul 19),10,1168,612,0%,20.2,0,17,3.92,1.35,0,
"Jonah TongNANo new player Notes NYM - P Top 7, 1-6 @ PHI",@ PHI,W (Jul 19),3,1246,613,3%,10.0,0,7,3.6,1.5,0,
"Cody LawerysonNANo new player Notes MIN - P L, 2-6 @ CHC",@ CHC,W (Jul 19),15,612,614,0%,16.2,1,18,4.86,1.38,0,
Gregory SantosNANo new player Notes SF - P 8:08 pm @ SEA,@ SEA,W (Jul 19),3,1268,615,0%,5.0,0,1,3.6,1.6,0,
"Max RajcicIL60No new player Notes STL - P Bot 4, 0-5 @ AZ",@ AZ,W (Jul 19),6,1206,616,0%,9.0,0,8,5.0,1.33,0,
"Jeff CriswellIL15New Player Note COL - P Top 8, 10-3 vs CIN",CIN,W (Jul 19),3,1199,617,0%,4.0,0,3,4.5,1.75,0,
"Hunter GreenePlayer Note CIN - P Top 8, 3-10 @ COL",@ COL,Stealth Bomber,2,393,618,81%,10.1,0,19,6.97,1.45,1,
"Winston SantosNANo new player Notes TEX - P Top 4, 3-5 @ ATL",@ ATL,W (Jul 19),1,1208,619,0%,2.0,0,1,9.0,1.5,0,
"Hunter StrattonNAPlayer Note PIT - P W, 7-1 @ CLE; 7:10 pm @ CLE",@ CLE,W (Jul 19),3,1258,620,0%,3.1,0,3,5.4,1.8,0,
"David SandlinNANo new player Notes CWS - P Bot 6, 0-1 @ TOR",@ TOR,W (Jul 19),4,731,621,1%,19.1,0,20,6.05,1.29,2,
"Anthony MolinaNANo new player Notes ATL - P Top 4, 5-3 vs TEX",TEX,W (Jul 19),3,1476,622,0%,5.0,0,2,5.4,1.4,0,
"Bruce ZimmermannNAPlayer Note STL - P Bot 4, 0-5 @ AZ",@ AZ,W (Jul 19),1,1272,623,0%,5.0,0,2,5.4,1.4,0,
"Matt PushardNANo new player Notes MIA - P Top 4, 3-2 @ MIL",@ MIL,W (Jul 19),6,1215,624,0%,7.0,0,6,5.14,1.43,0,
"Hunter HarveyIL60No new player Notes CHC - P W, 6-2 vs MIN",MIN,W (Jul 19),4,639,625,0%,4.0,0,4,6.75,1.5,0,
"Kai-Wei TengPlayer Note HOU - P Bot 4, 0-1 vs BAL",BAL,W (Jul 19),23,1175,626,2%,64.0,0,63,4.36,1.36,2,
"Cal QuantrillNew Player Note TEX - P Top 4, 3-5 @ ATL",@ ATL,W (Jul 19),20,1513,627,1%,50.1,0,31,3.93,1.29,1,
"Steven CruzNo new player Notes KC - P Bot 4, 3-1 vs SD",SD,W (Jul 19),30,572,628,0%,32.1,0,41,4.73,1.33,0,
"Drey JamesonNo new player Notes AZ - P Bot 4, 5-0 vs STL",STL,W (Jul 19),10,1235,629,0%,15.1,0,11,4.11,1.37,0,
"Casey LeguminaNo new player Notes TB - P Bot 1, 0-0 @ BOS",@ BOS,W (Jul 19),31,1189,631,0%,39.1,0,28,3.89,1.3,0,
Reiver SanmartinNANo new player Notes SF - P 8:08 pm @ SEA,@ SEA,W (Jul 19),2,702,632,0%,3.1,0,4,8.1,1.5,0,
"Jalen BeeksIL15No new player Notes TEX - P Top 4, 3-5 @ ATL",@ ATL,W (Jul 19),29,536,634,0%,26.0,0,21,3.81,1.38,0,
"Taylor RashiNANo new player Notes MIN - P L, 2-6 @ CHC",@ CHC,W (Jul 19),3,1143,635,0%,3.2,0,4,9.82,1.09,0,
Tim HillPlayer Note NYY - P PPD vs LAD,"LAD,LAD",W (Jul 19),43,516,636,1%,36.0,0,17,4.50,1.11,0,
"Tony SantillanIL15New Player Note CIN - P Top 8, 3-10 @ COL",@ COL,W (Jul 19),34,509,637,5%,31.0,5,28,5.23,1.39,0,
"Chris DevenskiIL60No new player Notes PIT - P W, 7-1 @ CLE; 7:10 pm @ CLE",@ CLE,W (Jul 19),3,1152,638,0%,2.1,0,3,7.71,2.14,0,
"Nick RaquetNAPlayer Note BAL - P Bot 4, 1-0 @ HOU",@ HOU,W (Jul 19),4,1205,639,0%,3.2,0,1,7.36,1.36,0,
Luis SeverinoIL60No new player Notes ATH - P 10:05 pm vs WSH,WSH,W (Jul 19),12,1364,640,6%,62.2,0,65,4.16,1.47,3,
Trevor McDonaldPlayer Note SF - P 8:08 pm @ SEA,@ SEA,W (Jul 19),13,1198,641,8%,66.1,0,54,5.02,1.30,5,
"Beck WayNo new player Notes KC - P Bot 4, 3-1 vs SD",SD,W (Jul 19),16,722,642,0%,19.2,0,17,3.20,1.58,0,
"Brycen MautzNANo new player Notes STL - P Bot 4, 0-5 @ AZ",@ AZ,W (Jul 19),1,1226,643,0%,3.0,0,2,6.00,2.00,0,
"Kade StrowdNANo new player Notes AZ - P Bot 4, 5-0 vs STL",STL,W (Jul 19),1,684,644,0%,1.0,0,1,9.00,4.00,0,
"Sean ManaeaPlayer Note NYM - P Top 7, 1-6 @ PHI",@ PHI,W (Jul 19),20,373,645,16%,75.0,0,74,4.56,1.32,2,
"Nolan HoffmanNANo new player Notes PHI - P Top 7, 6-1 vs NYM",NYM,W (Jul 19),3,1295,646,0%,4.2,0,2,3.86,1.93,0,
Carson PalmquistPlayer Note WSH - P 10:05 pm @ ATH,@ ATH,W (Jul 19),5,1530,647,0%,9.1,0,11,5.79,1.39,0,
"Kumar RockerPlayer Note TEX - P Top 4, 3-5 @ ATL",@ ATL,W (Jul 19),18,1488,648,9%,90.0,0,80,4.40,1.37,4,
"Chase SoleskyNANo new player Notes TB - P Bot 1, 0-0 @ BOS",@ BOS,W (Jul 19),1,1232,649,0%,3.0,0,4,6.00,2.33,0,
Joey EstesNANo new player Notes ATH - P 10:05 pm vs WSH,WSH,W (Jul 19),1,1414,650,0%,4.1,0,4,8.31,1.38,0,
"Lucas SimsNANo new player Notes CWS - P Bot 6, 0-1 @ TOR",@ TOR,W (Jul 19),9,1455,651,0%,10.0,0,10,4.50,1.60,0,
Jack FlahertyPlayer Note DET - P 10:07 pm @ LAA,@ LAA,No Longer Rowdy,18,644,652,60%,82.1,0,98,4.48,1.41,2,
"Dietrich EnnsNANo new player Notes BAL - P Bot 4, 1-0 @ HOU",@ HOU,W (Jul 19),13,574,653,0%,16.0,0,13,3.94,1.50,0,
"Jordan HicksNo new player Notes CWS - P Bot 6, 0-1 @ TOR",@ TOR,W (Jul 19),28,1540,654,0%,25.2,1,30,3.86,1.60,0,
Sammy PeraltaNANo new player Notes LAA - P 10:07 pm vs DET,DET,W (Jul 19),2,1367,655,0%,2.2,0,4,10.13,1.88,0,
"Max LazarNo new player Notes PHI - P Top 7, 6-1 vs NYM",NYM,W (Jul 19),5,1320,657,0%,6.1,0,4,7.11,1.26,0,
Andrew AlvarezNo new player Notes WSH - P 10:05 pm @ ATH,@ ATH,W (Jul 19),13,595,658,3%,49.0,1,53,4.04,1.45,0,
"Jonathan CannonNANo new player Notes CWS - P Bot 6, 0-1 @ TOR",@ TOR,W (Jul 19),1,1497,659,0%,0.0,0,0,-,-,0,
"Trevor MartinNANo new player Notes TB - P Bot 1, 0-0 @ BOS",@ BOS,W (Jul 19),6,1247,660,0%,11.1,0,7,3.97,1.59,0,
"Robby SnellingIL60No new player Notes MIA - P Top 4, 3-2 @ MIL",@ MIL,W (Jul 19),1,1248,661,2%,5.0,0,2,5.4,1.8,0,
"Grant WolframNo new player Notes BAL - P Bot 4, 1-0 @ HOU",@ HOU,W (Jul 19),36,1212,662,0%,28.2,0,32,4.71,1.36,0,
"Craig KimbrelNo new player Notes TB - P Bot 1, 0-0 @ BOS",@ BOS,W (Jul 19),28,1209,663,0%,29.0,0,27,4.66,1.31,0,
"Spencer StriderIL60New Player Note ATL - P Top 4, 5-3 vs TEX",TEX,Tm Mndlsn nd Mtchn,8,344,665,55%,39.0,0,46,5.31,1.36,2,
Josh SimpsonNANo new player Notes SEA - P 8:08 pm vs SF,SF,W (Jul 19),4,1420,666,0%,3.0,0,3,9.0,2.0,0,
"Chase LeeNANo new player Notes TOR - P Bot 6, 1-0 vs CWS",CWS,W (Jul 19),3,698,667,0%,3.1,0,1,8.1,1.8,0,
Kyle HurtNAPlayer Note LAD - P PPD @ NYY,"@ NYY,@ NYY",W (Jul 19),32,597,668,0%,31.1,1,38,4.88,1.4,0,
"Kody FunderburkNo new player Notes MIN - P L, 2-6 @ CHC",@ CHC,W (Jul 19),26,1162,669,0%,24.1,1,16,4.07,1.44,0,
Jake BirdNo new player Notes NYY - P PPD vs LAD,"LAD,LAD",W (Jul 19),35,1353,670,0%,30.0,0,30,4.5,1.37,0,
"Emiliano TeodoNANew Player Note TEX - P Top 4, 3-5 @ ATL",@ ATL,W (Jul 19),1,1260,671,0%,1.2,0,1,10.8,3.0,0,
"Justin BruihlNo new player Notes STL - P Bot 4, 0-5 @ AZ",@ AZ,W (Jul 19),42,1374,673,0%,46.2,0,32,3.66,1.37,0,
"Cade PovichNANo new player Notes BAL - P Bot 4, 1-0 @ HOU",@ HOU,W (Jul 19),4,1503,674,0%,19.1,0,12,5.12,1.34,1,
Drew SommersNo new player Notes DET - P 10:07 pm @ LAA,@ LAA,W (Jul 19),17,1366,675,0%,10.0,0,15,5.4,1.7,0,
Landon KnackPlayer Note LAD - P PPD @ NYY,"@ NYY,@ NYY",W (Jul 19),1,1279,676,0%,3.0,0,2,9.0,2.0,0,
"Chase ShugartPlayer Note PHI - P Top 7, 6-1 vs NYM",NYM,W (Jul 19),26,568,677,0%,29.0,0,34,4.97,1.34,0,
"Mitch BrattPlayer Note AZ - P Bot 4, 5-0 vs STL",STL,W (Jul 19),2,1270,678,1%,6.0,0,3,6.0,1.67,0,
Michael RuckerNo new player Notes SEA - P 8:08 pm vs SF,SF,W (Jul 19),13,1275,680,0%,13.2,0,14,5.27,1.46,0,
Hayden JuengerNANo new player Notes ATH - P 10:05 pm vs WSH,WSH,W (Jul 19),2,1274,681,0%,2.0,0,0,13.5,2.0,0,
"Lucas ErcegNew Player Note KC - P Bot 4, 3-1 vs SD",SD,W (Jul 19),39,364,682,17%,38.0,12,27,5.21,1.63,0,
"Connor ThomasNANo new player Notes ATL - P Top 4, 5-3 vs TEX",TEX,W (Jul 19),1,1435,683,0%,3.2,0,2,9.82,1.64,0,
"Robert GasserNew Player Note MIL - P Top 4, 2-3 vs MIA",MIA,Fightin Farmers,9,1239,684,11%,46.1,0,43,5.24,1.27,2,
"JR RitchiePlayer Note ATL - P Top 4, 5-3 vs TEX",TEX,Fightin Farmers,11,1282,686,4%,49.1,1,44,4.38,1.4,1,
Domingo GonzálezNANo new player Notes SEA - P 8:08 pm vs SF,SF,W (Jul 19),5,1287,687,0%,7.2,0,5,4.7,1.83,0,
"Chris MurphyNo new player Notes CWS - P Bot 6, 0-1 @ TOR",@ TOR,W (Jul 19),21,587,688,0%,21.2,1,21,4.57,1.52,0,
"Bennett SousaIL60Player Note HOU - P Bot 4, 0-1 vs BAL",BAL,W (Jul 19),5,556,689,0%,3.1,0,4,8.1,2.4,0,
Mitch FarrisNo new player Notes LAA - P 10:07 pm vs DET,DET,W (Jul 19),19,1402,690,0%,40.1,0,40,3.79,1.49,0,
"Luis GastelumNo new player Notes STL - P Bot 4, 0-5 @ AZ",@ AZ,W (Jul 19),4,1200,691,0%,3.2,0,4,9.82,1.91,0,
"Shawn ArmstrongNo new player Notes CLE - P L, 1-7 vs PIT; 7:10 pm vs PIT",PIT,W (Jul 19),34,448,692,2%,29.2,0,28,4.55,1.38,0,
Wyatt MillsNANo new player Notes LAD - P PPD @ NYY,"@ NYY,@ NYY",W (Jul 19),5,1294,693,0%,4.1,0,4,6.23,2.31,0,
Beau BrieskeNo new player Notes DET - P 10:07 pm @ LAA,@ LAA,W (Jul 19),8,1397,694,0%,9.1,0,8,6.75,1.39,0,
Edwin DíazIL60New Player Note LAD - P PPD @ NYY,"@ NYY,@ NYY",Joey Spierer's Team,7,360,695,83%,6.0,4,10,10.5,2.33,0,
"Andrew NardiIL60No new player Notes MIA - P Top 4, 3-2 @ MIL",@ MIL,W (Jul 19),25,608,696,0%,22.2,0,27,5.16,1.41,0,
"Anthony KayNew Player Note CWS - P Bot 6, 0-1 @ TOR",@ TOR,W (Jul 19),20,618,697,10%,93.1,0,76,4.24,1.37,3,
"Ian HamiltonNANo new player Notes ATL - P Top 4, 5-3 vs TEX",TEX,W (Jul 19),4,1267,698,0%,4.2,0,4,7.71,1.93,0,
"Johan OviedoIL60Player Note BOS - P Bot 1, 0-0 vs TB",TB,W (Jul 19),1,1210,699,0%,3.2,0,3,9.82,1.91,0,
"Mason BlackNANo new player Notes KC - P Bot 4, 3-1 vs SD",SD,W (Jul 19),12,1340,700,0%,17.2,0,15,3.57,1.7,0,
"Joel KuhnelIL15No new player Notes MIL - P Top 4, 2-3 vs MIA",MIA,W (Jul 19),35,1216,701,1%,35.1,6,22,4.84,1.47,0,
"Mitch KellerPlayer Note PIT - P W, 7-1 @ CLE; 7:10 pm @ CLE",@ CLE,W (Jul 19),19,230,702,27%,103.1,0,77,5.14,1.33,9,
Geoff HartliebNANo new player Notes ATH - P 10:05 pm vs WSH,WSH,W (Jul 19),4,1379,703,0%,8.2,0,3,5.19,1.62,0,
"Ethan RobertsIL15New Player Note CHC - P W, 6-2 vs MIN",MIN,W (Jul 19),23,1321,705,0%,25.2,0,17,4.21,1.4,0,
"Rolddy MuñozNANo new player Notes ATL - P Top 4, 5-3 vs TEX",TEX,W (Jul 19),1,1365,706,0%,2.0,0,3,13.5,3.0,0,
"Brady SingerNew Player Note CIN - P Top 8, 3-10 @ COL",@ COL,Stealth Bomber,19,384,707,18%,96.2,0,82,4.56,1.41,6,
"Connor PrielippIL15Player Note MIN - P L, 2-6 @ CHC",@ CHC,Detroit Fastballs,13,1359,708,5%,66.2,0,71,5.0,1.37,3,
