"Justyn-Henry MalloyNANo new player Notes TB - OF W, 4-3 vs WSH",KC,W (Jun 22),-,1772,1632,0%,-/-,-,-,-,-,-,
"Keaton AnthonyNANo new player Notes PHI - 1B W, 6-2 vs NYM",@ WSH,W (Jun 22),-,2012,1633,0%,-/-,-,-,-,-,-,
"Jacob MeltonNA7Player Note TB - OF W, 4-3 vs WSH",KC,W (Jun 22),-,1833,1634,0%,-/-,-,-,-,-,-,
"Ryan CliffordNANo new player Notes NYM - 1B,OF L, 2-6 @ PHI",CHC,W (Jun 22),-,1932,1635,0%,-/-,-,-,-,-,-,
"Alexander AlbertusNANo new player Notes CWS - 3B L, 4-5 @ DET",CLE,W (Jun 22),-,2397,1636,0%,-/-,-,-,-,-,-,
"Kenni GomezNANo new player Notes HOU - OF W, 2-1 vs CLE",@ TOR,W (Jun 22),-,2287,1637,0%,-/-,-,-,-,-,-,
"Gavin CrossNANo new player Notes KC - OF L, 10-12 vs STL",@ TB,W (Jun 22),-,2096,1638,0%,-/-,-,-,-,-,-,
"Cayden WallaceNANo new player Notes WSH - 2B,3B L, 3-4 @ TB",PHI,W (Jun 22),-,1894,1639,0%,-/-,-,-,-,-,-,
"Tyler GentryNANo new player Notes DET - OF W, 5-4 vs CWS",NYY,W (Jun 22),-,2435,1640,0%,-/-,-,-,-,-,-,
"Austin CharlesNANo new player Notes KC - 3B,SS L, 10-12 vs STL",@ TB,W (Jun 22),-,2146,1641,0%,-/-,-,-,-,-,-,
"Payton EelesNANo new player Notes BAL - 2B,SS,OF W, 12-1 @ LAD",@ LAA,W (Jun 22),-,2415,1642,0%,-/-,-,-,-,-,-,
"Charlie CondonNANo new player Notes COL - 1B,OF L, 6-8 vs PIT",BOS,Joe Byron,-,1916,1643,6%,-/-,-,-,-,-,-,
"Randy De JesusNANo new player Notes LAA - OF W, 9-7 @ ATH",BAL,W (Jun 22),-,2169,1644,0%,-/-,-,-,-,-,-,
"Bryce RainerNANo new player Notes DET - SS W, 5-4 vs CWS",NYY,W (Jun 22),-,2051,1645,1%,-/-,-,-,-,-,-,
"Seaver KingNANo new player Notes WSH - SS L, 3-4 @ TB",PHI,W (Jun 22),-,1987,1646,0%,-/-,-,-,-,-,-,
"Caleb LomavitaNANo new player Notes WSH - C L, 3-4 @ TB",PHI,W (Jun 22),-,2052,1647,0%,-/-,-,-,-,-,-,
"Billy AmickNANo new player Notes MIN - 1B,3B W, 4-2 @ AZ",LAD,W (Jun 22),-,1923,1648,0%,-/-,-,-,-,-,-,
"Tommy WhiteNANo new player Notes ATH - 3B L, 7-9 vs LAA",,W (Jun 22),-,2413,1649,0%,-/-,-,-,-,-,-,
"Slade CaldwellNANo new player Notes AZ - OF L, 2-4 vs MIN",@ STL,W (Jun 22),-,2142,1650,0%,-/-,-,-,-,-,-,
"Vance HoneycuttNANo new player Notes BAL - OF W, 12-1 @ LAD",@ LAA,W (Jun 22),-,1978,1651,0%,-/-,-,-,-,-,-,
"Dakota JordanNANo new player Notes SF - OF L, 1-2 @ MIA",,W (Jun 22),-,2430,1652,0%,-/-,-,-,-,-,-,
"Cavan BiggioNANo new player Notes HOU - 1B,OF W, 2-1 vs CLE",@ TOR,W (Jun 22),-,1841,1653,0%,-/-,-,-,-,-,-,
"Walker JanekNANo new player Notes HOU - C W, 2-1 vs CLE",@ TOR,W (Jun 22),-,2280,1654,0%,-/-,-,-,-,-,-,
"Theo GillenNANo new player Notes TB - OF W, 4-3 vs WSH",KC,W (Jun 22),-,2203,1655,1%,-/-,-,-,-,-,-,
"Rayne DonconNANo new player Notes MIN - 3B W, 4-2 @ AZ",LAD,W (Jun 22),-,2244,1656,0%,-/-,-,-,-,-,-,
"Logan WagnerNANo new player Notes LAD - 2B,3B L, 1-12 vs BAL",@ MIN,W (Jun 22),-,1930,1657,0%,-/-,-,-,-,-,-,
"Kellon LindseyNANo new player Notes LAD - SS L, 1-12 vs BAL",@ MIN,W (Jun 22),-,2279,1658,0%,-/-,-,-,-,-,-,
"Kaelen CulpepperNANo new player Notes MIN - SS W, 4-2 @ AZ",LAD,The Eds,-,2097,1659,4%,-/-,-,-,-,-,-,
"Malcolm MooreNANo new player Notes TEX - C W, 4-3 vs SD",@ MIA,W (Jun 22),-,2116,1660,0%,-/-,-,-,-,-,-,
"Wyatt SanfordNANo new player Notes PIT - 2B,SS W, 8-6 @ COL",,W (Jun 22),-,1901,1661,0%,-/-,-,-,-,-,-,
"Ronald HernandezNANo new player Notes NYM - C,1B L, 2-6 @ PHI",CHC,W (Jun 22),-,2159,1662,0%,-/-,-,-,-,-,-,
"Griff O'FerrallNANo new player Notes BAL - 2B,SS W, 12-1 @ LAD",@ LAA,W (Jun 22),-,2205,1663,0%,-/-,-,-,-,-,-,
"Jacob CozartNANo new player Notes CLE - C L, 1-2 @ HOU",@ CWS,W (Jun 22),-,2100,1664,0%,-/-,-,-,-,-,-,
"Carter JohnsonNANo new player Notes MIA - 2B,SS W, 2-1 vs SF",TEX,W (Jun 22),-,1972,1665,0%,-/-,-,-,-,-,-,
"Luis LaraNANo new player Notes MIL - OF W, 9-4 @ ATL",@ CIN,Tm Mndlsn nd Mtchn,-,2401,1666,3%,-/-,-,-,-,-,-,
"Tyson LewisNANo new player Notes CIN - SS W, 4-1 @ NYY",MIL,W (Jun 22),-,2363,1667,0%,-/-,-,-,-,-,-,
"Hendry MendezNA7Player Note MIN - OF W, 4-2 @ AZ",LAD,Tm Mndlsn nd Mtchn,-,2246,1668,0%,-/-,-,-,-,-,-,
"Kevin BazzellNANo new player Notes WSH - C L, 3-4 @ TB",PHI,W (Jun 22),-,2154,1669,0%,-/-,-,-,-,-,-,
"Dante NoriNANo new player Notes PHI - OF W, 6-2 vs NYM",@ WSH,W (Jun 22),-,2044,1670,0%,-/-,-,-,-,-,-,
"PJ MorlandoNANo new player Notes MIA - OF W, 2-1 vs SF",TEX,W (Jun 22),-,2192,1671,0%,-/-,-,-,-,-,-,
"Jared ThomasNANo new player Notes COL - OF L, 6-8 vs PIT",BOS,W (Jun 22),-,1948,1672,0%,-/-,-,-,-,-,-,
"Braylon PayneNANo new player Notes MIL - OF W, 9-4 @ ATL",@ CIN,W (Jun 22),-,2283,1673,0%,-/-,-,-,-,-,-,
"Tanner SchobelNANo new player Notes MIN - 3B,SS W, 4-2 @ AZ",LAD,W (Jun 22),-,2333,1674,0%,-/-,-,-,-,-,-,
"Yasser MercedesNANo new player Notes MIN - OF W, 4-2 @ AZ",LAD,W (Jun 22),-,1918,1675,0%,-/-,-,-,-,-,-,
"Mike SirotaNANo new player Notes LAD - OF L, 1-12 vs BAL",@ MIN,Joe Byron,-,2249,1676,1%,-/-,-,-,-,-,-,
"Danny De AndradeNANo new player Notes MIN - 2B,3B,SS W, 4-2 @ AZ",LAD,W (Jun 22),-,2080,1677,0%,-/-,-,-,-,-,-,
"Caleb BonemerNANo new player Notes CWS - 3B,SS L, 4-5 @ DET",CLE,W (Jun 22),-,2338,1678,1%,-/-,-,-,-,-,-,
"Kavares TearsNANo new player Notes SD - OF L, 3-4 @ TEX",ATL,W (Jun 22),-,2060,1679,0%,-/-,-,-,-,-,-,
"Kevin ParadaNANo new player Notes NYM - C L, 2-6 @ PHI",CHC,W (Jun 22),-,2212,1680,0%,-/-,-,-,-,-,-,
"Jett WilliamsNANo new player Notes MIL - 2B,SS,OF W, 9-4 @ ATL",@ CIN,Detroit Fastballs,-,2319,1681,2%,-/-,-,-,-,-,-,
"Blake BurkeNANo new player Notes MIL - 1B W, 9-4 @ ATL",@ CIN,W (Jun 22),-,1890,1682,0%,-/-,-,-,-,-,-,
"Peyton StovallNANo new player Notes CIN - 1B,2B W, 4-1 @ NYY",MIL,W (Jun 22),-,1990,1683,0%,-/-,-,-,-,-,-,
"Ethan AndersonNANo new player Notes BAL - C,1B W, 12-1 @ LAD",@ LAA,W (Jun 22),-,2135,1684,0%,-/-,-,-,-,-,-,
"Jacob ReimerNANo new player Notes NYM - 1B,3B L, 2-6 @ PHI",CHC,W (Jun 22),-,2281,1685,0%,-/-,-,-,-,-,-,
"Gage MillerNANo new player Notes MIA - 2B,3B W, 2-1 vs SF",TEX,W (Jun 22),-,2036,1686,0%,-/-,-,-,-,-,-,
"Kyle DeBargeNANo new player Notes MIN - 2B,SS,OF W, 4-2 @ AZ",LAD,W (Jun 22),-,2288,1687,0%,-/-,-,-,-,-,-,
"Roderick AriasNANo new player Notes NYY - 3B,SS L, 1-4 vs CIN",@ DET,W (Jun 22),-,1910,1688,0%,-/-,-,-,-,-,-,
"Dylan DreilingNANo new player Notes TEX - OF W, 4-3 vs SD",@ MIA,W (Jun 22),-,2379,1689,0%,-/-,-,-,-,-,-,
"Carson DeMartiniNANo new player Notes PHI - 3B,SS W, 6-2 vs NYM",@ WSH,W (Jun 22),-,2037,1690,0%,-/-,-,-,-,-,-,
"Griffin BurkholderNANo new player Notes PHI - OF W, 6-2 vs NYM",@ WSH,W (Jun 22),-,2088,1691,0%,-/-,-,-,-,-,-,
Ty SouthiseneNANo new player Notes CHC - 2B PPD vs TOR,@ NYM,W (Jun 22),-,2381,1692,0%,-/-,-,-,-,-,-,
"Cooper BowmanNANo new player Notes TB - 1B,2B,OF W, 4-3 vs WSH",KC,W (Jun 22),-,2362,1693,0%,-/-,-,-,-,-,-,
"Austin OvernNANo new player Notes TB - OF W, 4-3 vs WSH",KC,W (Jun 22),-,1943,1694,0%,-/-,-,-,-,-,-,
"Jon BertiNANo new player Notes CHC - 2B,3B PPD vs TOR",@ NYM,W (Jun 22),-,1774,1695,0%,-/-,-,-,-,-,-,
"William BergollaNANo new player Notes CWS - 2B,SS L, 4-5 @ DET",CLE,W (Jun 22),-,2394,1696,0%,-/-,-,-,-,-,-,
"JD DixNANo new player Notes AZ - 2B L, 2-4 vs MIN",@ STL,W (Jun 22),-,2031,1697,0%,-/-,-,-,-,-,-,
Cole MathisNANo new player Notes CHC - 3B PPD vs TOR,@ NYM,W (Jun 22),-,2144,1698,0%,-/-,-,-,-,-,-,
"Jared JonesNANo new player Notes PIT - 1B W, 8-6 @ COL",,W (Jun 22),-,1911,1699,0%,-/-,-,-,-,-,-,
"Caleb RickettsNANo new player Notes PHI - C W, 6-2 vs NYM",@ WSH,W (Jun 22),-,2092,1700,0%,-/-,-,-,-,-,-,
"Termarr JohnsonNANo new player Notes PIT - 2B W, 8-6 @ COL",,W (Jun 22),-,2318,1701,0%,-/-,-,-,-,-,-,
"Kale FountainNANo new player Notes SD - 1B,3B L, 3-4 @ TEX",ATL,W (Jun 22),-,1934,1702,0%,-/-,-,-,-,-,-,
"Joshua Kuroda-GrauerNANo new player Notes ATH - SS L, 7-9 vs LAA",,W (Jun 22),-,2166,1703,0%,-/-,-,-,-,-,-,
"Chase HarlanNANo new player Notes LAD - 3B L, 1-12 vs BAL",@ MIN,W (Jun 22),-,2016,1704,0%,-/-,-,-,-,-,-,
"Shalin PolancoNANo new player Notes PIT - OF W, 8-6 @ COL",,W (Jun 22),-,2263,1705,0%,-/-,-,-,-,-,-,
"John SpikermanNANo new player Notes PHI - OF W, 6-2 vs NYM",@ WSH,W (Jun 22),-,2034,1706,0%,-/-,-,-,-,-,-,
"Casey SauckeNANo new player Notes CWS - Util L, 4-5 @ DET",CLE,W (Jun 22),-,2073,1707,0%,-/-,-,-,-,-,-,
"Robert HipwellNANo new player Notes SF - 1B,3B L, 1-2 @ MIA",,W (Jun 22),-,1953,1708,0%,-/-,-,-,-,-,-,
"Cole MessinaNANo new player Notes COL - C L, 6-8 vs PIT",BOS,W (Jun 22),-,1902,1709,0%,-/-,-,-,-,-,-,
"Lamar King Jr.NANo new player Notes SD - C,1B L, 3-4 @ TEX",ATL,W (Jun 22),-,2007,1710,0%,-/-,-,-,-,-,-,
"Lazaro MontesNANo new player Notes SEA - OF W, 3-1 vs BOS",,Trust The Process,-,2190,1711,1%,-/-,-,-,-,-,-,
"Victor LabradaNANo new player Notes SEA - OF W, 3-1 vs BOS",,W (Jun 22),-,1942,1712,0%,-/-,-,-,-,-,-,
"Grant McCrayNA7No new player Notes SF - OF L, 1-2 @ MIA",,W (Jun 22),-,1875,1713,0%,-/-,-,-,-,-,-,
"Luke DickersonNANo new player Notes WSH - 2B,SS L, 3-4 @ TB",PHI,W (Jun 22),-,2158,1714,0%,-/-,-,-,-,-,-,
"Nick McLainNANo new player Notes CWS - OF L, 4-5 @ DET",CLE,W (Jun 22),-,2324,1715,0%,-/-,-,-,-,-,-,
"Jonathan MejiaNANo new player Notes STL - 2B,SS W, 12-10 @ KC",AZ,W (Jun 22),-,2128,1716,0%,-/-,-,-,-,-,-,
"Khadim DiawNANo new player Notes MIN - C,OF W, 4-2 @ AZ",LAD,W (Jun 22),-,2049,1717,0%,-/-,-,-,-,-,-,
"Leonardo BernalNANo new player Notes STL - C W, 12-10 @ KC",AZ,W (Jun 22),-,2035,1718,0%,-/-,-,-,-,-,-,
"Won-Bin ChoNANo new player Notes STL - OF W, 12-10 @ KC",AZ,W (Jun 22),-,2170,1719,0%,-/-,-,-,-,-,-,
"Casey CookNANo new player Notes TEX - 2B,SS W, 4-3 vs SD",@ MIA,W (Jun 22),-,2067,1720,0%,-/-,-,-,-,-,-,
"Josh CaronNANo new player Notes SEA - C W, 3-1 vs BOS",,W (Jun 22),-,2416,1721,0%,-/-,-,-,-,-,-,
"Ryan CamposNANo new player Notes STL - C W, 12-10 @ KC",AZ,W (Jun 22),-,2112,1722,0%,-/-,-,-,-,-,-,
"Xavier IsaacNANo new player Notes TB - Util W, 4-3 vs WSH",KC,W (Jun 22),-,1962,1723,0%,-/-,-,-,-,-,-,
"Émilien PitreNANo new player Notes TB - 2B,SS W, 4-3 vs WSH",KC,W (Jun 22),-,2250,1724,0%,-/-,-,-,-,-,-,
"Dom KeeganNANo new player Notes TB - C W, 4-3 vs WSH",KC,W (Jun 22),-,2326,1725,0%,-/-,-,-,-,-,-,
"Drew WatersNANo new player Notes KC - OF L, 10-12 vs STL",@ TB,W (Jun 22),-,1753,1726,0%,-/-,-,-,-,-,-,
"Anthony GutierrezNANo new player Notes TEX - OF W, 4-3 vs SD",@ MIA,W (Jun 22),-,2095,1727,0%,-/-,-,-,-,-,-,
"Nick MontgomeryNANo new player Notes ATL - C L, 4-9 vs MIL",@ SD,W (Jun 22),-,2217,1728,0%,-/-,-,-,-,-,-,
"Triston CasasIL60No new player Notes BOS - 1B L, 1-3 @ SEA",@ COL,W (Jun 22),-,1808,1729,1%,-/-,-,-,-,-,-,
"Gleider FiguereoNANo new player Notes TEX - 3B W, 4-3 vs SD",@ MIA,W (Jun 22),-,2151,1730,0%,-/-,-,-,-,-,-,
"Carter MathisonNANo new player Notes PHI - OF W, 6-2 vs NYM",@ WSH,W (Jun 22),-,1912,1731,0%,-/-,-,-,-,-,-,
"Sam PetersenNANo new player Notes WSH - OF L, 3-4 @ TB",PHI,W (Jun 22),-,2269,1732,0%,-/-,-,-,-,-,-,
"Michael SianiPlayer Note BAL - OF W, 12-1 @ LAD",@ LAA,W (Jun 22),-,1819,1733,0%,-/-,-,-,-,-,-,
"Josh KasevichNANo new player Notes TOR - 3B,SS PPD @ CHC",HOU,W (Jun 22),-,2284,1734,0%,-/-,-,-,-,-,-,
"Sean KeysNANo new player Notes TOR - 1B,3B PPD @ CHC",HOU,W (Jun 22),-,2134,1735,0%,-/-,-,-,-,-,-,
"Jakob ChristianNANo new player Notes SF - 1B,OF L, 1-2 @ MIA",,W (Jun 22),-,2405,1736,0%,-/-,-,-,-,-,-,
"Devin Fitz-GeraldNANo new player Notes WSH - Util L, 3-4 @ TB",PHI,W (Jun 22),-,1984,1737,0%,-/-,-,-,-,-,-,
"Ivan LucianoNANo new player Notes AZ - C L, 2-4 vs MIN",@ STL,W (Jun 22),-,2207,1738,0%,-/-,-,-,-,-,-,
"Zach EhrhardNANo new player Notes LAD - OF L, 1-12 vs BAL",@ MIN,W (Jun 22),-,2098,1739,0%,-/-,-,-,-,-,-,
"Alan RodenNAPlayer Note MIN - OF W, 4-2 @ AZ",LAD,W (Jun 22),-,1829,1740,0%,-/-,-,-,-,-,-,
"Bobby BoserNANo new player Notes ATH - SS L, 7-9 vs LAA",,W (Jun 22),-,2355,1741,0%,-/-,-,-,-,-,-,
"Nathan FlewellingNANo new player Notes TB - C W, 4-3 vs WSH",KC,W (Jun 22),-,2243,1742,0%,-/-,-,-,-,-,-,
"Fenwick TrimbleNANo new player Notes MIA - OF W, 2-1 vs SF",TEX,W (Jun 22),-,2348,1743,0%,-/-,-,-,-,-,-,
"Tirso OrnelasNANo new player Notes SD - OF L, 3-4 @ TEX",ATL,W (Jun 22),-,2456,1744,0%,-/-,-,-,-,-,-,
"Cobb HightowerNANo new player Notes BAL - 2B,SS W, 12-1 @ LAD",@ LAA,W (Jun 22),-,2213,1745,0%,-/-,-,-,-,-,-,
"Ronny CruzNANo new player Notes WSH - SS L, 3-4 @ TB",PHI,W (Jun 22),-,2305,1746,0%,-/-,-,-,-,-,-,
"Elijah GreenNANo new player Notes WSH - OF L, 3-4 @ TB",PHI,W (Jun 22),-,2298,1747,0%,-/-,-,-,-,-,-,
"Cristhian VaqueroNANo new player Notes WSH - OF L, 3-4 @ TB",PHI,W (Jun 22),-,2181,1748,0%,-/-,-,-,-,-,-,
"Marco LucianoNANo new player Notes NYY - 2B,SS L, 1-4 vs CIN",@ DET,W (Jun 22),-,1883,1749,0%,-/-,-,-,-,-,-,
"Andrew KniznerNAPlayer Note SEA - C W, 3-1 vs BOS",,W (Jun 22),-,1832,1750,0%,-/-,-,-,-,-,-,
"Ivan MelendezNANo new player Notes AZ - 1B L, 2-4 vs MIN",@ STL,W (Jun 22),-,2141,1751,0%,-/-,-,-,-,-,-,
"Ruben SantanaNANo new player Notes AZ - 1B,3B L, 2-4 vs MIN",@ STL,W (Jun 22),-,2262,1752,0%,-/-,-,-,-,-,-,
"Orelvis MartinezNANo new player Notes WSH - 2B,3B L, 3-4 @ TB",PHI,W (Jun 22),-,1886,1753,0%,-/-,-,-,-,-,-,
"Andrew PintarNANo new player Notes MIA - OF W, 2-1 vs SF",TEX,W (Jun 22),-,2104,1754,0%,-/-,-,-,-,-,-,
"Tyler LocklearNANo new player Notes AZ - 1B L, 2-4 vs MIN",@ STL,W (Jun 22),-,1839,1755,0%,-/-,-,-,-,-,-,
"Michael ArroyoNANo new player Notes SEA - 2B W, 3-1 vs BOS",,W (Jun 22),-,2373,1756,0%,-/-,-,-,-,-,-,
"Carlos JimenezNANo new player Notes SEA - OF W, 3-1 vs BOS",,W (Jun 22),-,2393,1757,0%,-/-,-,-,-,-,-,
"Gabriel RodriguezNANo new player Notes CLE - 3B,SS L, 1-2 @ HOU",@ CWS,W (Jun 22),-,2350,1758,0%,-/-,-,-,-,-,-,
"Brendan TuninkNANo new player Notes LAD - OF L, 1-12 vs BAL",@ MIN,W (Jun 22),-,1896,1759,0%,-/-,-,-,-,-,-,
"Jacob BerryNANo new player Notes MIA - 2B,3B,OF W, 2-1 vs SF",TEX,W (Jun 22),-,2369,1760,0%,-/-,-,-,-,-,-,
"DJ LaytonNANo new player Notes BAL - 2B,SS W, 12-1 @ LAD",@ LAA,W (Jun 22),-,2109,1761,0%,-/-,-,-,-,-,-,
"Carlos RodríguezNANo new player Notes SD - OF L, 3-4 @ TEX",ATL,W (Jun 22),-,2030,1762,0%,-/-,-,-,-,-,-,
"Caden PowellNANo new player Notes HOU - 3B,SS W, 2-1 vs CLE",@ TOR,W (Jun 22),-,1945,1763,0%,-/-,-,-,-,-,-,
"Joseph SullivanNANo new player Notes HOU - OF W, 2-1 vs CLE",@ TOR,W (Jun 22),-,2428,1764,0%,-/-,-,-,-,-,-,
"Marco VargasNANo new player Notes NYM - 2B,SS L, 2-6 @ PHI",CHC,W (Jun 22),-,2231,1765,0%,-/-,-,-,-,-,-,
"Max WagnerNANo new player Notes BAL - 2B,3B W, 12-1 @ LAD",@ LAA,W (Jun 22),-,2427,1766,0%,-/-,-,-,-,-,-,
"Aron EstradaNANo new player Notes BAL - 2B,OF W, 12-1 @ LAD",@ LAA,W (Jun 22),-,2156,1767,0%,-/-,-,-,-,-,-,
"Braylin TaveraNANo new player Notes BAL - OF W, 12-1 @ LAD",@ LAA,W (Jun 22),-,2062,1768,0%,-/-,-,-,-,-,-,
"Leandro AriasNANo new player Notes BAL - 2B,3B,SS W, 12-1 @ LAD",@ LAA,W (Jun 22),-,2347,1769,0%,-/-,-,-,-,-,-,
"Coco MontesNANo new player Notes TB - 2B,3B,OF W, 4-3 vs WSH",KC,W (Jun 22),-,2433,1770,0%,-/-,-,-,-,-,-,
"Axiel PlazNANo new player Notes PIT - C,1B W, 8-6 @ COL",,W (Jun 22),-,2272,1771,0%,-/-,-,-,-,-,-,
"Tony Blanco Jr.NANo new player Notes PIT - 1B W, 8-6 @ COL",,W (Jun 22),-,1950,1772,0%,-/-,-,-,-,-,-,
"Yordany De Los SantosNANo new player Notes PIT - 2B,3B,SS W, 8-6 @ COL",,W (Jun 22),-,2218,1773,0%,-/-,-,-,-,-,-,
"Brennan MiloneNANo new player Notes ATH - 1B L, 7-9 vs LAA",,W (Jun 22),-,2014,1774,0%,-/-,-,-,-,-,-,
"Carlos PachecoNANo new player Notes ATH - OF L, 7-9 vs LAA",,W (Jun 22),-,2317,1775,0%,-/-,-,-,-,-,-,
"Javi VazNANo new player Notes KC - 2B,OF L, 10-12 vs STL",@ TB,W (Jun 22),-,2199,1776,0%,-/-,-,-,-,-,-,
"Mason McCoyNANo new player Notes SD - SS L, 3-4 @ TEX",ATL,W (Jun 22),-,1862,1777,0%,-/-,-,-,-,-,-,
"Jesús MadeNANo new player Notes MIL - 2B,3B,SS W, 9-4 @ ATL",@ CIN,The Eds,-,2023,1778,9%,-/-,-,-,-,-,-,
"Luis PeñaNANo new player Notes MIL - 2B,3B,SS W, 9-4 @ ATL",@ CIN,W (Jun 22),-,2137,1779,1%,-/-,-,-,-,-,-,
"Jorge QuintanaNANo new player Notes SD - 3B,SS L, 3-4 @ TEX",ATL,W (Jun 22),-,2285,1780,0%,-/-,-,-,-,-,-,
"Joswa LugoNANo new player Notes LAA - SS W, 9-7 @ ATH",BAL,W (Jun 22),-,2211,1781,0%,-/-,-,-,-,-,-,
"Hayden AlvarezNANo new player Notes LAA - OF W, 9-7 @ ATH",BAL,W (Jun 22),-,2418,1782,0%,-/-,-,-,-,-,-,
"Pascanel FerrerasNANo new player Notes HOU - 2B,3B,SS W, 2-1 vs CLE",@ TOR,W (Jun 22),-,2356,1783,0%,-/-,-,-,-,-,-,
"Jancel VillarroelNANo new player Notes SF - C,OF L, 1-2 @ MIA",,W (Jun 22),-,1908,1784,0%,-/-,-,-,-,-,-,
"Jose PerdomoNANo new player Notes ATL - SS L, 4-9 vs MIL",@ SD,W (Jun 22),-,2293,1785,0%,-/-,-,-,-,-,-,
"Rainiel RodriguezNANo new player Notes STL - C W, 12-10 @ KC",AZ,W (Jun 22),-,2226,1786,1%,-/-,-,-,-,-,-,
"Yairo PadillaNANo new player Notes STL - SS W, 12-10 @ KC",AZ,W (Jun 22),-,2375,1787,0%,-/-,-,-,-,-,-,
"Adriel RadneyNANo new player Notes AZ - OF L, 2-4 vs MIN",@ STL,W (Jun 22),-,2140,1788,0%,-/-,-,-,-,-,-,
"Yassel SolerNANo new player Notes AZ - 3B L, 2-4 vs MIN",@ STL,W (Jun 22),-,1921,1789,0%,-/-,-,-,-,-,-,
"Demetrio CrisantesNANo new player Notes AZ - 2B,3B L, 2-4 vs MIN",@ STL,W (Jun 22),-,2196,1790,0%,-/-,-,-,-,-,-,
"Alberto BarrigaNANo new player Notes AZ - C L, 2-4 vs MIN",@ STL,W (Jun 22),-,1985,1791,0%,-/-,-,-,-,-,-,
Fernando CruzNANo new player Notes CHC - SS PPD vs TOR,@ NYM,W (Jun 22),-,2358,1792,0%,-/-,-,-,-,-,-,
Eli LovichNANo new player Notes CHC - OF PPD vs TOR,@ NYM,W (Jun 22),-,1926,1793,0%,-/-,-,-,-,-,-,
"Stiven MartinezNANo new player Notes BAL - OF W, 12-1 @ LAD",@ LAA,W (Jun 22),-,2106,1794,0%,-/-,-,-,-,-,-,
"Thomas SosaNANo new player Notes BAL - OF W, 12-1 @ LAD",@ LAA,W (Jun 22),-,2367,1795,0%,-/-,-,-,-,-,-,
"Joshua LiranzoNANo new player Notes BAL - 1B,3B,SS W, 12-1 @ LAD",@ LAA,W (Jun 22),-,2145,1796,0%,-/-,-,-,-,-,-,
"Emilio SanchezNANo new player Notes BAL - 3B,SS W, 12-1 @ LAD",@ LAA,W (Jun 22),-,2424,1797,0%,-/-,-,-,-,-,-,
"Jordan SanchezNANo new player Notes BAL - OF W, 12-1 @ LAD",@ LAA,W (Jun 22),-,2331,1798,0%,-/-,-,-,-,-,-,
"Nelly TaylorNANo new player Notes BOS - OF L, 1-3 @ SEA",@ COL,W (Jun 22),-,2328,1799,0%,-/-,-,-,-,-,-,
"Angel CepedaNANo new player Notes CHC - 2B,3B,SS PPD vs TOR",@ NYM,W (Jun 22),-,2041,1800,0%,-/-,-,-,-,-,-,
"Robert AriasNANo new player Notes CLE - OF L, 1-2 @ HOU",@ CWS,W (Jun 22),-,1997,1801,0%,-/-,-,-,-,-,-,
"Ashly AndujarNANo new player Notes COL - SS L, 6-8 vs PIT",BOS,W (Jun 22),-,2403,1802,0%,-/-,-,-,-,-,-,
"Franyerber MontillaNANo new player Notes DET - 2B,SS W, 5-4 vs CWS",NYY,W (Jun 22),-,2321,1803,0%,-/-,-,-,-,-,-,
"Nestor MirandaNANo new player Notes DET - Util W, 5-4 vs CWS",NYY,W (Jun 22),-,2155,1804,0%,-/-,-,-,-,-,-,
"Yandel RicardoNANo new player Notes KC - SS L, 10-12 vs STL",@ TB,W (Jun 22),-,2236,1805,0%,-/-,-,-,-,-,-,
"Ramon RamirezNANo new player Notes KC - C L, 10-12 vs STL",@ TB,W (Jun 22),-,2296,1806,0%,-/-,-,-,-,-,-,
"Jhonayker UgarteNANo new player Notes KC - 3B,SS L, 10-12 vs STL",@ TB,W (Jun 22),-,2307,1807,0%,-/-,-,-,-,-,-,
"Asbel GonzalezNANo new player Notes KC - OF L, 10-12 vs STL",@ TB,W (Jun 22),-,2161,1808,0%,-/-,-,-,-,-,-,
"Hyungchan UmNANo new player Notes KC - C L, 10-12 vs STL",@ TB,W (Jun 22),-,2386,1809,0%,-/-,-,-,-,-,-,
"Emil MoralesNANo new player Notes LAD - SS L, 1-12 vs BAL",@ MIN,W (Jun 22),-,2247,1810,0%,-/-,-,-,-,-,-,
"Eduardo QuinteroNANo new player Notes LAD - OF L, 1-12 vs BAL",@ MIN,W (Jun 22),-,2089,1811,1%,-/-,-,-,-,-,-,
"Ching-Hsien KoNANo new player Notes LAD - OF L, 1-12 vs BAL",@ MIN,W (Jun 22),-,1927,1812,0%,-/-,-,-,-,-,-,
"Luis CovaNANo new player Notes MIA - OF W, 2-1 vs SF",TEX,W (Jun 22),-,2341,1813,0%,-/-,-,-,-,-,-,
"Eduardo BeltreNANo new player Notes MIN - OF W, 4-2 @ AZ",LAD,W (Jun 22),-,2068,1814,0%,-/-,-,-,-,-,-,
"Dameury PenaNANo new player Notes MIN - 2B,OF W, 4-2 @ AZ",LAD,W (Jun 22),-,2183,1815,0%,-/-,-,-,-,-,-,
"Daiverson GutierrezNANo new player Notes NYM - C L, 2-6 @ PHI",CHC,W (Jun 22),-,1922,1816,0%,-/-,-,-,-,-,-,
"Edward LantiguaNANo new player Notes NYM - 2B,3B,SS L, 2-6 @ PHI",CHC,W (Jun 22),-,2316,1817,0%,-/-,-,-,-,-,-,
"Yovanny RodriguezNANo new player Notes NYM - C L, 2-6 @ PHI",CHC,W (Jun 22),-,2094,1818,0%,-/-,-,-,-,-,-,
"Francisco VilorioNANo new player Notes NYY - OF L, 1-4 vs CIN",@ DET,W (Jun 22),-,1946,1819,0%,-/-,-,-,-,-,-,
"Edgleen PerezNANo new player Notes PIT - C W, 8-6 @ COL",,W (Jun 22),-,2329,1820,0%,-/-,-,-,-,-,-,
"Matthew LugoNANo new player Notes KC - OF L, 10-12 vs STL",@ TB,W (Jun 22),-,1797,1821,0%,-/-,-,-,-,-,-,
"Ryan FitzgeraldNANo new player Notes LAD - SS L, 1-12 vs BAL",@ MIN,W (Jun 22),-,1793,1822,0%,-/-,-,-,-,-,-,
"Engelth UrenaNANo new player Notes NYY - C L, 1-4 vs CIN",@ DET,W (Jun 22),-,2221,1823,0%,-/-,-,-,-,-,-,
"Aroon EscobarNANo new player Notes PHI - 2B,3B W, 6-2 vs NYM",@ WSH,W (Jun 22),-,2053,1824,0%,-/-,-,-,-,-,-,
"Alirio FerrebusNANo new player Notes PHI - C,1B W, 6-2 vs NYM",@ WSH,W (Jun 22),-,2194,1825,0%,-/-,-,-,-,-,-,
"Edward FlorentinoNANo new player Notes PIT - 1B,OF W, 8-6 @ COL",,W (Jun 22),-,2384,1826,1%,-/-,-,-,-,-,-,
"Romeo SanabriaNANo new player Notes SD - 1B L, 3-4 @ TEX",ATL,W (Jun 22),-,2076,1827,0%,-/-,-,-,-,-,-,
"Jhonny LevelNANo new player Notes SF - SS L, 1-2 @ MIA",,W (Jun 22),-,2311,1828,0%,-/-,-,-,-,-,-,
"Yohendry SanchezNANo new player Notes SF - C L, 1-2 @ MIA",,W (Jun 22),-,2336,1829,0%,-/-,-,-,-,-,-,
"Jose OrtizNANo new player Notes SF - OF L, 1-2 @ MIA",,W (Jun 22),-,1991,1830,0%,-/-,-,-,-,-,-,
"Bo DavidsonNANo new player Notes SF - OF L, 1-2 @ MIA",,W (Jun 22),-,1895,1831,0%,-/-,-,-,-,-,-,
"Oliver TejadaNANo new player Notes SF - OF L, 1-2 @ MIA",,W (Jun 22),-,2410,1832,0%,-/-,-,-,-,-,-,
"Dawel JosephNANo new player Notes SEA - 3B,SS W, 3-1 vs BOS",,W (Jun 22),-,2248,1833,0%,-/-,-,-,-,-,-,
"Michael TogliaNANo new player Notes CIN - 1B W, 4-1 @ NYY",MIL,W (Jun 22),-,1695,1834,0%,-/-,-,-,-,-,-,
"Paulino SantanaNANo new player Notes TEX - OF W, 4-3 vs SD",@ MIA,W (Jun 22),-,2099,1835,0%,-/-,-,-,-,-,-,
"Yolfran CastilloNANo new player Notes TEX - 3B,SS W, 4-3 vs SD",@ MIA,W (Jun 22),-,1899,1836,0%,-/-,-,-,-,-,-,
"Braylin MorelNANo new player Notes TEX - OF W, 4-3 vs SD",@ MIA,W (Jun 22),-,1944,1837,0%,-/-,-,-,-,-,-,
"Yeremy CabreraNANo new player Notes WSH - OF L, 3-4 @ TB",PHI,W (Jun 22),-,2320,1838,0%,-/-,-,-,-,-,-,
"Victor HurtadoNANo new player Notes WSH - OF L, 3-4 @ TB",PHI,W (Jun 22),-,2175,1839,0%,-/-,-,-,-,-,-,
"Angel FelizNANo new player Notes WSH - 2B,SS L, 3-4 @ TB",PHI,W (Jun 22),-,2167,1840,0%,-/-,-,-,-,-,-,
"Korey LeeNANo new player Notes CWS - C L, 4-5 @ DET",CLE,W (Jun 22),-,1782,1841,0%,-/-,-,-,-,-,-,
"Adolfo SanchezNANo new player Notes CIN - OF W, 4-1 @ NYY",MIL,W (Jun 22),-,2240,1842,0%,-/-,-,-,-,-,-,
"Naibel MarianoNANo new player Notes CIN - 3B,SS W, 4-1 @ NYY",MIL,W (Jun 22),-,1958,1843,0%,-/-,-,-,-,-,-,
"Eli Serrano IIINANo new player Notes NYM - OF L, 2-6 @ PHI",CHC,W (Jun 22),-,1933,1844,0%,-/-,-,-,-,-,-,
"James Tibbs IIINANo new player Notes LAD - OF L, 1-12 vs BAL",@ MIN,Detroit Fastballs,-,2179,1845,4%,-/-,-,-,-,-,-,
"Kyren ParisNANo new player Notes LAA - 2B,OF W, 9-7 @ ATH",BAL,W (Jun 22),-,1756,1846,0%,-/-,-,-,-,-,-,
"Shotaro MoriiNANo new player Notes ATH - SS L, 7-9 vs LAA",,W (Jun 22),-,2206,1847,0%,-/-,-,-,-,-,-,
"Josuar GonzalezNANo new player Notes SF - SS L, 1-2 @ MIA",,W (Jun 22),-,2042,1848,1%,-/-,-,-,-,-,-,
"Logan DavidsonNANo new player Notes TB - 1B,3B W, 4-3 vs WSH",KC,W (Jun 22),-,1880,1849,0%,-/-,-,-,-,-,-,
"Ji Hwan BaeNANo new player Notes NYM - OF L, 2-6 @ PHI",CHC,W (Jun 22),-,1858,1850,0%,-/-,-,-,-,-,-,
"Arnoldo LantiguaNANo new player Notes CIN - OF W, 4-1 @ NYY",MIL,W (Jun 22),-,2172,1851,0%,-/-,-,-,-,-,-,
"Edgar MonteroNANo new player Notes ATH - SS L, 7-9 vs LAA",,W (Jun 22),-,2182,1852,0%,-/-,-,-,-,-,-,
"Maximo AcostaNANo new player Notes MIA - SS W, 2-1 vs SF",TEX,W (Jun 22),-,1828,1853,0%,-/-,-,-,-,-,-,
"Alex RamírezNANo new player Notes NYM - OF L, 2-6 @ PHI",CHC,W (Jun 22),-,2408,1854,0%,-/-,-,-,-,-,-,
"Kevin HidalgoNANo new player Notes COL - 3B,SS L, 6-8 vs PIT",BOS,W (Jun 22),-,1954,1855,0%,-/-,-,-,-,-,-,
"Andy PerezNANo new player Notes COL - SS L, 6-8 vs PIT",BOS,W (Jun 22),-,2254,1856,0%,-/-,-,-,-,-,-,
"Mani CedenoNANo new player Notes NYY - SS L, 1-4 vs CIN",@ DET,W (Jun 22),-,1893,1857,0%,-/-,-,-,-,-,-,
"Robert Hassell IIINANo new player Notes WSH - OF L, 3-4 @ TB",PHI,W (Jun 22),-,1757,1858,0%,-/-,-,-,-,-,-,
"Riley AdamsNANo new player Notes WSH - C L, 3-4 @ TB",PHI,W (Jun 22),-,1767,1859,0%,-/-,-,-,-,-,-,
"Brayan BuelvasNANo new player Notes ATH - OF L, 7-9 vs LAA",,W (Jun 22),-,2018,1860,0%,-/-,-,-,-,-,-,
"John GilNANo new player Notes ATL - SS L, 4-9 vs MIL",@ SD,W (Jun 22),-,1992,1861,0%,-/-,-,-,-,-,-,
"Chris SueroNANo new player Notes NYM - C,1B,OF L, 2-6 @ PHI",CHC,W (Jun 22),-,2084,1862,0%,-/-,-,-,-,-,-,
Willie MacIverNANo new player Notes TOR - C PPD @ CHC,HOU,W (Jun 22),-,1836,1863,0%,-/-,-,-,-,-,-,
"Braedon KarpathiosNANo new player Notes SD - OF L, 3-4 @ TEX",ATL,W (Jun 22),-,1924,1864,0%,-/-,-,-,-,-,-,
"Brendan JonesNANo new player Notes MIA - OF W, 2-1 vs SF",TEX,W (Jun 22),-,2176,1865,0%,-/-,-,-,-,-,-,
"Heston KjerstadNANo new player Notes BAL - OF W, 12-1 @ LAD",@ LAA,W (Jun 22),-,1776,1866,0%,-/-,-,-,-,-,-,
"Jordan WestburgIL60No new player Notes BAL - 2B,3B W, 12-1 @ LAD",@ LAA,W (Jun 22),-,1564,1867,9%,-/-,-,-,-,-,-,
"Zac VeenNANo new player Notes COL - OF L, 6-8 vs PIT",BOS,W (Jun 22),-,2447,1868,1%,-/-,-,-,-,-,-,
"Will BushNANo new player Notes HOU - C,1B W, 2-1 vs CLE",@ TOR,W (Jun 22),-,2376,1869,0%,-/-,-,-,-,-,-,
"Tyler FitzgeraldNANo new player Notes SF - 2B L, 1-2 @ MIA",,W (Jun 22),-,1693,1870,0%,-/-,-,-,-,-,-,
"Josh AdamczewskiNANo new player Notes MIL - 2B W, 9-4 @ ATL",@ CIN,W (Jun 22),-,2353,1871,0%,-/-,-,-,-,-,-,
"Pedro LeónNANo new player Notes PHI - OF W, 6-2 vs NYM",@ WSH,W (Jun 22),-,2432,1872,0%,-/-,-,-,-,-,-,
"Bryan De La CruzNANo new player Notes PHI - OF W, 6-2 vs NYM",@ WSH,W (Jun 22),-,1805,1873,0%,-/-,-,-,-,-,-,
"Diego TornesNANo new player Notes ATL - OF L, 4-9 vs MIL",@ SD,W (Jun 22),-,2071,1874,0%,-/-,-,-,-,-,-,
"Justin GonzalesNANo new player Notes BOS - OF L, 1-3 @ SEA",@ COL,W (Jun 22),-,2180,1875,0%,-/-,-,-,-,-,-,
"Dorian SotoNANo new player Notes BOS - SS L, 1-3 @ SEA",@ COL,W (Jun 22),-,2048,1876,0%,-/-,-,-,-,-,-,
