"Seth LugoNew Player Note KC - P W, 5-4 vs SF",SF,Rafael Devers,20,256,436,26%,110.2,0,89,4.39,1.41,11,
Franco AlemanNo new player Notes CLE - P 6:40 pm vs MIN,MIN,FA,9,605,437,0%,10.0,0,8,1.8,1.1,0,
"Cooper CriswellIL60No new player Notes SEA - P Top 8, 3-5 vs CIN",CIN,FA,26,548,438,0%,30.2,1,23,3.52,1.17,0,
"Brad LordIL15No new player Notes WSH - P Bot 8, 8-0 @ COL",@ COL,FA,27,506,439,1%,58.0,1,52,3.88,1.22,0,
Dax FultonNo new player Notes MIA - P 8:10 pm @ HOU,@ HOU,FA,4,607,440,0%,10.0,0,10,2.7,1.0,0,
Griffin JaxPlayer Note TB - P 7:07 pm @ TOR,@ TOR,The Eds,26,345,441,54%,75.0,0,77,4.08,1.27,1,
Logan VanWeyNANo new player Notes HOU - P 8:10 pm vs MIA,MIA,FA,5,598,442,0%,6.0,0,5,1.5,0.83,0,
Vince VelasquezNANo new player Notes CHC - P 8:10 pm vs DET,DET,FA,2,608,443,0%,3.1,0,1,0.0,0.3,0,
Carl Edwards Jr.NANo new player Notes DET - P 8:10 pm @ CHC,@ CHC,FA,2,610,444,0%,6.0,0,11,1.5,1.17,0,
"Brock BurkeNo new player Notes CIN - P Top 8, 5-3 @ SEA",@ SEA,FA,50,472,447,0%,47.0,1,40,2.87,1.38,0,
"Emilio PagánNew Player Note CIN - P Top 8, 5-3 @ SEA",@ SEA,Cash is King,20,287,448,65%,18.1,8,19,5.89,1.36,0,
"Aaron AshbyNo new player Notes MIL - P W, 4-3 vs NYM",NYM,FA,47,341,450,34%,57.2,0,78,3.43,1.44,0,
Ty BlachNANo new player Notes CHC - P 8:10 pm vs DET,DET,FA,1,671,451,0%,3.0,0,2,0.0,0.33,0,
"Eduardo RiveraNew Player Note BOS - P W, 6-3 vs BAL; 7:10 pm vs BAL","BAL,BAL",FA,3,614,452,1%,9.1,0,9,2.89,0.96,0,
"JoJo RomeroIL15Player Note STL - P Bot 6, 1-0 @ LAA",@ LAA,FA,44,476,453,10%,43.0,0,43,3.35,1.3,0,
"Ryan YarbroughPlayer Note NYY - P L, 3-5 vs PIT; 7:05 pm vs PIT","PIT,PIT",FA,25,529,454,0%,39.2,2,28,3.86,1.18,0,
"Sam BachmanNo new player Notes LAA - P Bot 6, 0-1 vs STL",STL,FA,37,643,455,1%,43.1,1,45,3.95,1.25,0,
"Alec GamboaNew Player Note BOS - P W, 6-3 vs BAL; 7:10 pm vs BAL","BAL,BAL",FA,5,619,458,0%,8.0,1,5,2.25,1.13,0,
"Garrett StallingsNAPlayer Note MIL - P W, 4-3 vs NYM",NYM,FA,2,618,459,0%,3.0,0,4,0.0,0.67,0,
"Albert SuárezNo new player Notes BAL - P L, 3-6 @ BOS; 7:10 pm @ BOS","@ BOS,@ BOS",FA,16,510,461,0%,40.2,1,28,3.54,1.2,0,
"Ryan FernandezNANo new player Notes STL - P Bot 6, 1-0 @ LAA",@ LAA,FA,11,1245,462,0%,13.1,0,20,2.7,1.35,0,
"Chase DollanderIL60No new player Notes COL - P Bot 8, 0-8 vs WSH",WSH,FA,10,1464,463,4%,44.0,0,47,3.89,1.3,1,
Caleb ThielbarNo new player Notes CHC - P 8:10 pm vs DET,DET,FA,34,459,465,1%,29.0,2,37,4.34,1.28,0,
"Jonathan PintaroNAPlayer Note NYM - P L, 3-4 @ MIL",@ MIL,FA,5,677,467,0%,12.1,0,12,5.11,0.73,0,
"Greg WeissertNo new player Notes BOS - P W, 6-3 vs BAL; 7:10 pm vs BAL","BAL,BAL",FA,41,463,468,0%,39.1,0,36,3.66,1.22,0,
"Stephen KolekIL60New Player Note KC - P W, 5-4 vs SF",SF,No Longer Rowdy,10,255,469,6%,54.0,0,34,4.5,1.24,5,
Drew AndersonNo new player Notes DET - P 8:10 pm @ CHC,@ CHC,FA,35,544,470,1%,57.1,2,71,4.24,1.33,0,
Garrett ActonIL60Player Note MIN - P 6:40 pm @ CLE,@ CLE,FA,4,580,471,0%,6.2,0,9,2.7,1.05,0,
"Jason FoleyNo new player Notes SF - P L, 4-5 @ KC",@ KC,FA,2,596,472,0%,2.0,0,1,0.0,0.0,0,
"Sam HentgesNo new player Notes SF - P L, 4-5 @ KC",@ KC,FA,26,576,473,0%,20.0,0,23,1.8,1.55,0,
"John SchreiberNo new player Notes KC - P W, 5-4 vs SF",SF,FA,42,571,474,0%,38.1,1,28,3.29,1.28,0,
Ben PeoplesNo new player Notes TEX - P 8:05 pm vs CWS,CWS,FA,6,628,475,0%,6.1,0,4,2.84,0.79,0,
AJ BlubaughPlayer Note HOU - P 8:10 pm vs MIA,MIA,FA,38,451,476,1%,63.0,0,66,3.86,1.29,0,
Josh EknessIL60No new player Notes MIA - P 8:10 pm @ HOU,@ HOU,FA,6,627,477,0%,5.1,1,5,1.69,1.31,0,
Framber ValdezNew Player Note DET - P 8:10 pm @ CHC,@ CHC,Ranger danger,20,183,478,88%,108.1,0,88,4.57,1.38,10,
"Andrew KittredgeNo new player Notes BAL - P L, 3-6 @ BOS; 7:10 pm @ BOS","@ BOS,@ BOS",Joe Byron,31,478,479,7%,27.0,3,24,4.0,1.3,0,
Nick PivettaIL60Player Note SD - P 7:15 pm @ ATL,@ ATL,Cookie Monster ,4,222,480,72%,16.0,0,24,4.5,1.13,0,
Yacksel RíosNANo new player Notes CHC - P 8:10 pm vs DET,DET,FA,1,631,481,0%,1.2,0,2,0.0,0.0,0,
"Hunter GreeneVideo ForecastPlayer Note CIN - P Top 8, 5-3 @ SEA",@ SEA,Stealth Bomber,3,393,482,83%,16.1,0,26,6.06,1.16,2,
Tim HerrinIL15Player Note CLE - P 6:40 pm vs MIN,MIN,FA,41,582,483,1%,32.1,0,27,3.06,1.3,0,
"Nick DavilaNo new player Notes SEA - P Top 8, 3-5 vs CIN",CIN,FA,19,642,484,0%,21.1,1,9,3.38,1.13,0,
Emmet SheehanPlayer Note LAD - P 6:40 pm @ PHI,@ PHI,Stealth Bomber,18,134,485,75%,87.2,0,99,5.13,1.27,5,
"Eddy YeanPlayer Note WSH - P Bot 8, 8-0 @ COL",@ COL,FA,1,634,486,0%,2.0,0,3,0.0,0.5,0,
"Yerry De los SantosNANo new player Notes NYY - P L, 3-5 vs PIT; 7:05 pm vs PIT","PIT,PIT",FA,5,716,487,0%,8.2,0,7,1.04,1.38,0,
Marco GonzalesNew Player Note TEX - P 8:05 pm vs CWS,CWS,W (Jul 24),1,647,488,0%,3.0,1,2,0.0,1.33,0,
"Eiberson CastellanoNANo new player Notes COL - P Bot 8, 0-8 vs WSH",WSH,FA,1,633,489,0%,3.0,1,2,0.0,1.33,0,
Javier AssadPlayer Note CHC - P 8:10 pm vs DET,DET,FA,16,469,490,8%,62.1,0,39,4.04,1.16,1,
Brad KellerIL15Player Note PHI - P 6:40 pm vs LAD,LAD,FA,32,442,491,3%,31.1,3,32,4.02,1.34,0,
Jack AndersonPlayer Note MIN - P 6:40 pm @ CLE,@ CLE,FA,4,639,492,0%,9.1,0,7,2.89,1.07,0,
"Ryan ThompsonNo new player Notes AZ - P Bot 6, 10-2 vs ATH",ATH,FA,41,493,493,0%,36.2,0,26,2.95,1.31,0,
Kyle FinneganNo new player Notes DET - P 8:10 pm @ CHC,@ CHC,FA,42,441,495,6%,44.0,1,34,2.45,1.48,0,
Blake TreinenIL15No new player Notes LAD - P 6:40 pm @ PHI,@ PHI,FA,29,521,496,1%,23.0,1,25,3.52,1.35,0,
CJ Van EykNew Player Note TOR - P 7:07 pm vs TB,TB,FA,1,646,497,0%,2.0,0,1,0.0,0.5,0,
Tyler PhillipsNew Player Note MIA - P 8:10 pm @ HOU,@ HOU,W (Jul 24),26,555,498,4%,79.1,2,58,3.52,1.39,2,
Tanner AndrewsNANo new player Notes TOR - P 7:07 pm vs TB,TB,FA,2,651,499,0%,3.0,0,1,0.0,1.0,0,
"Kohl DrakeNew Player Note AZ - P Bot 6, 10-2 vs ATH",ATH,FA,1,653,500,1%,5.0,0,5,1.8,1.2,0,
Enmanuel De JesúsNANo new player Notes DET - P 8:10 pm @ CHC,@ CHC,FA,22,565,501,0%,31.2,1,31,3.98,1.26,0,
Chad DallasNANo new player Notes TOR - P 7:07 pm vs TB,TB,FA,2,595,503,0%,4.2,0,3,1.93,1.07,0,
"Brooks KriskeIL60No new player Notes ATH - P Bot 6, 2-10 @ AZ",@ AZ,FA,2,1303,504,0%,2.2,0,2,0.0,1.13,0,
Joe BoyleNANo new player Notes TB - P 7:07 pm @ TOR,@ TOR,FA,3,1282,505,1%,15.2,0,16,5.17,1.09,1,
Jhony BritoNAPlayer Note SD - P 7:15 pm @ ATL,@ ATL,FA,3,673,506,0%,5.1,0,4,3.38,0.94,0,
Hoby MilnerIL15Player Note CHC - P 8:10 pm vs DET,DET,FA,38,590,507,0%,35.2,1,18,3.53,1.21,0,
"Joel PegueroIL60No new player Notes SF - P L, 4-5 @ KC",@ KC,FA,11,568,508,0%,11.1,0,5,2.38,1.24,0,
Hunter BrownPlayer Note HOU - P  8:10 pm vs MIA,MIA,Joe Byron,8,69,509,94%,40.0,0,43,4.05,1.45,3,
"Easton McGeeNAPlayer Note KC - P W, 5-4 vs SF",SF,FA,2,1163,510,0%,2.0,0,1,0.0,1.0,0,
"Welinton HerreraIL60No new player Notes COL - P Bot 8, 0-8 vs WSH",WSH,FA,3,669,511,0%,2.1,0,2,0.0,1.29,0,
Tyler DavisNAPlayer Note CWS - P 8:05 pm @ TEX,@ TEX,FA,24,572,512,0%,26.1,1,22,4.1,1.22,0,
Gavin HollowellNo new player Notes CHC - P 8:10 pm vs DET,DET,FA,10,1159,513,0%,11.0,0,12,2.45,1.45,0,
Jake EderNANo new player Notes LAD - P 6:40 pm @ PHI,@ PHI,FA,4,640,514,0%,4.0,0,1,2.25,1.0,0,
Zach PopNANo new player Notes MIA - P 8:10 pm @ HOU,@ HOU,FA,7,1325,515,0%,7.1,0,6,3.68,1.09,0,
"Zack KellyIL60Player Note BOS - P W, 6-3 vs BAL; 7:10 pm vs BAL","BAL,BAL",FA,17,1136,516,0%,16.1,0,14,3.31,1.29,0,
"Brian FitzpatrickIL60No new player Notes MIL - P W, 4-3 vs NYM",NYM,FA,5,679,517,0%,6.2,0,5,1.35,1.5,0,
Cody PonceIL60No new player Notes TOR - P 7:07 pm vs TB,TB,FA,1,683,518,3%,2.1,0,3,3.86,0.86,0,
"Xzavion CurryNAPlayer Note NYM - P L, 3-4 @ MIL",@ MIL,FA,4,1158,519,0%,6.0,0,4,3.0,1.17,0,
"Julian FernándezNANo new player Notes WSH - P Bot 8, 8-0 @ COL",@ COL,FA,3,657,521,0%,4.0,0,3,2.25,1.25,0,
"Scott BlewettNANew Player Note STL - P Bot 6, 1-0 @ LAA",@ LAA,FA,1,1230,522,0%,2.0,0,2,0.0,1.5,0,
"Guillo ZuñigaNANo new player Notes NYM - P L, 3-4 @ MIL",@ MIL,FA,1,694,523,0%,1.0,0,1,0.0,1.0,0,
"Cameron WestonNANo new player Notes BAL - P L, 3-6 @ BOS; 7:10 pm @ BOS","@ BOS,@ BOS",FA,1,688,524,0%,1.0,0,1,0.0,1.0,0,
Tyler KinleyNo new player Notes ATL - P 7:15 pm vs SD,SD,FA,40,454,527,1%,35.0,0,36,4.11,1.26,0,
"Zach EflinIL60No new player Notes BAL - P L, 3-6 @ BOS; 7:10 pm @ BOS","@ BOS,@ BOS",FA,1,1308,528,2%,3.2,0,7,2.45,1.64,0,
"Cole RagansIL60Player Note KC - P  W, 5-4 vs SF",SF,FA,8,622,529,50%,35.1,0,45,4.84,1.42,3,
Duncan DavittNANo new player Notes CWS - P 8:05 pm @ TEX,@ TEX,FA,1,697,530,0%,1.0,0,0,0.0,1.0,0,
"Anthony NunezNo new player Notes BAL - P L, 3-6 @ BOS; 7:10 pm @ BOS","@ BOS,@ BOS",FA,35,592,532,0%,39.1,3,41,4.81,1.27,0,
Lazaro EstradaNANew Player Note TOR - P 7:07 pm vs TB,TB,FA,4,1210,533,0%,9.1,0,6,4.82,0.96,0,
"Josh WalkerNew Player Note BAL - P L, 3-6 @ BOS; 7:10 pm @ BOS","@ BOS,@ BOS",FA,5,1202,534,0%,6.0,0,7,4.5,1.17,0,
Kai-Wei TengPlayer Note HOU - P 8:10 pm vs MIA,MIA,FA,24,703,535,2%,66.1,0,66,4.21,1.34,2,
"Ryne NelsonIL60Player Note AZ - P Bot 6, 10-2 vs ATH",ATH,FA,15,392,536,30%,83.1,0,62,4.97,1.24,6,
"Kervin CastroNANew Player Note NYY - P L, 3-5 vs PIT; 7:05 pm vs PIT","PIT,PIT",FA,1,711,537,0%,2.0,0,2,4.5,1.0,0,
Burch SmithIL60Player Note DET - P 8:10 pm @ CHC,@ CHC,FA,13,1138,538,0%,17.0,0,20,3.18,1.47,0,
"Spencer BivensNANo new player Notes SF - P L, 4-5 @ KC",@ KC,FA,2,670,539,0%,2.0,0,3,0.0,2.0,0,
"Jose CuasNANo new player Notes KC - P W, 5-4 vs SF",SF,FA,5,1153,541,0%,6.1,0,9,2.84,1.58,0,
Paul GervaseNANo new player Notes LAD - P 6:40 pm @ PHI,@ PHI,FA,4,1183,542,0%,7.2,0,8,2.35,1.57,0,
Owen MurphyNAPlayer Note ATL - P 7:15 pm vs SD,SD,FA,3,720,543,1%,6.2,0,6,4.05,1.2,0,
Connor BrogdonNANo new player Notes CLE - P 6:40 pm vs MIN,MIN,FA,15,644,544,0%,15.1,1,14,5.28,1.11,0,
Marco RayaIL15Player Note MIN - P 6:40 pm @ CLE,@ CLE,FA,3,719,545,0%,6.0,0,4,3.0,1.33,0,
"Tyler SamaniegoNANo new player Notes BOS - P W, 6-3 vs BAL; 7:10 pm vs BAL","BAL,BAL",FA,20,1139,546,0%,20.1,0,17,2.66,1.48,0,
"Brett KerryNANo new player Notes LAA - P Bot 6, 0-1 vs STL",STL,FA,1,1126,547,0%,4.0,0,2,4.5,1.0,0,
"Randy DobnakPlayer Note KC - P W, 5-4 vs SF",SF,FA,3,689,548,0%,14.0,0,7,1.93,1.5,0,
"Robert GasserPlayer Note MIL - P W, 4-3 vs NYM",NYM,Fightin Farmers,10,1133,549,11%,51.1,0,48,4.91,1.21,2,
"Joey GerberNANo new player Notes NYM - P L, 3-4 @ MIL",@ MIL,FA,7,682,551,0%,8.1,0,8,4.32,1.2,0,
"Steven CruzNew Player Note KC - P W, 5-4 vs SF",SF,FA,32,549,552,0%,34.0,0,41,4.5,1.26,0,
"Juan BurgosNANew Player Note AZ - P Bot 6, 10-2 vs ATH",ATH,FA,2,1240,553,0%,2.2,0,0,3.38,1.13,0,
Mick AbelIL60Player Note MIN - P 6:40 pm @ CLE,@ CLE,FA,4,363,554,6%,20.1,0,23,3.98,1.57,2,
"Drew RomNANo new player Notes MIL - P W, 4-3 vs NYM",NYM,FA,5,626,555,0%,5.2,0,11,3.18,1.76,0,
"Jose EspadaNANo new player Notes BAL - P L, 3-6 @ BOS; 7:10 pm @ BOS","@ BOS,@ BOS",FA,1,667,557,0%,1.0,0,0,0.0,2.0,0,
"Tyler UberstineNANo new player Notes BOS - P W, 6-3 vs BAL; 7:10 pm vs BAL","BAL,BAL",FA,1,1150,559,0%,2.2,0,2,3.38,1.5,0,
"Nate PearsonNANew Player Note KC - P W, 5-4 vs SF",SF,FA,16,1335,560,0%,20.0,1,16,3.6,1.4,0,
Jesse ScholtensIL15Player Note TB - P 7:07 pm @ TOR,@ TOR,FA,9,514,561,1%,37.2,0,30,3.82,1.27,0,
"Hunter DobbinsNew Player Note STL - P Bot 6, 1-0 @ LAA",@ LAA,Joey Spierer's Team,5,629,562,2%,22.1,1,23,4.03,1.39,0,
Craig KimbrelNo new player Notes TB - P 7:07 pm @ TOR,@ TOR,FA,30,702,563,0%,31.0,0,29,4.35,1.23,0,
"Tayler SaucedoNANo new player Notes LAA - P Bot 6, 0-1 vs STL",STL,FA,6,1305,564,0%,3.1,0,6,5.4,1.5,0,
Zach BrzykcyPlayer Note MIA - P 8:10 pm @ HOU,@ HOU,FA,2,1423,566,0%,3.0,0,2,3.0,1.67,0,
Doug NikhazyNANo new player Notes CHC - P 8:10 pm vs DET,DET,FA,1,1274,567,0%,2.0,0,1,4.5,1.5,0,
"Mason BarnettNew Player Note ATH - P Bot 6, 2-10 @ AZ",@ AZ,FA,13,1261,568,0%,21.1,2,21,4.64,1.36,0,
Tyler ZuberNo new player Notes MIA - P 8:10 pm @ HOU,@ HOU,FA,16,1367,570,0%,13.2,1,15,4.61,1.39,0,
"Jordan RomanoNew Player Note COL - P Bot 8, 0-8 vs WSH",WSH,FA,17,1373,572,5%,13.2,7,20,6.59,1.83,0,
Cole SandsIL15Player Note MIN - P 6:40 pm @ CLE,@ CLE,FA,12,564,573,1%,11.2,1,11,4.63,1.37,0,
Ronel BlancoPlayer Note HOU - P 8:10 pm vs MIA,MIA,NY Bombsquad,1,588,575,10%,4.2,0,8,7.71,1.07,0,
"Jimmy HergetNo new player Notes COL - P Bot 8, 0-8 vs WSH",WSH,FA,27,574,577,1%,26.2,3,28,4.39,1.46,0,
Evan PhillipsNo new player Notes LAD - P 6:40 pm @ PHI,@ PHI,FA,5,638,578,1%,5.0,0,7,5.4,1.4,0,
"Grant WolframPlayer Note BAL - P L, 3-6 @ BOS; 7:10 pm @ BOS","@ BOS,@ BOS",FA,37,1129,579,0%,29.2,1,32,4.55,1.31,0,
Tyler FergusonNo new player Notes CHC - P 8:10 pm vs DET,DET,FA,12,1160,580,0%,11.2,0,15,6.94,0.94,0,
Danny YoungNo new player Notes ATL - P 7:15 pm vs SD,SD,FA,7,1180,581,0%,5.2,0,4,3.18,1.59,0,
Robert GarciaIL60No new player Notes TEX - P 8:05 pm vs CWS,CWS,FA,9,542,582,4%,8.0,0,6,3.38,1.5,0,
"Carson WhisenhuntNAPlayer Note SF - P L, 4-5 @ KC",@ KC,FA,2,625,583,1%,10.2,0,6,3.38,1.41,0,
Pete FairbanksPlayer Note MIA - P 8:10 pm @ HOU,@ HOU,Joe Byron,33,149,584,66%,30.1,13,41,7.42,1.52,0,
"Elvis AlvaradoNo new player Notes ATH - P Bot 6, 2-10 @ AZ",@ AZ,FA,27,550,585,3%,29.0,2,36,5.59,1.24,0,
Alek JacobNANo new player Notes SD - P 7:15 pm @ ATL,@ ATL,FA,3,1222,586,0%,5.0,0,6,5.4,1.4,0,
Anthony BandaIL15No new player Notes MIN - P 6:40 pm @ CLE,@ CLE,FA,39,530,587,0%,34.1,2,33,4.46,1.34,0,
Luke LittleNANo new player Notes CHC - P 8:10 pm vs DET,DET,FA,1,1201,588,0%,1.0,0,1,9.0,2.0,0,
"Chase PettyNo new player Notes CIN - P Top 8, 5-3 @ SEA",@ SEA,FA,12,1370,589,0%,25.2,1,11,4.56,1.13,0,
Daniel EspinoNANo new player Notes CLE - P 6:40 pm vs MIN,MIN,FA,5,1187,590,0%,5.0,0,9,5.4,1.6,0,
Jordan HicksNo new player Notes CWS - P 8:05 pm @ TEX,@ TEX,FA,30,1519,591,1%,27.1,1,32,3.62,1.54,0,
Carter BaumlerIL60No new player Notes TEX - P 8:05 pm vs CWS,CWS,FA,4,1189,592,0%,5.2,0,6,3.18,1.76,0,
Tommy NanceNo new player Notes MIN - P 6:40 pm @ CLE,@ CLE,FA,35,534,593,0%,36.1,0,39,3.96,1.38,0,
"Joe La SorsaNA7Player Note BOS - P W, 6-3 vs BAL; 7:10 pm vs BAL","BAL,BAL",FA,1,1323,594,0%,0.1,0,1,27.0,3.0,0,
"Wilber DotelPlayer Note PIT - P W, 5-3 @ NYY; 7:05 pm @ NYY","@ NYY,@ NYY",FA,10,690,596,0%,21.1,0,24,5.06,1.22,0,
Chayce McDermottNANo new player Notes LAD - P 6:40 pm @ PHI,@ PHI,FA,2,1426,599,0%,2.1,0,1,7.71,1.29,0,
"Carlos RodriguezNAPlayer Note MIL - P W, 4-3 vs NYM",NYM,FA,4,1306,601,0%,9.1,0,8,3.86,1.5,0,
Cody LawerysonNA7Player Note MIN - P 6:40 pm @ CLE,@ CLE,FA,15,617,602,0%,16.2,1,18,4.86,1.38,0,
"Blas CastañoIL15No new player Notes COL - P Bot 8, 0-8 vs WSH",WSH,FA,10,1170,603,0%,20.2,0,17,3.92,1.35,0,
Reynaldo LópezNew Player Note ATL - P 7:15 pm vs SD,SD,Cookie Monster ,23,396,604,24%,66.0,0,60,3.95,1.36,1,
John KleinNANo new player Notes MIN - P 6:40 pm @ CLE,@ CLE,FA,3,1203,605,0%,4.1,0,2,4.15,1.62,0,
"Jonah TongNANo new player Notes NYM - P L, 3-4 @ MIL",@ MIL,FA,3,1246,608,3%,10.0,0,7,3.6,1.5,0,
JP SearsPlayer Note SD - P 7:15 pm @ ATL,@ ATL,FA,5,1194,609,2%,24.2,0,20,4.38,1.26,0,
"Beck WayNo new player Notes KC - P W, 5-4 vs SF",SF,FA,18,691,610,0%,22.1,0,21,3.22,1.52,0,
David SandlinNANew Player Note CWS - P 8:05 pm @ TEX,@ TEX,FA,4,1147,611,1%,19.1,0,20,6.05,1.29,2,
"Max RajcicIL60No new player Notes STL - P Bot 6, 1-0 @ LAA",@ LAA,FA,6,1209,612,0%,9.0,0,8,5.0,1.33,0,
"Gregory SantosNANo new player Notes SF - P L, 4-5 @ KC",@ KC,FA,3,1262,614,0%,5.0,0,1,3.6,1.6,0,
"Jeff CriswellIL15Player Note COL - P Bot 8, 0-8 vs WSH",WSH,FA,3,1204,615,0%,4.0,0,3,4.5,1.75,0,
Kendry RojasPlayer Note MIN - P 6:40 pm @ CLE,@ CLE,FA,9,699,616,0%,21.2,0,24,3.32,1.57,0,
Winston SantosNANo new player Notes TEX - P 8:05 pm vs CWS,CWS,FA,1,1208,618,0%,2.0,0,1,9.0,1.5,0,
Cal QuantrillNew Player Note TEX - P 8:05 pm vs CWS,CWS,FA,20,1506,619,1%,50.1,0,31,3.93,1.29,1,
Logan AllenNAPlayer Note CLE - P 6:40 pm vs MIN,MIN,FA,2,1402,620,1%,7.1,0,10,2.45,2.05,0,
"Bryse WilsonNo new player Notes MIL - P W, 4-3 vs NYM",NYM,FA,6,1513,621,0%,17.2,0,14,4.08,1.36,0,
Casey LeguminaNo new player Notes TB - P 7:07 pm @ TOR,@ TOR,FA,33,1196,622,0%,41.1,0,29,3.92,1.28,0,
"Hunter StrattonNANo new player Notes PIT - P W, 5-3 @ NYY; 7:05 pm @ NYY","@ NYY,@ NYY",FA,3,1257,623,0%,3.1,0,3,5.4,1.8,0,
Tyler SchweitzerNo new player Notes CWS - P 8:05 pm @ TEX,@ TEX,FA,8,698,625,0%,15.2,1,8,4.02,1.4,0,
"Tony SantillanIL15Player Note CIN - P Top 8, 5-3 @ SEA",@ SEA,FA,34,519,626,4%,31.0,5,28,5.23,1.39,0,
Matt PushardNANo new player Notes MIA - P 8:10 pm @ HOU,@ HOU,FA,6,1213,627,0%,7.0,0,6,5.14,1.43,0,
Anthony MolinaNANo new player Notes ATL - P 7:15 pm vs SD,SD,FA,3,1475,628,0%,5.0,0,2,5.4,1.4,0,
"Bruce ZimmermannNAPlayer Note STL - P Bot 6, 1-0 @ LAA",@ LAA,FA,1,1268,629,0%,5.0,0,2,5.4,1.4,0,
Hunter HarveyIL60Player Note CHC - P 8:10 pm vs DET,DET,FA,4,635,630,0%,4.0,0,4,6.75,1.5,0,
Kyle HurtNAPlayer Note LAD - P 6:40 pm @ PHI,@ PHI,FA,33,583,631,0%,33.1,1,39,4.59,1.38,0,
"Tim HillPlayer Note NYY - P L, 3-5 vs PIT; 7:05 pm vs PIT","PIT,PIT",FA,45,522,632,1%,38.0,0,18,4.26,1.16,0,
"Reiver SanmartinNANo new player Notes SF - P L, 4-5 @ KC",@ KC,FA,2,696,633,0%,3.1,0,4,8.1,1.5,0,
Jalen BeeksIL60New Player Note TEX - P 8:05 pm vs CWS,CWS,FA,29,535,634,0%,26.0,0,21,3.81,1.38,0,
"Luis SeverinoIL60Player Note ATH - P Bot 6, 2-10 @ AZ",@ AZ,FA,12,1387,635,6%,62.2,0,65,4.16,1.47,3,
"Mitch FarrisNo new player Notes LAA - P Bot 6, 0-1 vs STL",STL,FA,20,1364,637,0%,41.2,0,42,3.67,1.44,0,
Taylor RashiNANo new player Notes MIN - P 6:40 pm @ CLE,@ CLE,FA,3,1134,638,0%,3.2,0,4,9.82,1.09,0,
Chris MurphyNo new player Notes CWS - P 8:05 pm @ TEX,@ TEX,FA,22,537,639,0%,23.0,1,22,4.3,1.43,0,
"Chris DevenskiIL60Player Note PIT - P W, 5-3 @ NYY; 7:05 pm @ NYY","@ NYY,@ NYY",FA,3,1148,641,0%,2.1,0,3,7.71,2.14,0,
"Nick RaquetNAPlayer Note BAL - P L, 3-6 @ BOS; 7:10 pm @ BOS","@ BOS,@ BOS",FA,4,1205,642,0%,3.2,0,1,7.36,1.36,0,
"Michael RuckerNo new player Notes SEA - P Top 8, 3-5 vs CIN",CIN,FA,15,1238,644,0%,15.2,0,18,5.17,1.34,0,
Matt FestaNo new player Notes CLE - P 6:40 pm vs MIN,MIN,FA,42,551,645,0%,40.2,1,44,4.43,1.38,0,
"Luis MedinaNo new player Notes ATH - P Bot 6, 2-10 @ AZ",@ AZ,FA,34,685,646,0%,46.0,0,55,3.72,1.5,0,
"Brycen MautzNANo new player Notes STL - P Bot 6, 1-0 @ LAA",@ LAA,FA,1,1224,647,0%,3.0,0,2,6.0,2.0,0,
Mason FluhartyNo new player Notes TOR - P 7:07 pm vs TB,TB,FA,52,513,649,1%,39.2,1,47,4.31,1.44,0,
"Sam MollNo new player Notes CIN - P Top 8, 5-3 @ SEA",@ SEA,FA,47,1233,650,0%,41.0,1,45,4.39,1.39,0,
"Kade StrowdNANo new player Notes AZ - P Bot 6, 10-2 vs ATH",ATH,FA,1,678,651,0%,1.0,0,1,9.0,4.0,0,
Nolan HoffmanNANo new player Notes PHI - P 6:40 pm vs LAD,LAD,FA,3,1283,652,0%,4.2,0,2,3.86,1.93,0,
Shawn ArmstrongNo new player Notes CLE - P 6:40 pm vs MIN,MIN,FA,37,447,654,2%,32.1,0,33,4.18,1.39,0,
Chase SoleskyNANo new player Notes TB - P 7:07 pm @ TOR,@ TOR,FA,1,1232,655,0%,3.0,0,4,6.0,2.33,0,
"Joey EstesNANo new player Notes ATH - P Bot 6, 2-10 @ AZ",@ AZ,FA,1,1413,656,0%,4.1,0,4,8.31,1.38,0,
Bennett SousaPlayer Note HOU - P 8:10 pm vs MIA,MIA,FA,6,541,657,0%,4.1,0,5,6.23,1.85,0,
Lucas SimsNAPlayer Note CWS - P 8:05 pm @ TEX,@ TEX,FA,9,1453,658,0%,10.0,0,10,4.5,1.6,0,
Max LazarNo new player Notes PHI - P 6:40 pm vs LAD,LAD,FA,6,1319,659,0%,8.0,0,5,5.63,1.38,0,
"Dietrich EnnsNANo new player Notes BAL - P L, 3-6 @ BOS; 7:10 pm @ BOS","@ BOS,@ BOS",FA,13,575,660,0%,16.0,0,13,3.94,1.50,0,
"Caleb FergusonNo new player Notes CIN - P Top 8, 5-3 @ SEA",@ SEA,FA,21,591,661,0%,20.1,1,20,3.98,1.57,0,
"Sammy PeraltaNANo new player Notes LAA - P Bot 6, 0-1 vs STL",STL,FA,2,1368,662,0%,2.2,0,4,10.13,1.88,0,
"Luis GastelumNo new player Notes STL - P Bot 6, 1-0 @ LAA",@ LAA,FA,5,1154,663,0%,5.0,0,6,7.20,1.60,0,
"Justin BruihlNo new player Notes STL - P Bot 6, 1-0 @ LAA",@ LAA,FA,43,1371,664,0%,47.2,0,32,3.59,1.36,0,
Spencer StriderIL60Player Note ATL - P 7:15 pm vs SD,SD,Tm Mndlsn nd Mtchn,8,344,665,53%,39.0,0,46,5.31,1.36,2,
Drew SommersNo new player Notes DET - P 8:10 pm @ CHC,@ CHC,FA,18,1363,667,0%,11.1,0,16,4.76,1.68,0,
"Isaac MattsonNo new player Notes PIT - P W, 5-3 @ NYY; 7:05 pm @ NYY","@ NYY,@ NYY",FA,34,623,668,0%,32.2,0,29,4.13,1.38,0,
Jonathan CannonNANo new player Notes CWS - P 8:05 pm @ TEX,@ TEX,FA,1,1488,669,0%,0.0,0,0,-,-,0,
Trevor MartinNANo new player Notes TB - P 7:07 pm @ TOR,@ TOR,FA,6,1253,670,0%,11.1,0,7,3.97,1.59,0,
Robby SnellingIL60No new player Notes MIA - P 8:10 pm @ HOU,@ HOU,FA,1,1249,671,2%,5.0,0,2,5.40,1.80,0,
"Josh SimpsonNANo new player Notes SEA - P Top 8, 3-5 vs CIN",CIN,FA,4,1419,672,0%,3.0,0,3,9.00,2.00,0,
"Cade PovichNANo new player Notes BAL - P L, 3-6 @ BOS; 7:10 pm @ BOS","@ BOS,@ BOS",FA,4,1500,673,0%,19.1,0,12,5.12,1.34,1,
Chase LeeNANo new player Notes TOR - P 7:07 pm vs TB,TB,FA,3,693,674,0%,3.1,0,1,8.10,1.80,0,
Emiliano TeodoNAPlayer Note TEX - P 8:05 pm vs CWS,CWS,FA,1,1259,675,0%,1.2,0,1,10.80,3.00,0,
"Patrick SandovalPlayer Note BOS - P W, 6-3 vs BAL; 7:10 pm vs BAL","BAL,BAL",FA,2,1294,676,4%,9.1,0,10,4.82,1.71,0,
"Trevor McDonaldIL15Player Note SF - P L, 4-5 @ KC",@ KC,W (Jul 23),14,1301,678,5%,70.1,0,57,5.12,1.31,5,
"Mitch KellerNew Player Note PIT - P W, 5-3 @ NYY; 7:05 pm @ NYY","@ NYY,@ NYY",Joey Spierer's Team,19,230,679,26%,103.1,0,77,5.14,1.33,9,
Zebby MatthewsPlayer Note MIN - P 6:40 pm @ CLE,@ CLE,Ranger danger,12,253,680,12%,70.0,0,58,5.40,1.34,7,
"Hayden JuengerPlayer Note ATH - P Bot 6, 2-10 @ AZ",@ AZ,FA,2,1270,681,0%,2.0,0,0,13.50,2.00,0,
Jack FlahertyIL15New Player Note DET - P 8:10 pm @ CHC,@ CHC,No Longer Rowdy,19,1188,683,57%,86.1,0,102,4.59,1.41,2,
Kody FunderburkNo new player Notes MIN - P 6:40 pm @ CLE,@ CLE,FA,28,1191,684,0%,26.1,1,17,4.10,1.44,0,
Anthony KayPlayer Note CWS - P 8:05 pm @ TEX,@ TEX,Ranger danger,20,650,685,10%,93.1,0,76,4.24,1.37,3,
Connor ThomasNANo new player Notes ATL - P 7:15 pm vs SD,SD,FA,1,1428,686,0%,3.2,0,2,9.82,1.64,0,
Brenan HanifeePlayer Note DET - P 8:10 pm @ CHC,@ CHC,FA,17,1206,687,0%,17.2,0,7,4.08,1.42,0,
"Brady SingerPlayer Note CIN - P Top 8, 5-3 @ SEA",@ SEA,Stealth Bomber,19,384,688,26%,96.2,0,82,4.56,1.41,6,
"Ryan WatsonNo new player Notes BOS - P W, 6-3 vs BAL; 7:10 pm vs BAL","BAL,BAL",FA,32,1260,689,0%,51.2,1,42,4.53,1.3,0,
"Domingo GonzálezNANo new player Notes SEA - P Top 8, 3-5 vs CIN",CIN,FA,5,1279,690,0%,7.2,0,5,4.7,1.83,0,
Connor PrielippIL15Player Note MIN - P 6:40 pm @ CLE,@ CLE,Detroit Fastballs,13,1383,692,5%,66.2,0,71,5.0,1.37,3,
"Joel KuhnelIL15Player Note MIL - P W, 4-3 vs NYM",NYM,FA,35,1231,693,1%,35.1,6,22,4.84,1.47,0,
Edwin DíazIL60New Player Note LAD - P 6:40 pm @ PHI,@ PHI,Joey Spierer's Team,7,360,694,84%,6.0,4,10,10.5,2.33,0,
Andrew NardiIL60No new player Notes MIA - P 8:10 pm @ HOU,@ HOU,FA,25,616,695,0%,22.2,0,27,5.16,1.41,0,
"Drey JamesonIL15New Player Note AZ - P Bot 6, 10-2 vs ATH",ATH,FA,11,1314,696,0%,17.1,0,13,4.67,1.44,0,
Beau BrieskeNAPlayer Note DET - P 8:10 pm @ CHC,@ CHC,FA,8,1395,698,0%,9.1,0,8,6.75,1.39,0,
Roki SasakiPlayer Note LAD - P 6:40 pm @ PHI,@ PHI,Detroit Fastballs,17,330,699,34%,86.2,0,85,4.98,1.34,4,
Wyatt MillsNANo new player Notes LAD - P 6:40 pm @ PHI,@ PHI,FA,5,1285,700,0%,4.1,0,4,6.23,2.31,0,
Ian HamiltonNANo new player Notes ATL - P 7:15 pm vs SD,SD,FA,4,1265,701,0%,4.2,0,4,7.71,1.93,0,
Ethan RobertsIL15Player Note CHC - P 8:10 pm vs DET,DET,FA,23,1328,702,0%,25.2,0,17,4.21,1.4,0,
"Johan OviedoIL60Player Note BOS - P W, 6-3 vs BAL; 7:10 pm vs BAL","BAL,BAL",FA,1,1212,703,0%,3.2,0,3,9.82,1.91,0,
Landon KnackNAVideo ForecastNew Player Note LAD - P 6:40 pm @ PHI,@ PHI,FA,2,1307,704,0%,5.0,0,4,9.0,1.6,0,
Cade GibsonNo new player Notes MIA - P 8:10 pm @ HOU,@ HOU,FA,20,563,705,0%,25.2,0,24,4.91,1.36,0,
"Mason BlackNANo new player Notes KC - P W, 5-4 vs SF",SF,FA,12,1342,706,0%,17.2,0,15,3.57,1.7,0,
Travis AdamsNo new player Notes MIN - P 6:40 pm @ CLE,@ CLE,FA,19,1459,707,0%,27.2,2,34,5.53,1.45,0,
Rolddy MuñozNANo new player Notes ATL - P 7:15 pm vs SD,SD,FA,1,1366,708,0%,2.0,0,3,13.5,3.0,0,
Kyle HartPlayer Note SD - P 7:15 pm @ ATL,@ ATL,FA,25,1378,709,0%,35.0,0,30,5.66,1.14,0,
Codi HeuerNAPlayer Note CLE - P 6:40 pm vs MIN,MIN,FA,8,1320,711,0%,9.2,0,6,4.66,1.76,0,
Jordan LeasureIL60No new player Notes CWS - P 8:05 pm @ TEX,@ TEX,FA,18,559,713,0%,18.2,0,18,6.27,1.23,0,
"Tristan BeckPlayer Note SF - P L, 4-5 @ KC",@ KC,FA,8,1300,714,0%,10.2,1,5,6.75,1.41,0,
"Cole WilcoxNo new player Notes SEA - P Top 8, 3-5 vs CIN",CIN,FA,16,1379,715,0%,19.0,0,18,3.79,1.68,0,
"Ken WaldichukIL60No new player Notes WSH - P Bot 8, 8-0 @ COL",@ COL,FA,5,1312,716,0%,9.1,0,8,6.75,1.5,0,
Joe RockNANo new player Notes CWS - P 8:05 pm @ TEX,@ TEX,FA,4,1276,717,0%,10.1,0,12,3.48,2.13,0,
Ryan GustoNo new player Notes MIA - P 8:10 pm @ HOU,@ HOU,FA,11,1497,719,0%,30.2,0,27,4.7,1.37,0,
Chase ShugartNo new player Notes PHI - P 6:40 pm vs LAD,LAD,FA,28,602,720,0%,31.2,0,37,5.4,1.33,0,
Cole SulserNo new player Notes TB - P 7:07 pm @ TOR,@ TOR,FA,39,1132,721,1%,44.1,2,45,5.08,1.35,0,
"Luis CastilloNew Player Note SEA - P Top 8, 3-5 vs CIN",CIN,The Eds,19,387,722,67%,94.2,0,84,4.85,1.33,4,
"John BrebbiaNANo new player Notes COL - P Bot 8, 0-8 vs WSH",WSH,FA,3,1460,723,0%,4.1,0,2,10.38,1.62,0,
"Sean ManaeaPlayer Note NYM - P L, 3-4 @ MIL",@ MIL,FA,21,373,724,14%,79.2,0,81,4.74,1.36,2,
"Zach McCambleyNANo new player Notes CIN - P Top 8, 5-3 @ SEA",@ SEA,FA,4,1309,725,0%,4.1,0,4,6.23,2.54,0,
"Brent SuterNo new player Notes LAA - P Bot 6, 0-1 vs STL",STL,FA,36,1377,726,0%,55.1,0,48,4.55,1.3,0,
JR RitchieNANew Player Note ATL - P 7:15 pm vs SD,SD,FA,13,1348,727,3%,54.0,1,49,4.5,1.41,1,
Aaron BrooksNA60No new player Notes TB - P 7:07 pm @ TOR,@ TOR,FA,1,1327,728,0%,0.1,0,0,81.0,9.0,0,
Eric LauerNo new player Notes LAD - P 6:40 pm @ PHI,@ PHI,Cash is King,15,539,729,13%,76.2,0,47,4.81,1.28,4,
Mason EnglertNAPlayer Note TB - P 7:07 pm @ TOR,@ TOR,FA,14,1344,730,0%,35.2,1,32,4.54,1.43,0,
Will DionPlayer Note CLE - P 6:40 pm vs MIN,MIN,FA,8,1324,731,0%,14.1,0,18,5.65,1.6,0,
Adam MackoNAPlayer Note TOR - P 7:07 pm vs TB,TB,FA,19,1173,732,0%,19.2,0,21,5.03,1.53,0,
"Geoff HartliebPlayer Note ATH - P Bot 6, 2-10 @ AZ",@ AZ,FA,6,1405,733,0%,11.0,0,4,4.91,1.64,0,
"Justin SlatenPlayer Note BOS - P W, 6-3 vs BAL; 7:10 pm vs BAL","BAL,BAL",FA,27,708,734,3%,23.1,0,32,5.4,1.5,0,
