Mike YastrzemskiPlayer Note ATL - OF 7:15 pm vs SD,SD,FA,86,1221,606,1%,53/232,34,6,28,1,0.68,
Randal GrichukNo new player Notes CWS - OF 8:05 pm @ TEX,@ TEX,FA,65,1491,607,0%,36/144,23,9,24,0,0.804,
"Jeremiah JacksonNo new player Notes BAL - 2B,3B,OF L, 3-6 @ BOS; 7:10 pm @ BOS","@ BOS,@ BOS",FA,73,333,613,3%,53/210,24,7,37,2,0.671,
"Mark VientosIL10No new player Notes NYM - 1B,3B L, 3-4 @ MIL",@ MIL,FA,73,223,617,4%,50/237,25,11,35,0,0.644,
J.T. RealmutoNew Player Note PHI - C 6:40 pm vs LAD,LAD,FA,73,381,624,17%,53/246,28,7,33,3,0.643,
Jesús SánchezIL10Player Note TOR - OF 7:07 pm vs TB,TB,FA,73,601,636,3%,59/215,22,7,29,1,0.753,
"Nick LoftinNew Player Note KC - 2B,3B,OF W, 5-4 vs SF",SF,FA,64,1556,640,1%,47/193,27,4,31,1,0.723,
"Amed RosarioNo new player Notes NYY - 2B,3B L, 3-5 vs PIT; 7:05 pm vs PIT","PIT,PIT",FA,57,1510,643,1%,36/152,20,9,27,1,0.737,
"Brent RookerIL60Player Note ATH - OF  Top 6, 2-9 @ AZ",@ AZ,Joe Byron,48,202,648,50%,36/180,20,10,29,2,0.67,
"Javier SanojaNo new player Notes MIA - 2B,3B,SS,OF 8:10 pm @ HOU",@ HOU,FA,84,1255,653,10%,68/247,24,3,34,5,0.718,
"Jonah HeimPlayer Note ATH - C Top 6, 2-9 @ AZ",@ AZ,NY Bombsquad,55,1504,666,2%,42/182,20,9,31,0,0.71,
Ramón LaureanoIL60No new player Notes SD - OF 7:15 pm @ ATL,@ ATL,FA,53,567,677,25%,37/182,23,7,21,7,0.66,
"Marcus SemienPlayer Note NYM - 2B L, 3-4 @ MIL",@ MIL,Rafael Devers,83,285,682,34%,63/303,30,9,29,6,0.594,
"Joey OrtizPlayer Note MIL - 3B,SS W, 4-3 vs NYM",NYM,Stealth Bomber,88,1304,691,3%,52/227,27,5,26,7,0.629,
"Andrew VaughnPlayer Note MIL - 1B W, 4-3 vs NYM",NYM,Fightin Farmers,59,257,697,23%,49/160,21,3,26,0,0.869,
Justin CrawfordNew Player Note PHI - OF 6:40 pm vs LAD,LAD,FA,93,365,710,6%,71/276,28,2,22,13,0.648,
"Dylan CrewsNew Player Note WSH - OF Top 8, 7-0 @ COL",@ COL,Joe Byron,51,370,712,30%,39/189,29,7,20,6,0.628,
"Ryan McMahonPlayer Note NYY - 3B L, 3-5 vs PIT; 7:05 pm vs PIT","PIT,PIT",FA,81,1416,718,1%,47/217,24,9,26,3,0.659,
"Cal RaleighPlayer Note SEA - C Bot 7, 3-5 vs CIN",CIN,No Longer Rowdy,70,105,739,94%,42/259,24,10,34,2,0.574,
"Daniel SchneemannNo new player Notes CLE - 2B,3B,SS,OF 6:40 pm vs MIN",MIN,FA,81,398,741,3%,52/246,28,6,28,6,0.61,
Gleyber TorresNew Player Note DET - 2B  8:10 pm @ CHC,@ CHC,No Longer Rowdy,45,243,751,42%,46/164,27,4,18,0,0.787,
Steven KwanNew Player Note CLE - OF 6:40 pm vs MIN,MIN,Rafael Devers,94,343,753,46%,75/314,42,1,18,6,0.646,
"Jorge MateoNo new player Notes ATL - 2B,SS,OF 7:15 pm vs SD",SD,FA,62,1555,771,1%,31/127,28,4,11,9,0.675,
"Ezequiel TovarNew Player Note COL - SS Top 8, 0-7 vs WSH",WSH,Fightin Farmers,96,212,772,35%,64/328,33,8,32,5,0.559,
"Ben WilliamsonNew Player Note TB - 2B,3B,SS 7:07 pm @ TOR",@ TOR,FA,71,1479,779,1%,55/214,28,2,23,8,0.657,
"Lawrence ButlerNo new player Notes ATH - OF  Top 6, 2-9 @ AZ",@ AZ,The Eds,93,273,783,32%,51/256,34,5,23,6,0.597,
"Tyler StephensonPlayer Note CIN - C Bot 7, 5-3 @ SEA",@ SEA,FA,76,337,785,5%,58/238,20,8,27,0,0.712,
"Edouard JulienNew Player Note COL - 1B,2B Top 8, 0-7 vs WSH",WSH,FA,81,1594,791,0%,48/219,34,3,20,5,0.635,
"Henry DavisPlayer Note PIT - C W, 5-3 @ NYY; 7:05 pm @ NYY","@ NYY,@ NYY",FA,65,1634,794,1%,29/174,24,8,27,2,0.596,
Will SmithIL60New Player Note LAD - C 6:40 pm @ PHI,@ PHI,Trust The Process,52,221,795,74%,43/173,23,6,23,0,0.72,
"José TenaNo new player Notes WSH - 2B,3B Top 8, 7-0 @ COL",@ COL,FA,75,1567,796,0%,43/177,26,5,20,3,0.716,
Griffin ConinePlayer Note MIA - OF 8:10 pm @ HOU,@ HOU,Ranger danger,35,1600,797,2%,26/94,15,7,16,2,0.911,
"Brandon ValenzuelaPlayer Note TOR - C,1B 7:07 pm vs TB",TB,FA,60,1623,805,3%,40/172,20,8,21,1,0.721,
"Max MuncyNew Player Note ATH - 2B,3B,SS Top 6, 2-9 @ AZ",@ AZ,FA,47,1593,811,3%,35/156,24,5,20,3,0.69,
"Brady HouseNANo new player Notes WSH - 3B Top 8, 7-0 @ COL",@ COL,FA,44,1560,812,2%,37/163,22,7,25,1,0.681,
"Tyler FreemanNo new player Notes COL - 2B,OF Top 8, 0-7 vs WSH",WSH,FA,69,1234,819,1%,59/231,27,3,23,6,0.66,
Victor Mesa Jr.Player Note TB - OF 7:07 pm @ TOR,@ TOR,Stealth Bomber,37,1632,822,2%,22/101,16,8,15,3,0.779,
"Henry BolteNew Player Note ATH - OF Top 6, 2-9 @ AZ",@ AZ,Joe Byron,58,1602,823,6%,48/189,18,3,17,11,0.671,
"Matt ShawIL10Player Note CHC - 3B,OF 8:10 pm vs DET",DET,NY Bombsquad,56,211,826,7%,32/130,20,4,20,4,0.737,
"Justin FoscueNo new player Notes TEX - 1B,2B 8:05 pm vs CWS",CWS,FA,51,1627,830,1%,32/117,15,7,19,0,0.851,
"Masataka YoshidaNew Player Note BOS - OF W, 6-3 vs BAL; 7:10 pm vs BAL","BAL,BAL",The Eds,65,1526,838,1%,51/191,25,4,18,2,0.739,
"Miguel AndujarIL10Player Note SD - 3B,OF 7:15 pm @ ATL",@ ATL,FA,74,372,840,1%,62/239,24,5,22,2,0.726,
"Dane MyersPlayer Note CIN - OF Bot 7, 5-3 @ SEA",@ SEA,FA,68,1529,846,0%,33/127,19,3,14,6,0.753,
"Endy RodríguezIL10Player Note PIT - C,1B W, 5-3 @ NYY; 7:05 pm @ NYY","@ NYY,@ NYY",FA,35,1651,848,2%,26/100,15,5,16,2,0.858,
"Francisco LindorNew Player Note NYM - SS L, 3-4 @ MIL",@ MIL,No Longer Rowdy,45,122,849,96%,40/172,24,6,16,2,0.717,
"Jared YoungNew Player Note NYM - 1B,OF L, 3-4 @ MIL",@ MIL,FA,55,1621,851,1%,38/152,18,7,19,0,0.761,
"Jose SiriNo new player Notes LAA - OF Top 6, 0-1 vs STL",STL,FA,49,1612,858,0%,25/93,19,5,18,1,0.797,
"Tyler TolbertNew Player Note KC - SS,OF W, 5-4 vs SF",SF,FA,36,1548,872,5%,20/61,17,2,5,11,0.807,
"Ryan KreidlerNew Player Note MIN - SS,OF 6:40 pm @ CLE",@ CLE,FA,57,1628,874,1%,35/145,21,5,24,0,0.704,
Matt VierlingPlayer Note DET - OF 8:10 pm @ CHC,@ CHC,FA,86,1603,881,0%,53/253,23,5,30,4,0.593,
"Sung-Mun SongPlayer Note SD - 2B,3B,SS 7:15 pm @ ATL",@ ATL,FA,45,1630,882,1%,21/91,16,1,15,11,0.635,
"Carlos CorreaIL60No new player Notes HOU - 3B,SS 8:10 pm vs MIA",MIA,FA,32,1334,885,10%,34/122,22,3,16,1,0.787,
"Jackson HollidayPlayer Note BAL - 2B,SS L, 3-6 @ BOS; 7:10 pm @ BOS","@ BOS,@ BOS",Rafael Devers,49,319,887,22%,26/127,18,5,15,4,0.684,
Nick FortesNew Player Note TB - C 7:07 pm @ TOR,@ TOR,FA,76,1542,889,1%,59/222,27,4,25,0,0.677,
"Colt EmersonNo new player Notes SEA - 3B,SS Bot 7, 3-5 vs CIN",CIN,Joe Byron,50,362,893,10%,31/161,18,7,21,3,0.624,
"Marcell OzunaNo new player Notes PIT - Util W, 5-3 @ NYY; 7:05 pm @ NYY","@ NYY,@ NYY",FA,63,335,896,3%,48/231,20,8,28,0,0.629,
Moisés BallesterosNANo new player Notes CHC - C 8:10 pm vs DET,DET,FA,59,1613,897,4%,36/156,16,6,23,1,0.688,
"José FermínNew Player Note STL - 2B,3B,OF Top 6, 1-0 @ LAA",@ LAA,FA,64,1601,898,0%,45/169,18,4,20,3,0.719,
Nathan LukesPlayer Note TOR - OF 7:07 pm vs TB,TB,FA,66,1272,905,2%,62/214,23,5,18,0,0.738,
"Andruw MonasterioPlayer Note BOS - 1B,2B,3B,SS W, 6-3 vs BAL; 7:10 pm vs BAL","BAL,BAL",Fightin Farmers,60,1599,908,1%,39/163,20,5,17,2,0.731,
"Brice MatthewsIL10Player Note HOU - 2B,OF 8:10 pm vs MIA",MIA,FA,82,1631,910,1%,41/208,23,7,22,4,0.582,
"Wade MecklerNew Player Note LAA - OF Top 6, 0-1 vs STL",STL,FA,46,1610,911,1%,39/129,19,2,17,3,0.782,
Eli WhiteVideo ForecastNo new player Notes ATL - OF 7:15 pm vs SD,SD,FA,59,1549,912,0%,27/122,17,5,17,4,0.68,
"Edmundo SosaNo new player Notes PHI - 2B,3B,SS,OF 6:40 pm vs LAD",LAD,FA,55,1528,915,1%,34/156,17,5,25,3,0.615,
"Luisangel AcuñaNo new player Notes CWS - 2B,SS,OF 8:05 pm @ TEX",@ TEX,FA,71,1545,916,1%,38/153,18,1,12,15,0.57,
Alejandro OsunaNew Player Note TEX - OF 8:05 pm vs CWS,CWS,FA,64,1590,919,0%,45/170,23,1,21,4,0.665,
"Isiah Kiner-FalefaIL10Player Note BOS - 2B,3B,SS W, 6-3 vs BAL; 7:10 pm vs BAL","BAL,BAL",FA,47,1454,920,1%,33/119,19,2,13,7,0.705,
"Jose FernandezNANo new player Notes AZ - 1B,3B,SS Top 6, 9-2 vs ATH",ATH,FA,55,1608,923,1%,42/165,23,3,15,7,0.641,
"Josh LoweNew Player Note LAA - OF Top 6, 0-1 vs STL",STL,W (Jul 24),63,1520,925,2%,36/180,17,8,22,3,0.605,
Kyle HigashiokaIL10New Player Note TEX - C 8:05 pm vs CWS,CWS,FA,56,1559,929,1%,36/165,20,7,18,0,0.676,
"Tommy EdmanPlayer Note LAD - 2B,3B,OF 6:40 pm @ PHI",@ PHI,No Longer Rowdy,27,1517,933,27%,28/82,15,2,14,2,0.926,
Miguel AmayaNo new player Notes CHC - C 8:10 pm vs DET,DET,FA,54,1604,934,0%,32/138,26,3,15,0,0.705,
"Jeff McNeilVideo ForecastPlayer Note ATH - 2B,OF Top 6, 2-9 @ AZ",@ AZ,FA,89,1471,935,4%,64/273,26,3,30,2,0.606,
Wenceel PérezIL60No new player Notes DET - OF 8:10 pm @ CHC,@ CHC,FA,53,1544,936,0%,29/161,22,7,17,3,0.594,
Adolis GarcíaIL60No new player Notes PHI - OF 6:40 pm vs LAD,LAD,Rafael Devers,67,286,939,13%,45/231,21,7,21,3,0.599,
"Nolan GormanNANo new player Notes STL - 2B,3B Top 6, 1-0 @ LAA",@ LAA,FA,62,1586,940,1%,39/201,19,7,26,0,0.597,
Yainer DiazPlayer Note HOU - C 8:10 pm vs MIA,MIA,FA,47,121,942,41%,43/178,19,6,23,0,0.66,
"Tristan GrayNAPlayer Note MIN - 2B,3B,SS 6:40 pm @ CLE",@ CLE,FA,63,1616,945,0%,39/168,16,4,29,2,0.604,
"Tyrone TaylorNo new player Notes NYM - OF L, 3-4 @ MIL",@ MIL,FA,58,1591,951,0%,29/126,15,7,18,0,0.717,
"Joey WiemerNANo new player Notes WSH - OF Top 8, 7-0 @ COL",@ COL,FA,32,1645,952,1%,20/70,16,3,12,1,0.912,
"Tyler O'NeillPlayer Note BAL - OF L, 3-6 @ BOS; 7:10 pm @ BOS","@ BOS,@ BOS",FA,61,1605,954,1%,33/161,22,6,15,1,0.657,
Luis CampusanoNew Player Note SD - C 7:15 pm @ ATL,@ ATL,FA,30,1675,957,1%,23/79,14,4,12,0,0.93,
"Connor NorbyNANo new player Notes MIA - 1B,3B 8:10 pm @ HOU",@ HOU,FA,65,1584,959,1%,41/200,17,4,16,6,0.638,
"Andrés ChaparroPlayer Note WSH - 1B Top 8, 7-0 @ COL",@ COL,W (Jul 24),35,1683,961,1%,14/66,14,4,18,0,0.781,
"Samad TaylorIL10No new player Notes SD - 2B,OF 7:15 pm @ ATL",@ ATL,FA,26,173,965,5%,29/88,14,1,11,6,0.808,
"Drew GilbertNo new player Notes SF - OF L, 4-5 @ KC",@ KC,FA,79,1644,966,0%,47/206,23,4,21,0,0.661,
Myles StrawNo new player Notes TOR - OF 7:07 pm vs TB,TB,FA,88,1532,967,0%,35/157,26,3,16,3,0.595,
"Anthony VolpeNo new player Notes NYY - SS L, 3-5 vs PIT; 7:05 pm vs PIT","PIT,PIT",FA,47,291,969,3%,35/143,18,1,14,7,0.663,
"Jared TrioloNew Player Note PIT - 1B,2B,3B,SS W, 5-3 @ NYY; 7:05 pm @ NYY","@ NYY,@ NYY",FA,66,1543,970,1%,49/201,23,1,18,6,0.633,
"Dylan BeaversPlayer Note BAL - OF L, 3-6 @ BOS; 7:10 pm @ BOS","@ BOS,@ BOS",FA,47,1626,971,1%,34/140,19,2,14,4,0.691,
"Donovan WaltonNew Player Note ATH - 2B,3B Top 6, 2-9 @ AZ",@ AZ,FA,37,1654,972,0%,30/99,17,3,12,0,0.868,
"Alex FreelandNo new player Notes LAD - 2B,3B,SS 6:40 pm @ PHI",@ PHI,FA,71,1640,973,1%,45/194,24,3,19,2,0.625,
Austin HedgesNo new player Notes CLE - C 6:40 pm vs MIN,MIN,FA,49,1636,974,0%,37/132,18,3,15,1,0.742,
"Miguel RojasNo new player Notes LAD - 2B,3B,SS 6:40 pm @ PHI",@ PHI,FA,66,1538,976,1%,42/144,16,3,17,0,0.752,
"Blake DunnIL10Player Note CIN - OF Bot 7, 5-3 @ SEA",@ SEA,FA,38,1625,980,1%,40/142,20,2,7,6,0.722,
Braden MontgomeryPlayer Note CWS - OF 8:05 pm @ TEX,@ TEX,Trust The Process,34,232,984,10%,29/124,17,3,18,1,0.702,
"Noelvi MarteNew Player Note CIN - 3B,OF Bot 7, 5-3 @ SEA",@ SEA,Cash is King,45,308,986,26%,26/137,16,6,13,5,0.605,
"Lars NootbaarNew Player Note STL - OF Top 6, 1-0 @ LAA",@ LAA,Trust The Process,37,315,989,3%,30/121,18,3,12,1,0.74,
"Jasson DomínguezVideo ForecastPlayer Note NYY - OF L, 3-5 vs PIT; 7:05 pm vs PIT","PIT,PIT",Cookie Monster ,40,1480,990,11%,34/148,15,5,11,6,0.657,
"Connor WongNo new player Notes BOS - C W, 6-3 vs BAL; 7:10 pm vs BAL","BAL,BAL",FA,45,1642,996,0%,33/119,14,1,15,3,0.744,
"Jorbit VivasNo new player Notes WSH - 2B,3B Top 8, 7-0 @ COL",@ COL,FA,73,1667,997,0%,44/184,21,3,18,0,0.653,
"Tyler CallihanNo new player Notes PIT - 2B,CI,OF W, 5-3 @ NYY; 7:05 pm @ NYY","@ NYY,@ NYY",FA,31,1688,998,0%,20/83,13,3,15,1,0.765,
"Cooper PrattPlayer Note MIL - SS W, 4-3 vs NYM",NYM,Ranger danger,29,1677,999,4%,24/89,13,1,8,7,0.716,
Yohendrick PiñangoNew Player Note TOR - OF 7:07 pm vs TB,TB,FA,51,1656,1000,0%,40/150,11,5,20,0,0.726,
"Jacob GonzalezPlayer Note PIT - 1B,2B,SS W, 5-3 @ NYY; 7:05 pm @ NYY","@ NYY,@ NYY",The Eds,35,1673,1001,3%,25/98,13,3,20,0,0.722,
Christian VázquezNo new player Notes HOU - C 8:10 pm vs MIA,MIA,FA,62,1657,1002,1%,38/178,18,5,22,1,0.6,
Alex CallNo new player Notes LAD - OF 6:40 pm @ PHI,@ PHI,FA,59,1575,1004,0%,29/117,19,1,16,1,0.673,
"Max SchuemannNew Player Note NYY - 2B,3B,SS,OF L, 3-5 vs PIT; 7:05 pm vs PIT","PIT,PIT",FA,33,1658,1006,0%,13/57,17,2,6,3,0.801,
"Marcelo MayerIL10Player Note BOS - 2B,3B,SS W, 6-3 vs BAL; 7:10 pm vs BAL","BAL,BAL",FA,70,397,1010,3%,45/205,19,3,22,3,0.594,
"Tommy TroyIL10Player Note AZ - 2B,OF Top 6, 9-2 vs ATH",ATH,FA,39,1687,1012,0%,27/121,22,4,9,1,0.663,
David FryNo new player Notes CLE - OF 6:40 pm vs MIN,MIN,FA,66,1674,1013,0%,26/136,16,6,13,0,0.657,
"Gabriel AriasNew Player Note CLE - 2B,3B,SS 6:40 pm vs MIN",MIN,FA,35,1578,1014,1%,25/103,11,5,10,4,0.692,
"Nicky LopezNew Player Note TEX - 2B,3B,SS 8:05 pm vs CWS",CWS,FA,48,1622,1016,1%,42/132,15,1,14,4,0.712,
"Hyeseong KimNANo new player Notes LAD - 2B,SS,OF 6:40 pm @ PHI",@ PHI,FA,43,352,1017,1%,30/116,16,1,11,5,0.651,
"Tim TawaPlayer Note AZ - 1B,2B,OF Top 6, 9-2 vs ATH",ATH,NY Bombsquad,44,1653,1018,3%,21/101,10,4,16,2,0.663,
"Kyle IsbelIL10New Player Note KC - OF W, 5-4 vs SF",SF,FA,56,1571,1019,1%,40/164,16,3,11,5,0.652,
Agustín RamírezNANo new player Notes MIA - C 8:10 pm @ HOU,@ HOU,NY Bombsquad,31,1502,1020,33%,26/113,14,2,14,3,0.663,
"Brenton DoyleIL10New Player Note COL - OF Top 8, 0-7 vs WSH",WSH,Detroit Fastballs,43,278,1022,30%,23/111,21,1,4,9,0.549,
"Mitch GarverNo new player Notes SEA - C Bot 7, 3-5 vs CIN",CIN,FA,45,1655,1023,0%,21/114,17,4,14,0,0.627,
"Victor Scott IINANo new player Notes STL - OF Top 6, 1-0 @ LAA",@ LAA,FA,61,1563,1024,1%,30/155,19,2,9,9,0.534,
"Adrian Del CastilloPlayer Note AZ - C Top 6, 9-2 vs ATH",ATH,FA,52,1664,1025,0%,30/154,14,5,23,0,0.581,
Elias DíazNew Player Note TEX - C 8:05 pm vs CWS,CWS,FA,41,1618,1026,0%,26/100,11,4,16,0,0.722,
"Nelson VelázquezNo new player Notes STL - OF Top 6, 1-0 @ LAA",@ LAA,FA,26,1700,1028,0%,14/61,10,4,12,0,0.779,
"Luis TorrensPlayer Note NYM - C L, 3-4 @ MIL",@ MIL,FA,61,1629,1029,0%,39/170,22,2,19,0,0.621,
"Weston WilsonNew Player Note SEA - 2B,3B,OF Bot 7, 3-5 vs CIN",CIN,FA,32,1662,1031,0%,15/65,10,3,9,4,0.706,
"Brendan DonovanIL10Player Note SEA - 2B,3B,SS,OF Bot 7, 3-5 vs CIN",CIN,Ranger danger,25,1518,1034,49%,23/84,9,3,8,1,0.838,
"Trevor StoryIL60Player Note BOS - SS  W, 6-3 vs BAL; 7:10 pm vs BAL","BAL,BAL",Joey Spierer's Team,41,307,1035,38%,34/165,16,3,19,4,0.547,
"Hao-Yu LeePlayer Note DET - 2B,3B 8:10 pm @ CHC",@ CHC,FA,59,1672,1036,1%,42/164,13,4,17,1,0.671,
"Luis RengifoPlayer Note SD - 2B,3B,OF 7:15 pm @ ATL",@ ATL,FA,61,1552,1038,1%,44/197,23,0,20,3,0.568,
James OutmanNo new player Notes DET - OF 8:10 pm @ CHC,@ CHC,FA,78,1712,1039,0%,21/138,19,3,13,6,0.49,
"Brett SullivanNew Player Note COL - C Top 8, 0-7 vs WSH",WSH,FA,50,1706,1040,0%,28/127,13,4,15,0,0.657,
"MJ MelendezNANo new player Notes NYM - OF L, 3-4 @ MIL",@ MIL,FA,56,1752,1041,0%,23/120,14,4,11,0,0.665,
"Logan O'HoppeNew Player Note LAA - C Top 6, 0-1 vs STL",STL,FA,72,386,1042,3%,47/223,20,4,23,0,0.575,
Nick CastellanosNANo new player Notes SD - OF 7:15 pm @ ATL,@ ATL,FA,39,1501,1043,1%,22/115,9,4,20,2,0.56,
"Brandon LockridgeIL60Player Note MIL - OF W, 4-3 vs NYM",NYM,FA,28,1639,1044,0%,25/85,9,0,12,5,0.709,
Joey BartNo new player Notes ATL - C 7:15 pm vs SD,SD,FA,37,1649,1045,0%,20/94,12,4,13,0,0.658,
Kahlil WatsonNANew Player Note CLE - OF 6:40 pm vs MIN,MIN,Stealth Bomber,27,1690,1046,1%,21/88,6,1,11,9,0.605,
"Davis SchneiderNANo new player Notes TOR - 2B,OF 7:07 pm vs TB",TB,FA,49,1650,1047,0%,15/98,16,3,12,1,0.578,
"Victor BericotoIL10No new player Notes SF - OF L, 4-5 @ KC",@ KC,FA,24,1698,1049,1%,17/58,7,4,9,1,0.857,
"Denzer GuzmanNew Player Note LAA - 3B,SS Top 6, 0-1 vs STL",STL,FA,32,1689,1050,1%,29/118,11,4,14,1,0.669,
"Giancarlo StantonIL10Player Note NYY - OF L, 3-5 vs PIT; 7:05 pm vs PIT","PIT,PIT",Joe Byron,24,296,1051,21%,23/90,8,3,14,1,0.724,
"Braden ShewmakeNo new player Notes MIL - 2B,3B,SS W, 4-3 vs NYM",NYM,FA,34,1696,1053,0%,22/85,12,3,10,1,0.694,
"Zach McKinstryPlayer Note DET - 2B,3B,SS,OF 8:10 pm @ CHC",@ CHC,FA,76,1547,1054,2%,44/231,21,4,19,1,0.56,
Taylor TrammellNo new player Notes HOU - OF 8:10 pm vs MIA,MIA,FA,47,1686,1055,0%,28/121,14,3,12,1,0.654,
"Pedro RamirezNew Player Note CHC - 2B,3B 8:10 pm vs DET",DET,Tm Mndlsn nd Mtchn,30,1699,1057,1%,20/70,9,1,11,2,0.772,
"Jorge BarrosaPlayer Note AZ - OF Top 6, 9-2 vs ATH",ATH,FA,70,1726,1058,0%,23/119,21,2,10,0,0.626,
"Jake CronenworthPlayer Note SD - 1B,2B,SS 7:15 pm @ ATL",@ ATL,Rafael Devers,50,1565,1060,6%,31/158,18,3,12,3,0.565,
"Ryan WaldschmidtNew Player Note AZ - OF Top 6, 9-2 vs ATH",ATH,Ranger danger,38,353,1061,3%,32/127,13,0,9,6,0.65,
"Anthony SeiglerNew Player Note BOS - 2B,3B W, 6-3 vs BAL; 7:10 pm vs BAL","BAL,BAL",Detroit Fastballs,26,1709,1062,2%,22/90,13,2,7,2,0.706,
"Blaze JordanPlayer Note STL - 1B,3B Top 6, 1-0 @ LAA",@ LAA,FA,27,1703,1065,2%,22/88,10,1,18,0,0.638,
"Ryan WardNANo new player Notes LAD - 1B,OF 6:40 pm @ PHI",@ PHI,FA,20,1727,1066,0%,12/55,8,3,12,0,0.738,
Patrick BaileyPlayer Note CLE - C 6:40 pm vs MIN,MIN,FA,68,1615,1067,1%,38/191,18,4,17,2,0.547,
"Luis Robert Jr.Video ForecastNew Player Note NYM - OF L, 3-4 @ MIL",@ MIL,Trust The Process,26,226,1069,42%,20/94,11,3,9,2,0.648,
"Bryan TorresPlayer Note STL - 2B,OF Top 6, 1-0 @ LAA",@ LAA,FA,34,1738,1070,0%,14/69,9,4,8,1,0.702,
"Braxton FulfordNo new player Notes COL - C Top 8, 0-7 vs WSH",WSH,FA,38,1710,1071,0%,11/59,12,1,7,4,0.57,
Joey LoperfidoNANo new player Notes HOU - OF 8:10 pm vs MIA,MIA,FA,39,1680,1074,0%,22/102,13,1,12,1,0.647,
"Alika WilliamsNo new player Notes ATH - 2B,3B,SS Top 6, 2-9 @ AZ",@ AZ,FA,40,1702,1075,0%,25/92,13,2,9,0,0.737,
Alek ThomasNANo new player Notes LAD - OF 6:40 pm @ PHI,@ PHI,FA,28,1617,1076,0%,17/94,12,2,10,4,0.562,
"Jordan LawlarIL10Player Note AZ - 3B,MI,OF Top 6, 9-2 vs ATH",ATH,FA,12,391,1078,6%,12/38,6,1,4,4,0.856,
Petey HalpinPlayer Note CLE - OF 6:40 pm vs MIN,MIN,FA,35,1717,1079,0%,16/74,12,2,5,4,0.599,
"Nick AllenPlayer Note HOU - 2B,SS 8:10 pm vs MIA",MIA,FA,51,1676,1080,0%,22/92,14,1,10,2,0.591,
"TJ FriedlNew Player Note CIN - OF Bot 7, 5-3 @ SEA",@ SEA,FA,62,1553,1081,7%,34/196,19,3,11,5,0.522,
"Harrison BaderIL10Player Note SF - OF L, 4-5 @ KC",@ KC,FA,30,332,1082,2%,18/106,10,5,14,0,0.556,
"Colby ThomasDTDNew Player Note ATH - OF Top 6, 2-9 @ AZ",@ AZ,FA,50,1684,1083,0%,21/103,11,4,11,1,0.591,
"Pedro PagésDTDNew Player Note STL - C Top 6, 1-0 @ LAA",@ LAA,FA,57,1633,1084,0%,31/148,13,4,11,2,0.578,
"Jose TrevinoPlayer Note CIN - C Bot 7, 5-3 @ SEA",@ SEA,FA,24,1659,1085,0%,20/75,9,3,10,0,0.703,
Jake RogersNo new player Notes DET - C 8:10 pm @ CHC,@ CHC,FA,33,1730,1086,0%,15/90,11,3,9,1,0.585,
Kyle TeelIL10New Player Note CWS - C 8:05 pm @ TEX,@ TEX,W (Jul 23),19,324,1088,9%,12/63,9,2,14,0,0.588,
"Blake PerkinsPlayer Note MIL - OF W, 4-3 vs NYM",NYM,FA,54,1682,1089,0%,14/89,14,1,11,3,0.508,
"Joshua Kuroda-GrauerIL10New Player Note ATH - 3B,SS Top 6, 2-9 @ AZ",@ AZ,Joey Spierer's Team,16,1695,1090,5%,25/60,8,1,4,0,1.018,
Everson PereiraIL7Player Note CWS - OF 8:05 pm @ TEX,@ TEX,FA,21,1735,1091,0%,16/69,7,3,7,1,0.719,
"Austin WellsNo new player Notes NYY - C L, 3-5 vs PIT; 7:05 pm vs PIT","PIT,PIT",FA,69,1614,1094,5%,32/202,19,6,13,1,0.51,
Hunter FeducciaPlayer Note TB - C 7:07 pm @ TOR,@ TOR,FA,54,1737,1095,0%,29/126,13,2,11,0,0.643,
"Max KeplerNew Player Note AZ - OF Top 6, 9-2 vs ATH",ATH,FA,16,1611,1096,0%,12/50,5,2,12,0,0.706,
"Leo JiménezNo new player Notes MIA - 2B,3B 8:10 pm @ HOU",@ HOU,FA,46,1749,1097,0%,25/118,14,2,9,1,0.606,
"Will BensonNANo new player Notes CIN - OF Bot 7, 5-3 @ SEA",@ SEA,FA,51,1661,1099,0%,18/96,11,3,6,1,0.643,
Danny JansenIL10Player Note TEX - C 8:05 pm vs CWS,CWS,FA,41,1685,1100,0%,21/123,11,3,12,1,0.586,
"Starling MarteNo new player Notes KC - OF W, 5-4 vs SF",SF,FA,45,1592,1101,0%,31/115,12,1,9,1,0.663,
Jake MeyersNANo new player Notes HOU - OF 8:10 pm vs MIA,MIA,FA,52,1588,1102,0%,28/136,14,3,11,1,0.58,
"LaMonte Wade Jr.Player Note HOU - 1B,OF 8:10 pm vs MIA",MIA,FA,15,1743,1103,0%,8/43,8,2,8,0,0.699,
"Roman AnthonyIL60Player Note BOS - OF  W, 6-3 vs BAL; 7:10 pm vs BAL","BAL,BAL",Tm Mndlsn nd Mtchn,30,178,1104,75%,25/109,12,1,5,2,0.675,
"Lourdes Gurriel Jr.IL10Player Note AZ - OF Top 6, 9-2 vs ATH",ATH,FA,47,1524,1105,1%,36/174,12,2,21,1,0.541,
Matt WallnerNANo new player Notes MIN - OF 6:40 pm @ CLE,@ CLE,FA,34,1648,1107,1%,20/120,14,4,10,0,0.551,
"Yoán MoncadaIL60No new player Notes LAA - 3B Top 6, 0-1 vs STL",STL,FA,41,1678,1108,0%,21/111,9,3,10,1,0.605,
"Drew MillasIL10Player Note WSH - C Top 8, 7-0 @ COL",@ COL,FA,50,1724,1109,0%,24/130,18,2,11,0,0.539,
"Eric HaaseNAPlayer Note SF - C L, 4-5 @ KC",@ KC,FA,29,1741,1110,0%,12/74,8,4,9,0,0.6,
"Sterlin ThompsonNANo new player Notes COL - 1B,OF Top 8, 0-7 vs WSH",WSH,FA,27,1757,1112,0%,16/69,7,2,10,0,0.689,
"Javier BáezIL60Player Note DET - 2B,3B,SS,OF 8:10 pm @ CHC",@ CHC,FA,24,1585,1113,2%,20/78,10,2,6,1,0.677,
Drew RomoNo new player Notes CWS - C 8:05 pm @ TEX,@ TEX,FA,38,1854,1114,0%,15/115,9,5,11,1,0.521,
"Jonah CoxIL10No new player Notes SF - OF L, 4-5 @ KC",@ KC,FA,24,1756,1115,0%,7/26,5,1,3,4,0.769,
"Carlos NarváezNew Player Note BOS - C W, 6-3 vs BAL; 7:10 pm vs BAL","BAL,BAL",FA,55,1624,1116,1%,32/160,17,3,9,1,0.56,
Jake FraleyIL10No new player Notes TB - OF 7:07 pm @ TOR,@ TOR,FA,28,1663,1117,0%,19/82,6,2,5,3,0.69,
"Adam FrazierIL10Player Note LAA - 2B,OF Top 6, 0-1 vs STL",STL,FA,40,1619,1118,0%,17/81,15,1,6,0,0.63,
"Jonathan IndiaIL60No new player Notes KC - 2B,3B,OF W, 5-4 vs SF",SF,FA,17,1637,1119,1%,8/48,8,2,8,0,0.623,
"Darell HernaizNANo new player Notes ATH - 2B,3B,SS Top 6, 2-9 @ AZ",@ AZ,FA,47,1691,1120,0%,28/118,12,1,7,3,0.606,
Dustin HarrisNAPlayer Note SD - OF 7:15 pm @ ATL,@ ATL,FA,17,1750,1121,0%,10/43,6,0,5,4,0.635,
"Jesus RodriguezNo new player Notes SF - C L, 4-5 @ KC",@ KC,FA,16,1761,1122,0%,11/45,4,2,8,1,0.728,
"Victor RoblesPlayer Note SEA - OF Bot 7, 3-5 vs CIN",CIN,FA,46,1670,1123,0%,26/108,10,0,5,7,0.553,
"Spencer JonesNew Player Note NYY - OF L, 3-5 vs PIT; 7:05 pm vs PIT","PIT,PIT",NY Bombsquad,30,1770,1124,4%,17/73,6,2,7,1,0.687,
"Daniel SusacNew Player Note SF - C L, 4-5 @ KC",@ KC,FA,39,1725,1125,1%,29/110,5,0,14,2,0.644,
Jonatan ClaseNANew Player Note TOR - OF 7:07 pm vs TB,TB,FA,9,1736,1126,0%,6/22,4,2,6,0,0.905,
Freddy FerminNew Player Note SD - C 7:15 pm @ ATL,@ ATL,FA,62,1704,1127,0%,23/145,15,3,11,0,0.529,
"Billy CookPlayer Note PIT - OF W, 5-3 @ NYY; 7:05 pm @ NYY","@ NYY,@ NYY",FA,58,1747,1130,0%,9/41,9,0,2,5,0.513,
"Ramón UríasIL60No new player Notes STL - 2B,3B Top 6, 1-0 @ LAA",@ LAA,FA,25,1679,1131,0%,9/57,9,2,5,0,0.595,
Jim JarvisNew Player Note ATL - SS 7:15 pm vs SD,SD,FA,15,1759,1132,1%,14/48,6,1,6,0,0.791,
"Jimmy CrooksNew Player Note STL - C Top 6, 1-0 @ LAA",@ LAA,FA,28,1828,1133,0%,12/68,4,3,9,0,0.62,
"Eduardo ValenciaNAPlayer Note DET - C,1B 8:10 pm @ CHC",@ CHC,FA,6,1779,1134,0%,5/12,3,2,3,0,1.379,
Zach DezenzoNo new player Notes HOU - OF 8:10 pm vs MIA,MIA,FA,30,1720,1136,0%,15/65,11,1,3,1,0.644,
Alejandro KirkPlayer Note TOR - C 7:07 pm vs TB,TB,FA,30,305,1137,21%,20/98,8,2,10,0,0.594,
Edgar QueroPlayer Note CWS - C 8:05 pm @ TEX,@ TEX,FA,55,1681,1138,0%,28/150,12,2,15,1,0.486,
"Jhonny PeredaNANo new player Notes SEA - C Bot 7, 3-5 vs CIN",CIN,FA,19,1746,1139,0%,17/63,8,2,4,0,0.689,
"Harry FordPlayer Note WSH - C Top 8, 7-0 @ COL",@ COL,Cash is King,3,1793,1140,2%,3/11,3,1,4,1,1.021,
"Jordan BeckNANo new player Notes COL - OF Top 8, 0-7 vs WSH",WSH,FA,30,339,1142,3%,15/82,7,1,10,2,0.532,
"James McCannNo new player Notes AZ - C Top 6, 9-2 vs ATH",ATH,FA,24,1692,1143,0%,16/70,5,2,11,0,0.596,
"Josh SmithNANo new player Notes TEX - 1B,2B,3B,SS,OF 8:05 pm vs CWS",CWS,FA,40,1598,1144,1%,28/122,8,1,8,2,0.607,
"Luis UríasPlayer Note TOR - 2B,3B 7:07 pm vs TB",TB,FA,15,1713,1145,0%,8/29,3,2,3,0,0.861,
Zach ColeNANo new player Notes HOU - OF 8:10 pm vs MIA,MIA,FA,19,1751,1146,0%,8/51,4,3,8,0,0.542,
Austin SlaterNANo new player Notes TB - OF 7:07 pm @ TOR,@ TOR,FA,28,1721,1147,0%,15/65,6,0,3,4,0.588,
Rodolfo DuránPlayer Note SD - C 7:15 pm @ ATL,@ ATL,FA,36,1849,1148,0%,12/82,8,3,8,0,0.527,
"Enrique HernándezIL10Player Note LAD - 1B,2B,3B,OF 6:40 pm @ PHI",@ PHI,FA,2,1694,1150,1%,4/4,2,1,2,0,3.25,
"Nate EatonNAPlayer Note BOS - 3B,OF W, 6-3 vs BAL; 7:10 pm vs BAL","BAL,BAL",FA,14,1744,1151,0%,4/32,3,1,5,2,0.563,
Alex JacksonNo new player Notes MIN - C 6:40 pm @ CLE,@ CLE,FA,23,1718,1152,0%,17/55,6,1,4,0,0.751,
"Tsung-Che ChengNo new player Notes BOS - 2B,3B,SS W, 6-3 vs BAL; 7:10 pm vs BAL","BAL,BAL",FA,13,1785,1153,0%,10/36,7,0,5,0,0.647,
"Santiago EspinalNANo new player Notes TEX - 2B,3B,OF 8:05 pm vs CWS",CWS,FA,36,1708,1154,0%,15/56,5,1,7,0,0.651,
Graham PauleyPlayer Note MIA - 3B 8:10 pm @ HOU,@ HOU,FA,38,1755,1155,0%,16/93,9,1,11,1,0.504,
"Romy GonzalezPlayer Note BOS - 1B,2B W, 6-3 vs BAL; 7:10 pm vs BAL","BAL,BAL",Cash is King,14,1607,1156,1%,9/49,5,1,6,1,0.579,
Nick MadrigalNANo new player Notes TB - 2B 7:07 pm @ TOR,@ TOR,FA,15,1783,1158,0%,12/44,7,0,2,1,0.68,
"Jahmai JonesPlayer Note BOS - OF W, 6-3 vs BAL; 7:10 pm vs BAL","BAL,BAL",FA,60,1716,1159,0%,15/100,9,3,9,0,0.494,
"Tyler BlackNANo new player Notes MIL - 1B W, 4-3 vs NYM",NYM,FA,9,1782,1160,0%,9/27,2,0,7,0,0.838,
"Mickey GasperNANo new player Notes BOS - C W, 6-3 vs BAL; 7:10 pm vs BAL","BAL,BAL",FA,34,1748,1161,0%,26/107,11,0,7,0,0.613,
"Rafael Flores Jr.No new player Notes PIT - C,1B W, 5-3 @ NYY; 7:05 pm @ NYY","@ NYY,@ NYY",FA,6,1831,1162,0%,4/12,2,1,2,0,1.167,
Bryce JohnsonNANo new player Notes SD - OF 7:15 pm @ ATL,@ ATL,FA,32,1733,1163,0%,8/45,5,0,2,5,0.451,
"Shay WhitcombNANo new player Notes HOU - 2B,3B 8:10 pm vs MIA",MIA,FA,17,1855,1164,0%,3/23,2,2,5,0,0.558,
Jase BowenNo new player Notes SD - OF 7:15 pm @ ATL,@ ATL,FA,32,1815,1165,0%,7/47,7,0,3,4,0.391,
"Bryce TeodosioNANo new player Notes LAA - OF Top 6, 0-1 vs STL",STL,FA,34,1768,1166,0%,10/47,5,0,2,4,0.515,
Parker MeadowsIL60No new player Notes DET - OF 8:10 pm @ CHC,@ CHC,FA,12,1723,1167,0%,9/36,3,0,2,3,0.641,
Rowdy TellezNANo new player Notes ATL - 1B 7:15 pm vs SD,SD,FA,7,1666,1168,0%,2/10,2,1,4,0,0.773,
Gabriel Rincones Jr.New Player Note PHI - OF 6:40 pm vs LAD,LAD,FA,24,1827,1169,0%,13/74,7,2,7,0,0.516,
