Pitchers,Opp: 7/9,Roster Status,GP*,Rankings_Pre-Season,Rankings_Current,Trends_% Ros,Season (total)_IP*,Season (total)_SV,Season (total)_K,Season (total)_ERA,Season (total)_WHIP,Season (total)_QS,
Jacob MisiorowskiPlayer Note MIL - P  7:45 pm @ STL,@ STL,The Eds,18,9,3,98%,111.0,0,167,1.62,0.76,12,
"Cam SchlittlerPlayer Note NYY - P W, 12-4 @ TB",@ TB,Detroit Fastballs,19,14,14,98%,112.0,0,131,2.01,0.93,11,
Yoshinobu YamamotoPlayer Note LAD - P ,,NY Bombsquad,16,13,24,99%,104.2,0,100,2.49,0.88,13,
Shohei Ohtani (Pitcher)Video ForecastPlayer Note LAD - P ,,Detroit Fastballs,84,58,29,98%,85.2,0,95,1.79,0.95,12,
Mason MillerPlayer Note SD - P  9:40 pm vs AZ,AZ,Stealth Bomber,36,21,35,99%,37.2,23,69,0.96,0.8,0,
Zack WheelerVideo ForecastPlayer Note PHI - P 7:10 pm @ CIN,@ CIN,The Eds,14,27,36,97%,87.0,0,98,2.28,0.91,10,
Cristopher SánchezPlayer Note PHI - P  7:10 pm @ CIN,@ CIN,Cookie Monster ,19,8,39,99%,120.1,0,137,2.62,1.16,13,
"Drew RasmussenPlayer Note TB - P L, 4-12 vs NYY",NYY,Tm Mndlsn nd Mtchn,17,104,41,94%,97.0,0,96,2.78,0.9,10,
"Joe RyanPlayer Note MIN - P Bot 9, 2-5 vs CLE",CLE,Cash is King,19,40,46,99%,104.1,0,122,2.85,1.04,10,
Foster GriffinNew Player Note WSH - P,,Joey Spierer's Team,19,254,48,81%,110.1,0,109,2.77,1.02,10,
Louis VarlandPlayer Note TOR - P,,Trust The Process,43,98,49,84%,48.0,18,66,0.94,0.94,0,
"Chris SalePlayer Note ATL - P  Top 9, 6-5 @ PIT",@ PIT,Rafael Devers,16,26,51,99%,95.0,0,112,2.27,1.12,10,
Dylan CeaseNew Player Note TOR - P,,Rafael Devers,17,133,52,99%,98.1,0,148,2.56,1.13,7,
Chase BurnsNew Player Note CIN - P  7:10 pm vs PHI,PHI,Cash is King,18,20,59,98%,102.2,0,118,2.54,1.11,9,
"Bryan BakerNew Player Note TB - P L, 4-12 vs NYY",NYY,Stealth Bomber,38,144,61,78%,36.1,25,41,1.73,0.83,0,
Jacob LatzPlayer Note TEX - P 8:05 pm vs LAA,LAA,Joe Byron,33,197,62,66%,42.0,18,43,1.71,0.62,0,
Logan GilbertPlayer Note SEA - P 6:40 pm @ MIA,@ MIA,Stealth Bomber,18,43,63,99%,107.1,0,114,3.19,0.95,8,
Justin WrobleskiPlayer Note LAD - P,,NY Bombsquad,16,317,73,79%,100.1,0,73,2.69,1.02,11,
Max MeyerNew Player Note MIA - P 6:40 pm vs SEA,SEA,Stealth Bomber,19,185,76,88%,108.0,0,116,2.58,1.11,7,
"Braxton AshcraftPlayer Note PIT - P Top 9, 5-6 vs ATL",ATL,Cash is King,18,93,77,89%,108.1,0,122,3.24,1.1,10,
Jhoan DuranPlayer Note PHI - P 7:10 pm @ CIN,@ CIN,Tm Mndlsn nd Mtchn,32,95,80,98%,30.2,22,48,1.47,0.95,0,
Eduardo RodriguezPlayer Note AZ - P 9:40 pm @ SD,@ SD,Fightin Farmers,18,279,82,66%,108.0,0,74,2.25,1.16,11,
Jacob deGromPlayer Note TEX - P  8:05 pm vs LAA,LAA,Trust The Process,18,22,83,99%,100.2,0,122,3.49,1.01,8,
"Sonny GrayNew Player Note BOS - P Bot 6, 2-1 @ CWS",@ CWS,Cash is King,16,142,84,96%,89.2,0,82,2.61,1.1,11,
"Paul SkenesVideo ForecastPlayer Note PIT - P  Top 9, 5-6 vs ATL",ATL,Ranger danger,19,12,87,99%,103.0,0,123,3.58,1.04,9,
"Cade SmithNo new player Notes CLE - P Bot 9, 5-2 @ MIN",@ MIN,Tm Mndlsn nd Mtchn,39,47,88,98%,41.1,26,59,2.83,1.14,0,
Bryce MillerPlayer Note SEA - P 6:40 pm @ MIA,@ MIA,Tm Mndlsn nd Mtchn,9,88,90,84%,52.2,0,62,1.71,0.66,3,
Emerson HancockPlayer Note SEA - P 6:40 pm @ MIA,@ MIA,Trust The Process,17,171,91,81%,97.2,0,92,3.23,1.01,9,
"Parker MessickPlayer Note CLE - P Bot 9, 5-2 @ MIN",@ MIN,Cookie Monster ,18,89,92,91%,106.0,0,109,2.8,1.08,6,
Casey MizePlayer Note DET - P 6:40 pm vs ATH,ATH,Detroit Fastballs,13,284,99,67%,71.2,0,72,2.64,0.98,7,
Michael McGreevyNew Player Note STL - P 7:45 pm vs MIL,MIL,Joey Spierer's Team,18,313,100,33%,101.2,0,66,3.01,1.1,12,
"Ben BrownIL15No new player Notes CHC - P Top 9, 2-3 @ BAL",@ BAL,Ranger danger,20,180,101,44%,68.0,1,65,1.85,0.94,3,
Tarik SkubalPlayer Note DET - P  6:40 pm vs ATH,ATH,Ranger danger,12,23,104,99%,70.2,0,84,3.06,0.95,6,
Kyle HarrisonDTDNew Player Note MIL - P 7:45 pm @ STL,@ STL,Ranger danger,17,59,105,87%,83.2,0,101,3.01,1.08,6,
"Nolan McLeanPlayer Note NYM - P  W, 7-3 vs KC",KC,NY Bombsquad,18,84,108,97%,101.1,0,118,3.73,1.12,9,
"Michael WachaNew Player Note KC - P L, 3-7 @ NYM",@ NYM,Stealth Bomber,18,186,112,67%,114.2,0,91,3.45,1.16,12,
Tanner ScottNew Player Note LAD - P,,Fightin Farmers,40,213,113,53%,37.2,13,49,2.63,0.8,0,
"Nick MartinezPlayer Note TB - P L, 4-12 vs NYY",NYY,Fightin Farmers,17,196,116,60%,100.0,0,61,2.61,1.13,9,
Troy MeltonNew Player Note DET - P 6:40 pm vs ATH,ATH,Detroit Fastballs,8,275,117,59%,49.1,0,41,1.82,0.81,5,
"Payton TollePlayer Note BOS - P Bot 6, 2-1 @ CWS",@ CWS,Ranger danger,14,210,118,59%,80.1,0,80,3.14,1.07,8,
Keider MonteroPlayer Note DET - P 6:40 pm vs ATH,ATH,Joe Byron,19,251,120,15%,94.1,1,60,3.15,0.99,7,
Michael SorokaIL15Player Note AZ - P 9:40 pm @ SD,@ SD,Detroit Fastballs,15,167,127,69%,82.0,0,79,3.07,1.09,7,
"Ranger SuarezIL15Video ForecastNew Player Note BOS - P  Bot 6, 2-1 @ CWS",@ CWS,Fightin Farmers,17,119,130,87%,91.1,0,97,3.15,1.16,7,
Michael KingNew Player Note SD - P 9:40 pm vs AZ,AZ,Trust The Process,19,85,132,91%,108.1,0,92,3.41,1.15,9,
Bryan WooPlayer Note SEA - P  6:40 pm @ MIA,@ MIA,The Eds,18,38,135,98%,104.1,0,102,4.23,1.07,10,
"Raisel IglesiasNew Player Note ATL - P Top 9, 6-5 @ PIT",@ PIT,Rafael Devers,30,128,137,92%,31.1,18,35,2.3,1.12,0,
"Dylan LeeNo new player Notes ATL - P Top 9, 6-5 @ PIT",@ PIT,FA,43,378,140,24%,41.1,0,51,1.52,0.68,0,
Trevor MegillPlayer Note MIL - P 7:45 pm @ STL,@ STL,Joey Spierer's Team,37,117,144,79%,36.0,14,46,3.0,0.97,0,
Riley O'BrienPlayer Note STL - P 7:45 pm vs MIL,MIL,NY Bombsquad,37,177,146,78%,37.1,22,36,3.62,1.15,0,
Jesús LuzardoPlayer Note PHI - P 7:10 pm @ CIN,@ CIN,Tm Mndlsn nd Mtchn,18,66,147,98%,103.1,0,125,3.75,1.27,9,
J.T. GinnNew Player Note ATH - P 6:40 pm @ DET,@ DET,Tm Mndlsn nd Mtchn,20,421,149,43%,98.2,0,86,3.1,1.22,8,
"David BednarPlayer Note NYY - P  W, 12-4 @ TB",@ TB,Rafael Devers,35,75,150,95%,37.0,17,44,2.92,1.16,0,
Reid DetmersPlayer Note LAA - P 8:05 pm @ TEX,@ TEX,Cash is King,18,327,153,69%,104.2,0,117,4.13,1.11,7,
"Shane McClanahanNew Player Note TB - P L, 4-12 vs NYY",NYY,Trust The Process,17,103,155,86%,86.0,0,82,2.83,1.13,4,
Paul SewaldPlayer Note AZ - P 9:40 pm @ SD,@ SD,NY Bombsquad,35,106,156,64%,32.0,20,35,4.5,0.94,0,
Nathan EovaldiPlayer Note TEX - P  8:05 pm vs LAA,LAA,Trust The Process,17,79,158,94%,105.1,0,110,4.02,1.17,9,
"Aroldis ChapmanPlayer Note BOS - P Bot 6, 2-1 @ CWS",@ CWS,Detroit Fastballs,28,70,162,96%,26.2,18,35,2.36,1.28,0,
"Taj BradleyPlayer Note MIN - P Bot 9, 2-5 vs CLE",CLE,Tm Mndlsn nd Mtchn,17,306,165,69%,95.2,0,112,3.67,1.22,7,
Tyler GlasnowIL60Player Note LAD - P,,The Eds,7,194,166,88%,39.2,0,49,2.72,0.83,4,
"Gavin WilliamsPlayer Note CLE - P Bot 9, 5-2 @ MIN",@ MIN,Fightin Farmers,18,112,168,95%,106.1,0,123,3.89,1.18,6,
"Davis MartinNew Player Note CWS - P Bot 6, 1-2 vs BOS",BOS,Joey Spierer's Team,18,237,169,75%,100.1,0,92,3.41,1.29,10,
José SorianoPlayer Note LAA - P 8:05 pm @ TEX,@ TEX,NY Bombsquad,19,150,170,84%,106.0,0,115,3.4,1.28,7,
Logan WebbNew Player Note SF - P 9:45 pm vs COL,COL,Ranger danger,16,41,173,97%,100.1,0,80,3.86,1.16,10,
"Robert SuarezIL15No new player Notes ATL - P Top 9, 6-5 @ PIT",@ PIT,FA,31,304,175,49%,32.0,4,26,0.56,0.84,0,
"Max FriedIL15Player Note NYY - P  W, 12-4 @ TB",@ TB,Cash is King,10,131,177,98%,61.2,0,50,3.21,1.01,6,
Josh HaderPlayer Note HOU - P,,Cash is King,16,107,178,92%,15.1,10,25,0.59,0.72,0,
"Tanner BibeePlayer Note CLE - P Bot 9, 5-2 @ MIN",@ MIN,Fightin Farmers,19,203,181,79%,106.1,0,84,4.06,1.14,10,
Trey YesavagePlayer Note TOR - P,,Detroit Fastballs,13,139,183,92%,73.1,0,68,3.31,1.08,5,
Brandon WoodruffIL15New Player Note MIL - P 7:45 pm @ STL,@ STL,Trust The Process,9,195,184,82%,45.1,0,47,2.98,0.84,3,
"Shota ImanagaPlayer Note CHC - P Top 9, 2-3 @ BAL",@ BAL,Fightin Farmers,18,87,188,89%,103.0,0,100,4.28,1.1,7,
Sandy AlcantaraPlayer Note MIA - P 6:40 pm vs SEA,SEA,Joe Byron,19,172,189,92%,123.2,0,92,4.0,1.25,13,
"Connelly EarlyIL15Video ForecastPlayer Note BOS - P Bot 6, 2-1 @ CWS",@ CWS,No Longer Rowdy,17,225,190,47%,91.2,0,93,3.44,1.25,7,
Eury PérezVideo ForecastPlayer Note MIA - P  6:40 pm vs SEA,SEA,Tm Mndlsn nd Mtchn,15,336,192,87%,79.2,0,89,3.84,1.1,5,
"Sean BurkePlayer Note CWS - P Bot 6, 1-2 vs BOS",BOS,NY Bombsquad,18,297,193,59%,98.2,0,106,3.56,1.22,5,
Peter LambertPlayer Note HOU - P,,Stealth Bomber,14,217,194,35%,80.0,0,74,3.26,1.15,5,
"Luke WeaverPlayer Note NYM - P W, 7-3 vs KC",KC,FA,36,401,196,13%,38.0,1,42,1.89,0.84,0,
"Jake BennettVideo ForecastNew Player Note BOS - P Bot 6, 2-1 @ CWS",@ CWS,Joe Byron,8,456,197,47%,47.2,0,35,2.64,0.94,4,
George KirbyNew Player Note SEA - P 6:40 pm @ MIA,@ MIA,Trust The Process,18,120,199,97%,110.0,0,98,3.76,1.32,11,
Robbie RayPlayer Note SF - P 9:45 pm vs COL,COL,Joey Spierer's Team,18,156,200,87%,101.2,0,86,3.45,1.23,7,
"Clay HolmesIL60Player Note NYM - P W, 7-3 vs KC",KC,FA,9,366,201,24%,52.2,0,45,2.39,1.1,4,
"Rico GarciaPlayer Note BAL - P Top 9, 3-2 vs CHC",CHC,FA,42,351,204,23%,39.1,4,42,2.75,0.86,0,
Walbert UreñaNew Player Note LAA - P 8:05 pm @ TEX,@ TEX,Tm Mndlsn nd Mtchn,17,440,205,34%,81.1,0,78,2.88,1.32,6,
"Bryce ElderPlayer Note ATL - P Top 9, 6-5 @ PIT",@ PIT,No Longer Rowdy,17,1206,209,41%,98.2,0,83,4.01,1.23,10,
Kevin GausmanPlayer Note TOR - P,,Ranger danger,19,71,210,95%,106.1,0,108,4.32,1.22,9,
"Brent HeadrickNo new player Notes NYY - P W, 12-4 @ TB",@ TB,FA,45,407,212,3%,44.1,0,49,1.42,1.11,0,
"Sean NewcombPlayer Note CWS - P Bot 6, 1-2 vs BOS",BOS,FA,34,430,213,3%,52.1,3,51,2.58,1.05,0,
Steven OkertNo new player Notes HOU - P,,FA,44,404,215,4%,44.2,0,44,2.42,0.87,0,
Andrés MuñozPlayer Note SEA - P 6:40 pm @ MIA,@ MIA,Detroit Fastballs,36,163,216,94%,33.1,16,49,4.32,1.29,0,
John KingIL15New Player Note MIA - P 6:40 pm vs SEA,SEA,FA,40,415,218,3%,40.0,1,30,2.48,0.75,0,
"Grant TaylorPlayer Note CWS - P Bot 6, 1-2 vs BOS",BOS,FA,34,289,220,20%,45.2,3,65,2.96,1.12,0,
"Colin HoldermanNo new player Notes CLE - P Bot 9, 5-2 @ MIN",@ MIN,FA,33,450,222,4%,33.2,0,38,1.87,0.86,0,
Abner UribePlayer Note MIL - P 7:45 pm @ STL,@ STL,Rafael Devers,37,272,224,56%,36.2,6,35,2.7,1.01,0,
"Kevin KellyPlayer Note TB - P L, 4-12 vs NYY",NYY,FA,39,416,230,17%,42.0,4,31,2.57,0.95,0,
"Gregory SotoPlayer Note PIT - P Top 9, 5-6 vs ATL",ATL,FA,38,169,232,37%,38.0,11,44,4.26,1.08,0,
Bryan KingNo new player Notes HOU - P,,FA,38,406,233,13%,40.0,6,31,2.03,1.18,0,
Anthony BenderIL15Player Note MIA - P 6:40 pm vs SEA,SEA,FA,35,414,238,2%,34.1,2,41,2.62,0.96,0,
Edgardo HenriquezNo new player Notes LAD - P,,FA,34,417,239,2%,36.2,1,35,2.45,0.9,0,
Michael PetersenNo new player Notes MIA - P 6:40 pm vs SEA,SEA,FA,38,469,243,8%,40.0,1,48,2.93,0.98,0,
Andre PallantePlayer Note STL - P 7:45 pm vs MIL,MIL,Cash is King,17,325,245,43%,95.0,0,70,3.6,1.22,6,
"Ryan WeathersPlayer Note NYY - P W, 12-4 @ TB",@ TB,The Eds,17,314,247,46%,92.1,0,104,4.29,1.25,6,
Landen RouppPlayer Note SF - P 9:45 pm vs COL,COL,No Longer Rowdy,18,349,252,42%,97.0,0,104,4.27,1.31,8,
Alex VesiaNo new player Notes LAD - P,,FA,41,338,254,20%,30.2,3,43,2.35,1.14,0,
"Tyler WellsPlayer Note BAL - P Top 9, 3-2 vs CHC",CHC,NY Bombsquad,33,442,255,17%,42.2,2,44,2.95,1.03,0,
Shane DrohanPlayer Note MIL - P 7:45 pm @ STL,@ STL,No Longer Rowdy,18,438,256,29%,63.2,1,61,2.97,1.24,2,
Spencer MilesPlayer Note TOR - P,,FA,25,429,257,4%,58.0,0,56,2.95,1.09,0,
Jakob JunisIL15Player Note TEX - P 8:05 pm vs LAA,LAA,FA,31,204,258,9%,35.1,5,27,2.8,1.02,0,
Cade CavalliSUSPPlayer Note WSH - P,,The Eds,19,379,259,27%,92.2,0,105,3.88,1.38,7,
"Ian SeymourPlayer Note TB - P L, 4-12 vs NYY",NYY,Stealth Bomber,32,377,260,50%,61.1,2,72,4.11,1.08,1,
"Daniel Lynch IVNo new player Notes KC - P L, 3-7 @ NYM",@ NYM,FA,38,426,261,3%,37.1,1,32,2.41,0.96,0,
"Dylan DoddPlayer Note ATL - P Top 9, 6-5 @ PIT",@ PIT,FA,20,463,263,0%,25.0,1,27,2.16,0.8,0,
"Kyle BradishPlayer Note BAL - P  Top 9, 3-2 vs CHC",CHC,Tm Mndlsn nd Mtchn,18,73,264,91%,100.2,0,101,3.75,1.4,8,
Dustin MayPlayer Note STL - P 7:45 pm vs MIL,MIL,No Longer Rowdy,17,252,265,28%,89.0,0,85,4.55,1.25,9,
"Garrett WhitlockPlayer Note BOS - P Bot 6, 2-1 @ CWS",@ CWS,FA,31,402,268,20%,30.0,1,34,2.4,0.97,0,
Tim MayzaNo new player Notes PHI - P 7:10 pm @ CIN,@ CIN,FA,36,471,269,0%,41.2,0,42,2.81,1.01,0,
"Yoendrys GómezPlayer Note MIN - P Bot 9, 2-5 vs CLE",CLE,Fightin Farmers,38,260,270,27%,42.2,10,37,3.59,1.24,0,
Chad PatrickNo new player Notes MIL - P 7:45 pm @ STL,@ STL,FA,27,419,271,9%,70.2,4,59,3.44,1.2,1,
"A.J. MinterNo new player Notes NYM - P W, 7-3 vs KC",KC,FA,17,447,275,1%,17.0,0,14,0.53,0.65,0,
"Jovani MoránPlayer Note BOS - P Bot 6, 2-1 @ CWS",@ CWS,FA,24,497,276,0%,36.2,0,45,2.95,1.01,0,
Brandyn GarciaNo new player Notes AZ - P 9:40 pm @ SD,@ SD,FA,26,541,277,2%,22.0,1,24,2.05,0.82,0,
Clayton BeeterPlayer Note WSH - P,,FA,27,399,279,12%,27.0,7,30,3.0,1.22,0,
Taylor ClarkeNo new player Notes AZ - P 9:40 pm @ SD,@ SD,FA,41,409,280,3%,40.1,0,21,2.68,0.87,0,
"Zebby MatthewsNew Player Note MIN - P Bot 9, 2-5 vs CLE",CLE,Ranger danger,10,253,282,15%,61.0,0,51,4.43,1.16,7,
Tyler RogersNo new player Notes TOR - P,,FA,43,412,284,21%,41.2,2,21,1.73,1.18,0,
"Carlos RodónIL15New Player Note NYY - P W, 12-4 @ TB",@ TB,The Eds,9,141,286,83%,46.1,0,52,3.3,1.25,3,
"Didier FuentesNo new player Notes ATL - P Top 9, 6-5 @ PIT",@ PIT,FA,29,511,287,9%,35.2,1,41,2.52,1.15,0,
"Evan SiskIL15Player Note PIT - P Top 9, 5-6 vs ATL",ATL,FA,32,475,288,0%,36.1,0,43,2.23,1.18,0,
"Bryan HudsonNo new player Notes CWS - P Bot 6, 1-2 vs BOS",BOS,FA,41,454,289,1%,40.0,3,39,2.25,1.3,0,
"Brandon YoungPlayer Note BAL - P Top 9, 3-2 vs CHC",CHC,Cookie Monster ,14,592,290,30%,77.1,0,62,3.38,1.36,6,
"Grant HolmesNew Player Note ATL - P Top 9, 6-5 @ PIT",@ PIT,Cookie Monster ,18,507,291,23%,87.1,0,76,3.61,1.32,5,
"Fernando CruzNo new player Notes NYY - P W, 12-4 @ TB",@ TB,FA,42,419,292,11%,38.1,1,48,2.35,1.28,0,
Tejay AntoneNo new player Notes CIN - P 7:10 pm vs PHI,PHI,FA,26,481,294,0%,26.0,1,24,2.42,0.92,0,
Kirby YatesNo new player Notes LAA - P 8:05 pm @ TEX,@ TEX,FA,22,460,295,6%,19.2,2,28,2.75,0.92,0,
Jonathan LoáisigaNo new player Notes AZ - P 9:40 pm @ SD,@ SD,FA,38,479,296,0%,35.1,1,22,2.29,1.02,0,
Jack DreyerPlayer Note LAD - P,,FA,36,412,298,3%,36.2,0,42,3.19,1.01,0,
Tyler AlexanderNo new player Notes TEX - P 8:05 pm vs LAA,LAA,FA,39,551,299,4%,38.0,4,34,2.37,1.29,0,
Adrian MorejonNo new player Notes SD - P 9:40 pm vs AZ,AZ,FA,41,395,300,16%,46.0,1,54,3.52,1.11,0,
"Paul BlackburnNew Player Note NYY - P W, 12-4 @ TB",@ TB,FA,30,538,301,1%,44.2,0,32,2.22,1.14,0,
Juan MorilloNo new player Notes AZ - P 9:40 pm @ SD,@ SD,FA,39,509,302,4%,35.1,1,43,3.06,1.1,0,
Matt BrashIL15No new player Notes SEA - P 6:40 pm @ MIA,@ MIA,FA,20,423,303,5%,16.2,0,15,0.54,0.84,0,
"Seranthony DomínguezPlayer Note CWS - P Bot 6, 1-2 vs BOS",BOS,FA,35,146,305,36%,31.2,12,39,4.55,1.39,0,
Bradgley RodriguezPlayer Note SD - P 9:40 pm vs AZ,AZ,FA,35,467,306,1%,37.2,0,35,2.15,1.17,0,
Orion KerkeringNo new player Notes PHI - P 7:10 pm @ CIN,@ CIN,FA,38,405,307,5%,36.0,1,40,2.5,1.19,0,
Caleb KilianPlayer Note SF - P 9:45 pm vs COL,COL,No Longer Rowdy,36,219,310,15%,37.0,8,45,4.14,1.27,0,
Braydon FisherNAPlayer Note TOR - P,,FA,43,411,312,3%,46.0,1,46,3.33,1.11,0,
"Martín PérezIL15Player Note ATL - P Top 9, 6-5 @ PIT",@ PIT,FA,18,300,313,16%,81.1,0,62,3.54,1.19,2,
Logan HendersonIL15Player Note MIL - P 7:45 pm @ STL,@ STL,The Eds,5,207,315,56%,23.0,0,30,2.74,1.04,1,
Eduard BazardoNo new player Notes SEA - P 6:40 pm @ MIA,@ MIA,FA,42,408,316,12%,39.1,0,37,2.06,1.25,0,
"Brooks RaleyNo new player Notes NYM - P W, 7-3 vs KC",KC,FA,37,417,317,3%,33.1,0,36,2.16,1.2,0,
"Yennier CanoNo new player Notes BAL - P Top 9, 3-2 vs CHC",CHC,FA,39,534,319,2%,29.0,1,27,2.48,1.07,0,
"Huascar BrazobánNo new player Notes NYM - P W, 7-3 vs KC",KC,FA,37,426,320,2%,44.0,0,41,2.86,1.14,0,
"Griffin JaxPlayer Note TB - P L, 4-12 vs NYY",NYY,The Eds,24,345,321,59%,65.0,0,68,3.6,1.22,1,
"Jacob WebbNew Player Note CHC - P Top 9, 2-3 @ BAL",@ BAL,Detroit Fastballs,40,418,322,5%,39.2,4,47,3.18,1.31,0,
Antonio SenzatelaPlayer Note COL - P 9:45 pm @ SF,@ SF,FA,28,1434,323,11%,47.0,3,40,3.06,1.21,0,
Peyton GrayNo new player Notes TEX - P 8:05 pm vs LAA,LAA,FA,25,443,324,1%,32.1,0,36,2.78,1.08,0,
José A. FerrerNo new player Notes SEA - P 6:40 pm @ MIA,@ MIA,FA,42,466,325,4%,38.0,3,32,2.37,1.29,0,
William KempnerPlayer Note MIA - P 6:40 pm vs SEA,SEA,FA,7,491,326,0%,10.0,0,11,0.0,0.5,0,
Kenley JansenPlayer Note DET - P 6:40 pm vs ATH,ATH,Joey Spierer's Team,25,148,327,67%,21.2,10,23,4.98,1.2,0,
"Gerrit ColeNew Player Note NYY - P  W, 12-4 @ TB",@ TB,NY Bombsquad,9,65,329,89%,49.0,0,47,4.04,1.2,4,
Will KleinPlayer Note LAD - P,,FA,31,461,331,3%,35.2,2,41,2.27,1.37,0,
"Joey CantilloPlayer Note CLE - P Bot 9, 5-2 @ MIN",@ MIN,Joey Spierer's Team,19,347,332,51%,96.0,0,96,3.66,1.39,4,
Lake BacharPlayer Note MIA - P 6:40 pm vs SEA,SEA,FA,30,451,333,1%,47.0,1,49,3.83,1.09,0,
"Trevor RichardsNANew Player Note CWS - P Bot 6, 1-2 vs BOS",BOS,FA,24,571,334,0%,35.1,0,35,3.31,1.02,0,
"Kris BubicIL60Player Note KC - P L, 3-7 @ NYM",@ NYM,Cash is King,9,274,335,40%,50.1,0,51,4.11,1.23,4,
DL HallIL15Player Note MIL - P 7:45 pm @ STL,@ STL,FA,24,520,336,0%,31.0,0,32,2.03,1.23,0,
Keaton WinnIL15New Player Note SF - P 9:45 pm vs COL,COL,FA,29,504,337,3%,30.2,1,26,3.23,0.98,0,
Yuki MatsuiNo new player Notes SD - P 9:40 pm vs AZ,AZ,FA,23,526,338,0%,31.1,0,35,2.01,1.28,0,
"Christian ScottNew Player Note NYM - P W, 7-3 vs KC",KC,FA,12,506,339,16%,54.0,0,65,3.17,1.3,0,
"Cam BooserNo new player Notes TB - P L, 4-12 vs NYY",NYY,FA,13,557,340,0%,13.1,0,16,1.35,0.83,0,
George SorianoNo new player Notes STL - P 7:45 pm vs MIL,MIL,FA,39,604,342,2%,38.1,2,32,3.29,1.12,0,
"Trent ThorntonPlayer Note CHC - P Top 9, 2-3 @ BAL",@ BAL,FA,23,470,343,0%,27.2,2,13,2.6,1.01,0,
Jason AdamIL15Player Note SD - P 9:40 pm vs AZ,AZ,FA,36,409,345,12%,32.1,2,22,2.51,1.18,0,
"Ryan HelsleyIL15Player Note BAL - P Top 9, 3-2 vs CHC",CHC,FA,17,190,347,64%,15.1,8,21,4.11,1.43,0,
MacKenzie GoreNew Player Note TEX - P 8:05 pm vs LAA,LAA,No Longer Rowdy,19,191,350,81%,101.0,0,111,4.72,1.31,6,
"Reynaldo LópezPlayer Note ATL - P Top 9, 6-5 @ PIT",@ PIT,Cookie Monster ,21,396,351,33%,56.2,0,51,3.18,1.27,1,
"Devin WilliamsPlayer Note NYM - P W, 7-3 vs KC",KC,Cookie Monster ,33,108,352,89%,29.2,13,43,4.85,1.65,0,
Ryan ZeferjahnNo new player Notes LAA - P 8:05 pm @ TEX,@ TEX,FA,36,461,354,2%,41.2,2,58,3.89,1.27,0,
Gabe SpeierNo new player Notes SEA - P 6:40 pm @ MIA,@ MIA,FA,28,427,356,5%,23.0,1,19,1.96,1.17,0,
Jacob WaguespackNo new player Notes DET - P 6:40 pm vs ATH,ATH,FA,8,546,357,0%,11.2,0,8,1.54,0.6,0,
"Dean KremerNew Player Note BAL - P Top 9, 3-2 vs CHC",CHC,W (Jul 11),4,472,358,19%,22.0,0,24,4.09,1.0,2,
Alimber SantaPlayer Note HOU - P,,FA,10,559,360,0%,15.1,0,9,1.17,0.91,0,
"Ryan RolisonPlayer Note CHC - P Top 9, 2-3 @ BAL",@ BAL,FA,30,557,361,1%,34.0,1,35,2.91,1.24,0,
Jeff HoffmanPlayer Note TOR - P,,FA,42,403,362,53%,39.1,5,63,4.35,1.4,0,
Kevin GinkelNo new player Notes AZ - P 9:40 pm @ SD,@ SD,FA,38,514,365,1%,35.1,0,38,3.06,1.19,0,
Ryan FeltnerPlayer Note COL - P 9:45 pm @ SF,@ SF,Cookie Monster ,12,1148,366,12%,59.0,0,44,4.27,1.22,5,
"Tyron GuerreroNo new player Notes BOS - P Top 7, 2-1 @ CWS",@ CWS,FA,17,548,367,4%,16.2,0,22,2.7,0.96,0,
"Erik SabrowskiNo new player Notes CLE - P W, 5-2 @ MIN",@ MIN,FA,34,439,369,16%,27.0,0,48,3.33,1.3,0,
Aaron AshbyNo new player Notes MIL - P 7:45 pm @ STL,@ STL,FA,43,341,370,36%,53.2,0,71,3.19,1.4,0,
"Carmen MlodzinskiNo new player Notes PIT - P Top 9, 5-6 vs ATL",ATL,FA,19,445,371,4%,77.2,2,62,3.24,1.35,1,
Jonathan BowlanPlayer Note PHI - P 7:10 pm @ CIN,@ CIN,FA,30,500,374,0%,27.2,0,36,3.25,1.16,0,
"Will WarrenPlayer Note NYY - P W, 12-4 @ TB",@ TB,W (Jul 10),18,264,375,64%,93.1,0,94,4.15,1.37,5,
Hogan HarrisNo new player Notes ATH - P 6:40 pm @ DET,@ DET,FA,43,246,377,8%,40.0,6,52,3.38,1.55,0,
Tyler PhillipsNew Player Note MIA - P 6:40 pm vs SEA,SEA,Joey Spierer's Team,24,545,378,4%,74.0,2,55,3.28,1.36,2,
Spencer ArrighettiNew Player Note HOU - P,,W (Jul 11),15,151,379,39%,82.0,0,81,4.5,1.33,6,
Framber ValdezPlayer Note DET - P 6:40 pm vs ATH,ATH,No Longer Rowdy,18,183,384,89%,100.2,0,78,4.29,1.38,9,
Grant AndersonNo new player Notes MIL - P 7:45 pm @ STL,@ STL,FA,36,491,385,0%,40.2,0,31,3.32,1.11,0,
Gage JumpPlayer Note ATH - P 6:40 pm @ DET,@ DET,Trust The Process,8,236,386,33%,43.0,0,41,3.77,1.3,3,
Andrew AbbottPlayer Note CIN - P 7:10 pm vs PHI,PHI,Detroit Fastballs,19,170,387,63%,101.0,0,81,3.92,1.41,7,
Emmet SheehanPlayer Note LAD - P,,Stealth Bomber,16,134,388,75%,77.0,0,86,4.91,1.27,5,
JT BrubakerNo new player Notes SF - P 9:45 pm vs COL,COL,FA,28,578,389,0%,43.2,0,30,2.89,1.19,0,
Samy Natera Jr.New Player Note LAA - P 8:05 pm @ TEX,@ TEX,FA,11,624,390,0%,13.1,1,20,3.38,0.98,0,
Enyel De Los SantosNo new player Notes HOU - P,,FA,39,568,391,2%,41.2,5,39,4.54,1.18,0,
Hunter BrownPlayer Note HOU - P ,,Joe Byron,6,69,392,96%,29.1,0,35,3.38,1.36,2,
Kumar RockerPlayer Note TEX - P 8:05 pm vs LAA,LAA,Cookie Monster ,17,1367,394,13%,84.1,0,74,3.95,1.34,4,
Orlando RibaltaNo new player Notes WSH - P,,FA,29,1245,395,0%,27.1,2,23,3.29,1.17,0,
Justin SternerNo new player Notes ATH - P 6:40 pm @ DET,@ DET,FA,43,454,396,2%,41.1,1,40,3.92,1.14,0,
"Shane BazPlayer Note BAL - P Top 9, 3-2 vs CHC",CHC,No Longer Rowdy,18,288,397,51%,107.0,0,90,4.21,1.37,7,
Graham AshcraftIL60Player Note CIN - P 7:10 pm vs PHI,PHI,FA,26,523,398,1%,27.0,1,32,3.33,1.22,0,
Ty MaddenNANo new player Notes DET - P 6:40 pm vs ATH,ATH,FA,7,575,399,0%,20.0,0,23,3.15,1.05,0,
AJ BlubaughNo new player Notes HOU - P,,FA,35,432,400,1%,58.0,0,56,3.57,1.24,0,
Robert GasserNAPlayer Note MIL - P 7:45 pm @ STL,@ STL,Fightin Farmers,8,563,401,4%,43.1,0,40,4.15,1.18,2,
Gordon GraceffoPlayer Note STL - P 7:45 pm vs MIL,MIL,FA,37,466,404,0%,43.0,1,20,3.14,1.12,0,
Brant HurterIL60No new player Notes DET - P 6:40 pm vs ATH,ATH,FA,21,428,405,1%,25.1,0,18,2.84,1.07,0,
Joe MantiplyIL60No new player Notes TOR - P,,FA,17,1199,406,0%,17.2,0,16,2.04,1.13,0,
"Daniel PalenciaIL15No new player Notes CHC - P  Top 9, 2-3 @ BAL",@ BAL,Ranger danger,19,228,408,60%,16.2,3,19,2.7,1.38,0,
PJ PoulinNo new player Notes WSH - P,,FA,34,486,409,1%,35.0,3,22,2.83,1.31,0,
Jeremiah EstradaIL15Player Note SD - P 9:40 pm vs AZ,AZ,FA,21,437,411,5%,20.2,1,23,3.48,1.11,0,
Wandy PeraltaPlayer Note SD - P 9:40 pm vs AZ,AZ,FA,39,499,413,0%,46.1,0,30,2.33,1.34,0,
"Yovanny CruzNAPlayer Note NYY - P W, 12-4 @ TB",@ TB,FA,3,577,414,0%,4.1,0,6,0.0,0.23,0,
Pete FairbanksNew Player Note MIA - P 6:40 pm vs SEA,SEA,FA,30,149,415,68%,28.0,13,38,6.75,1.43,0,
Gabriel HughesNew Player Note COL - P 9:45 pm @ SF,@ SF,FA,2,626,416,0%,9.0,1,8,3.0,1.0,1,
"Andrew MorrisNo new player Notes MIN - P L, 2-5 vs CLE",CLE,FA,33,481,417,5%,42.0,2,44,3.64,1.31,0,
"Garrett CleavingerPlayer Note TB - P L, 4-12 vs NYY",NYY,FA,29,434,418,9%,25.2,2,34,3.86,1.29,0,
Caleb FergusonNo new player Notes CIN - P 7:10 pm vs PHI,PHI,FA,18,508,419,0%,18.0,1,17,2.0,1.33,0,
Jimmy HergetNo new player Notes COL - P 9:45 pm @ SF,@ SF,FA,23,507,420,3%,23.0,3,24,3.52,1.3,0,
"Jared JonesVideo ForecastNew Player Note PIT - P Top 9, 5-6 vs ATL",ATL,The Eds,8,1246,421,25%,35.0,0,39,4.37,1.14,1,
Julian GarciaNo new player Notes CIN - P 7:10 pm vs PHI,PHI,FA,6,584,422,0%,9.1,0,9,1.93,0.86,0,
Nick DavilaNo new player Notes SEA - P 6:40 pm @ MIA,@ MIA,FA,15,628,423,0%,16.2,1,9,2.16,1.14,0,
"Daniel DuarteNANo new player Notes NYM - P W, 7-3 vs KC",KC,FA,3,582,424,0%,5.0,0,3,0.0,0.4,0,
Brad LordPlayer Note WSH - P,,FA,27,492,425,2%,58.0,1,52,3.88,1.22,0,
"Riley MartinIL15No new player Notes CHC - P Top 9, 2-3 @ BAL",@ BAL,FA,8,588,426,0%,8.1,0,10,2.16,0.84,0,
Miguel UllolaNAPlayer Note HOU - P,,FA,2,587,427,0%,4.0,0,7,0.0,0.5,0,
Mason BarnettNo new player Notes ATH - P 6:40 pm @ DET,@ DET,FA,12,657,429,1%,20.1,2,21,3.54,1.23,0,
"Yohan RamírezNo new player Notes PIT - P Top 9, 5-6 vs ATL",ATL,FA,38,490,430,1%,48.2,1,56,3.51,1.38,0,
"Cade HortonIL60No new player Notes CHC - P  Top 9, 2-3 @ BAL",@ BAL,FA,2,425,431,23%,7.1,0,4,2.45,0.82,1,
Brock StewartNo new player Notes LAD - P,,FA,8,533,432,0%,7.2,0,7,1.17,0.91,0,
Drew AndersonNo new player Notes DET - P 6:40 pm vs ATH,ATH,FA,33,527,433,1%,54.2,2,68,4.28,1.32,0,
Cal QuantrillPlayer Note TEX - P 8:05 pm vs LAA,LAA,FA,18,1416,435,1%,40.1,0,27,3.35,1.17,0,
Chase DollanderIL60No new player Notes COL - P 9:45 pm @ SF,@ SF,FA,10,1469,436,5%,44.0,0,47,3.89,1.3,1,
"Stephen KolekNAPlayer Note KC - P L, 3-7 @ NYM",@ NYM,No Longer Rowdy,10,255,437,10%,54.0,0,34,4.5,1.24,5,
"Tyler KinleyNAPlayer Note ATL - P Top 9, 6-5 @ PIT",@ PIT,FA,36,444,438,1%,32.1,0,33,3.62,1.21,0,
Cooper CriswellIL60Player Note SEA - P 6:40 pm @ MIA,@ MIA,FA,26,543,441,0%,30.2,1,23,3.52,1.17,0,
Blade TidwellNANo new player Notes SF - P 9:45 pm vs COL,COL,FA,8,1266,443,0%,12.0,1,10,3.0,1.08,0,
"James KarinchakPlayer Note ATL - P Top 9, 6-5 @ PIT",@ PIT,FA,8,604,444,0%,8.2,0,7,2.08,0.92,0,
José FerminNo new player Notes LAA - P 8:05 pm @ TEX,@ TEX,FA,25,537,445,0%,27.0,0,29,3.33,1.26,0,
Craig YohoPlayer Note MIL - P 7:45 pm @ STL,@ STL,FA,7,718,446,0%,10.0,0,10,3.6,0.8,0,
Kyle FinneganNo new player Notes DET - P 6:40 pm vs ATH,ATH,FA,39,431,447,6%,41.1,1,31,2.18,1.5,0,
"Albert SuárezNo new player Notes BAL - P Top 9, 3-2 vs CHC",CHC,FA,16,518,448,0%,40.2,1,28,3.54,1.2,0,
"Eduardo RiveraNANo new player Notes BOS - P Top 7, 2-1 @ CWS",@ CWS,FA,1,606,449,0%,3.1,0,3,0.0,0.3,0,
"Javier AssadNew Player Note CHC - P Top 9, 2-3 @ BAL",@ BAL,Trust The Process,14,453,451,12%,56.1,0,33,4.15,1.1,1,
"Michael GroveNANo new player Notes TB - P L, 4-12 vs NYY",NYY,FA,1,569,453,0%,3.0,0,4,0.0,0.33,0,
Carl Edwards Jr.NANo new player Notes DET - P 6:40 pm vs ATH,ATH,FA,2,613,454,0%,6.0,0,11,1.5,1.17,0,
"Matthew BoydPlayer Note CHC - P  Top 9, 2-3 @ BAL",@ BAL,Ranger danger,8,331,455,62%,39.2,0,44,4.31,1.31,2,
Brennan BernardinoPlayer Note COL - P 9:45 pm @ SF,@ SF,FA,44,484,456,0%,37.1,1,26,3.13,1.29,0,
Logan VanWeyNANo new player Notes HOU - P,,FA,5,603,458,0%,6.0,0,5,1.5,0.83,0,
